Array,Site_Name,Year,Latitude,Longitude,Start_Date,End_Date,Survey_Nights,Habitat,Development_Level,Humans_Per_Camera,Humans_Per_Camera_Per_Day
CoteauRanch,10CoteauRanch 09/30/2023_2023,2023,47.379809,-100.262186,2023-09-30,2023-11-03,34,Grassland,Rural,2,0.0588235294117647
CoteauRanch,11CoteauRanch 09/30/2023_2023,2023,47.422735,-100.251013,2023-09-30,2023-11-03,34,Grassland,Rural,2,0.0588235294117647
OakvillePrairie,11OakvillePrairie 09/17/2023_2023,2023,47.90964,-97.321533,2023-09-17,2023-11-02,46,Grassland,Rural,2,0.0434782608695652
CoteauRanch,12CoteauRanch 09/30/2023_2023,2023,47.426957,-100.252871,2023-09-30,2023-11-03,34,Grassland,Rural,2,0.0588235294117647
CoteauRanch,1CoteauRanch 09/30/2023_2023,2023,47.383805,-100.259701,2023-09-30,2023-11-03,34,Grassland,Rural,2,0.0588235294117647
CoteauRanch,2CoteauRanch 09/30/2023_2023,2023,47.383719,-100.270405,2023-09-30,2023-11-03,34,Grassland,Rural,2,0.0588235294117647
OakvillePrairie,2OakvillePrairie 09/17/2023_2023,2023,47.90956,-97.31054,2023-09-17,2023-11-02,46,Grassland,Rural,2,0.0434782608695652
CoteauRanch,3CoteauRanch 09/30/2024_2023,2023,47.378307,-100.270556,2023-09-30,2023-11-03,34,Grassland,Rural,2,0.0588235294117647
OakvillePrairie,3OakvillePrairie 09/17/2023_2023,2023,47.97356,-97.32027,2023-09-17,2023-11-02,46,Grassland,Rural,2,0.0434782608695652
CoteauRanch,4CoteauRanch 09/30/2023_2023,2023,47.42402,-100.25752,2023-09-30,2023-11-03,34,Grassland,Rural,2,0.0588235294117647
CoteauRanch,5CoteauRanch 09/30/2023_2023,2023,47.40241,-100.277864,2023-09-30,2023-11-03,34,Grassland,Rural,4,0.117647058823529
CoteauRanch,6CoteauRanch 09/30/2023_2023,2023,47.398301,-100.268694,2023-09-30,2023-11-03,34,Grassland,Rural,2,0.0588235294117647
CoteauRanch,7CoteauRanch 09/30/2023_2023,2023,47.392796,-100.267568,2023-09-30,2023-11-03,34,Grassland,Rural,2,0.0588235294117647
CoteauRanch,8CoteauRanch 09/30/2023_2023,2023,47.39401,-100.275568,2023-09-30,2023-11-03,34,Grassland,Rural,2,0.0588235294117647
CoteauRanch,9CoteauRanch 09/30/2023_2023,2023,47.41722,-100.248028,2023-09-30,2023-11-03,34,Grassland,Rural,2,0.0588235294117647
Afognak,AK_Forest_Afognak_22_C22-05_2022,2022,58.24012,-152.21669,2022-08-31,2022-10-04,34,Forest,Wild,9,0.264705882352941
Afognak,AK_Forest_Afognak_22_C22-10_2022,2022,58.258,-152.2169,2022-08-31,2022-10-04,34,Forest,Wild,15,0.441176470588235
Afognak,AK_Forest_Afognak_22_C22-15 08/31/2022_2022,2022,58.2669,-152.20229,2022-08-31,2022-10-04,34,Forest,Wild,8,0.235294117647059
Afognak,AK_Forest_Afognak_22_C22-16_2022,2022,58.27627,-152.27123,2022-08-30,2022-10-04,35,Forest,Wild,4,0.114285714285714
Afognak,AK_Forest_Afognak_22_C22-18 08/31/2022_2022,2022,58.27618,-152.23811,2022-08-31,2022-10-04,34,Forest,Wild,31,0.911764705882353
Afognak,AK_Forest_Afognak_22_C22-21 08/30/2022_2022,2022,58.28619,-152.28911,2022-08-30,2022-10-04,35,Forest,Wild,3,0.0857142857142857
Afognak,AK_Forest_Afognak_22_C22-27 08/30/2022_2022,2022,58.29431,-152.3045,2022-08-30,2022-10-04,35,Forest,Wild,4,0.114285714285714
Afognak,AK_Forest_Afognak_22_C22-51 08/30/2022_2022,2022,58.34107,-152.3538,2022-08-30,2022-10-04,35,Forest,Wild,60,1.71428571428571
Afognak,AK_Forest_Afognak_22_C22-57 09/01/2022_2022,2022,58.29307,-152.35754,2022-09-01,2022-10-04,33,Forest,Wild,3,0.0909090909090909
Afognak,AK_Forest_Afognak_22_C22-59 09/01/2022_2022,2022,58.28453,-152.37792,2022-09-01,2022-10-04,33,Forest,Wild,9,0.272727272727273
Afognak,AK_Forest_Afognak_22_C22-60 09/01/2022_2022,2022,58.28519,-152.35924,2022-09-01,2022-10-04,33,Forest,Wild,6,0.181818181818182
Afognak,AK_Forest_Afognak_22_W-25 09/01/2022_2022,2022,58.32125,-152.32087,2022-09-01,2022-10-03,32,Forest,Wild,7,0.21875
Afognak,AK_Forest_Afognak_22_W-9 09/01/2022_2022,2022,58.32849,-152.3278,2022-09-01,2022-10-03,32,Forest,Wild,7,0.21875
Crupi,AK_Forest_Chilkat_Preserve_1_2019,2019,59.42643,-136.2225,2019-08-31,2019-11-03,64,Forest,Wild,0,0
Crupi,AK_Forest_Chilkat_Preserve_20_01_2020,2020,59.42643,-136.22251,2020-08-26,2020-11-28,94,Forest,Wild,2,0.0212765957446809
Crupi,AK_Forest_Chilkat_Preserve_20_02_2020,2020,59.39905,-135.92881,2020-08-27,2020-11-04,69,Forest,Wild,2,0.0289855072463768
Crupi,AK_Forest_Chilkat_Preserve_20_03_2020,2020,59.3802,-135.84097,2020-08-27,2020-11-03,68,Forest,Wild,9,0.132352941176471
Crupi,AK_Forest_Chilkat_Preserve_20_04_2020,2020,59.42641,-136.3046,2020-09-26,2020-10-30,34,Forest,Wild,3,0.0882352941176471
Crupi,AK_Forest_Chilkat_Preserve_20_05_2020,2020,59.41194,-136.15142,2020-08-26,2020-11-04,70,Forest,Wild,1,0.0142857142857143
Crupi,AK_Forest_Chilkat_Preserve_20_06_2020,2020,59.41492,-136.07539,2020-08-27,2020-11-05,70,Forest,Wild,1,0.0142857142857143
Crupi,AK_Forest_Chilkat_Preserve_20_08_2020,2020,59.41423,-136.06423,2020-08-27,2020-11-05,70,Forest,Wild,3,0.0428571428571429
Crupi,AK_Forest_Chilkat_Preserve_2_2019,2019,59.39905,-135.9288,2019-08-29,2019-11-04,67,Forest,Wild,3,0.0447761194029851
Crupi,AK_Forest_Chilkat_Preserve_3_2019,2019,59.3802,-135.84097,2019-08-29,2019-11-03,66,Forest,Wild,6,0.0909090909090909
Crupi,AK_Forest_Chilkat_Preserve_4_2019,2019,59.42641,-136.30461,2019-08-27,2019-11-03,68,Forest,Wild,7,0.102941176470588
Crupi,AK_Forest_Chilkat_Preserve_5_2019,2019,59.41195,-136.15141,2019-08-27,2019-11-03,68,Forest,Wild,3,0.0441176470588235
Crupi,AK_Forest_Chilkat_Preserve_6_2019,2019,59.41492,-136.0754,2019-08-18,2019-11-03,77,Forest,Wild,1,0.012987012987013
Crupi,AK_Forest_Chilkat_Preserve_7_2019,2019,59.41505,-136.0691,2019-08-31,2019-11-02,63,Forest,Wild,2,0.0317460317460317
Crupi,AK_Forest_Chilkat_Preserve_8_2019,2019,59.41423,-136.06422,2019-08-30,2019-11-03,65,Forest,Wild,2,0.0307692307692308
Crupi,AK_Forest_Crupi_21_dep_01 08/30/2021_2021,2021,59.42643109,-136.2225117,2021-08-30,2021-12-15,107,Forest,Wild,2,0.0186915887850467
Crupi,AK_Forest_Crupi_21_dep_02 09/01/2021_2021,2021,59.39466,-135.87256,2021-09-01,2021-12-16,106,Forest,Wild,2,0.0188679245283019
Crupi,AK_Forest_Crupi_21_dep_03 09/01/2021_2021,2021,59.39905304,-135.9288107,2021-09-01,2021-12-16,106,Forest,Wild,2,0.0188679245283019
Crupi,AK_Forest_Crupi_21_dep_04 04 08/31/2021_2021,2021,59.4264141,-136.3046087,2021-08-31,2021-12-15,106,Forest,Wild,3,0.0283018867924528
Crupi,AK_Forest_Crupi_21_dep_05 08/30/2021_2021,2021,59.41491635,-136.0753879,2021-08-30,2021-12-15,107,Forest,Wild,2,0.0186915887850467
Crupi,AK_Forest_Crupi_21_dep_06 08/30/2021_2021,2021,59.41505398,-136.0691137,2021-08-30,2021-12-16,108,Forest,Wild,4,0.037037037037037
Crupi,AK_Forest_Crupi_21_dep_07 08/31/2021_2021,2021,59.41422998,-136.0642317,2021-08-31,2021-12-15,106,Forest,Wild,3,0.0283018867924528
Crupi,AK_Forest_Crupi_21_dep_08 08/30/2021_2021,2021,59.403024,-136.145609,2021-08-29,2021-10-12,44,Forest,Wild,2,0.0454545454545455
Crupi,AK_Forest_Crupi_21_dep_09 08/24/2021_2021,2021,59.358192,-135.955056,2021-08-24,2021-10-11,48,Forest,Wild,2,0.0416666666666667
Crupi,AK_Forest_Crupi_21_dep_10 08/24/2021_2021,2021,59.452635,-136.20086,2021-08-24,2021-10-10,47,Forest,Wild,2,0.0425531914893617
Crupi,AK_Forest_Crupi_22_loc02 08/09/2022_2022,2022,59.42643109,-136.2225117,2022-08-08,2022-08-10,2,Forest,Wild,0,0
Crupi,AK_Forest_Crupi_22_loc04 07/08/2022_2022,2022,59.4264141,-136.3046087,2022-08-10,2022-10-09,60,Forest,Wild,1,0.0166666666666667
Crupi,AK_Forest_Crupi_22_loc05_2022,2022,59.41491635,-136.0753879,2022-08-30,2022-11-04,66,Forest,Wild,2,0.0303030303030303
Crupi,AK_Forest_Crupi_23 07/26/2023_2023,2023,59.425637,-136.283158,2023-08-02,2023-11-03,93,Forest,Wild,8,0.0860215053763441
Crupi,AK_Forest_Crupi_dep_02 09/01/2022_2022,2022,59.39466,-135.87256,2022-09-01,2022-11-05,65,Forest,Wild,5,0.0769230769230769
Crupi,AK_Forest_Crupi_dep_03_2022,2022,59.39905304,-135.9288107,2022-08-16,2022-11-05,81,Forest,Wild,2,0.0246913580246914
Crupi,AK_Forest_Crupi_loc_06_2022,2022,59.41505398,-136.0691137,2022-08-30,2022-11-04,66,Forest,Wild,4,0.0606060606060606
Crupi,AK_Forest_Crupi_loc_07 08/30/2022_2022,2022,59.41422998,-136.0642317,2022-08-30,2022-11-04,66,Forest,Wild,2,0.0303030303030303
Crupi,AK_Forest_Crupi_loc_08 07/08/2022_2022,2022,59.403024,-136.145609,2022-08-16,2022-10-09,54,Forest,Wild,1,0.0185185185185185
Crupi,AK_Forest_Crupi_loc_09 08/27/2022_2022,2022,59.358192,-135.955056,2022-08-27,2022-10-09,43,Forest,Wild,2,0.0465116279069767
Crupi,AK_Forest_Crupi_loc_10 08/26/2022_2022,2022,59.452635,-136.20086,2022-08-26,2022-10-09,44,Forest,Wild,2,0.0454545454545455
Crupi,AK_Forest_Crupi_loc_11 07/08/2022_2022,2022,59.44281,-136.388257,2022-08-12,2022-10-09,58,Forest,Wild,1,0.0172413793103448
Crupi,AK_Forest_Wild_Crupi_dep_01_2023,2023,59.42643109,-136.2225117,2023-08-02,2023-11-03,93,Forest,Wild,1,0.010752688172043
Crupi,AK_Forest_Wild_Crupi_dep_02_2023,2023,59.39466,-135.87256,2023-08-09,2023-11-04,87,Forest,Wild,4,0.0459770114942529
Crupi,AK_Forest_Wild_Crupi_dep_03_2023,2023,59.39905,-135.92881,2023-08-21,2023-11-04,75,Forest,Wild,4,0.0533333333333333
Crupi,AK_Forest_Wild_Crupi_dep_06_2023,2023,59.41505,-136.06911,2023-08-31,2023-11-03,64,Forest,Wild,3,0.046875
Crupi,AK_Forest_Wild_Crupi_dep_07_2023,2023,59.41422998,-136.0642317,2023-08-31,2023-11-03,64,Forest,Wild,2,0.03125
Crupi,AK_Forest_Wild_Crupi_dep_08_2023,2023,59.403024,-136.145609,2023-08-02,2023-10-10,69,Forest,Wild,2,0.0289855072463768
Crupi,AK_Forest_Wild_Crupi_dep_09_2023,2023,59.358192,-135.955056,2023-08-02,2023-10-10,69,Forest,Wild,1,0.0144927536231884
Crupi,AK_Forest_Wild_Crupi_dep_10_2023,2023,59.452635,-136.20086,2023-08-19,2023-08-24,5,Forest,Wild,1,0.2
Crupi,AK_Forest_Wild_Crupi_dep_11_2023,2023,59.440571,-136.353833,2023-08-03,2023-08-22,19,Forest,Wild,0,0
Crupi,AK_Forest_Wild_Crupi_dep_12_2023,2023,59.39226,-136.05232,2023-08-01,2023-11-04,95,Forest,Wild,1,0.0105263157894737
Fantle-Lepczyk,AL_Forest_Auburn_10_2019,2019,32.66487,-85.48588,2019-10-13,2019-11-06,24,Forest,Suburban,87,3.625
Fantle-Lepczyk,AL_Forest_Auburn_12_2019,2019,32.6644,-85.48485,2019-10-13,2019-11-02,20,Forest,Suburban,0,0
Fantle-Lepczyk,AL_Forest_Auburn_13_2019,2019,32.66379,-85.48567,2019-10-13,2019-11-06,24,Forest,Suburban,1,0.0416666666666667
Fantle-Lepczyk,AL_Forest_Auburn_14_2019,2019,32.66455,-85.4863,2019-10-13,2019-11-06,24,Forest,Suburban,3,0.125
Fantle-Lepczyk,AL_Forest_Auburn_15_2019,2019,32.66385,-85.48677,2019-10-14,2019-11-06,23,Forest,Suburban,0,0
Fantle-Lepczyk,AL_Forest_Auburn_16_2019,2019,32.66366,-85.48525,2019-10-13,2019-11-06,24,Forest,Suburban,95,3.95833333333333
Fantle-Lepczyk,AL_Forest_Auburn_17_2019,2019,32.66363,-85.48324,2019-10-13,2019-10-28,15,Forest,Suburban,0,0
Fantle-Lepczyk,AL_Forest_Auburn_18_2019,2019,32.66131,-85.48274,2019-10-13,2019-11-05,23,Forest,Suburban,0,0
Fantle-Lepczyk,AL_Forest_Auburn_19_2019,2019,32.66335,-85.48654,2019-10-14,2019-11-04,21,Forest,Suburban,88,4.19047619047619
Fantle-Lepczyk,AL_Forest_Auburn_1_2019,2019,32.66049,-85.4881,2019-10-12,2019-11-06,25,Forest,Suburban,160,6.4
Fantle-Lepczyk,AL_Forest_Auburn_20_02_2020,2020,32.6612,-85.48712,2020-10-11,2020-11-25,45,Forest,Suburban,3,0.0666666666666667
Fantle-Lepczyk,AL_Forest_Auburn_20_04_2020,2020,32.66264,-85.48766,2020-10-11,2020-11-22,42,Forest,Suburban,4,0.0952380952380952
Fantle-Lepczyk,AL_Forest_Auburn_20_05_2020,2020,32.66302,-85.48793,2020-10-11,2020-11-24,44,Forest,Suburban,2,0.0454545454545455
Fantle-Lepczyk,AL_Forest_Auburn_20_07_2020,2020,32.66389,-85.48844,2020-10-11,2020-11-25,45,Forest,Suburban,1,0.0222222222222222
Fantle-Lepczyk,AL_Forest_Auburn_20_14_2020,2020,32.66447,-85.48639,2020-10-12,2020-11-25,44,Forest,Suburban,1,0.0227272727272727
Fantle-Lepczyk,AL_Forest_Auburn_20_15_2020,2020,32.66437,-85.48717,2020-10-13,2020-11-24,42,Forest,Suburban,3,0.0714285714285714
Fantle-Lepczyk,AL_Forest_Auburn_20_16_2020,2020,32.65922,-85.48719,2020-10-13,2020-11-25,43,Forest,Suburban,0,0
Fantle-Lepczyk,AL_Forest_Auburn_20_17_2020,2020,32.66358,-85.48308,2020-10-13,2020-11-25,43,Forest,Suburban,1,0.0232558139534884
Fantle-Lepczyk,AL_Forest_Auburn_20_18_2020,2020,32.66138,-85.48267,2020-10-13,2020-11-25,43,Forest,Suburban,3,0.0697674418604651
Fantle-Lepczyk,AL_Forest_Auburn_20_19_2020,2020,32.66363,-85.4863,2020-10-13,2020-10-26,13,Forest,Suburban,1,0.0769230769230769
Fantle-Lepczyk,AL_Forest_Auburn_20_2019,2019,32.66298,-85.48557,2019-10-17,2019-11-06,20,Forest,Suburban,0,0
Fantle-Lepczyk,AL_Forest_Auburn_20_24_2020,2020,32.65977,-85.48338,2020-10-17,2020-11-16,30,Forest,Suburban,1,0.0333333333333333
Fantle-Lepczyk,AL_Forest_Auburn_20_25_2020,2020,32.65896,-85.48269,2020-10-13,2020-11-24,42,Forest,Suburban,1,0.0238095238095238
Fantle-Lepczyk,AL_Forest_Auburn_20_26_2020,2020,32.65877,-85.48349,2020-10-13,2020-11-24,42,Forest,Suburban,2,0.0476190476190476
Fantle-Lepczyk,AL_Forest_Auburn_20_27_2020,2020,32.65902,-85.48579,2020-10-13,2020-11-24,42,Forest,Suburban,0,0
Fantle-Lepczyk,AL_Forest_Auburn_21_2019,2019,32.66153,-85.48549,2019-10-14,2019-11-06,23,Forest,Suburban,15,0.652173913043478
Fantle-Lepczyk,AL_Forest_Auburn_22_2019,2019,32.66104,-85.48479,2019-10-15,2019-11-04,20,Forest,Suburban,0,0
Fantle-Lepczyk,AL_Forest_Auburn_23_2019,2019,32.66043,-85.48366,2019-10-17,2019-11-06,20,Forest,Suburban,0,0
Fantle-Lepczyk,AL_Forest_Auburn_24_2019,2019,32.65973,-85.48338,2019-10-14,2019-11-06,23,Forest,Suburban,0,0
Fantle-Lepczyk,AL_Forest_Auburn_25_2019,2019,32.65897,-85.4828,2019-10-14,2019-11-05,22,Forest,Suburban,0,0
Fantle-Lepczyk,AL_Forest_Auburn_26_2019,2019,32.65876,-85.4836,2019-10-14,2019-11-06,23,Forest,Suburban,0,0
Fantle-Lepczyk,AL_Forest_Auburn_27_2019,2019,32.6596,-85.48561,2019-10-15,2019-11-06,22,Forest,Suburban,0,0
Fantle-Lepczyk,AL_Forest_Auburn_2_2019,2019,32.66125,-85.48711,2019-10-12,2019-11-06,25,Forest,Suburban,3,0.12
Fantle-Lepczyk,AL_Forest_Auburn_3_2019,2019,32.66182,-85.48709,2019-10-14,2019-11-06,23,Forest,Suburban,1,0.0434782608695652
Fantle-Lepczyk,AL_Forest_Auburn_4_2019,2019,32.66249,-85.48768,2019-10-13,2019-11-06,24,Forest,Suburban,0,0
Fantle-Lepczyk,AL_Forest_Auburn_5_2019,2019,32.66294,-85.48788,2019-10-13,2019-11-06,24,Forest,Suburban,0,0
Fantle-Lepczyk,AL_Forest_Auburn_6_2019,2019,32.66269,-85.48874,2019-10-12,2019-11-06,25,Forest,Suburban,0,0
Fantle-Lepczyk,AL_Forest_Auburn_7_2019,2019,32.66381,-85.48851,2019-10-12,2019-11-05,24,Forest,Suburban,0,0
Fantle-Lepczyk,AL_Forest_Auburn_8_2019,2019,32.66496,-85.48828,2019-10-13,2019-11-04,22,Forest,Suburban,2,0.0909090909090909
Fantle-Lepczyk,AL_Forest_Fantle-Lepczyk_21_Camera 2 10/03/2021_2021,2021,32.661727,-85.487035,2021-10-03,2021-12-01,59,Forest,Suburban,3,0.0508474576271186
Fantle-Lepczyk,AL_Forest_Fantle-Lepczyk_21_camera 1 10/03/2021_2021,2021,32.660299,-85.488132,2021-10-03,2021-12-04,62,Forest,Suburban,3,0.0483870967741935
Fantle-Lepczyk,AL_Forest_Fantle-Lepczyk_21_camera 10 10/04/2021_2021,2021,32.663625,-85.487013,2021-10-04,2021-12-02,59,Forest,Suburban,1,0.0169491525423729
Fantle-Lepczyk,AL_Forest_Fantle-Lepczyk_21_camera 11 10/03/2021_2021,2021,32.663064,-85.485452,2021-10-03,2021-12-02,60,Forest,Suburban,15,0.25
Fantle-Lepczyk,AL_Forest_Fantle-Lepczyk_21_camera 13 10/04/2021_2021,2021,32.661315,-85.482881,2021-10-04,2021-11-30,57,Forest,Suburban,1,0.0175438596491228
Fantle-Lepczyk,AL_Forest_Fantle-Lepczyk_21_camera 14 10/04/2021_2021,2021,32.661362,-85.484886,2021-10-04,2021-12-03,60,Forest,Suburban,3,0.05
Fantle-Lepczyk,AL_Forest_Fantle-Lepczyk_21_camera 15 10/04/2021_2021,2021,32.66012,-85.484011,2021-10-03,2021-11-28,56,Forest,Suburban,1,0.0178571428571429
Fantle-Lepczyk,AL_Forest_Fantle-Lepczyk_21_camera 16 10/04/2021_2021,2021,32.658775,-85.483102,2021-10-04,2021-12-04,61,Forest,Suburban,5,0.0819672131147541
Fantle-Lepczyk,AL_Forest_Fantle-Lepczyk_21_camera 17 10/04/2021_2021,2021,32.659196,-85.485161,2021-10-04,2021-12-03,60,Forest,Suburban,1,0.0166666666666667
Fantle-Lepczyk,AL_Forest_Fantle-Lepczyk_21_camera 18 10/04/2021_2021,2021,32.658775,-85.486891,2021-10-04,2021-12-04,61,Forest,Suburban,3,0.0491803278688525
Fantle-Lepczyk,AL_Forest_Fantle-Lepczyk_21_camera 3 10/03/2021_2021,2021,32.662641,-85.488635,2021-10-03,2021-12-04,62,Forest,Suburban,1,0.0161290322580645
Fantle-Lepczyk,AL_Forest_Fantle-Lepczyk_21_camera 4 10/03/2021_2021,2021,32.664343,-85.488724,2021-10-03,2021-12-03,61,Forest,Suburban,1,0.0163934426229508
Fantle-Lepczyk,AL_Forest_Fantle-Lepczyk_21_camera 5 10/03/2021_2021,2021,32.665209,-85.487386,2021-10-03,2021-12-01,59,Forest,Suburban,2,0.0338983050847458
Fantle-Lepczyk,AL_Forest_Fantle-Lepczyk_21_camera 6 10/03/2021_2021,2021,32.665422,-85.485108,2021-10-03,2021-12-04,62,Forest,Suburban,3,0.0483870967741935
Fantle-Lepczyk,AL_Forest_Fantle-Lepczyk_21_camera 7 10/03/2021_2021,2021,32.66524,-85.483126,2021-10-03,2021-11-21,49,Forest,Suburban,1,0.0204081632653061
Fantle-Lepczyk,AL_Forest_Fantle-Lepczyk_21_camera 8 10/03/2021_2021,2021,32.663324,-85.482693,2021-10-03,2021-12-04,62,Forest,Suburban,3,0.0483870967741935
Fantle-Lepczyk,AL_Forest_Fantle-Lepczyk_22_camera 10 09/24/2022_2022,2022,32.663881,-85.485938,2022-09-24,2022-11-29,66,Forest,Suburban,4,0.0606060606060606
Fantle-Lepczyk,AL_Forest_Fantle-Lepczyk_22_camera 11 09/24/2022_2022,2022,32.663264,-85.487305,2022-09-24,2022-11-28,65,Forest,Suburban,1,0.0153846153846154
Fantle-Lepczyk,AL_Forest_Fantle-Lepczyk_22_camera 13 09/24/2022_2022,2022,32.663167,-85.485476,2022-09-24,2022-11-29,66,Forest,Suburban,31,0.46969696969697
Fantle-Lepczyk,AL_Forest_Fantle-Lepczyk_22_camera 14_2022,2022,32.661299,-85.482634,2022-09-24,2022-11-26,63,Forest,Suburban,1,0.0158730158730159
Fantle-Lepczyk,AL_Forest_Fantle-Lepczyk_22_camera 15 09/24/2022_2022,2022,32.661405,-85.484777,2022-09-24,2022-11-29,66,Forest,Suburban,5,0.0757575757575758
Fantle-Lepczyk,AL_Forest_Fantle-Lepczyk_22_camera 18 09/24/2022_2022,2022,32.658829,-85.482904,2022-09-24,2022-11-29,66,Forest,Suburban,3,0.0454545454545455
Fantle-Lepczyk,AL_Forest_Fantle-Lepczyk_22_camera 19 09/26/2022_2022,2022,32.658674,-85.48705,2022-09-26,2022-11-29,64,Forest,Suburban,7,0.109375
Fantle-Lepczyk,AL_Forest_Fantle-Lepczyk_22_camera 1_2022,2022,32.660404,-85.487768,2022-09-24,2022-11-29,66,Forest,Suburban,3,0.0454545454545455
Fantle-Lepczyk,AL_Forest_Fantle-Lepczyk_22_camera 2_2022,2022,32.661711,-85.487082,2022-09-24,2022-11-17,54,Forest,Suburban,3,0.0555555555555556
Fantle-Lepczyk,AL_Forest_Fantle-Lepczyk_22_camera 3_2022,2022,32.662567,-85.488645,2022-09-24,2022-11-24,61,Forest,Suburban,1,0.0163934426229508
Fantle-Lepczyk,AL_Forest_Fantle-Lepczyk_22_camera 4_2022,2022,32.6591,-85.485154,2022-09-25,2022-11-30,66,Forest,Suburban,0,0
Fantle-Lepczyk,AL_Forest_Fantle-Lepczyk_22_camera 5_2022,2022,32.664085,-85.488356,2022-09-24,2022-11-29,66,Forest,Suburban,2,0.0303030303030303
Fantle-Lepczyk,AL_Forest_Fantle-Lepczyk_22_camera 6 09/24/2022_2022,2022,32.665141,-85.48748,2022-09-24,2022-11-29,66,Forest,Suburban,1,0.0151515151515152
Fantle-Lepczyk,AL_Forest_Fantle-Lepczyk_22_camera 7 09/24/2022_2022,2022,32.66518,-85.485223,2022-09-24,2022-11-29,66,Forest,Suburban,1,0.0151515151515152
Fantle-Lepczyk,AL_Forest_Fantle-Lepczyk_22_camera 8 09/24/2022_2022,2022,32.665178,-85.483187,2022-09-24,2022-11-27,64,Forest,Suburban,1,0.015625
Fantle-Lepczyk,AL_Forest_Fantle-Lepczyk_23_Site 10_2023,2023,32.663945,-85.48581,2023-09-28,2023-11-20,53,Forest,Suburban,1,0.0188679245283019
Fantle-Lepczyk,AL_Forest_Fantle-Lepczyk_23_Site 11_2023,2023,32.662912,-85.48538,2023-09-28,2023-11-22,55,Forest,Suburban,36,0.654545454545455
Fantle-Lepczyk,AL_Forest_Fantle-Lepczyk_23_Site 12_2023,2023,32.661455,-85.482709,2023-10-01,2023-11-22,52,Forest,Suburban,1,0.0192307692307692
Fantle-Lepczyk,AL_Forest_Fantle-Lepczyk_23_Site 13_2023,2023,32.661407,-85.484875,2023-10-01,2023-11-18,48,Forest,Suburban,1,0.0208333333333333
Fantle-Lepczyk,AL_Forest_Fantle-Lepczyk_23_Site 14_2023,2023,32.660357,-85.483378,2023-10-01,2023-11-22,52,Forest,Suburban,5,0.0961538461538462
Fantle-Lepczyk,AL_Forest_Fantle-Lepczyk_23_Site 15_2023,2023,32.658771,-85.48296,2023-10-01,2023-11-20,50,Forest,Suburban,1,0.02
Fantle-Lepczyk,AL_Forest_Fantle-Lepczyk_23_Site 16_2023,2023,32.659216,-85.485362,2023-10-01,2023-11-22,52,Forest,Suburban,3,0.0576923076923077
Fantle-Lepczyk,AL_Forest_Fantle-Lepczyk_23_Site 17_2023,2023,32.658735,-85.486843,2023-10-01,2023-11-22,52,Forest,Suburban,7,0.134615384615385
Fantle-Lepczyk,AL_Forest_Fantle-Lepczyk_23_Site 1_2023,2023,32.660118,-85.488395,2023-10-01,2023-11-21,51,Forest,Suburban,240,4.70588235294118
Fantle-Lepczyk,AL_Forest_Fantle-Lepczyk_23_Site 2_2023,2023,32.661875,-85.486909,2023-09-28,2023-11-22,55,Forest,Suburban,0,0
Fantle-Lepczyk,AL_Forest_Fantle-Lepczyk_23_Site 3_2023,2023,32.662616,-85.488757,2023-09-28,2023-11-22,55,Forest,Suburban,3,0.0545454545454545
Fantle-Lepczyk,AL_Forest_Fantle-Lepczyk_23_Site 4_2023,2023,32.660405,-85.488731,2023-09-28,2023-11-22,55,Forest,Suburban,1,0.0181818181818182
Fantle-Lepczyk,AL_Forest_Fantle-Lepczyk_23_Site 6_2023,2023,32.665248,-85.487529,2023-09-28,2023-11-22,55,Forest,Suburban,1,0.0181818181818182
Fantle-Lepczyk,AL_Forest_Fantle-Lepczyk_23_Site 7_2023,2023,32.665198,-85.485304,2023-09-28,2023-11-22,55,Forest,Suburban,1,0.0181818181818182
Fantle-Lepczyk,AL_Forest_Fantle-Lepczyk_23_Site 8_2023,2023,32.665351,-85.483135,2023-09-28,2023-11-19,52,Forest,Suburban,1,0.0192307692307692
Fantle-Lepczyk,AL_Forest_Fantle-Lepczyk_23_Site 9_2023,2023,32.66345,-85.482939,2023-09-28,2023-11-19,52,Forest,Suburban,1,0.0192307692307692
DeGregorio,AR_Forest_DeGregorio_21_dep_02_2021,2021,36.25343,-93.70936,2021-09-21,2021-10-27,36,Forest,Rural,2,0.0555555555555556
DeGregorio,AR_Forest_DeGregorio_21_dep_03_2021,2021,36.2543,-93.70441,2021-09-21,2021-10-29,38,Forest,Rural,2,0.0526315789473684
DeGregorio,AR_Forest_DeGregorio_21_dep_04_2021,2021,36.25358,-93.7055,2021-09-21,2021-10-29,38,Forest,Rural,2,0.0526315789473684
DeGregorio,AR_Forest_DeGregorio_21_dep_05_2021,2021,36.25434,-93.70083,2021-09-21,2021-10-29,38,Forest,Rural,2,0.0526315789473684
DeGregorio,AR_Forest_DeGregorio_21_dep_06_2021,2021,36.25188,-93.69858,2021-09-21,2021-10-29,38,Forest,Rural,1,0.0263157894736842
DeGregorio,AR_Forest_DeGregorio_21_dep_07_2021,2021,36.25423,-93.69842,2021-09-21,2021-10-29,38,Forest,Rural,2,0.0526315789473684
DeGregorio,AR_Forest_DeGregorio_21_dep_08_2021,2021,36.25513,-93.70244,2021-09-21,2021-10-29,38,Forest,Rural,3,0.0789473684210526
DeGregorio,AR_Forest_DeGregorio_21_dep_09_2021,2021,36.25794,-93.70019,2021-09-21,2021-10-29,38,Forest,Rural,2,0.0526315789473684
DeGregorio,AR_Forest_DeGregorio_21_dep_10_2021,2021,36.25538,-93.70875,2021-09-21,2021-10-29,38,Forest,Rural,2,0.0526315789473684
DeGregorio,AR_Forest_DeGregorio_21_dep_11_2021,2021,36.25712,-93.70729,2021-09-21,2021-10-29,38,Forest,Rural,2,0.0526315789473684
DeGregorio,AR_Forest_DeGregorio_21_dep_12_2021,2021,36.25741,-93.70604,2021-09-21,2021-10-02,11,Forest,Rural,1,0.0909090909090909
DeGregorio,AR_Forest_DeGregorio_21_dep_13_2021,2021,36.25915,-93.70463,2021-09-21,2021-10-29,38,Forest,Rural,2,0.0526315789473684
DeGregorio,AR_Forest_DeGregorio_22_10_2022,2022,36.25602,-93.69908,2022-09-16,2022-10-31,45,Forest,Rural,2,0.0444444444444444
DeGregorio,AR_Forest_DeGregorio_22_11_2022,2022,36.25605,-93.70756,2022-09-16,2022-10-31,45,Forest,Rural,2,0.0444444444444444
DeGregorio,AR_Forest_DeGregorio_22_12_2022,2022,36.25752,-93.70675,2022-09-16,2022-10-31,45,Forest,Rural,2,0.0444444444444444
DeGregorio,AR_Forest_DeGregorio_22_13_2022,2022,36.25819,-93.70502,2022-09-16,2022-10-31,45,Forest,Rural,2,0.0444444444444444
DeGregorio,AR_Forest_DeGregorio_22_14_2022,2022,36.25958,-93.7043,2022-09-16,2022-10-31,45,Forest,Rural,2,0.0444444444444444
DeGregorio,AR_Forest_DeGregorio_22_15_2022,2022,36.26032,-93.70184,2022-09-16,2022-10-31,45,Forest,Rural,2,0.0444444444444444
DeGregorio,AR_Forest_DeGregorio_22_1_2022,2022,36.25492,-93.704,2022-09-16,2022-10-31,45,Forest,Rural,2,0.0444444444444444
DeGregorio,AR_Forest_DeGregorio_22_2_2022,2022,36.25507,-93.70569,2022-09-16,2022-10-31,45,Forest,Rural,2,0.0444444444444444
DeGregorio,AR_Forest_DeGregorio_22_3_2022,2022,36.25343,-93.70936,2022-09-16,2022-10-31,45,Forest,Rural,2,0.0444444444444444
DeGregorio,AR_Forest_DeGregorio_22_4_2022,2022,36.25297,-93.70639,2022-09-16,2022-10-31,45,Forest,Rural,2,0.0444444444444444
DeGregorio,AR_Forest_DeGregorio_22_5_2022,2022,36.25267,-93.70445,2022-09-16,2022-10-31,45,Forest,Rural,2,0.0444444444444444
DeGregorio,AR_Forest_DeGregorio_22_6_2022,2022,36.2538,-93.70068,2022-09-17,2022-10-31,44,Forest,Rural,0,0
DeGregorio,AR_Forest_DeGregorio_22_7_2022,2022,36.25123,-93.70026,2022-09-16,2022-10-31,45,Forest,Rural,2,0.0444444444444444
DeGregorio,AR_Forest_DeGregorio_22_8_2022,2022,36.25164,-93.69783,2022-09-16,2022-10-17,31,Forest,Rural,1,0.032258064516129
DeGregorio,AR_Forest_DeGregorio_22_9_2022,2022,36.25331,-93.69909,2022-09-16,2022-10-31,45,Forest,Rural,2,0.0444444444444444
Johans,AR_Forest_Johans_22_1.2_2022,2022,35.99882,-94.24904,2022-10-07,2022-11-13,37,Forest,Wild,1,0.027027027027027
Johans,AR_Forest_Johans_22_10_2022,2022,35.99952,-94.2463,2022-09-06,2022-10-06,30,Forest,Wild,1,0.0333333333333333
Johans,AR_Forest_Johans_22_12 09/01/2022_2022,2022,35.9991,-94.25026,2022-09-02,2022-09-13,11,Forest,Wild,0,0
Johans,AR_Forest_Johans_22_12.2_2022,2022,35.9991,-94.25026,2022-10-06,2022-11-05,30,Forest,Wild,0,0
Johans,AR_Forest_Johans_22_13.2_2022,2022,35.99817,-94.25012,2022-10-06,2022-11-13,38,Forest,Wild,1,0.0263157894736842
Johans,AR_Forest_Johans_22_13_2022,2022,35.99817,-94.25012,2022-09-02,2022-10-06,34,Forest,Wild,1,0.0294117647058824
Johans,AR_Forest_Johans_22_14 09/01/2022_2022,2022,35.99726,-94.25025,2022-09-20,2022-10-06,16,Forest,Wild,2,0.125
Johans,AR_Forest_Johans_22_14.2_2022,2022,35.99726,-94.25025,2022-08-23,2022-10-24,62,Forest,Wild,6,0.0967741935483871
Johans,AR_Forest_Johans_22_1_2022,2022,35.99882,-94.24904,2022-09-01,2022-10-06,35,Forest,Wild,1,0.0285714285714286
Johans,AR_Forest_Johans_22_2 10/06/2022_2022,2022,35.99848,-94.24779,2022-10-06,2022-11-13,38,Forest,Wild,17,0.447368421052632
Johans,AR_Forest_Johans_22_3.2_2022,2022,35.99866,-94.24631,2022-10-06,2022-11-13,38,Forest,Wild,2,0.0526315789473684
Johans,AR_Forest_Johans_22_3_2022,2022,35.99866,-94.24631,2022-09-01,2022-10-06,35,Forest,Wild,1,0.0285714285714286
Johans,AR_Forest_Johans_22_4_2022,2022,35.99731,-94.24661,2022-09-03,2022-10-06,33,Forest,Wild,1,0.0303030303030303
Johans,AR_Forest_Johans_22_5.2_2022,2022,35.99666,-94.24673,2022-10-06,2022-11-13,38,Forest,Wild,2,0.0526315789473684
Johans,AR_Forest_Johans_22_5_2022,2022,35.99666,-94.24673,2022-09-01,2022-10-06,35,Forest,Wild,3,0.0857142857142857
Johans,AR_Forest_Johans_22_6 09/01/2022_2022,2022,35.99563,-94.24648,2022-09-02,2022-10-06,34,Forest,Wild,1,0.0294117647058824
Johans,AR_Forest_Johans_22_6.2_2022,2022,35.99563,-94.24648,2022-10-06,2022-11-12,37,Forest,Wild,1,0.027027027027027
Johans,AR_Forest_Johans_22_7 09/01/2022_2022,2022,35.99667,-94.24574,2022-09-01,2022-10-06,35,Forest,Wild,1,0.0285714285714286
Johans,AR_Forest_Johans_22_7.2_2022,2022,35.99667,-94.24574,2022-10-06,2022-11-13,38,Forest,Wild,2,0.0526315789473684
Johans,AR_Forest_Johans_22_8.2_2022,2022,35.99784,-94.24522,2022-10-06,2022-11-13,38,Forest,Wild,1,0.0263157894736842
Johans,AR_Forest_Johans_22_8_2022,2022,35.99784,-94.24522,2022-09-02,2022-10-06,34,Forest,Wild,1,0.0294117647058824
Johans,AR_Forest_Johans_22_9_2022,2022,35.99901,-94.24463,2022-09-03,2022-10-06,33,Forest,Wild,1,0.0303030303030303
Tigue,AR_Forest_Tigue_Cam 15 09/02/2022_2022,2022,34.38896,-93.8946,2022-09-02,2022-10-31,59,Forest,Wild,2,0.0338983050847458
Tigue,AR_Forest_Tigue_Ouachita1 09/02/2022_2022,2022,34.3902,-93.89705,2022-09-02,2022-10-27,55,Forest,Wild,1,0.0181818181818182
Tigue,AR_Forest_Tigue_OuachitaCam30_2022,2022,34.35844,-93.90509,2022-09-02,2022-10-31,59,Forest,Wild,2,0.0338983050847458
Tigue,AR_Forest_Tigue_OuachitaCam34_2022,2022,34.36902,-93.90761,2022-09-02,2022-10-31,59,Forest,Wild,2,0.0338983050847458
Tigue,AR_Forest_Tigue_OuachitaCam36_2022,2022,34.37642,-93.91803,2022-09-02,2022-10-31,59,Forest,Wild,2,0.0338983050847458
Tigue,AR_Forest_Tigue_OuachitaCam45_2022,2022,34.35611,-93.90564,2022-09-02,2022-10-31,59,Forest,Wild,3,0.0508474576271186
Tigue,AR_Forest_Tigue_OuachitaCam49_2022,2022,34.37545,-93.93684,2022-09-02,2022-10-31,59,Forest,Wild,2,0.0338983050847458
Tigue,AR_Forest_Tigue_OuachitaCam5_2022,2022,34.38806,-93.89009,2022-09-02,2022-10-31,59,Forest,Wild,2,0.0338983050847458
Tigue,AR_Forest_Tigue_OuachitaCam67_2022,2022,34.37002,-93.91168,2022-09-02,2022-10-31,59,Forest,Wild,2,0.0338983050847458
Tigue,AR_Forest_Tigue_OuachitaCam71_2022,2022,34.38462,-93.8847,2022-09-02,2022-10-30,58,Forest,Wild,2,0.0344827586206897
Tigue,AR_Forest_Tigue_OuachitaCam73_2022,2022,34.37252,-93.9214,2022-09-02,2022-10-31,59,Forest,Wild,2,0.0338983050847458
Tigue,AR_Forest_Tigue_OuachitaCam74_2022,2022,34.37749,-93.95082,2022-09-02,2022-10-31,59,Forest,Wild,2,0.0338983050847458
Tigue,AR_Forest_Tigue_OuachitaCam82_2022,2022,34.35975,-93.9036,2022-09-02,2022-10-31,59,Forest,Wild,2,0.0338983050847458
Tigue,AR_Forest_Tigue_OuachitaCam85_2022,2022,34.38613,-93.88907,2022-09-02,2022-10-31,59,Forest,Wild,2,0.0338983050847458
Tigue,AR_Forest_Tigue_ouachitaCam21_2022,2022,34.35378,-93.90431,2022-09-02,2022-10-31,59,Forest,Wild,5,0.0847457627118644
Fayetteville,AR_Grassland_Fayetteville_10_2019,2019,36.06722,-94.23393,2019-09-13,2019-10-17,34,Grassland,Rural,4,0.117647058823529
Fayetteville,AR_Grassland_Fayetteville_11_2019,2019,36.06946,-94.2387,2019-09-13,2019-09-21,8,Grassland,Rural,5,0.625
Fayetteville,AR_Grassland_Fayetteville_12_2019,2019,36.06951,-94.23688,2019-09-13,2019-10-29,46,Grassland,Rural,2,0.0434782608695652
Fayetteville,AR_Grassland_Fayetteville_1_2019,2019,36.06512,-94.23357,2019-09-13,2019-10-28,45,Grassland,Rural,1,0.0222222222222222
Fayetteville,AR_Grassland_Fayetteville_3_2019,2019,36.06882,-94.23449,2019-09-13,2019-10-29,46,Grassland,Rural,1,0.0217391304347826
Fayetteville,AR_Grassland_Fayetteville_5_2019,2019,36.06684,-94.23191,2019-09-13,2019-10-22,39,Grassland,Rural,5,0.128205128205128
Fayetteville,AR_Grassland_Fayetteville_6_2019,2019,36.06537,-94.23211,2019-09-13,2019-10-29,46,Grassland,Rural,1,0.0217391304347826
Fayetteville,AR_Grassland_Fayetteville_7_2019,2019,36.06504,-94.23568,2019-09-13,2019-10-29,46,Grassland,Rural,2,0.0434782608695652
Fayetteville,AR_Grassland_Fayetteville_8_2019,2019,36.06489,-94.23813,2019-09-13,2019-10-29,46,Grassland,Rural,7,0.152173913043478
Fayetteville,AR_Grassland_Fayetteville_9_2019,2019,36.06697,-94.23611,2019-09-13,2019-10-27,44,Grassland,Rural,1,0.0227272727272727
Grandview,AR_Grassland_Grandview_22_03_2022,2022,33.80778,-93.78961,2022-09-01,2022-09-21,20,Grassland,Rural,1,0.05
Grandview,AR_Grassland_Grandview_22_04_2022,2022,33.80256,-93.7813,2022-09-01,2022-11-03,63,Grassland,Rural,2,0.0317460317460317
Grandview,AR_Grassland_Grandview_22_05_2022,2022,33.81054,-93.77577,2022-09-02,2022-11-04,63,Grassland,Rural,2,0.0317460317460317
Grandview,AR_Grassland_Grandview_22_06_2022,2022,33.8083,-93.77321,2022-09-02,2022-11-04,63,Grassland,Rural,1,0.0158730158730159
Grandview,AR_Grassland_Grandview_22_07_2022,2022,33.79834,-93.77167,2022-09-02,2022-11-04,63,Grassland,Rural,2,0.0317460317460317
Grandview,AR_Grassland_Grandview_22_08_2022,2022,33.78921,-93.76879,2022-09-02,2022-11-04,63,Grassland,Rural,2,0.0317460317460317
Grandview,AR_Grassland_Grandview_22_09_2022,2022,33.78666,-93.76866,2022-09-02,2022-11-04,63,Grassland,Rural,3,0.0476190476190476
Grandview,AR_Grassland_Grandview_22_10_2022,2022,33.81466,-93.76786,2022-09-02,2022-11-04,63,Grassland,Rural,2,0.0317460317460317
Grandview,AR_Grassland_Grandview_22_12_2022,2022,33.78265,-93.76666,2022-09-02,2022-10-06,34,Grassland,Rural,2,0.0588235294117647
Grandview,AR_Grassland_Grandview_22_13_2022,2022,33.7963,-93.76629,2022-09-02,2022-11-04,63,Grassland,Rural,1,0.0158730158730159
Grandview,AR_Grassland_Grandview_22_14_2022,2022,33.78239,-93.76376,2022-09-02,2022-11-04,63,Grassland,Rural,4,0.0634920634920635
Grandview,AR_Grassland_Grandview_22_15_2022,2022,33.79885,-93.7625,2022-09-02,2022-11-04,63,Grassland,Rural,2,0.0317460317460317
Grandview,AR_Grassland_Grandview_Dep 1_2022,2022,33.7992,-93.79882,2022-09-02,2022-11-04,63,Grassland,Rural,3,0.0476190476190476
Grandview,AR_Grassland_Grandview_Dep 2_2022,2022,33.79944,-93.79096,2022-09-01,2022-09-30,29,Grassland,Rural,1,0.0344827586206897
Grandview,AR_Grassland_Grandview_Prairie_20_01_2020,2020,33.81093,-93.78539,2020-09-16,2020-10-22,36,Grassland,Rural,1,0.0277777777777778
Grandview,AR_Grassland_Grandview_Prairie_20_02_2020,2020,33.80792,-93.78587,2020-09-16,2020-10-22,36,Grassland,Rural,2,0.0555555555555556
Grandview,AR_Grassland_Grandview_Prairie_20_03_2020,2020,33.81287,-93.78557,2020-09-16,2020-10-22,36,Grassland,Rural,1,0.0277777777777778
Grandview,AR_Grassland_Grandview_Prairie_20_04_2020,2020,33.8152,-93.78719,2020-09-16,2020-10-22,36,Grassland,Rural,4,0.111111111111111
Grandview,AR_Grassland_Grandview_Prairie_20_05_2020,2020,33.81657,-93.79562,2020-09-16,2020-10-22,36,Grassland,Rural,20,0.555555555555556
Grandview,AR_Grassland_Grandview_Prairie_20_06_2020,2020,33.81376,-93.79562,2020-09-16,2020-10-22,36,Grassland,Rural,2,0.0555555555555556
Grandview,AR_Grassland_Grandview_Prairie_20_07_2020,2020,33.80109,-93.78249,2020-09-16,2020-10-22,36,Grassland,Rural,2,0.0555555555555556
Grandview,AR_Grassland_Grandview_Prairie_20_09_2020,2020,33.80326,-93.78263,2020-09-17,2020-10-22,35,Grassland,Rural,13,0.371428571428571
Grandview,AR_Grassland_Grandview_Prairie_20_10_2020,2020,33.80233,-93.7742,2020-09-16,2020-10-22,36,Grassland,Rural,2,0.0555555555555556
Grandview,AR_Grassland_Grandview_Prairie_20_11_2020,2020,33.7994,-93.79256,2020-09-16,2020-10-22,36,Grassland,Rural,1,0.0277777777777778
Tucson,AZ_Desert_BC1_dep1_2022,2022,32.303397,-110.803233,2022-08-18,2022-11-12,86,Desert,Suburban,60,0.697674418604651
Tucson,AZ_Desert_LP7_dep1_2022,2022,32.1865,-110.801335,2022-09-11,2022-10-27,46,Desert,Suburban,4,0.0869565217391304
Tucson,AZ_Desert_LP9_dep1_2022,2022,32.17523,-110.78306,2022-09-11,2022-10-27,46,Desert,Suburban,1,0.0217391304347826
McDowell,AZ_Desert_McDowell_Sonoran_Preserve_10_2019,2019,33.74075,-111.80756,2019-08-26,2019-10-21,56,Desert,Rural,16,0.285714285714286
McDowell,AZ_Desert_McDowell_Sonoran_Preserve_1_2019,2019,33.74051,-111.8153,2019-08-26,2019-10-21,56,Desert,Rural,7,0.125
McDowell,AZ_Desert_McDowell_Sonoran_Preserve_20_01_2020,2020,33.73354,-111.81382,2020-09-10,2020-10-26,46,Desert,Rural,11,0.239130434782609
McDowell,AZ_Desert_McDowell_Sonoran_Preserve_20_02_2020,2020,33.6997,-111.79261,2020-09-11,2020-10-26,45,Desert,Rural,4,0.0888888888888889
McDowell,AZ_Desert_McDowell_Sonoran_Preserve_20_03_2020,2020,33.73341,-111.8083,2020-09-10,2020-10-26,46,Desert,Rural,9,0.195652173913043
McDowell,AZ_Desert_McDowell_Sonoran_Preserve_20_04_2020,2020,33.72556,-111.81516,2020-09-10,2020-10-26,46,Desert,Rural,4,0.0869565217391304
McDowell,AZ_Desert_McDowell_Sonoran_Preserve_20_05_2020,2020,33.72388,-111.80848,2020-09-10,2020-10-26,46,Desert,Rural,4,0.0869565217391304
McDowell,AZ_Desert_McDowell_Sonoran_Preserve_20_06_2020,2020,33.71826,-111.81207,2020-09-10,2020-10-26,46,Desert,Rural,6,0.130434782608696
McDowell,AZ_Desert_McDowell_Sonoran_Preserve_20_07_2020,2020,33.69793,-111.78978,2020-09-11,2020-10-27,46,Desert,Rural,7,0.152173913043478
McDowell,AZ_Desert_McDowell_Sonoran_Preserve_20_08_2020,2020,33.69004,-111.80097,2020-09-11,2020-10-27,46,Desert,Rural,5,0.108695652173913
McDowell,AZ_Desert_McDowell_Sonoran_Preserve_20_10_2020,2020,33.71574,-111.78957,2020-09-10,2020-10-21,41,Desert,Rural,5,0.121951219512195
McDowell,AZ_Desert_McDowell_Sonoran_Preserve_20_11_2020,2020,33.6969,-111.80902,2020-09-11,2020-10-27,46,Desert,Rural,7,0.152173913043478
McDowell,AZ_Desert_McDowell_Sonoran_Preserve_3_2019,2019,33.73351,-111.80827,2019-08-26,2019-10-21,56,Desert,Rural,17,0.303571428571429
McDowell,AZ_Desert_McDowell_Sonoran_Preserve_4_2019,2019,33.7192,-111.81408,2019-08-26,2019-10-21,56,Desert,Rural,22,0.392857142857143
McDowell,AZ_Desert_McDowell_Sonoran_Preserve_5_2019,2019,33.71981,-111.80666,2019-08-26,2019-10-21,56,Desert,Rural,23,0.410714285714286
McDowell,AZ_Desert_McDowell_Sonoran_Preserve_6_2019,2019,33.71222,-111.78917,2019-09-30,2019-10-21,21,Desert,Rural,4,0.19047619047619
McDowell,AZ_Desert_McDowell_Sonoran_Preserve_7B_2019,2019,33.69861,-111.79361,2019-09-03,2019-10-10,37,Desert,Rural,0,0
McDowell,AZ_Desert_McDowell_Sonoran_Preserve_8_2019,2019,33.69278,-111.79083,2019-08-27,2019-10-21,55,Desert,Rural,2,0.0363636363636364
Tucson,AZ_Desert_Res2_dep1_2022,2022,32.21555,-110.88875,2022-08-29,2022-11-08,71,Desert,Suburban,14,0.197183098591549
Tucson,AZ_Desert_Res5_dep1_2022,2022,32.224438,-110.880844,2022-09-13,2022-10-27,44,Desert,Suburban,29,0.659090909090909
Tucson,AZ_Desert_SB3_dep1_2022,2022,32.260218,-110.822554,2022-08-23,2022-11-08,77,Desert,Suburban,5,0.0649350649350649
Sonoran,AZ_Desert_Sonoran_22_CONFORTI 08/06/2022_2022,2022,32.45722,-110.93167,2022-08-06,2022-12-03,119,Desert,Suburban,2,0.0168067226890756
Sonoran,AZ_Desert_Sonoran_22_DEER 09/01/2022_2022,2022,32.46622,-110.93786,2022-09-01,2022-11-20,80,Desert,Suburban,9,0.1125
Sonoran,AZ_Desert_Sonoran_22_DOVE 10/24/2022_2022,2022,32.43822,-110.92892,2022-10-24,2022-11-02,9,Desert,Suburban,2,0.222222222222222
Sonoran,AZ_Desert_Sonoran_22_MALLOW 08/18/2022_2022,2022,32.41753,-110.92402,2022-08-18,2022-11-10,84,Desert,Suburban,38,0.452380952380952
Sonoran,AZ_Desert_Sonoran_22_Mallow_10-01_2022,2022,32.41753,-110.92402,2022-09-14,2022-09-28,14,Desert,Suburban,3,0.214285714285714
Sonoran,AZ_Desert_Sonoran_22_OWL_09-04_2022,2022,32.44865,-110.94195,2022-08-13,2022-09-04,22,Desert,Suburban,2,0.0909090909090909
Sonoran,AZ_Desert_Sonoran_22_OWL_2022,2022,32.44865,-110.94195,2022-09-04,2022-11-14,71,Desert,Suburban,1,0.0140845070422535
Sonoran,AZ_Desert_Sonoran_22_RINGTAIL 10/09/2022_2022,2022,32.45684,-110.92036,2022-10-09,2022-11-20,42,Desert,Suburban,1,0.0238095238095238
Sonoran,AZ_Desert_Sonoran_22_SNIBBY 10/03/2022_2022,2022,32.43584,-110.91683,2022-10-03,2022-11-09,37,Desert,Suburban,2,0.0540540540540541
Sonoran,AZ_Desert_Sonoran_22_THRASHER_2022,2022,32.44166,-110.94694,2022-10-28,2022-12-02,35,Desert,Suburban,2,0.0571428571428571
Sonoran,AZ_Desert_Sonoran_22_TOAD_2022,2022,32.45587,-110.92937,2022-08-02,2022-10-08,67,Desert,Suburban,2,0.0298507462686567
Sonoran,AZ_Desert_Sonoran_22_VIEW_2022,2022,32.45335,-110.93004,2022-08-02,2022-08-24,22,Desert,Suburban,1,0.0454545454545455
Sonoran,AZ_Desert_Sonoran_23_DAVID_09-23-2023_2023,2023,32.44991,-110.92865,2023-08-27,2023-09-23,27,Desert,Suburban,2,0.0740740740740741
Sonoran,AZ_Desert_Sonoran_23_DEER_11-11-2023_2023,2023,32.46622,-110.93786,2023-09-16,2023-11-11,56,Desert,Suburban,8,0.142857142857143
Sonoran,AZ_Desert_Sonoran_23_DOVE_10-29-2023_2023,2023,32.43822,-110.92892,2023-08-20,2023-10-29,70,Desert,Suburban,11,0.157142857142857
Sonoran,AZ_Desert_Sonoran_23_LION_10-29-2023_2023,2023,32.43594,-110.94627,2023-09-16,2023-10-29,43,Desert,Suburban,2,0.0465116279069767
Sonoran,AZ_Desert_Sonoran_23_OWL_10-31-2023_2023,2023,32.44865,-110.94195,2023-08-21,2023-10-31,71,Desert,Suburban,1,0.0140845070422535
Tucson,AZ_Desert_TV5_dep1_2022,2022,32.248543,-110.796723,2022-08-23,2022-11-08,77,Desert,Suburban,3,0.038961038961039
Tucson,AZ_Desert_Tucson_AC2_dep1_2022,2022,32.282793,-110.739291,2022-09-07,2022-11-12,66,Desert,Suburban,38,0.575757575757576
Tucson,AZ_Desert_Tucson_AC3_depl1_2022,2022,32.266866,-110.750661,2022-09-07,2022-11-12,66,Desert,Suburban,5,0.0757575757575758
Tucson,AZ_Desert_Tucson_AC4_dep1_2022,2022,32.256277,-110.762075,2022-09-07,2022-10-31,54,Desert,Suburban,5,0.0925925925925926
Tucson,AZ_Desert_Tucson_Res3_dep1_2022,2022,32.277661,-110.866838,2022-09-13,2022-11-23,71,Desert,Suburban,116,1.63380281690141
Tucson,AZ_Desert_UT3_2022,2022,32.242993,-110.749996,2022-08-30,2022-11-17,79,Desert,Suburban,3,0.0379746835443038
Harrity,AZ_Forest_1001_20220718_2022,2022,31.35955,-110.78466,2022-08-06,2022-09-13,38,Forest,Wild,2,0.0526315789473684
Harrity,AZ_Forest_1002_20220718_2022,2022,31.35977,-110.76364,2022-08-02,2022-09-13,42,Forest,Wild,1,0.0238095238095238
Harrity,AZ_Forest_1003_20220718_2022,2022,31.359933,-110.74257,2022-08-01,2022-09-13,43,Forest,Wild,2,0.0465116279069767
Harrity,AZ_Forest_1004_20220718_2022,2022,31.3509,-110.77428,2022-08-01,2022-09-13,43,Forest,Wild,2,0.0465116279069767
Harrity,AZ_Forest_1005_20220718_2022,2022,31.35072,-110.75279,2022-08-01,2022-09-13,43,Forest,Wild,1,0.0232558139534884
Harrity,AZ_Forest_1006_20220718_2022,2022,31.34165,-110.78448,2022-08-02,2022-09-13,42,Forest,Wild,1,0.0238095238095238
Harrity,AZ_Forest_1007_20220718_2022,2022,31.34159,-110.76318,2022-08-01,2022-09-12,42,Forest,Wild,1,0.0238095238095238
Harrity,AZ_Forest_1008_20220718_2022,2022,31.34165,-110.74272,2022-08-08,2022-09-13,36,Forest,Wild,0,0
Harrity,AZ_Forest_1101_20220722_2022,2022,31.3594,-110.70051,2022-08-01,2022-09-26,56,Forest,Wild,1,0.0178571428571429
Harrity,AZ_Forest_1101_20220926_2022,2022,31.3594,-110.70051,2022-09-26,2022-11-17,52,Forest,Wild,0,0
Harrity,AZ_Forest_1102_20220722_2022,2022,31.35964,-110.67932,2022-08-08,2022-09-10,33,Forest,Wild,0,0
Harrity,AZ_Forest_1102_20220926_2022,2022,31.35964,-110.67932,2022-09-27,2022-11-17,51,Forest,Wild,0,0
Harrity,AZ_Forest_1103_20220722_2022,2022,31.35944,-110.65825,2022-08-06,2022-09-26,51,Forest,Wild,0,0
Harrity,AZ_Forest_1103_20220926_2022,2022,31.35944,-110.65825,2022-09-26,2022-11-17,52,Forest,Wild,0,0
Harrity,AZ_Forest_1104_20220722_2022,2022,31.35055,-110.6898,2022-08-02,2022-09-23,52,Forest,Wild,0,0
Harrity,AZ_Forest_1104_20220926_2022,2022,31.35055,-110.6898,2022-09-26,2022-11-13,48,Forest,Wild,2,0.0416666666666667
Harrity,AZ_Forest_1105_20220926_2022,2022,31.35005,-110.66898,2022-09-26,2022-11-16,51,Forest,Wild,0,0
Harrity,AZ_Forest_1106_20220926_2022,2022,31.34158,-110.70044,2022-09-29,2022-11-14,46,Forest,Wild,0,0
Harrity,AZ_Forest_1107_20220926_2022,2022,31.34133,-110.67929,2022-09-30,2022-11-12,43,Forest,Wild,0,0
Harrity,AZ_Forest_1108_20220926_2022,2022,31.34148,-110.65851,2022-09-26,2022-11-15,50,Forest,Wild,2,0.04
Harrity,AZ_Forest_Harrity_1001_20220913_2022,2022,31.35955,-110.78466,2022-09-14,2022-11-06,53,Forest,Wild,0,0
Harrity,AZ_Forest_Harrity_1002_20220913_2022,2022,31.35977,-110.76364,2022-09-18,2022-11-06,49,Forest,Wild,0,0
Harrity,AZ_Forest_Harrity_1003_20220913_2022,2022,31.359933,-110.74257,2022-09-14,2022-11-05,52,Forest,Wild,1,0.0192307692307692
Harrity,AZ_Forest_Harrity_1004_20220913_2022,2022,31.3509,-110.77428,2022-09-14,2022-11-06,53,Forest,Wild,0,0
Harrity,AZ_Forest_Harrity_1005_20220913_2022,2022,31.35072,-110.75279,2022-09-14,2022-11-06,53,Forest,Wild,0,0
Harrity,AZ_Forest_Harrity_1006_20220913_2022,2022,31.34165,-110.78448,2022-09-16,2022-11-07,52,Forest,Wild,0,0
Harrity,AZ_Forest_Harrity_1007_20220913_2022,2022,31.34159,-110.76318,2022-09-14,2022-11-06,53,Forest,Wild,1,0.0188679245283019
Harrity,AZ_Forest_Harrity_1008_20220913_2022,2022,31.34165,-110.74272,2022-09-14,2022-11-05,52,Forest,Wild,0,0
SRER2,AZ_Forest_Rural_SRER2_2023_10_2023,2023,31.764158,-110.84574,2023-09-16,2023-11-10,55,Forest,Rural,5,0.0909090909090909
SRER2,AZ_Forest_Rural_SRER2_2023_11_2023,2023,31.765504,-110.847265,2023-09-16,2023-11-10,55,Forest,Rural,4,0.0727272727272727
SRER2,AZ_Forest_Rural_SRER2_2023_12_2023,2023,31.767271,-110.848459,2023-09-16,2023-11-10,55,Forest,Rural,4,0.0727272727272727
SRER2,AZ_Forest_Rural_SRER2_2023_13_2023,2023,31.768643,-110.849972,2023-09-16,2023-11-10,55,Forest,Rural,4,0.0727272727272727
SRER2,AZ_Forest_Rural_SRER2_2023_14_2023,2023,31.769208,-110.852224,2023-09-16,2023-11-10,55,Forest,Rural,2,0.0363636363636364
SRER2,AZ_Forest_Rural_SRER2_2023_15_2023,2023,31.769799,-110.854341,2023-09-16,2023-11-10,55,Forest,Rural,5,0.0909090909090909
SRER2,AZ_Forest_Rural_SRER2_2023_16_2023,2023,31.770299,-110.857662,2023-10-04,2023-11-10,37,Forest,Rural,2,0.0540540540540541
SRER2,AZ_Forest_Rural_SRER2_2023_17_2023,2023,31.771313,-110.8595,2023-09-16,2023-09-27,11,Forest,Rural,1,0.0909090909090909
SRER2,AZ_Forest_Rural_SRER2_2023_18_2023,2023,31.772663,-110.861052,2023-09-16,2023-11-10,55,Forest,Rural,5,0.0909090909090909
SRER2,AZ_Forest_Rural_SRER2_2023_19_2023,2023,31.773711,-110.862938,2023-09-16,2023-11-10,55,Forest,Rural,5,0.0909090909090909
Harrity,AZ_Forest_Wild_Harrity_23_100320230717_2023,2023,31.359933,-110.74257,2023-08-01,2023-09-11,41,Forest,Wild,1,0.024390243902439
Harrity,AZ_Forest_Wild_Harrity_23_100320230912_2023,2023,31.359933,-110.74257,2023-09-13,2023-12-01,79,Forest,Wild,2,0.0253164556962025
Harrity,AZ_Forest_Wild_Harrity_23_100420230717_2023,2023,31.3509,-110.77428,2023-08-01,2023-09-12,42,Forest,Wild,0,0
Harrity,AZ_Forest_Wild_Harrity_23_100420230912_2023,2023,31.3509,-110.77428,2023-09-13,2023-11-30,78,Forest,Wild,0,0
Harrity,AZ_Forest_Wild_Harrity_23_100520230717_2023,2023,31.35072,-110.75279,2023-08-01,2023-09-03,33,Forest,Wild,0,0
Harrity,AZ_Forest_Wild_Harrity_23_100520230912_2023,2023,31.35072,-110.75279,2023-09-12,2023-11-13,62,Forest,Wild,0,0
Harrity,AZ_Forest_Wild_Harrity_23_100620230717_2023,2023,31.34165,-110.78448,2023-08-05,2023-09-10,36,Forest,Wild,0,0
Harrity,AZ_Forest_Wild_Harrity_23_100620230912_2023,2023,31.34165,-110.78448,2023-09-13,2023-11-04,52,Forest,Wild,0,0
Harrity,AZ_Forest_Wild_Harrity_23_100720230717_2023,2023,31.34159,-110.76318,2023-08-01,2023-09-09,39,Forest,Wild,0,0
Harrity,AZ_Forest_Wild_Harrity_23_100720230912_2023,2023,31.34159,-110.76318,2023-09-15,2023-11-29,75,Forest,Wild,0,0
Harrity,AZ_Forest_Wild_Harrity_23_100820230717_2023,2023,31.34165,-110.74272,2023-08-01,2023-09-12,42,Forest,Wild,0,0
Harrity,AZ_Forest_Wild_Harrity_23_100820230912_2023,2023,31.34165,-110.74272,2023-09-13,2023-11-25,73,Forest,Wild,0,0
Harrity,AZ_Forest_Wild_Harrity_23_110120230831_2023,2023,31.3594,-110.70051,2023-08-31,2023-10-13,43,Forest,Wild,0,0
Harrity,AZ_Forest_Wild_Harrity_23_110420230831_2023,2023,31.35044,-110.68963,2023-08-31,2023-10-13,43,Forest,Wild,0,0
Harrity,AZ_Forest_Wild_Harrity_23_110520230831_2023,2023,31.35005,-110.66898,2023-09-01,2023-10-12,41,Forest,Wild,0,0
Harrity,AZ_Forest_Wild_Harrity_23_110620230831_2023,2023,31.34175,-110.70042,2023-09-01,2023-10-06,35,Forest,Wild,0,0
Harrity,AZ_Forest_Wild_Harrity_23_110720230831_2023,2023,31.34133,-110.67929,2023-09-01,2023-10-08,37,Forest,Wild,0,0
Harrity,AZ_Forest_Wild_Harrity_23_110820230831_2023,2023,31.34148,-110.65851,2023-08-31,2023-10-13,43,Forest,Wild,0,0
NAU,AZ_Forest_Wild_NAU_Loc1 09/09/2023_2023,2023,34.91187,-111.82684,2023-09-09,2023-11-19,71,Forest,Wild,5,0.0704225352112676
NAU,AZ_Forest_Wild_NAU_Loc2 09/09/2023_2023,2023,34.89551,-111.83062,2023-09-09,2023-11-17,69,Forest,Wild,6,0.0869565217391304
NAU,AZ_Forest_Wild_NAU_Loc3_REAL 09/09/2023_2023,2023,34.918,-111.91191,2023-09-09,2023-11-19,71,Forest,Wild,4,0.0563380281690141
NAU,AZ_Forest_Wild_NAU_Loc4 09/09/2023_2023,2023,34.89273,-111.8326,2023-09-09,2023-11-19,71,Forest,Wild,4,0.0563380281690141
NAU,AZ_Forest_Wild_NAU_Loc5 09/09/2023_2023,2023,34.88931,-111.87852,2023-09-09,2023-11-19,71,Forest,Wild,4,0.0563380281690141
NAU,AZ_Forest_Wild_NAU_Loc6 09/09/2023_2023,2023,34.91585,-111.91498,2023-09-09,2023-11-19,71,Forest,Wild,5,0.0704225352112676
NAU,AZ_Forest_Wild_NAU_Loc7 09/09/2023_2023,2023,34.90802,-111.82527,2023-09-09,2023-10-13,34,Forest,Wild,8,0.235294117647059
NAU,AZ_Forest_Wild_NAU_Loc8 09/09/2023_2023,2023,34.91466,-111.91675,2023-09-09,2023-11-19,71,Forest,Wild,4,0.0563380281690141
NAU,AZ_Forest_Wild_NAU_Loc9_09.30.23_2023,2023,34.90976,-111.82702,2023-09-30,2023-11-19,50,Forest,Wild,287,5.74
Cienega,AZ_Grassland_Cienega_10_2019,2019,32.16065,-109.497,2019-09-05,2019-11-19,75,Grassland,Wild,8,0.106666666666667
Cienega,AZ_Grassland_Cienega_16_2019,2019,32.171217,-109.515533,2019-09-04,2019-11-20,77,Grassland,Wild,8,0.103896103896104
Cienega,AZ_Grassland_Cienega_17_2019,2019,32.180767,-109.517283,2019-09-14,2019-11-22,69,Grassland,Wild,7,0.101449275362319
Cienega,AZ_Grassland_Cienega_1_2019,2019,32.16413,-109.471,2019-09-05,2019-11-20,76,Grassland,Wild,7,0.0921052631578947
Cienega,AZ_Grassland_Cienega_22_2019,2019,32.16578,-109.51025,2019-09-08,2019-11-19,72,Grassland,Wild,0,0
Cienega,AZ_Grassland_Cienega_25_2019,2019,32.15255,-109.5337,2019-08-17,2019-09-14,28,Grassland,Wild,1,0.0357142857142857
Cienega,AZ_Grassland_Cienega_29_2019,2019,32.180233,-109.475633,2019-09-08,2019-11-18,71,Grassland,Wild,0,0
SRER1,AZ_Grassland_Rural_SRER1_2023_1_2023,2023,31.782896,-110.842315,2023-09-16,2023-10-16,30,Grassland,Rural,2,0.0666666666666667
SRER1,AZ_Grassland_Rural_SRER1_2023_2_2023,2023,31.78421,-110.8409,2023-09-16,2023-10-14,28,Grassland,Rural,4,0.142857142857143
SRER1,AZ_Grassland_Rural_SRER1_2023_3_2023,2023,31.785685,-110.83941,2023-09-16,2023-10-30,44,Grassland,Rural,3,0.0681818181818182
SRER1,AZ_Grassland_Rural_SRER1_2023_4_2023,2023,31.786767,-110.838234,2023-09-16,2023-10-03,17,Grassland,Rural,2,0.117647058823529
SRER1,AZ_Grassland_Rural_SRER1_2023_5_2023,2023,31.78866,-110.836336,2023-09-16,2023-09-25,9,Grassland,Rural,1,0.111111111111111
SRER1,AZ_Grassland_Rural_SRER1_2023_6_2023,2023,31.790183,-110.834022,2023-09-16,2023-11-10,55,Grassland,Rural,2,0.0363636363636364
SRER1,AZ_Grassland_Rural_SRER1_2023_7_2023,2023,31.791844,-110.832952,2023-09-16,2023-11-10,55,Grassland,Rural,2,0.0363636363636364
SRER1,AZ_Grassland_Rural_SRER1_2023_8_2023,2023,31.793334,-110.831369,2023-09-16,2023-11-10,55,Grassland,Rural,6,0.109090909090909
SRER1,AZ_Grassland_Rural_SRER1_2023_9_2023,2023,31.791851,-110.829281,2023-09-16,2023-09-28,12,Grassland,Rural,1,0.0833333333333333
VermilionCliffs,AZ_Grassland_Vermilion_Cliffs_11_2019,2019,35.28934,-111.709,2019-08-24,2019-10-14,51,Shrubland,Wild,0,0
VermilionCliffs,AZ_Grassland_Vermilion_Cliffs_12_2019,2019,35.28113,-111.709,2019-08-26,2019-10-11,46,Shrubland,Wild,0,0
VermilionCliffs,AZ_Grassland_Vermilion_Cliffs_13_2019,2019,35.27785,-111.7,2019-08-23,2019-10-14,52,Shrubland,Wild,0,0
VermilionCliffs,AZ_Grassland_Vermilion_Cliffs_14_2019,2019,35.33744,-111.717,2019-08-23,2019-10-13,51,Shrubland,Wild,0,0
VermilionCliffs,AZ_Grassland_Vermilion_Cliffs_7_2019,2019,35.35103,-111.718,2019-08-23,2019-10-13,51,Shrubland,Wild,0,0
VermilionCliffs,AZ_Grassland_Vermilion_Cliffs_8_2019,2019,35.36407,-111.717,2019-08-23,2019-10-13,51,Shrubland,Wild,0,0
Abilene,Abilene State Park 12_2021,2021,32.233939,-99.877733,2021-09-04,2021-11-04,61,Grassland,Rural,3,0.0491803278688525
Abilene,Abilene State Park 7_2021,2021,32.235069,-99.881211,2021-09-02,2021-10-29,57,Grassland,Rural,0,0
Abilene,Abilene State Park Texas 09/01/2021_2021,2021,32.243922,-99.888269,2021-09-05,2021-11-04,60,Grassland,Rural,0,0
Abilene,Abilene State Park Texas 10 09/01/2021_2021,2021,32.240811,-99.878303,2021-08-31,2021-09-21,21,Grassland,Rural,1,0.0476190476190476
Abilene,Abilene State Park Texas 11 09/01/2021_2021,2021,32.233706,-99.888022,2021-09-05,2021-10-30,55,Grassland,Rural,0,0
Abilene,Abilene State Park Texas 1_2021,2021,32.233947,-99.877736,2021-09-10,2021-11-03,54,Grassland,Rural,0,0
Abilene,Abilene State Park Texas 2 09/01/2021_2021,2021,32.235228,-99.885581,2021-09-02,2021-10-29,57,Grassland,Rural,1,0.0175438596491228
Abilene,Abilene State Park Texas 2_2021,2021,32.2352667,-99.8856278,2021-09-05,2021-11-04,60,Grassland,Rural,2,0.0333333333333333
Abilene,Abilene State Park Texas 4_2021,2021,32.249658,-99.892611,2021-09-05,2021-10-28,53,Grassland,Rural,2,0.0377358490566038
Abilene,Abilene State Park Texas 5 09/01/2021_2021,2021,32.241075,-99.883106,2021-09-05,2021-11-04,60,Grassland,Rural,4,0.0666666666666667
Abilene,Abilene State Park Texas 6_2021,2021,32.239586,-99.8880156,2021-08-31,2021-11-04,65,Grassland,Rural,0,0
Abilene,Abilene State Park Texas 7 09/01/2021_2021,2021,32.235069,-99.881211,2021-09-02,2021-10-29,57,Grassland,Rural,1,0.0175438596491228
Abilene,Abilene State Park Texas 8_2021,2021,32.232989,-99.881706,2021-08-01,2021-10-04,64,Grassland,Rural,1,0.015625
Abilene,Abilene State Park Texas 9_2021,2021,32.233939,-99.877733,2021-09-01,2021-10-29,58,Grassland,Rural,0,0
Rentz,Ames_1 09/02/2021_2021,2021,42.10823,-93.56691,2021-09-02,2021-09-18,16,Forest,Rural,2,0.125
Rentz,Ames_10 09/18/2021_2021,2021,42.10656,-93.56876,2021-09-18,2021-10-31,43,Forest,Rural,3,0.0697674418604651
Rentz,Ames_11 09/18/2021_2021,2021,42.10258,-93.58598,2021-09-18,2021-10-31,43,Forest,Rural,2,0.0465116279069767
Rentz,Ames_12 09/18/2021_2021,2021,42.10006,-93.58586,2021-09-18,2021-10-31,43,Forest,Rural,2,0.0465116279069767
Rentz,Ames_13 09/10/2021_2021,2021,42.099850000000004,-93.5729,2021-09-09,2021-09-27,18,Forest,Rural,4,0.222222222222222
Rentz,Ames_14 09/27/2021_2021,2021,42.10091,-93.57024,2021-09-27,2021-10-30,33,Forest,Rural,2,0.0606060606060606
Rentz,Ames_15 10/06/2021_2021,2021,42.0891,-93.59262,2021-10-06,2021-10-31,25,Forest,Rural,2,0.08
Rentz,Ames_16 10/06/2021_2021,2021,42.08718,-93.59324,2021-10-06,2021-10-31,25,Forest,Rural,14,0.56
Rentz,Ames_17 09/28/2021_2021,2021,42.09661,-93.56991,2021-09-28,2021-10-29,31,Forest,Rural,1,0.032258064516129
Rentz,Ames_18 09/12/2021_2021,2021,42.0934,-93.57596,2021-09-12,2021-09-28,16,Forest,Rural,2,0.125
Rentz,Ames_19 10/02/2021_2021,2021,42.12773,-93.56279,2021-10-02,2021-10-31,29,Forest,Rural,3,0.103448275862069
Rentz,Ames_2 09/02/2021_2021,2021,42.11104,-93.56465,2021-09-02,2021-10-02,30,Forest,Rural,4,0.133333333333333
Rentz,Ames_20 09/18/2021_2021,2021,42.14227,-93.57064,2021-09-18,2021-10-31,43,Forest,Rural,2,0.0465116279069767
Rentz,Ames_22 10/02/2021_2021,2021,42.12272,-93.56083,2021-10-02,2021-10-31,29,Forest,Rural,6,0.206896551724138
Rentz,Ames_23 10/02/2021_2021,2021,42.09679,-93.57906,2021-10-02,2021-10-31,29,Forest,Rural,2,0.0689655172413793
Rentz,Ames_24 09/04/2021_2021,2021,42.13963,-93.56927,2021-09-04,2021-09-18,14,Forest,Rural,2,0.142857142857143
Rentz,Ames_25 09/04/2021_2021,2021,42.15574,-93.57317,2021-09-04,2021-10-04,30,Forest,Rural,2,0.0666666666666667
Rentz,Ames_26 10/04/2021_2021,2021,42.16222,-93.57472,2021-10-04,2021-11-06,33,Forest,Rural,4,0.121212121212121
Rentz,Ames_27 10/06/2021_2021,2021,42.164167,-93.574167,2021-10-06,2021-11-06,31,Forest,Rural,2,0.0645161290322581
Rentz,Ames_28 09/18/2021_2021,2021,42.1537,-93.572234,2021-09-18,2021-11-06,49,Forest,Rural,3,0.0612244897959184
Rentz,Ames_29 10/04/2021_2021,2021,42.15609,-93.57654,2021-10-04,2021-11-06,33,Forest,Rural,3,0.0909090909090909
Rentz,Ames_3 09/02/2021_2021,2021,42.1105,-93.56171,2021-09-02,2021-09-23,21,Forest,Rural,3,0.142857142857143
Rentz,Ames_30 09/04/2021_2021,2021,42.15803,-93.57644,2021-09-04,2021-10-04,30,Forest,Rural,6,0.2
Rentz,Ames_4 09/02/2021_2021,2021,42.11244,-93.56088,2021-09-02,2021-10-02,30,Forest,Rural,4,0.133333333333333
Rentz,Ames_5 09/02/2021_2021,2021,42.1138,-93.56283,2021-09-02,2021-09-18,16,Forest,Rural,3,0.1875
Rentz,Ames_6 09/10/2021_2021,2021,42.09581,-93.57294,2021-09-10,2021-09-28,18,Forest,Rural,5,0.277777777777778
Rentz,Ames_7 09/12/2021_2021,2021,42.10124,-93.57885,2021-09-12,2021-09-28,16,Forest,Rural,3,0.1875
Rentz,Ames_8 09/12/2021_2021,2021,42.09678,-93.57554,2021-09-12,2021-09-28,16,Forest,Rural,3,0.1875
Rentz,Ames_9 09/10/2021_2021,2021,42.09739,-93.57263,2021-09-10,2021-09-28,18,Forest,Rural,2,0.111111111111111
MTHansen,BAC.AROW_Rec003_Mem048.20190901_2019,2019,48.04665,-112.7181,2019-09-01,2019-11-05,65,Forest,Wild,2,0.0307692307692308
MTHansen,BAC.AROW_Rec007_Mem088.20190831_2019,2019,48.09068,-112.62233,2019-08-31,2019-11-07,68,Forest,Wild,6,0.0882352941176471
MTHansen,BAC.AROW_Rec010_Mem098.20190831_2019,2019,48.10016,-112.63235,2019-08-31,2019-11-07,68,Forest,Wild,2,0.0294117647058824
MTHansen,BAC.AROW_Rec018_Mem059.20190901_2019,2019,48.07125,-112.71844,2019-09-01,2019-11-05,65,Forest,Wild,2,0.0307692307692308
MTHansen,BAC.AROW_Rec021_Mem072.20180830_2019,2019,48.08834,-112.715,2019-08-30,2019-11-06,68,Forest,Wild,1,0.0147058823529412
MTHansen,BAC.AROW_Rec024_Mem035.20190901_2019,2019,48.0583,-112.71178,2019-09-01,2019-11-05,65,Forest,Wild,2,0.0307692307692308
MTHansen,BAC.AROW_Rec028_Mem009.20190901_2019,2019,48.06534,-112.70638,2019-09-01,2019-11-05,65,Forest,Wild,3,0.0461538461538462
MTHansen,BAC.AROW_Rec033_Mem013.20190901_2019,2019,48.07642,-112.70396,2019-09-01,2019-11-05,65,Forest,Wild,2,0.0307692307692308
MTHansen,BAC.AROW_Rec038_Mem079.20190901_2019,2019,48.0567,-112.69405,2019-09-01,2019-11-05,65,Forest,Wild,2,0.0307692307692308
MTHansen,BAC.AROW_Rec041_Mem050.20190901_2019,2019,48.08186,-112.69195,2019-09-01,2019-11-05,65,Forest,Wild,2,0.0307692307692308
MTHansen,BAC.AROW_Rec047_Mem058.20190901_2019,2019,48.09279,-112.69278,2019-09-01,2019-11-05,65,Forest,Wild,2,0.0307692307692308
MTHansen,BAC.AROW_Rec051_Mem036.20190831_2019,2019,48.10173,-112.62114,2019-08-31,2019-11-07,68,Forest,Wild,2,0.0294117647058824
MTHansen,BAC.AROW_Rec054_Mem014.20190831_2019,2019,48.08351,-112.62646,2019-08-31,2019-11-07,68,Forest,Wild,4,0.0588235294117647
MTHansen,BAC.AROW_Rec055_Mem045.20190901_2019,2019,48.0527,-112.70563,2019-09-01,2019-11-05,65,Forest,Wild,10,0.153846153846154
MTHansen,BAC.AROW_Rec059_Mem083.20190901_2019,2019,48.08905,-112.70071,2019-09-01,2019-11-05,65,Forest,Wild,2,0.0307692307692308
MTHansen,BAC.AROW_Rec061_Mem060.20190901_2019,2019,48.08092,-112.71297,2019-09-01,2019-11-05,65,Forest,Wild,2,0.0307692307692308
Blackfoot,BAC.BLCH_Rec004_Mem071.20190819_2019,2019,47.08567,-113.11209,2019-08-19,2019-10-24,66,Forest,Wild,2,0.0303030303030303
Blackfoot,BAC.BLCH_Rec006_Mem033.20190819_2019,2019,47.04922,-113.05653,2019-08-19,2019-10-24,66,Forest,Wild,2,0.0303030303030303
Blackfoot,BAC.BLCH_Rec016_Mem078.20190819_2019,2019,47.06378,-113.08588,2019-08-19,2019-10-24,66,Forest,Wild,5,0.0757575757575758
Blackfoot,BAC.BLCH_Rec025_Mem065.20190819_2019,2019,47.0879,-113.09731,2019-08-19,2019-10-24,66,Forest,Wild,2,0.0303030303030303
Blackfoot,BAC.BLCH_Rec037_Mem041.20190819_2019,2019,47.05159,-113.09887,2019-08-19,2019-10-24,66,Forest,Wild,4,0.0606060606060606
Blackfoot,BAC.BLCH_Rec039_Mem084.20190819_2019,2019,47.05059,-113.0883,2019-08-19,2019-10-24,66,Forest,Wild,2,0.0303030303030303
Blackfoot,BAC.BLCH_Rec042_Mem097.20190819_2019,2019,47.07802,-113.07108,2019-08-19,2019-10-24,66,Forest,Wild,2,0.0303030303030303
Blackfoot,BAC.BLCH_Rec044_Mem077.20190819_2019,2019,47.07802,-113.08601,2019-08-19,2019-10-24,66,Forest,Wild,2,0.0303030303030303
Blackfoot,BAC.BLCH_Rec045_Mem094.20190819_2019,2019,47.06007,-113.07124,2019-08-19,2019-10-24,66,Forest,Wild,2,0.0303030303030303
Blackfoot,BAC.BLCH_Rec046_Mem023.20190819_2019,2019,47.07014,-113.10805,2019-08-19,2019-10-24,66,Forest,Wild,3,0.0454545454545455
Blackfoot,BAC.BLCH_Rec050_Mem109.20190819_2019,2019,47.08127,-113.09924,2019-08-19,2019-10-24,66,Forest,Wild,2,0.0303030303030303
Blackfoot,BAC.BLCH_Rec057_Mem099.20190819_2019,2019,47.06623,-113.09838,2019-08-19,2019-10-24,66,Forest,Wild,2,0.0303030303030303
Blackfoot,BAC.BLCH_Rec060_Mem046.20190819_2019,2019,47.06229,-113.05164,2019-08-19,2019-10-24,66,Forest,Wild,2,0.0303030303030303
Blackfoot,BAC.BLCH_Rec063_Mem108.20190819_2019,2019,47.05593,-113.08179,2019-08-19,2019-10-24,66,Forest,Wild,2,0.0303030303030303
Blackfoot,BAC.BLCH_Rec064_Mem042.20190819_2019,2019,47.04448,-113.07418,2019-08-19,2019-10-24,66,Forest,Wild,3,0.0454545454545455
MTHansen,BAC.HMSA_Rec009_Mem102.20190830_2019,2019,48.10101,-112.66422,2019-08-30,2019-11-07,69,Forest,Wild,9,0.130434782608696
MTHansen,BAC.HMSA_Rec012_Mem063.20190831_2019,2019,48.10607,-112.65005,2019-08-31,2019-11-07,68,Forest,Wild,2,0.0294117647058824
MTHansen,BAC.HMSA_Rec020_Mem081.20190831_2019,2019,48.12629,-112.64433,2019-08-31,2019-11-04,65,Forest,Wild,3,0.0461538461538462
MTHansen,BAC.HMSA_Rec023_Mem064.20190831_2019,2019,48.11958,-112.65015,2019-08-31,2019-11-07,68,Forest,Wild,2,0.0294117647058824
MTHansen,BAC.HMSA_Rec027_Mem091.20190831_2019,2019,48.11079,-112.64165,2019-08-31,2019-11-07,68,Forest,Wild,2,0.0294117647058824
MTHansen,BAC.HMSA_Rec030_Mem089.20190831_2019,2019,48.13914,-112.64834,2019-08-31,2019-11-04,65,Forest,Wild,3,0.0461538461538462
MTHansen,BAC.HMSA_Rec032_Mem075.20190831_2019,2019,48.12597,-112.65501,2019-08-31,2019-11-04,65,Forest,Wild,2,0.0307692307692308
MTHansen,BAC.HMSA_Rec036_Mem018.20190831_2019,2019,48.13256,-112.63963,2019-08-31,2019-11-04,65,Forest,Wild,2,0.0307692307692308
MTHansen,BAC.HMSA_Rec040_Mem068.20190831_2019,2019,48.13319,-112.64832,2019-08-31,2019-11-04,65,Forest,Wild,2,0.0307692307692308
MTHansen,BAC.HMSA_Rec062_Mem051.20190831_2019,2019,48.12922,-112.66247,2019-08-31,2019-09-18,18,Forest,Wild,1,0.0555555555555556
MTUrbanWild,BAC.MSLA_Bro001_Mem117.20190729_2019,2019,46.86254,-113.97896,2019-08-17,2019-10-07,51,Forest,Suburban,5,0.0980392156862745
MTUrbanWild,BAC.MSLA_Bro002_Mem186.20191012_2019,2019,46.82091,-114.03002,2019-10-12,2019-11-19,38,Forest,Suburban,3,0.0789473684210526
MTUrbanWild,BAC.MSLA_Bro007_Mem209.20190730_2019,2019,46.87617,-113.96255,2019-08-18,2019-11-14,88,Forest,Suburban,2,0.0227272727272727
MTUrbanWild,BAC.MSLA_Bro024_Mem174.20191012_2019,2019,46.83493,-114.0057,2019-10-12,2019-11-19,38,Forest,Suburban,206,5.42105263157895
MTUrbanWild,BAC.MSLA_Bro026_Mem139.20191012_2019,2019,46.81736,-114.06136,2019-10-12,2019-11-19,38,Forest,Suburban,165,4.3421052631579
MTUrbanWild,BAC.MSLA_Bro031_Mem207.20190730_2019,2019,46.89771,-114.17403,2019-08-17,2019-10-22,66,Forest,Suburban,1,0.0151515151515152
MTUrbanWild,BAC.MSLA_Bro039_Mem189.20190718_2019,2019,46.87191,-114.06057,2019-08-17,2019-10-06,50,Forest,Suburban,7,0.14
MTUrbanWild,BAC.MSLA_Bro046_Mem150.20190820_2019,2019,46.84881,-113.97624,2019-08-20,2019-11-20,92,Forest,Suburban,8,0.0869565217391304
MTUrbanWild,BAC.MSLA_Bro052_Mem147.20190910_2019,2019,46.88117,-113.97487,2019-09-10,2019-11-14,65,Forest,Suburban,5,0.0769230769230769
MTUrbanWild,BAC.MSLA_Bro055_Mem187.20190818_2019,2019,46.86875,-113.99052,2019-08-18,2019-10-12,55,Forest,Suburban,677,12.3090909090909
MTUrbanWild,BAC.MSLA_Bro067_Mem159.20191006_2019,2019,46.86777,-114.05781,2019-10-06,2019-11-17,42,Forest,Suburban,2,0.0476190476190476
MTUrbanWild,BAC.MSLA_Bro072_Mem212.20190904_2019,2019,46.81645,-114.01799,2019-09-04,2019-11-19,76,Forest,Suburban,3,0.0394736842105263
MTUrbanWild,BAC.MSLA_Bro074_Mem214.20190823_2019,2019,46.86262,-113.94162,2019-08-23,2019-11-14,83,Forest,Suburban,2,0.0240963855421687
MTUrbanWild,BAC.MSLA_Bro078_Mem194.20190904_2019,2019,46.81915,-114.01406,2019-09-04,2019-11-19,76,Forest,Suburban,3,0.0394736842105263
MTHansen,BAC.TRMR_Bro016_Mem116.20190830_2019,2019,48.09591,-112.68559,2019-08-30,2019-11-06,68,Forest,Wild,3,0.0441176470588235
MTHansen,BAC.TRMR_Bro021_Mem210.20190830_2019,2019,48.11224,-112.65851,2019-08-30,2019-11-07,69,Forest,Wild,2,0.0289855072463768
MTHansen,BAC.TRMR_Bro029_Mem195.20190830_2019,2019,48.06104,-112.73254,2019-08-30,2019-11-05,67,Forest,Wild,2,0.0298507462686567
MTHansen,BAC.TRMR_Bro032_Mem204.20190830_2019,2019,48.10326,-112.69839,2019-08-30,2019-11-06,68,Forest,Wild,2,0.0294117647058824
MTHansen,BAC.TRMR_Bro033_Mem172.20190830_2019,2019,48.09004,-112.65432,2019-08-30,2019-11-06,68,Forest,Wild,4,0.0588235294117647
MTHansen,BAC.TRMR_Bro037_Mem205.20190830_2019,2019,48.1005,-112.70988,2019-08-30,2019-11-04,66,Forest,Wild,2,0.0303030303030303
MTHansen,BAC.TRMR_Bro040_Mem217.20190830_2019,2019,48.07983,-112.72232,2019-08-30,2019-11-06,68,Forest,Wild,4,0.0588235294117647
MTHansen,BAC.TRMR_Bro042_Mem144.20190830_2019,2019,48.11029,-112.68571,2019-08-30,2019-11-06,68,Forest,Wild,2,0.0294117647058824
MTHansen,BAC.TRMR_Bro043_Mem148.20190830_2019,2019,48.12199,-112.67567,2019-08-30,2019-11-06,68,Forest,Wild,4,0.0588235294117647
MTHansen,BAC.TRMR_Bro073_Mem169.20190830_2019,2019,48.09256,-112.71216,2019-08-30,2019-11-06,68,Forest,Wild,2,0.0294117647058824
MTHansen,BAC.TRMR_Rec001_Mem037.20200831_2020,2020,48.09999,-112.68845,2020-08-31,2020-09-06,6,Forest,Wild,1,0.166666666666667
MTHansen,BAC.TRMR_Rec001_Mem174.20210530_2021,2021,48.09999,-112.68845,2021-08-23,2021-10-23,61,Forest,Wild,3,0.0491803278688525
MTHansen,BAC.TRMR_Rec002_Mem049.20200901_2020,2020,48.08463,-112.65726,2020-09-01,2020-11-01,61,Forest,Wild,3,0.0491803278688525
MTHansen,BAC.TRMR_Rec004_Mem102.20200831_2020,2020,48.09406,-112.68894,2020-08-31,2020-09-29,29,Forest,Wild,1,0.0344827586206897
MTHansen,BAC.TRMR_Rec004_Mem135.20210530_2021,2021,48.09406,-112.68894,2021-08-23,2021-10-23,61,Forest,Wild,1,0.0163934426229508
MTHansen,BAC.TRMR_Rec006_Mem085.20200901_2020,2020,48.08917,-112.64357,2020-09-01,2020-11-01,61,Forest,Wild,2,0.0327868852459016
MTHansen,BAC.TRMR_Rec010_Mem073.20200831_2020,2020,48.10738,-112.69267,2020-08-31,2020-11-01,62,Forest,Wild,3,0.0483870967741935
MTHansen,BAC.TRMR_Rec010_Mem195.20210530_2021,2021,48.10738,-112.69267,2021-08-23,2021-10-24,62,Forest,Wild,1,0.0161290322580645
MTHansen,BAC.TRMR_Rec014_Mem020.20200831_2020,2020,48.07463,-112.72936,2020-08-31,2020-10-31,61,Forest,Wild,2,0.0327868852459016
MTHansen,BAC.TRMR_Rec014_Mem210.20210529_2021,2021,48.07463,-112.72936,2021-08-23,2021-10-23,61,Forest,Wild,1,0.0163934426229508
MTHansen,BAC.TRMR_Rec017_Mem098.20200831_2020,2020,48.11575,-112.6833,2020-08-31,2020-11-01,62,Forest,Wild,9,0.145161290322581
MTHansen,BAC.TRMR_Rec017_Mem159.20210529_2021,2021,48.11575,-112.6833,2021-08-23,2021-10-24,62,Forest,Wild,2,0.032258064516129
MTHansen,BAC.TRMR_Rec018_Mem030.20200831_2020,2020,48.09874,-112.71037,2020-08-31,2020-10-31,61,Forest,Wild,3,0.0491803278688525
MTHansen,BAC.TRMR_Rec025_Mem076.20200831_2020,2020,48.06622,-112.73686,2020-08-31,2020-10-31,61,Forest,Wild,2,0.0327868852459016
MTHansen,BAC.TRMR_Rec027_Mem110.20200831_2020,2020,48.1081,-112.70698,2020-08-31,2020-11-01,62,Forest,Wild,3,0.0483870967741935
MTHansen,BAC.TRMR_Rec027_Mem113.20210530 08/23/2021_2021,2021,48.1081,-112.70698,2021-08-23,2021-10-24,62,Forest,Wild,2,0.032258064516129
MTHansen,BAC.TRMR_Rec036_Mem069.20200831_2020,2020,48.11409,-112.69596,2020-08-31,2020-11-01,62,Forest,Wild,2,0.032258064516129
MTHansen,BAC.TRMR_Rec036_Mem165.20210529 08/23/2021_2021,2021,48.11409,-112.69596,2021-08-23,2021-10-24,62,Forest,Wild,1,0.0161290322580645
MTHansen,BAC.TRMR_Rec037_Mem087.20200901_2020,2020,48.08261,-112.63763,2020-09-01,2020-11-01,61,Forest,Wild,6,0.0983606557377049
MTHansen,BAC.TRMR_Rec039_Mem094.20200831_2020,2020,48.08772,-112.73944,2020-08-31,2020-10-31,61,Forest,Wild,4,0.0655737704918033
MTHansen,BAC.TRMR_Rec039_Mem137.20210529_2021,2021,48.08772,-112.73944,2021-08-23,2021-10-23,61,Forest,Wild,1,0.0163934426229508
MTHansen,BAC.TRMR_Rec040_Mem100.20200831_2020,2020,48.12469,-112.66968,2020-08-31,2020-11-01,62,Forest,Wild,2,0.032258064516129
MTHansen,BAC.TRMR_Rec040_Mem151.20210529_2021,2021,48.12469,-112.66968,2021-08-23,2021-10-24,62,Forest,Wild,3,0.0483870967741935
MTHansen,BAC.TRMR_Rec041_Mem099.20200831_2020,2020,48.09295,-112.70779,2020-08-31,2020-10-31,61,Forest,Wild,2,0.0327868852459016
MTHansen,BAC.TRMR_Rec042_Mem088.20200901_2020,2020,48.07277,-112.63412,2020-09-01,2020-11-01,61,Forest,Wild,4,0.0655737704918033
MTHansen,BAC.TRMR_Rec042_Mem144.20210530_2021,2021,48.07277,-112.63412,2021-08-23,2021-10-24,62,Forest,Wild,1,0.0161290322580645
MTHansen,BAC.TRMR_Rec043_Mem081.20200901_2020,2020,48.09672,-112.66609,2020-09-01,2020-11-01,61,Forest,Wild,2,0.0327868852459016
MTHansen,BAC.TRMR_Rec043_Mem204.20210530_2021,2021,48.09672,-112.66609,2021-08-23,2021-10-24,62,Forest,Wild,1,0.0161290322580645
MTHansen,BAC.TRMR_Rec044_Mem065.20200831_2020,2020,48.08363,-112.73207,2020-08-31,2020-10-31,61,Forest,Wild,2,0.0327868852459016
MTHansen,BAC.TRMR_Rec044_Mem172.20210529_2021,2021,48.08363,-112.73207,2021-08-23,2021-10-23,61,Forest,Wild,1,0.0163934426229508
MTHansen,BAC.TRMR_Rec045_Mem064.20200831_2020,2020,48.12428,-112.68279,2020-08-31,2020-11-01,62,Forest,Wild,2,0.032258064516129
MTHansen,BAC.TRMR_Rec045_Mem216.20210529_2021,2021,48.12428,-112.68279,2021-08-23,2021-10-24,62,Forest,Wild,2,0.032258064516129
MTHansen,BAC.TRMR_Rec046_Mem107.20200901_2020,2020,48.08761,-112.67028,2020-09-01,2020-11-01,61,Forest,Wild,3,0.0491803278688525
MTHansen,BAC.TRMR_Rec046_Mem117.20210530_2021,2021,48.08761,-112.67028,2021-08-23,2021-10-24,62,Forest,Wild,1,0.0161290322580645
MTHansen,BAC.TRMR_Rec048_Mem093.20200831_2020,2020,48.12314,-112.69136,2020-08-31,2020-11-01,62,Forest,Wild,3,0.0483870967741935
MTHansen,BAC.TRMR_Rec048_Mem148.20210529.fix_2021,2021,48.12314,-112.69136,2021-08-23,2021-09-29,37,Forest,Wild,0,0
MTHansen,BAC.TRMR_Rec049_Mem095.20200901_2020,2020,48.09966,-112.67345,2020-09-01,2020-11-01,61,Forest,Wild,2,0.0327868852459016
MTHansen,BAC.TRMR_Rec049_Mem211.20210530_2021,2021,48.09966,-112.67345,2021-08-23,2021-10-24,62,Forest,Wild,1,0.0161290322580645
MTHansen,BAC.TRMR_Rec050_Mem060.20200831_2020,2020,48.07745,-112.7211,2020-08-31,2020-10-31,61,Forest,Wild,2,0.0327868852459016
MTHansen,BAC.TRMR_Rec050_Mem150.20210529_2021,2021,48.07745,-112.7211,2021-08-23,2021-10-23,61,Forest,Wild,1,0.0163934426229508
MTHansen,BAC.TRMR_Rec051_Mem036.20200831_2020,2020,48.08408,-112.72256,2020-08-31,2020-10-31,61,Forest,Wild,2,0.0327868852459016
MTHansen,BAC.TRMR_Rec051_Mem187.20210529_2021,2021,48.08408,-112.72256,2021-08-23,2021-10-23,61,Forest,Wild,1,0.0163934426229508
MTHansen,BAC.TRMR_Rec052_Mem038.20200901_2020,2020,48.08859,-112.677,2020-09-01,2020-11-01,61,Forest,Wild,3,0.0491803278688525
MTHansen,BAC.TRMR_Rec052_Mem152.20210530_2021,2021,48.08859,-112.677,2021-08-23,2021-10-24,62,Forest,Wild,1,0.0161290322580645
MTHansen,BAC.TRMR_Rec056_Mem033.20200901_2020,2020,48.10876,-112.6812,2020-09-01,2020-11-01,61,Forest,Wild,2,0.0327868852459016
MTHansen,BAC.TRMR_Rec056_Mem219.20210530_2021,2021,48.10876,-112.6812,2021-08-23,2021-10-23,61,Forest,Wild,1,0.0163934426229508
MTHansen,BAC.TRMR_Rec058_Mem097.20200831_2020,2020,48.06424,-112.72783,2020-08-31,2020-10-31,61,Forest,Wild,2,0.0327868852459016
MTHansen,BAC.TRMR_Rec058_Mem173.20210529_2021,2021,48.06424,-112.72783,2021-08-23,2021-10-23,61,Forest,Wild,1,0.0163934426229508
MTHansen,BAC.TRMR_Rec060_Mem083.20200901_2020,2020,48.1164,-112.66098,2020-09-01,2020-11-01,61,Forest,Wild,5,0.0819672131147541
MTHansen,BAC.TRMR_Rec060_Mem194.20210530_2021,2021,48.1164,-112.66098,2021-08-23,2021-10-24,62,Forest,Wild,1,0.0161290322580645
MTHansen,BAC.TRMR_Rec063_Mem079.20200831_2020,2020,48.05622,-112.72646,2020-08-31,2020-10-31,61,Forest,Wild,2,0.0327868852459016
MTHansen,BAC.TRMR_Rec063_Mem139.20210529_2021,2021,48.05622,-112.72646,2021-08-23,2021-10-23,61,Forest,Wild,1,0.0163934426229508
MTHansen,BAC.TRMR_Rec064_Mem061.20200831_2020,2020,48.05618,-112.73936,2020-08-31,2020-10-31,61,Forest,Wild,2,0.0327868852459016
MTHansen,BAC.TRMR_Rec064_Mem214.20210529_2021,2021,48.05618,-112.73936,2021-08-23,2021-10-23,61,Forest,Wild,2,0.0327868852459016
Baggs,Baggs_Wild_Grasslands_21_dep_01_2021,2021,41.25946,-107.64845,2021-09-04,2021-10-30,56,Grassland,Wild,3,0.0535714285714286
Baggs,Baggs_Wild_Grasslands_21_dep_01_USE_2021,2021,41.28419,-107.66229,2021-09-04,2021-10-09,35,Grassland,Wild,2,0.0571428571428571
Baggs,Baggs_Wild_Grasslands_21_dep_02_USE_2021,2021,41.28229,-107.66082,2021-09-04,2021-10-31,57,Grassland,Wild,4,0.0701754385964912
Baggs,Baggs_Wild_Grasslands_21_dep_03_USE_2021,2021,41.28034,-107.65901,2021-09-04,2021-10-31,57,Grassland,Wild,4,0.0701754385964912
Baggs,Baggs_Wild_Grasslands_21_dep_05_USE_2021,2021,41.27278,-107.65516,2021-09-04,2021-10-31,57,Grassland,Wild,4,0.0701754385964912
Baggs,Baggs_Wild_Grasslands_21_dep_06_USE_2021,2021,41.27078,-107.65013,2021-09-04,2021-10-31,57,Grassland,Wild,4,0.0701754385964912
Baggs,Baggs_Wild_Grasslands_21_dep_08_2021,2021,41.26388,-107.64718,2021-09-04,2021-10-31,57,Grassland,Wild,22,0.385964912280702
Baggs,Baggs_Wild_Grasslands_21_dep_10_2021,2021,41.25634,-107.64667,2021-09-04,2021-10-09,35,Grassland,Wild,2,0.0571428571428571
SLC,Blaine Preserve.USA.2019_2019,2019,40.73222,-111.84668,2019-10-04,2019-11-17,44,Desert,Urban,5,0.113636363636364
SLC,Blaine Preserve.USA.2020_2020,2020,40.73226,-111.84674,2020-10-06,2020-11-05,30,Desert,Urban,3,0.1
Carrizo,C 09/03/2021_2021,2021,35.366101,-120.019248,2021-09-03,2021-10-01,28,Grassland,Wild,3,0.107142857142857
URI,C06_2020,2020,41.4962147,-71.5265907,2020-09-20,2020-11-14,55,Forest,Suburban,17,0.309090909090909
URI,C07_2020,2020,41.4962147,-71.5265907,2020-09-29,2020-11-14,46,Forest,Suburban,6,0.130434782608696
URI,C12_2020,2020,41.49158,-71.52239,2020-09-20,2020-11-03,44,Forest,Suburban,6,0.136363636363636
Mojave,CAM_1 - Location 3_2021,2021,36.44726,-115.41371,2021-10-21,2021-10-21,0,Desert,Wild,4,4
Mojave,CAM_22 - Location 3_2021,2021,36.44847,-115.38708,2021-10-01,2021-11-03,33,Desert,Wild,20,0.606060606060606
Mojave,CAM_23 - Location 3_2021,2021,36.39083,-115.34051,2021-10-01,2021-10-01,0,Desert,Wild,0,0
Mojave,CAM_26 - Location 3_2021,2021,36.30638,-115.16678,2021-10-13,2021-11-05,23,Desert,Wild,0,0
Mojave,CAM_30 - Location 3_2021,2021,36.36948,-115.31667,2021-10-05,2021-10-27,22,Desert,Wild,3,0.136363636363636
Mojave,CAM_32 - Location 3_2021,2021,36.33581,-115.26071,2021-10-02,2021-11-13,42,Desert,Wild,46,1.0952380952381
Mojave,CAM_4 - Location 3_2021,2021,36.33658,-115.279,2021-10-01,2021-11-12,42,Desert,Wild,532,12.6666666666667
Mojave,CAM_6 - Location 3_2021,2021,36.36572,-115.3083,2021-10-01,2021-11-03,33,Desert,Wild,0,0
Mojave,CAM_7 - Location 3_2021,2021,36.42217,-115.40918,2021-10-05,2021-10-24,19,Desert,Wild,0,0
Carlile,CA_Anthropogenic_Carlile_22_01_2022,2022,37.9072222,-122.01083333,2022-09-12,2022-11-01,50,Grassland,Suburban,6,0.12
Carlile,CA_Anthropogenic_Carlile_22_02_2022,2022,37.91016,-122.00877,2022-08-29,2022-10-31,63,Grassland,Suburban,20,0.317460317460317
Carlile,CA_Anthropogenic_Carlile_22_03_2022,2022,37.909722,-122.011944,2022-08-29,2022-10-31,63,Grassland,Suburban,5,0.0793650793650794
Carlile,CA_Anthropogenic_Carlile_22_05_2022,2022,37.90694444,-122.00833333,2022-09-02,2022-10-31,59,Grassland,Suburban,22,0.372881355932203
Carlile,CA_Anthropogenic_Carlile_22_06_2022,2022,37.908611,-122.002778,2022-09-01,2022-10-31,60,Grassland,Suburban,12,0.2
Carlile,CA_Anthropogenic_Carlile_22_07a_2022,2022,37.905833,-122.003333,2022-09-01,2022-09-11,10,Grassland,Suburban,1,0.1
Carlile,CA_Anthropogenic_Carlile_22_07b_2022,2022,37.905833,-122.003333,2022-10-20,2022-10-31,11,Grassland,Suburban,1,0.0909090909090909
Carlile,CA_Anthropogenic_Carlile_22_08_2022,2022,37.905278,-122.000833,2022-09-01,2022-11-01,61,Grassland,Suburban,2,0.0327868852459016
Carlile,CA_Anthropogenic_Carlile_22_09_2022,2022,37.90654,-122.00604,2022-09-01,2022-11-01,61,Grassland,Suburban,6,0.0983606557377049
Carlile,CA_Anthropogenic_Carlile_22_10_2022,2022,37.90715,-121.99997,2022-09-01,2022-10-31,60,Grassland,Suburban,4,0.0666666666666667
Carlile,CA_Anthropogenic_Carlile_23_01_2023,2023,37.9072222,-122.0108333,2023-09-01,2023-11-01,61,Grassland,Suburban,15,0.245901639344262
Carlile,CA_Anthropogenic_Carlile_23_02_2023,2023,37.906944,-122.008611,2023-09-01,2023-10-31,60,Grassland,Suburban,7,0.116666666666667
Carlile,CA_Anthropogenic_Carlile_23_03_2023,2023,37.906944,-122.002222,2023-09-01,2023-10-31,60,Grassland,Suburban,4,0.0666666666666667
Carlile,CA_Anthropogenic_Carlile_23_05_2023,2023,37.90694444,-122.0083333,2023-09-01,2023-10-31,60,Grassland,Suburban,6,0.1
Carlile,CA_Anthropogenic_Carlile_23_06_2023,2023,37.909722,-122.0025,2023-09-01,2023-10-31,60,Grassland,Suburban,16,0.266666666666667
Carlile,CA_Anthropogenic_Carlile_23_07_2023,2023,37.905833,-122.003333,2023-09-01,2023-10-31,60,Grassland,Suburban,1,0.0166666666666667
Carlile,CA_Anthropogenic_Carlile_23_08_2023,2023,37.905278,-122.000833,2023-08-29,2023-10-31,63,Grassland,Suburban,3,0.0476190476190476
Carlile,CA_Anthropogenic_Carlile_23_09_2023,2023,37.906389,-122.006111,2023-09-15,2023-10-31,46,Grassland,Suburban,2,0.0434782608695652
Carlile,CA_Anthropogenic_Carlile_23_10_2023,2023,37.907222,-121.983333,2023-09-01,2023-10-31,60,Grassland,Suburban,2,0.0333333333333333
PointReyes,CA_Beach_PointReyes_Loc01_Dep01_2023,2023,38.0319005,-122.9340918,2023-09-05,2023-10-20,45,Beach,Rural,22,0.488888888888889
PointReyes,CA_Beach_PointReyes_Loc02_Dep01_2023,2023,38.0317691,-122.9398626,2023-09-05,2023-11-04,60,Beach,Rural,13,0.216666666666667
PointReyes,CA_Beach_PointReyes_Loc03_Dep01_2023,2023,38.0350203,-122.940551,2023-09-05,2023-09-20,15,Beach,Rural,14,0.933333333333333
PointReyes,CA_Beach_PointReyes_Loc03_Dep02_2023,2023,38.0350203,-122.940551,2023-09-24,2023-10-07,13,Beach,Rural,8,0.615384615384615
PointReyes,CA_Beach_PointReyes_Loc03_Dep03_2023,2023,38.0350203,-122.940551,2023-10-24,2023-11-04,11,Beach,Rural,3,0.272727272727273
PointReyes,CA_Beach_PointReyes_Loc04_Dep01_2023,2023,38.031728,-122.947321,2023-09-05,2023-11-04,60,Beach,Rural,44,0.733333333333333
PointReyes,CA_Beach_PointReyes_Loc05_Dep01_2023,2023,38.0310886,-122.9511409,2023-09-05,2023-09-09,4,Beach,Rural,2,0.5
PointReyes,CA_Beach_PointReyes_Loc05_Dep02_2023,2023,38.0310886,-122.9511409,2023-09-24,2023-11-04,41,Beach,Rural,16,0.390243902439024
PointReyes,CA_Beach_PointReyes_Loc06_Dep01_2023,2023,38.0278328,-122.9607784,2023-09-24,2023-10-24,30,Beach,Rural,51,1.7
PointReyes,CA_Beach_PointReyes_Loc06_Dep02_2023,2023,38.0278328,-122.9607784,2023-10-24,2023-11-04,11,Beach,Rural,7,0.636363636363636
PointReyes,CA_Beach_PointReyes_Loc07_Dep01_2023,2023,38.0216449,-122.9712755,2023-09-05,2023-11-05,61,Beach,Rural,44,0.721311475409836
PointReyes,CA_Beach_PointReyes_Loc08_Dep01_2023,2023,38.0161364,-122.9771045,2023-09-05,2023-10-19,44,Beach,Rural,11,0.25
PointReyes,CA_Beach_PointReyes_Loc08_Dep02_2023,2023,38.0161364,-122.9771045,2023-10-24,2023-11-05,12,Beach,Rural,14,1.16666666666667
PointReyes,CA_Beach_PointReyes_Loc09_Dep01_2023,2023,38.0103961,-122.9813945,2023-09-06,2023-11-05,60,Beach,Rural,16,0.266666666666667
Pepperdine,CA_Chaparral_Rural_Pepperdine_23_dep_01_2023,2023,34.0478161,-118.7148335,2023-09-13,2023-11-15,63,Chaparral,Rural,11,0.174603174603175
Pepperdine,CA_Chaparral_Rural_Pepperdine_23_dep_02_2023,2023,34.0458657,-118.7126405,2023-09-13,2023-10-02,19,Chaparral,Rural,35,1.84210526315789
Pepperdine,CA_Chaparral_Rural_Pepperdine_23_dep_03_2023,2023,34.0420544,-118.7185276,2023-09-13,2023-11-16,64,Chaparral,Rural,164,2.5625
Pepperdine,CA_Chaparral_Rural_Pepperdine_23_dep_04_2023,2023,34.038333,-118.708611,2023-09-15,2023-11-16,62,Chaparral,Rural,3,0.0483870967741935
Pepperdine,CA_Chaparral_Rural_Pepperdine_23_dep_05_2023,2023,34.037778,-118.706389,2023-10-04,2023-11-16,43,Chaparral,Rural,4,0.0930232558139535
Pepperdine,CA_Chaparral_Rural_Pepperdine_23_dep_06_2023,2023,34.045833,-118.705833,2023-09-15,2023-09-22,7,Chaparral,Rural,78,11.1428571428571
Pepperdine,CA_Chaparral_Rural_Pepperdine_23_dep_07_2023,2023,34.047778,-118.706389,2023-09-15,2023-10-24,39,Chaparral,Rural,175,4.48717948717949
Pepperdine,CA_Chaparral_Rural_Pepperdine_23_dep_08_2023,2023,34.043056,-118.709722,2023-09-15,2023-11-16,62,Chaparral,Rural,11,0.17741935483871
Pepperdine,CA_Chaparral_Rural_Pepperdine_23_dep_10_2023,2023,34.044722,-118.716667,2023-09-16,2023-11-16,61,Chaparral,Rural,125,2.04918032786885
Pepperdine,CA_Chaparral_Rural_Pepperdine_23_dep_11_2023,2023,34.044167,-118.718056,2023-09-22,2023-11-16,55,Chaparral,Rural,259,4.70909090909091
Pepperdine,CA_Chaparral_Rural_Pepperdine_23_dep_12_2023,2023,34.046944,-118.716944,2023-10-02,2023-10-12,10,Chaparral,Rural,8,0.8
Pepperdine,CA_Chaparral_Rural_Pepperdine_23_dep_13_2023,2023,34.046944,-118.710833,2023-09-16,2023-10-25,39,Chaparral,Rural,11,0.282051282051282
Pepperdine,CA_Chaparral_Rural_Pepperdine_23_dep_14_2023,2023,34.045556,-118.708333,2023-09-16,2023-11-16,61,Chaparral,Rural,6,0.0983606557377049
Redwoods,CA_Forest_CR2_Redwoods_D2_2023,2023,40.69552,-124.1899,2023-10-05,2023-11-15,41,Forest,Suburban,0,0
Redwoods,CA_Forest_CR3_NewNestLocation_Redwoods_D2_2023,2023,40.700383,-124.197829,2023-10-02,2023-11-17,46,Forest,Suburban,0,0
Redwoods,CA_Forest_CR6_Newlocationpond_Redwoods2023D2 10/02/2023_2023,2023,40.699884,-124.190672,2023-10-02,2023-11-17,46,Forest,Suburban,1,0.0217391304347826
SierraNevada,CA_Forest_Chaparral_2023 09/04/2023_2023,2023,37.36180854,-119.6986362,2023-09-04,2023-10-23,49,Forest,Wild,1,0.0204081632653061
SierraNevada,CA_Forest_Chapparal_10 09/04/2023_2023,2023,37.370903,-119.680268,2023-09-04,2023-10-27,53,Forest,Wild,2,0.0377358490566038
SierraNevada,CA_Forest_Chapparal_11 09/04/2023_2023,2023,37.367479,-119.692793,2023-09-04,2023-10-27,53,Forest,Wild,5,0.0943396226415094
SierraNevada,CA_Forest_Chapparal_13 09/04/2023_2023,2023,37.365388,-119.695907,2023-09-04,2023-10-27,53,Forest,Wild,3,0.0566037735849057
SierraNevada,CA_Forest_Chapparal_2 09/04/2023_2023,2023,37.3615346,-119.689227,2023-09-04,2023-10-27,53,Forest,Wild,3,0.0566037735849057
SierraNevada,CA_Forest_Chapparal_3 09/04/2023_2023,2023,37.36071222,-119.6869639,2023-09-09,2023-10-27,48,Forest,Wild,1,0.0208333333333333
SierraNevada,CA_Forest_Chapparal_4 09/04/2023_2023,2023,37.36180215,-119.6848449,2023-09-05,2023-10-27,52,Forest,Wild,48,0.923076923076923
SierraNevada,CA_Forest_Chapparal_5 09/04/2023_2023,2023,37.36529484,-119.678862,2023-09-05,2023-10-27,52,Forest,Wild,2,0.0384615384615385
SierraNevada,CA_Forest_Chapparal_6 09/04/2023_2023,2023,37.36767386,-119.6765554,2023-09-04,2023-10-27,53,Forest,Wild,4,0.0754716981132075
SierraNevada,CA_Forest_Chapparal_7 09/04/2023_2023,2023,37.36633514,-119.6743721,2023-09-04,2023-10-27,53,Forest,Wild,5,0.0943396226415094
SierraNevada,CA_Forest_Chapparal_9 09/04/2023_2023,2023,37.369114,-119.670461,2023-10-08,2023-11-27,50,Forest,Wild,3,0.06
Humboldt,CA_Forest_Humboldt_10_2019,2019,41.28632,-124.0065,2019-09-21,2019-10-20,29,Forest,Wild,2,0.0689655172413793
Humboldt,CA_Forest_Humboldt_11_2019,2019,41.27639,-124.00436,2019-09-05,2019-10-20,45,Forest,Wild,4,0.0888888888888889
Humboldt,CA_Forest_Humboldt_12_2019,2019,41.30415,-124.01818,2019-09-01,2019-10-20,49,Forest,Wild,6,0.122448979591837
Humboldt,CA_Forest_Humboldt_13_2019,2019,41.3026,-124.01615,2019-09-01,2019-10-20,49,Forest,Wild,5,0.102040816326531
Humboldt,CA_Forest_Humboldt_14_2019,2019,41.30504,-124.01562,2019-09-01,2019-09-21,20,Forest,Wild,2,0.1
Humboldt,CA_Forest_Humboldt_16_2019,2019,41.3058,-124.01984,2019-09-21,2019-10-20,29,Forest,Wild,3,0.103448275862069
Humboldt,CA_Forest_Humboldt_17_2019,2019,41.30658,-124.02187,2019-09-21,2019-10-20,29,Forest,Wild,3,0.103448275862069
Humboldt,CA_Forest_Humboldt_18_2019,2019,41.30835,-124.02464,2019-09-21,2019-10-20,29,Forest,Wild,2,0.0689655172413793
Humboldt,CA_Forest_Humboldt_1_2019,2019,41.30322,-124.01091,2019-09-01,2019-09-21,20,Forest,Wild,2,0.1
Humboldt,CA_Forest_Humboldt_2_2019,2019,41.30433,-124.01348,2019-09-01,2019-09-21,20,Forest,Wild,2,0.1
Humboldt,CA_Forest_Humboldt_3_2019,2019,41.30166,-124.01341,2019-09-01,2019-09-21,20,Forest,Wild,3,0.15
Humboldt,CA_Forest_Humboldt_4_2019,2019,41.30047,-124.01103,2019-09-01,2019-10-20,49,Forest,Wild,3,0.0612244897959184
Humboldt,CA_Forest_Humboldt_5_2019,2019,41.2844,-124.00714,2019-09-05,2019-10-20,45,Forest,Wild,6,0.133333333333333
Humboldt,CA_Forest_Humboldt_6_2019,2019,41.2827,-124.00808,2019-09-05,2019-10-12,37,Forest,Wild,2,0.0540540540540541
Humboldt,CA_Forest_Humboldt_7_2019,2019,41.2848,-124.00429,2019-09-05,2019-10-20,45,Forest,Wild,3,0.0666666666666667
Pepperwood,CA_Forest_Pepperwood_Preserve_10_2019,2019,38.59622,-122.71297,2019-09-01,2019-09-16,15,Forest,Wild,2,0.133333333333333
Pepperwood,CA_Forest_Pepperwood_Preserve_11_2019,2019,38.60502,-122.70084,2019-09-01,2019-09-16,15,Forest,Wild,2,0.133333333333333
Pepperwood,CA_Forest_Pepperwood_Preserve_12_2019,2019,38.60535,-122.72408,2019-09-16,2019-10-22,36,Forest,Wild,3,0.0833333333333333
Pepperwood,CA_Forest_Pepperwood_Preserve_13_2019,2019,38.60513,-122.71257,2019-09-01,2019-10-22,51,Forest,Wild,3,0.0588235294117647
Pepperwood,CA_Forest_Pepperwood_Preserve_1_2019,2019,38.58762,-122.72356,2019-09-02,2019-10-09,37,Forest,Wild,2,0.0540540540540541
Pepperwood,CA_Forest_Pepperwood_Preserve_20_01_2020,2020,38.6053,-122.724,2020-09-02,2020-10-13,41,Forest,Wild,12,0.292682926829268
Pepperwood,CA_Forest_Pepperwood_Preserve_20_02_reupload_2020,2020,38.6051,-122.7125,2020-09-02,2020-10-13,41,Forest,Wild,2,0.048780487804878
Pepperwood,CA_Forest_Pepperwood_Preserve_20_03_2020,2020,38.5966,-122.7352,2020-09-02,2020-10-13,41,Forest,Wild,9,0.219512195121951
Pepperwood,CA_Forest_Pepperwood_Preserve_20_04_2020,2020,38.5962,-122.7245,2020-09-02,2020-10-13,41,Forest,Wild,17,0.414634146341463
Pepperwood,CA_Forest_Pepperwood_Preserve_20_06_2020,2020,38.5962,-122.7129,2020-09-02,2020-09-14,12,Forest,Wild,8,0.666666666666667
Pepperwood,CA_Forest_Pepperwood_Preserve_20_07_2020,2020,38.5961,-122.7013,2020-09-02,2020-10-13,41,Forest,Wild,13,0.317073170731707
Pepperwood,CA_Forest_Pepperwood_Preserve_20_08_2020,2020,38.58761,-122.72355,2020-09-02,2020-10-14,42,Forest,Wild,24,0.571428571428571
Pepperwood,CA_Forest_Pepperwood_Preserve_20_09_2020,2020,38.58715,-122.70147,2020-09-03,2020-10-14,41,Forest,Wild,12,0.292682926829268
Pepperwood,CA_Forest_Pepperwood_Preserve_20_10_2020,2020,38.56913,-122.72415,2020-09-04,2020-10-15,41,Forest,Wild,13,0.317073170731707
Pepperwood,CA_Forest_Pepperwood_Preserve_20_11_2020,2020,38.5871,-122.6896,2020-09-03,2020-09-15,12,Forest,Wild,8,0.666666666666667
Pepperwood,CA_Forest_Pepperwood_Preserve_20_12_2020,2020,38.57803,-122.68996,2020-09-03,2020-10-14,41,Forest,Wild,16,0.390243902439024
Pepperwood,CA_Forest_Pepperwood_Preserve_20_13_2020,2020,38.56841,-122.73609,2020-09-04,2020-10-15,41,Forest,Wild,18,0.439024390243902
Pepperwood,CA_Forest_Pepperwood_Preserve_2_2019,2019,38.58716,-122.70148,2019-09-01,2019-10-09,38,Forest,Wild,2,0.0526315789473684
Pepperwood,CA_Forest_Pepperwood_Preserve_3_2019,2019,38.58714,-122.68969,2019-09-01,2019-10-09,38,Forest,Wild,2,0.0526315789473684
Pepperwood,CA_Forest_Pepperwood_Preserve_5_2019,2019,38.57804,-122.68997,2019-09-01,2019-10-09,38,Forest,Wild,1,0.0263157894736842
Pepperwood,CA_Forest_Pepperwood_Preserve_6_2019,2019,38.56842,-122.7361,2019-09-02,2019-10-11,39,Forest,Wild,4,0.102564102564103
Pepperwood,CA_Forest_Pepperwood_Preserve_7_2019,2019,38.59623,-122.72451,2019-09-01,2019-10-11,40,Forest,Wild,3,0.075
Pepperwood,CA_Forest_Pepperwood_Preserve_8_2019,2019,38.5966,-122.73527,2019-09-01,2019-09-20,19,Forest,Wild,0,0
Pepperwood,CA_Forest_Pepperwood_Preserve_9_2019,2019,38.56914,-122.72416,2019-09-01,2019-10-11,40,Forest,Wild,1,0.025
Redwoods,CA_Forest_Redwoods_01_01_2022,2022,40.69815,-124.1891,2022-09-03,2022-10-05,32,Forest,Suburban,0,0
Redwoods,CA_Forest_Redwoods_01_02_2022,2022,40.69592,-124.1889,2022-10-08,2022-11-03,26,Forest,Suburban,0,0
Redwoods,CA_Forest_Redwoods_02_01_2022,2022,40.69552,-124.1899,2022-09-01,2022-10-05,34,Forest,Suburban,0,0
Redwoods,CA_Forest_Redwoods_02_02_2022,2022,40.69552,-124.1899,2022-10-08,2022-11-03,26,Forest,Suburban,0,0
Redwoods,CA_Forest_Redwoods_03_02_2022,2022,40.700383,-124.197829,2022-10-06,2022-11-02,27,Forest,Suburban,0,0
Redwoods,CA_Forest_Redwoods_04_01_2022,2022,40.700767,-124.199509,2022-09-01,2022-10-05,34,Forest,Suburban,1,0.0294117647058824
Redwoods,CA_Forest_Redwoods_04_02_2022,2022,40.700767,-124.199509,2022-10-05,2022-10-27,22,Forest,Suburban,0,0
Redwoods,CA_Forest_Redwoods_05_01_2022,2022,40.700544,-124.203221,2022-09-01,2022-10-04,33,Forest,Suburban,1,0.0303030303030303
Redwoods,CA_Forest_Redwoods_05_02_2022,2022,40.700544,-124.203221,2022-10-06,2022-11-02,27,Forest,Suburban,0,0
Redwoods,CA_Forest_Redwoods_06_01_2022,2022,40.699884,-124.190672,2022-09-06,2022-09-08,2,Forest,Suburban,1,0.5
Redwoods,CA_Forest_Redwoods_06_02_2022,2022,40.699884,-124.190672,2022-10-06,2022-10-13,7,Forest,Suburban,0,0
Redwoods,CA_Forest_Redwoods_07_01_2022,2022,40.700387,-124.190672,2022-08-31,2022-10-06,36,Forest,Suburban,1,0.0277777777777778
Redwoods,CA_Forest_Redwoods_07_02_2022,2022,40.700387,-124.190672,2022-10-10,2022-11-03,24,Forest,Suburban,0,0
Redwoods,CA_Forest_Redwoods_08_01_2022,2022,40.700828,-124.192713,2022-08-31,2022-10-06,36,Forest,Suburban,0,0
Redwoods,CA_Forest_Redwoods_08_02_2022,2022,40.700828,-124.192713,2022-10-07,2022-11-03,27,Forest,Suburban,0,0
Redwoods,CA_Forest_Redwoods_09_01_2022,2022,40.69828,-124.1926,2022-09-01,2022-10-06,35,Forest,Suburban,2,0.0571428571428571
Redwoods,CA_Forest_Redwoods_09_02_2022,2022,40.69828,-124.1926,2022-10-06,2022-11-02,27,Forest,Suburban,0,0
Redwoods,CA_Forest_Redwoods_10_01_2022,2022,40.6996,-124.1894,2022-09-01,2022-10-06,35,Forest,Suburban,3,0.0857142857142857
Redwoods,CA_Forest_Redwoods_10_02_2022,2022,40.6996,-124.1894,2022-10-06,2022-10-31,25,Forest,Suburban,0,0
Redwoods,CA_Forest_Redwoods_11_01_2022,2022,40.69815,-124.1891,2022-08-31,2022-10-06,36,Forest,Suburban,0,0
Redwoods,CA_Forest_Redwoods_11_02_2022,2022,40.69815,-124.1891,2022-10-08,2022-10-27,19,Forest,Suburban,0,0
Redwoods,CA_Forest_Redwoods_12_01_2022,2022,40.69914,-124.1935,2022-08-31,2022-10-05,35,Forest,Suburban,3,0.0857142857142857
Redwoods,CA_Forest_Redwoods_12_02_2022,2022,40.69914,-124.1935,2022-10-07,2022-11-03,27,Forest,Suburban,0,0
Redwoods,CA_Forest_Redwoods_13_01_2022,2022,40.69548,-124.1933,2022-08-31,2022-10-31,61,Forest,Suburban,0,0
Redwoods,CA_Forest_Redwoods_14_01_2022,2022,40.69523,-124.1915,2022-09-06,2022-10-06,30,Forest,Suburban,0,0
Redwoods,CA_Forest_Redwoods_14_02_2022,2022,40.69523,-124.1915,2022-10-07,2022-11-03,27,Forest,Suburban,1,0.037037037037037
Redwoods,CA_Forest_Redwoods_15_01_2022,2022,40.699433,-124.191728,2022-09-01,2022-09-29,28,Forest,Suburban,2,0.0714285714285714
Redwoods,CA_Forest_Redwoods_15_02_2022,2022,40.699433,-124.191728,2022-10-07,2022-11-03,27,Forest,Suburban,0,0
Redwoods,CA_Forest_Redwoods_CR06B_2022,2022,40.699894,-124.201054,2022-10-30,2022-10-31,1,Forest,Suburban,0,0
Redwoods,CA_Forest_Redwoods_CR_01_23_D1_2023,2023,40.69592,-124.1889,2023-08-28,2023-10-02,35,Forest,Suburban,1,0.0285714285714286
Redwoods,CA_Forest_Redwoods_CR_02_23_D1_2023,2023,40.69552,-124.1899,2023-08-28,2023-10-02,35,Forest,Suburban,1,0.0285714285714286
Redwoods,CA_Forest_Redwoods_CR_03_23_D1_2023,2023,40.700383,-124.197829,2023-08-28,2023-10-02,35,Forest,Suburban,0,0
Redwoods,CA_Forest_Redwoods_CR_04_23_D1_2023,2023,40.700383,-124.197829,2023-08-28,2023-11-17,81,Forest,Suburban,0,0
Redwoods,CA_Forest_Redwoods_CR_05_23_D1_2023,2023,40.700544,-124.203221,2023-08-28,2023-11-17,81,Forest,Suburban,0,0
Redwoods,CA_Forest_Redwoods_CR_06_23_D1_2023,2023,40.699884,-124.190672,2023-08-28,2023-10-02,35,Forest,Suburban,1,0.0285714285714286
Redwoods,CA_Forest_Redwoods_CR_07_23_D1_2023,2023,40.700387,-124.190672,2023-08-28,2023-11-06,70,Forest,Suburban,0,0
Redwoods,CA_Forest_Redwoods_CR_08_23_D1_2023,2023,40.700828,-124.192713,2023-08-28,2023-11-06,70,Forest,Suburban,0,0
Redwoods,CA_Forest_Redwoods_CR_09_23_D1_2023,2023,40.69828,-124.1926,2023-08-28,2023-11-17,81,Forest,Suburban,0,0
Redwoods,CA_Forest_Redwoods_CR_10_23_D1_2023,2023,40.6996,-124.1894,2023-08-31,2023-11-06,67,Forest,Suburban,0,0
Redwoods,CA_Forest_Redwoods_CR_12_23_D1_2023,2023,40.69914,-124.1935,2023-08-28,2023-11-17,81,Forest,Suburban,0,0
Redwoods,CA_Forest_Redwoods_CR_13_23_D1_2023,2023,40.6954833,-124.1933333,2023-08-30,2023-11-15,77,Forest,Suburban,0,0
Redwoods,CA_Forest_Redwoods_CR_14_23_D1_2023,2023,40.69523,-124.1915,2023-08-28,2023-11-15,79,Forest,Suburban,0,0
Redwoods,CA_Forest_Redwoods_CR_15_23_D1_2023,2023,40.699433,-124.191728,2023-08-28,2023-11-06,70,Forest,Suburban,0,0
SierraNevada,CA_Forest_Sierra Nevada_10_2019,2019,37.37062,-119.68237,2019-09-28,2019-10-26,28,Forest,Wild,2,0.0714285714285714
SierraNevada,CA_Forest_Sierra Nevada_11_2019,2019,37.363,-119.69463,2019-08-31,2019-10-26,56,Forest,Wild,8,0.142857142857143
SierraNevada,CA_Forest_Sierra Nevada_1_2019,2019,37.36991,-119.67375,2019-08-31,2019-09-17,17,Forest,Wild,2,0.117647058823529
SierraNevada2,CA_Forest_Sierra Nevada_20_01_2020,2020,37.41507,-119.59993,2020-09-02,2020-10-24,52,Forest,Wild,3,0.0576923076923077
SierraNevada2,CA_Forest_Sierra Nevada_20_02_2020,2020,37.41716,-119.59964,2020-09-02,2020-10-24,52,Forest,Wild,2,0.0384615384615385
SierraNevada2,CA_Forest_Sierra Nevada_20_03_2020,2020,37.41382,-119.59771,2020-09-02,2020-10-24,52,Forest,Wild,6,0.115384615384615
SierraNevada2,CA_Forest_Sierra Nevada_20_04_2020,2020,37.41171,-119.59614,2020-09-02,2020-10-24,52,Forest,Wild,2,0.0384615384615385
SierraNevada2,CA_Forest_Sierra Nevada_20_05_2020,2020,37.41618,-119.59627,2020-09-02,2020-10-22,50,Forest,Wild,1,0.02
SierraNevada2,CA_Forest_Sierra Nevada_20_06_2020,2020,37.41854,-119.59508,2020-09-02,2020-10-24,52,Forest,Wild,2,0.0384615384615385
SierraNevada2,CA_Forest_Sierra Nevada_20_07_2020,2020,37.42293,-119.59515,2020-09-02,2020-10-24,52,Forest,Wild,2,0.0384615384615385
SierraNevada2,CA_Forest_Sierra Nevada_20_08_2020,2020,37.41197,-119.59953,2020-09-02,2020-10-24,52,Forest,Wild,2,0.0384615384615385
SierraNevada2,CA_Forest_Sierra Nevada_20_09_2020,2020,37.41124,-119.59506,2020-09-02,2020-10-24,52,Forest,Wild,2,0.0384615384615385
SierraNevada,CA_Forest_Sierra Nevada_2_2019,2019,37.36519,-119.69414,2019-08-31,2019-09-27,27,Forest,Wild,1,0.037037037037037
SierraNevada,CA_Forest_Sierra Nevada_3_2019,2019,37.36256,-119.69152,2019-08-31,2019-10-26,56,Forest,Wild,17,0.303571428571429
SierraNevada,CA_Forest_Sierra Nevada_4_2019,2019,37.36192,-119.68836,2019-08-31,2019-10-26,56,Forest,Wild,4,0.0714285714285714
SierraNevada,CA_Forest_Sierra Nevada_5_2019,2019,37.36185,-119.68449,2019-09-01,2019-10-26,55,Forest,Wild,6,0.109090909090909
SierraNevada,CA_Forest_Sierra Nevada_6_2019,2019,37.36478,-119.68007,2019-08-31,2019-10-26,56,Forest,Wild,14,0.25
SierraNevada,CA_Forest_Sierra Nevada_7_2019,2019,37.36906,-119.67689,2019-08-31,2019-10-26,56,Forest,Wild,7,0.125
SierraNevada,CA_Forest_Sierra Nevada_8_2019,2019,37.36697,-119.6736,2019-08-31,2019-10-26,56,Forest,Wild,8,0.142857142857143
SierraNevada,CA_Forest_Sierra Nevada_9_2019,2019,37.36815,-119.67053,2019-08-31,2019-10-26,56,Forest,Wild,4,0.0714285714285714
SierraNevada,"CA_Forest_SierraNevada_21_dep_02,CA_Forest_SierraNevada_21_loc_02, 08/27/2021_2021",2021,37.367503,-119.676376,2021-08-27,2021-10-29,63,Forest,Wild,3,0.0476190476190476
SierraNevada,"CA_Forest_SierraNevada_21_dep_03,CA_Forest_SierraNevada_21_loc_03, 08/27/2021_2021",2021,37.367845,-119.6738159,2021-08-27,2021-10-29,63,Forest,Wild,3,0.0476190476190476
SierraNevada,"CA_Forest_SierraNevada_21_dep_04,CA_Forest_SierraNevada_21_loc_04, 08/27/2021_2021",2021,37.367392100000004,-119.6684335,2021-08-27,2021-09-04,8,Forest,Wild,1,0.125
SierraNevada,"CA_Forest_SierraNevada_21_dep_05,CA_Forest_SierraNevada_21_loc_05, 08/27/2021_2021",2021,37.374195,-119.669007,2021-08-27,2021-10-29,63,Forest,Wild,3,0.0476190476190476
SierraNevada,"CA_Forest_SierraNevada_21_dep_06,CA_Forest_SierraNevada_21_loc_06, 08/27/2021_2021",2021,37.374195,-119.669007,2021-08-27,2021-10-29,63,Forest,Wild,4,0.0634920634920635
SierraNevada,"CA_Forest_SierraNevada_21_dep_07,CA_Forest_SierraNevada_21_loc_07, 08/27/2021_2021",2021,37.378245,-119.683887,2021-08-27,2021-10-29,63,Forest,Wild,3,0.0476190476190476
SierraNevada,"CA_Forest_SierraNevada_21_dep_08,CA_Forest_SierraNevada_21_loc_08, 08/27/2021_2021",2021,37.370683,-119.69914,2021-10-19,2021-12-20,62,Forest,Wild,1,0.0161290322580645
SierraNevada,"CA_Forest_SierraNevada_21_dep_09,CA_Forest_SierraNevada_21_loc_09, 08/27/2021_2021",2021,37.36184,-119.698846,2021-08-28,2021-10-29,62,Forest,Wild,2,0.032258064516129
SierraNevada,"CA_Forest_SierraNevada_21_dep_10,CA_Forest_SierraNevada_21_loc_10, 08/27/2021_2021",2021,37.367026,-119.692881,2021-08-27,2021-10-29,63,Forest,Wild,3,0.0476190476190476
SierraNevada,CA_Forest_SierraNevada_Camera 10_2022,2022,37.36808625,-119.67102644,2022-08-28,2022-10-22,55,Forest,Wild,4,0.0727272727272727
SierraNevada,CA_Forest_SierraNevada_Camera 11_2022,2022,37.3709953,-119.6803398,2022-08-28,2022-10-22,55,Forest,Wild,2,0.0363636363636364
SierraNevada,CA_Forest_SierraNevada_Camera 12_2022,2022,37.368693,-119.6791,2022-09-09,2022-10-22,43,Forest,Wild,1,0.0232558139534884
SierraNevada,CA_Forest_SierraNevada_Camera 13_Deployment 1_2022,2022,37.369145,-119.688059,2022-08-28,2022-10-11,44,Forest,Wild,1,0.0227272727272727
SierraNevada,CA_Forest_SierraNevada_Camera 13_Deployment 2_2022,2022,37.369145,-119.688059,2022-10-11,2022-10-22,11,Forest,Wild,5,0.454545454545455
SierraNevada,CA_Forest_SierraNevada_Camera 14_2022,2022,37.367865,-119.69218,2022-08-28,2022-10-03,36,Forest,Wild,1,0.0277777777777778
SierraNevada,CA_Forest_SierraNevada_Camera 15_2022,2022,37.3666,-119.694,2022-08-28,2022-10-22,55,Forest,Wild,3,0.0545454545454545
SierraNevada,CA_Forest_SierraNevada_Camera 1_2022,2022,37.36170318,-119.69608534,2022-08-28,2022-10-22,55,Forest,Wild,2,0.0363636363636364
SierraNevada,CA_Forest_SierraNevada_Camera 2_2022,2022,37.3624536,-119.6894334,2022-08-28,2022-10-22,55,Forest,Wild,2,0.0363636363636364
SierraNevada,CA_Forest_SierraNevada_Camera 3_2022,2022,37.3616018,-119.6855,2022-08-28,2022-10-22,55,Forest,Wild,2,0.0363636363636364
SierraNevada,CA_Forest_SierraNevada_Camera 4_2022,2022,37.362187,-119.68329498,2022-08-28,2022-10-22,55,Forest,Wild,4,0.0727272727272727
SierraNevada,CA_Forest_SierraNevada_Camera 5_2022,2022,37.36556383,-119.6787888,2022-08-28,2022-10-22,55,Forest,Wild,3,0.0545454545454545
SierraNevada,CA_Forest_SierraNevada_Camera 6_2022,2022,37.36776805,-119.67661,2022-08-28,2022-10-22,55,Forest,Wild,3,0.0545454545454545
SierraNevada,CA_Forest_SierraNevada_Camera 7_2022,2022,37.37014275,-119.6758062,2022-08-28,2022-10-15,48,Forest,Wild,1,0.0208333333333333
SierraNevada,CA_Forest_SierraNevada_Camera 8_2022,2022,37.37071245,-119.67304346,2022-08-28,2022-10-22,55,Forest,Wild,2,0.0363636363636364
SierraNevada,CA_Forest_SierraNevada_Camera 9_2022,2022,37.367821,-119.6732151,2022-08-28,2022-10-22,55,Forest,Wild,2,0.0363636363636364
DaleyRanch,CA_Forest_Suburban_DaleyRanch_23_DR2301_2023,2023,33.199732,-117.066466,2023-09-16,2023-11-02,47,Forest,Suburban,4,0.0851063829787234
DaleyRanch,CA_Forest_Suburban_DaleyRanch_23_DR2302_2023,2023,33.2012,-117.06365,2023-09-16,2023-11-02,47,Forest,Suburban,2,0.0425531914893617
DaleyRanch,CA_Forest_Suburban_DaleyRanch_23_DR2303_2023,2023,33.20116,-117.061773,2023-09-16,2023-11-02,47,Forest,Suburban,1,0.0212765957446809
DaleyRanch,CA_Forest_Suburban_DaleyRanch_23_DR2304_2023,2023,33.199741,-117.058044,2023-09-16,2023-11-02,47,Forest,Suburban,3,0.0638297872340425
DaleyRanch,CA_Forest_Suburban_DaleyRanch_23_DR2305_2023,2023,33.198578,-117.055158,2023-09-16,2023-11-02,47,Forest,Suburban,3,0.0638297872340425
DaleyRanch,CA_Forest_Suburban_DaleyRanch_23_DR2306_2023,2023,33.201804,-117.052634,2023-09-16,2023-11-02,47,Forest,Suburban,3,0.0638297872340425
DaleyRanch,CA_Forest_Suburban_DaleyRanch_23_DR2307_2023,2023,33.1982,-117.04996,2023-09-16,2023-11-02,47,Forest,Suburban,4,0.0851063829787234
DaleyRanch,CA_Forest_Suburban_DaleyRanch_23_DR2308_Deploy1_2023,2023,33.19482,-117.04924,2023-09-16,2023-09-24,8,Forest,Suburban,1,0.125
DaleyRanch,CA_Forest_Suburban_DaleyRanch_23_DR2308_Deploy2_2023,2023,33.19482,-117.04924,2023-10-17,2023-10-27,10,Forest,Suburban,1,0.1
DaleyRanch,CA_Forest_Suburban_DaleyRanch_23_DR2309_2023,2023,33.1909,-117.049,2023-09-19,2023-11-02,44,Forest,Suburban,4,0.0909090909090909
DaleyRanch,CA_Forest_Suburban_DaleyRanch_23_DR2310_2023,2023,33.1859,-117.04789,2023-09-19,2023-11-02,44,Forest,Suburban,3,0.0681818181818182
DaleyRanch,CA_Forest_Suburban_DaleyRanch_23_DR2311_Deploy 1_2023,2023,33.1825,-117.047,2023-09-19,2023-09-28,9,Forest,Suburban,1,0.111111111111111
DaleyRanch,CA_Forest_Suburban_DaleyRanch_23_DR2311_Deploy2_2023,2023,33.1825,-117.047,2023-10-15,2023-10-31,16,Forest,Suburban,1,0.0625
DaleyRanch,CA_Forest_Suburban_DaleyRanch_23_DR2312_2023,2023,33.1799,-117.0515,2023-09-19,2023-11-02,44,Forest,Suburban,5,0.113636363636364
DaleyRanch,CA_Forest_Suburban_DaleyRanch_23_DR2313_2023,2023,33.1734,-117.052,2023-09-19,2023-11-02,44,Forest,Suburban,3,0.0681818181818182
DaleyRanch,CA_Forest_Suburban_DaleyRanch_23_DR2314_2023,2023,33.1735,-117.04752,2023-09-19,2023-11-01,43,Forest,Suburban,7,0.162790697674419
Carrizo,CA_Grassland_Carrizo Plains_20_01_2020,2020,35.38726,-120.01558,2020-09-03,2020-09-23,20,Grassland,Wild,1,0.05
Carrizo,CA_Grassland_Carrizo Plains_20_02_2020,2020,35.33724,-120.05406,2020-09-25,2020-10-29,34,Grassland,Wild,1,0.0294117647058824
Carrizo,CA_Grassland_Carrizo Plains_20_03_2020,2020,35.35845,-119.99775,2020-09-03,2020-09-15,12,Grassland,Wild,1,0.0833333333333333
Carrizo,CA_Grassland_Carrizo Plains_20_04_2020,2020,35.38357,-119.98726,2020-09-03,2020-10-30,57,Grassland,Wild,2,0.0350877192982456
Carrizo,CA_Grassland_Carrizo Plains_20_05_2020,2020,35.3933,-120.02442,2020-09-03,2020-09-25,22,Grassland,Wild,7,0.318181818181818
Carrizo,CA_Grassland_Carrizo Plains_20_06_2020,2020,35.36669,-120.01926,2020-09-03,2020-10-23,50,Grassland,Wild,2,0.04
Carrizo,CA_Grassland_Carrizo Plains_20_07_2020,2020,35.39286,-119.98782,2020-09-03,2020-10-18,45,Grassland,Wild,13,0.288888888888889
Carrizo,CA_Grassland_Carrizo Plains_20_08_2020,2020,35.36948,-119.9763,2020-09-03,2020-09-06,3,Grassland,Wild,1,0.333333333333333
Carrizo,CA_Grassland_Carrizo Plains_20_09_2020,2020,35.33703,-120.05846,2020-09-03,2020-10-30,57,Grassland,Wild,4,0.0701754385964912
Carrizo,CA_Grassland_Carrizo Plains_20_10_2020,2020,35.4005,-119.94736,2020-09-03,2020-09-25,22,Grassland,Wild,2,0.0909090909090909
Carrizo,CA_Grassland_Carrizo Plains_20_11_2020,2020,35.35992,-120.0056,2020-09-24,2020-10-29,35,Grassland,Wild,244,6.97142857142857
Carrizo,CA_Grassland_Carrizo Plains_20_12_2020,2020,35.4033,-119.99237,2020-09-25,2020-10-30,35,Grassland,Wild,2,0.0571428571428571
Carrizo,CA_Grassland_Carrizo Plains_20_13_2020,2020,35.37875,-120.01302,2020-09-25,2020-10-30,35,Grassland,Wild,5,0.142857142857143
Carrizo,CA_Grassland_Carrizo Plains_20_14_2020,2020,35.36459,-119.99134,2020-09-25,2020-10-04,9,Grassland,Wild,0,0
Carrizo,CA_Grassland_Carrizo_1 09/20/2023_2023,2023,35.337105,-120.05855,2023-09-20,2023-11-09,50,Grassland,Wild,5,0.1
Carrizo,CA_Grassland_Carrizo_10 09/20/2023_2023,2023,35.373942,-119.987451,2023-09-20,2023-11-09,50,Grassland,Wild,2,0.04
Carrizo,CA_Grassland_Carrizo_11 09/20/2023_2023,2023,35.392781,-119.995024,2023-09-26,2023-11-09,44,Grassland,Wild,1,0.0227272727272727
Carrizo,CA_Grassland_Carrizo_12 09/20/2023_2023,2023,35.406969,-120.046073,2023-09-20,2023-11-09,50,Grassland,Wild,2,0.04
Carrizo,CA_Grassland_Carrizo_13 09/20/2023_2023,2023,35.366279,-120.022277,2023-09-20,2023-09-24,4,Grassland,Wild,1,0.25
Carrizo,CA_Grassland_Carrizo_14 09/20/2023_2023,2023,35.4770355,-120.036353,2023-09-01,2023-09-20,19,Grassland,Wild,1,0.0526315789473684
Carrizo,CA_Grassland_Carrizo_2 09/20/2023_2023,2023,35.338608,-120.070845,2023-09-20,2023-11-09,50,Grassland,Wild,3,0.06
Carrizo,"CA_Grassland_Carrizo_21_dep_02, CA_Grassland_Carrizo_21_loc_02 09/03/2021_2021",2021,35.366086,-120.014127,2021-09-03,2021-09-26,23,Grassland,Wild,1,0.0434782608695652
Carrizo,"CA_Grassland_Carrizo_21_dep_03, CA_Grassland_Carrizo_21_loc_03 09/03/2021_2021",2021,35.383607,-119.987339,2021-09-03,2021-10-01,28,Grassland,Wild,2,0.0714285714285714
Carrizo,"CA_Grassland_Carrizo_21_dep_04, CA_Grassland_Carrizo_21_loc_04 09/03/2021_2021",2021,35.392747,-119.987217,2021-09-03,2021-10-01,28,Grassland,Wild,2,0.0714285714285714
Carrizo,"CA_Grassland_Carrizo_21_dep_05, CA_Grassland_Carrizo_21_loc_05 09/03/2021_2021",2021,35.395391,-119.99311,2021-09-03,2021-10-01,28,Grassland,Wild,4,0.142857142857143
Carrizo,"CA_Grassland_Carrizo_21_dep_06, CA_Grassland_Carrizo_21_loc_06 09/03/2021_2021",2021,35.40818,-120.020726,2021-09-03,2021-10-01,28,Grassland,Wild,2,0.0714285714285714
Carrizo,"CA_Grassland_Carrizo_21_dep_07, CA_Grassland_Carrizo_21_loc_07 09/03/2021_2021",2021,35.401006,-120.013967,2021-09-03,2021-10-01,28,Grassland,Wild,3,0.107142857142857
Carrizo,"CA_Grassland_Carrizo_21_dep_08, CA_Grassland_Carrizo_21_loc_08 09/03/2021_2021",2021,35.393587,-120.013977,2021-09-03,2021-10-01,28,Grassland,Wild,3,0.107142857142857
Carrizo,"CA_Grassland_Carrizo_21_dep_09, CA_Grassland_Carrizo_21_loc_09 09/03/2021_2021",2021,35.384439,-120.010411,2021-09-03,2021-09-19,16,Grassland,Wild,1,0.0625
Carrizo,"CA_Grassland_Carrizo_21_dep_10, CA_Grassland_Carrizo_21_loc_10 09/03/2021_2021",2021,35.356755,-120.009423,2021-09-03,2021-10-01,28,Grassland,Wild,11,0.392857142857143
Carrizo,"CA_Grassland_Carrizo_21_dep_11, CA_Grassland_Carrizo_21_loc_11 09/03/2021_2021",2021,35.337082,-120.05852,2021-09-03,2021-10-01,28,Grassland,Wild,4,0.142857142857143
Carrizo,"CA_Grassland_Carrizo_21_dep_12, CA_Grassland_Carrizo_21_loc_12 09/03/2021_2021",2021,35.337186,-120.069772,2021-09-03,2021-09-14,11,Grassland,Wild,1,0.0909090909090909
Carrizo,"CA_Grassland_Carrizo_21_dep_13, CA_Grassland_Carrizo_21_loc_13 09/03/2021_2021",2021,35.410517,-120.094062,2021-09-03,2021-10-01,28,Grassland,Wild,2,0.0714285714285714
Carrizo,"CA_Grassland_Carrizo_21_dep_15, CA_Grassland_Carrizo_21_loc_15 09/03/2021_2021",2021,35.408436,-120.050862,2021-09-03,2021-10-01,28,Grassland,Wild,2,0.0714285714285714
Carrizo,CA_Grassland_Carrizo_3 09/20/2023_2023,2023,35.395347,-119.993355,2023-09-20,2023-11-09,50,Grassland,Wild,2,0.04
Carrizo,CA_Grassland_Carrizo_4 09/20/2023_2023,2023,35.410084,-120.00881,2023-09-20,2023-10-02,12,Grassland,Wild,3,0.25
Carrizo,CA_Grassland_Carrizo_5 09/20/2023_2023,2023,35.407609,-120.019862,2023-09-20,2023-10-05,15,Grassland,Wild,2,0.133333333333333
Carrizo,CA_Grassland_Carrizo_6 09/20/2023_2023,2023,35.401061,-120.013973,2023-09-20,2023-10-03,13,Grassland,Wild,2,0.153846153846154
Carrizo,CA_Grassland_Carrizo_7 09/20/2023_2023,2023,35.377178,-119.997867,2023-09-20,2023-11-09,50,Grassland,Wild,2,0.04
Carrizo,CA_Grassland_Carrizo_9 09/20/2023_2023,2023,35.402843,-119.987385,2023-09-20,2023-10-05,15,Grassland,Wild,1,0.0666666666666667
Carrizo,CA_Grassland_Carrizo_Camera 10_Deployment 1_2022,2022,35.393483,-120.013729,2022-09-11,2022-10-11,30,Grassland,Wild,1,0.0333333333333333
Carrizo,CA_Grassland_Carrizo_Camera 11_deployment 1_2022,2022,35.389302,-120.014094,2022-09-08,2022-09-12,4,Grassland,Wild,1,0.25
Carrizo,CA_Grassland_Carrizo_Camera 12_Deployment 1_2022,2022,35.374169,-120.005446,2022-09-08,2022-10-11,33,Grassland,Wild,0,0
Carrizo,CA_Grassland_Carrizo_Camera 1_Deployment 1_2022,2022,35.367494,-120.022499,2022-09-08,2022-10-06,28,Grassland,Wild,2,0.0714285714285714
Carrizo,CA_Grassland_Carrizo_Camera 2_Deployment 1_2022,2022,35.366059,-120.014174,2022-09-08,2022-10-07,29,Grassland,Wild,1,0.0344827586206897
Carrizo,CA_Grassland_Carrizo_Camera 4_Deployment 1_2022,2022,35.372507,-119.994647,2022-09-08,2022-10-11,33,Grassland,Wild,2,0.0606060606060606
Carrizo,CA_Grassland_Carrizo_Camera 5_Deployment  1_2022,2022,35.384709,-119.987195,2022-09-08,2022-10-11,33,Grassland,Wild,15,0.454545454545455
Carrizo,CA_Grassland_Carrizo_Camera 6_Deployment 1_2022,2022,35.395385,-119.993325,2022-09-08,2022-10-10,32,Grassland,Wild,0,0
Carrizo,CA_Grassland_Carrizo_Camera 8_Deployment 1_2022,2022,35.402876,-120.022494,2022-09-08,2022-10-11,33,Grassland,Wild,2,0.0606060606060606
Carrizo,CA_Grassland_Carrizo_Camera 9_Deployment 1_2022,2022,35.396334,-120.013783,2022-09-08,2022-10-11,33,Grassland,Wild,4,0.121212121212121
Osos,CA_Oak_Woodland_Osos_20_01_2020,2020,37.0396,-121.33829,2020-09-27,2020-10-23,26,Forest,Wild,1,0.0384615384615385
Osos,CA_Oak_Woodland_Osos_20_04_2020,2020,37.0516,-121.3782,2020-09-27,2020-10-23,26,Forest,Wild,2,0.0769230769230769
Osos,CA_Oak_Woodland_Osos_20_05_2020,2020,37.0477,-121.3691,2020-09-27,2020-10-23,26,Forest,Wild,2,0.0769230769230769
Osos,CA_Oak_Woodland_Osos_20_06_2020,2020,37.0459,-121.3573,2020-09-27,2020-10-23,26,Forest,Wild,3,0.115384615384615
Osos,CA_Oak_Woodland_Osos_20_07_2020,2020,37.0556,-121.3788,2020-09-28,2020-10-23,25,Forest,Wild,1,0.04
Osos,CA_Oak_Woodland_Osos_20_08_2020,2020,37.058,-121.3808,2020-09-27,2020-10-23,26,Forest,Wild,2,0.0769230769230769
Osos,CA_Oak_Woodland_Osos_20_09_2020,2020,37.0391,-121.3561,2020-09-27,2020-10-23,26,Forest,Wild,5,0.192307692307692
Osos,CA_Oak_Woodland_Osos_20_12_2020,2020,37.0431,-121.3455,2020-10-08,2020-10-23,15,Forest,Wild,2,0.133333333333333
Osos,CA_Oak_Woodland_Osos_20_13_2020,2020,37.0358,-121.34,2020-09-27,2020-10-23,26,Forest,Wild,2,0.0769230769230769
Osos,CA_Oak_Woodland_Osos_20_14_2020,2020,37.0466,-121.3831,2020-09-27,2020-10-23,26,Forest,Wild,2,0.0769230769230769
Osos,CA_Oak_Woodland_Osos_20_15_2020,2020,37.0463,-121.3912,2020-09-27,2020-10-23,26,Forest,Wild,2,0.0769230769230769
SanJoaquin,CA_Riparian_San_Joaquin_10_2019,2019,36.86104,-119.84094,2019-09-02,2019-10-30,58,Forest,Rural,26,0.448275862068966
SanJoaquin,CA_Riparian_San_Joaquin_11_2019,2019,36.8603,-119.84312,2019-09-02,2019-10-30,58,Forest,Rural,11,0.189655172413793
SanJoaquin,CA_Riparian_San_Joaquin_12_2019,2019,36.860393,-119.846157,2019-09-02,2019-10-30,58,Forest,Rural,14,0.241379310344828
SanJoaquin,CA_Riparian_San_Joaquin_13_2019,2019,36.85321,-119.85199,2019-09-17,2019-10-18,31,Forest,Rural,7,0.225806451612903
SanJoaquin,CA_Riparian_San_Joaquin_14_2019,2019,36.85285,-119.85772,2019-09-17,2019-10-18,31,Forest,Rural,4,0.129032258064516
SanJoaquin,CA_Riparian_San_Joaquin_15_2019,2019,36.8584,-119.84207,2019-09-02,2019-10-30,58,Forest,Rural,8,0.137931034482759
SanJoaquin,CA_Riparian_San_Joaquin_16_2019,2019,36.85683,-119.84547,2019-10-03,2019-10-30,27,Forest,Rural,12,0.444444444444444
SanJoaquin,CA_Riparian_San_Joaquin_17_2019,2019,36.85886,-119.84505,2019-10-03,2019-10-30,27,Forest,Rural,7,0.259259259259259
SanJoaquin,CA_Riparian_San_Joaquin_8_2019,2019,36.85711,-119.839,2019-09-16,2019-10-30,44,Forest,Rural,24,0.545454545454545
SanJoaquin,CA_Riparian_San_Joaquin_9_2019,2019,36.85904,-119.83969,2019-09-02,2019-10-30,58,Forest,Rural,16,0.275862068965517
Mesa,CO_Desert_Mesa_Bob1_2022,2022,39.04257,-108.62617,2022-09-07,2022-10-09,32,Desert,Suburban,4,0.125
Mesa,CO_Desert_Mesa_Charlie1_2022,2022,39.03656,-108.62189,2022-09-09,2022-10-31,52,Desert,Suburban,4,0.0769230769230769
Mesa,CO_Desert_Mesa_Cindy1_2022,2022,39.0365,-108.62852,2022-09-12,2022-09-30,18,Desert,Suburban,3,0.166666666666667
Mesa,CO_Desert_Mesa_Cindy2_2022,2022,39.0365,-108.62852,2022-10-09,2022-10-31,22,Desert,Suburban,2,0.0909090909090909
Mesa,CO_Desert_Mesa_Dennis1_2022,2022,39.03798,-108.62784,2022-09-07,2022-10-31,54,Desert,Suburban,4,0.0740740740740741
Mesa,CO_Desert_Mesa_Ghilia1_2022,2022,39.04147,-108.62074,2022-09-10,2022-10-31,51,Desert,Suburban,7,0.137254901960784
Mesa,CO_Desert_Mesa_Grady1_2022,2022,39.03603,-108.6264,2022-09-21,2022-10-31,40,Desert,Suburban,3,0.075
Mesa,CO_Desert_Mesa_Jane1_2022,2022,39.03818,-108.62212,2022-09-10,2022-09-19,9,Desert,Suburban,2,0.222222222222222
Mesa,CO_Desert_Mesa_Jane2_2022,2022,39.03818,-108.62212,2022-10-19,2022-10-31,12,Desert,Suburban,2,0.166666666666667
Mesa,CO_Desert_Mesa_Jo1_2022,2022,39.04342,-108.62348,2022-09-06,2022-10-19,43,Desert,Suburban,4,0.0930232558139535
Mesa,CO_Desert_Mesa_Lucy1_2022,2022,39.02926,-108.60268,2022-09-13,2022-10-31,48,Desert,Suburban,2,0.0416666666666667
Mesa,CO_Desert_Mesa_Ono1_2022,2022,39.03904,-108.62798,2022-09-07,2022-10-09,32,Desert,Suburban,4,0.125
Mesa,CO_Desert_Mesa_Patrice1_2022,2022,39.05714,-108.58868,2022-09-10,2022-10-07,27,Desert,Suburban,3,0.111111111111111
Mesa,CO_Desert_Mesa_Patrice2_2022,2022,39.05714,-108.58868,2022-10-11,2022-10-31,20,Desert,Suburban,1,0.05
Mesa,CO_Desert_Mesa_Sarah1_2022,2022,39.05238,-108.6544,2022-09-12,2022-10-31,49,Desert,Suburban,6,0.122448979591837
Mesa,CO_Desert_Mesa_Shepard1_2022,2022,39.03785,-108.62522,2022-09-12,2022-10-31,49,Desert,Suburban,5,0.102040816326531
Mesa,CO_Desert_Mesa_Swann1_2022,2022,39.04092,-108.62416,2022-09-07,2022-10-31,54,Desert,Suburban,4,0.0740740740740741
Mesa,CO_Desert_Mesa_Walt1_2022,2022,39.04146,-108.62502,2022-09-06,2022-10-31,55,Desert,Suburban,4,0.0727272727272727
Mesa,CO_Desert_Mesa_margaret1_2022,2022,39.03931,-108.6249,2022-09-21,2022-10-31,40,Desert,Suburban,2,0.05
Mesa,CO_Desert_Mesa_tricia1_2022,2022,39.03724,-108.63216,2022-09-13,2022-10-30,47,Desert,Suburban,8,0.170212765957447
Goldfarb,CO_Forest_AspenStand_Goldfarb_2022,2022,38.931297,-106.199113,2022-08-30,2022-10-04,35,Forest,Wild,2,0.0571428571428571
Goldfarb,CO_Forest_BeaverDam_Goldfarb_2022,2022,38.931941,-106.197492,2022-08-30,2022-10-05,36,Forest,Wild,8,0.222222222222222
Goldfarb,CO_Forest_BigPine_Goldfarb_2022,2022,38.93279943,-106.19269944,2022-08-30,2022-09-29,30,Forest,Wild,1,0.0333333333333333
Goldfarb,CO_Forest_Goldfarb_Bridge_2022,2022,38.93205,-106.198329,2022-10-05,2022-11-03,29,Forest,Wild,4,0.137931034482759
Goldfarb,CO_Forest_Goldfarb_GrassGulch_2022,2022,38.932648,-106.195607,2022-10-05,2022-10-11,6,Forest,Wild,1,0.166666666666667
Goldfarb,CO_Forest_Goldfarb_NorthTrail_2022,2022,38.932739,-106.195674,2022-10-05,2022-11-03,29,Forest,Wild,13,0.448275862068966
Goldfarb,CO_Forest_Goldfarb_SouthPondoForest_2022,2022,38.930861,-106.200222,2022-10-05,2022-11-03,29,Forest,Wild,1,0.0344827586206897
Goldfarb,CO_Forest_Goldfarb_Upslope_2022,2022,38.93141,-106.197903,2022-10-05,2022-11-03,29,Forest,Wild,1,0.0344827586206897
Goldfarb,CO_Forest_PonderosaForest_Goldfarb_2022,2022,38.931402,-106.203175,2022-08-30,2022-10-03,34,Forest,Wild,2,0.0588235294117647
Goldfarb,CO_Forest_SouthTrail_Goldfarb_2022,2022,38.932315,-106.194726,2022-08-30,2022-10-05,36,Forest,Wild,3,0.0833333333333333
USAFA,CO_GrasslandOakPine_USAFA_23_loc_04 08/27/2023_2023,2023,38.97417,-104.88515,2023-08-27,2023-11-05,70,Forest,Wild,2,0.0285714285714286
USAFA,CO_GrasslandOakPine_USAFA_23_loc_06_2023,2023,39.0064,-104.90447,2023-08-27,2023-11-05,70,Forest,Wild,4,0.0571428571428571
USAFA,CO_GrasslandOakPine_USAFA_23_loc_07_2023,2023,39.00863,-104.9046,2023-08-27,2023-11-05,70,Forest,Wild,2,0.0285714285714286
USAFA,CO_GrasslandOakPine_USAFA_23_loc_08_2023,2023,39.00955,-104.9065,2023-08-27,2023-11-05,70,Forest,Wild,2,0.0285714285714286
USAFA,CO_GrasslandOakPine_USAFA_23_loc_10 08/27/2023_2023,2023,39.00763,-104.8991,2023-08-27,2023-11-05,70,Forest,Wild,3,0.0428571428571429
USAFA,CO_GrasslandOakPine_USAFA_23_loc_12_2023,2023,38.98335,-104.85142,2023-08-27,2023-11-02,67,Forest,Wild,1,0.0149253731343284
USAFA,CO_GrasslandOakPine_USAFA_23_loc_13_2023,2023,38.983341,-104.833582,2023-08-27,2023-11-05,70,Forest,Wild,2,0.0285714285714286
USAFA,CO_GrasslandOakPine_USAFA_23_loc_14_2023,2023,38.9845,-104.84615,2023-08-31,2023-11-05,66,Forest,Wild,5,0.0757575757575758
USAFA,CO_GrasslandOakPine_USAFA_23_loc_15_2023,2023,39.00108,-104.9041,2023-08-27,2023-11-05,70,Forest,Wild,2,0.0285714285714286
USAFA,CO_GrasslandOakPine_USAFA_23_loc_16_2023,2023,38.9994,-104.9056667,2023-08-27,2023-11-05,70,Forest,Wild,3,0.0428571428571429
USAFA,CO_GrasslandOakPine_USAFA_23_loc_1808/27/2023_2023,2023,39.01088,-104.85245,2023-08-27,2023-10-13,47,Forest,Wild,1,0.0212765957446809
USAFA,CO_GrasslandOakPine_USAFA_23_loc_19 08/27/2023_2023,2023,38.983581,-104.866698,2023-08-27,2023-11-05,70,Forest,Wild,7,0.1
USAFA,CO_GrasslandOakPine_USAFA_23_loc_20 08/27/2023_2023,2023,39.02988,-104.84945,2023-08-27,2023-11-05,70,Forest,Wild,3,0.0428571428571429
USAFA,CO_GrasslandOakPine_USAFA_23_loc_21 08/27/2023_2023,2023,39.02872,-104.8545,2023-08-27,2023-11-05,70,Forest,Wild,10,0.142857142857143
USAFA,CO_GrasslandOakPine_USAFA_23_loc_22 08/27/2023_2023,2023,39.03328,-104.87277,2023-08-27,2023-11-05,70,Forest,Wild,7,0.1
USAFA,CO_GrasslandOakPine_USAFA_23_loc_23 08/27/2023_2023,2023,39.03133,-104.86812,2023-08-27,2023-11-05,70,Forest,Wild,9,0.128571428571429
USAFA,CO_GrasslandOak_USAFA_10_2019,2019,39.00763,-104.8991,2019-09-05,2019-11-03,59,Forest,Wild,10,0.169491525423729
USAFA,CO_GrasslandOak_USAFA_11_2019,2019,38.98338,-104.85388,2019-09-05,2019-11-06,62,Forest,Wild,3,0.0483870967741935
USAFA,CO_GrasslandOak_USAFA_12_2019,2019,38.98335,-104.85142,2019-09-05,2019-11-06,62,Forest,Wild,5,0.0806451612903226
USAFA,CO_GrasslandOak_USAFA_13_2019,2019,38.9838,-104.84843,2019-09-05,2019-11-06,62,Forest,Wild,8,0.129032258064516
USAFA,CO_GrasslandOak_USAFA_14_2019,2019,38.9845,-104.84615,2019-09-05,2019-11-06,62,Forest,Wild,9,0.145161290322581
USAFA,CO_GrasslandOak_USAFA_15_2019,2019,39.00108,-104.9041,2019-09-06,2019-09-25,19,Forest,Wild,3,0.157894736842105
USAFA,CO_GrasslandOak_USAFA_16_2019,2019,38.9994,-104.90567,2019-09-06,2019-10-03,27,Forest,Wild,3,0.111111111111111
USAFA,CO_GrasslandOak_USAFA_17B_2019,2019,39.01517,-104.85232,2019-09-27,2019-11-06,40,Forest,Wild,2,0.05
USAFA,CO_GrasslandOak_USAFA_18_2019,2019,39.01088,-104.85245,2019-09-27,2019-11-06,40,Forest,Wild,3,0.075
USAFA,CO_GrasslandOak_USAFA_19_2019,2019,39.00415,-104.8778,2019-09-27,2019-09-29,2,Forest,Wild,1,0.5
USAFA,CO_GrasslandOak_USAFA_20_01_2020,2020,38.97333,-104.87861,2020-08-30,2020-10-21,52,Forest,Wild,4,0.0769230769230769
USAFA,CO_GrasslandOak_USAFA_20_02_2020,2020,38.97363,-104.88047,2020-08-30,2020-10-21,52,Forest,Wild,4,0.0769230769230769
USAFA,CO_GrasslandOak_USAFA_20_03_2020,2020,38.9734,-104.88262,2020-08-31,2020-10-21,51,Forest,Wild,3,0.0588235294117647
USAFA,CO_GrasslandOak_USAFA_20_05_2020,2020,38.97598,-104.88602,2020-08-30,2020-10-21,52,Forest,Wild,4,0.0769230769230769
USAFA,CO_GrasslandOak_USAFA_20_06_2020,2020,39.0064,-104.90447,2020-08-30,2020-10-19,50,Forest,Wild,5,0.1
USAFA,CO_GrasslandOak_USAFA_20_07_2020,2020,39.01472,-104.90972,2020-08-30,2020-10-19,50,Forest,Wild,5,0.1
USAFA,CO_GrasslandOak_USAFA_20_08_2020,2020,39.00955,-104.9065,2020-08-30,2020-10-19,50,Forest,Wild,4,0.08
USAFA,CO_GrasslandOak_USAFA_20_10_2020,2020,39.00763,-104.8991,2020-08-30,2020-10-19,50,Forest,Wild,6,0.12
USAFA,CO_GrasslandOak_USAFA_20_11_2020,2020,38.98338,-104.85388,2020-08-30,2020-10-21,52,Forest,Wild,4,0.0769230769230769
USAFA,CO_GrasslandOak_USAFA_20_12_2020,2020,38.98335,-104.85142,2020-08-30,2020-10-21,52,Forest,Wild,4,0.0769230769230769
USAFA,CO_GrasslandOak_USAFA_20_13_2020,2020,38.9838,-104.84843,2020-08-30,2020-10-22,53,Forest,Wild,4,0.0754716981132075
USAFA,CO_GrasslandOak_USAFA_20_14_2020,2020,38.9845,-104.84615,2020-08-30,2020-10-21,52,Forest,Wild,4,0.0769230769230769
USAFA,CO_GrasslandOak_USAFA_20_15_2020,2020,39.00095,-104.90383,2020-08-30,2020-10-19,50,Forest,Wild,5,0.1
USAFA,CO_GrasslandOak_USAFA_20_17_2020,2020,39.01517,-104.85232,2020-08-30,2020-10-19,50,Forest,Wild,5,0.1
USAFA,CO_GrasslandOak_USAFA_20_18_2020,2020,39.01088,-104.85245,2020-08-30,2020-10-19,50,Forest,Wild,4,0.08
USAFA,CO_GrasslandOak_USAFA_20_19_2020,2020,38.99826,-104.86871,2020-09-24,2020-10-05,11,Forest,Wild,1,0.0909090909090909
USAFA,CO_GrasslandOak_USAFA_20_2019,2019,39.02988,-104.84945,2019-09-27,2019-11-08,42,Forest,Wild,3,0.0714285714285714
USAFA,CO_GrasslandOak_USAFA_20_20_2020,2020,39.02988,-104.84945,2020-08-30,2020-10-22,53,Forest,Wild,6,0.113207547169811
USAFA,CO_GrasslandOak_USAFA_20_21_2020,2020,39.02872,-104.8545,2020-08-30,2020-10-22,53,Forest,Wild,6,0.113207547169811
USAFA,CO_GrasslandOak_USAFA_20_22_2020,2020,39.03328,-104.87277,2020-08-30,2020-10-22,53,Forest,Wild,5,0.0943396226415094
USAFA,CO_GrasslandOak_USAFA_20_23_2020,2020,39.03133,-104.86812,2020-08-30,2020-10-22,53,Forest,Wild,8,0.150943396226415
USAFA,CO_GrasslandOak_USAFA_20_24_2020,2020,39.03565,-104.85213,2020-08-30,2020-10-22,53,Forest,Wild,9,0.169811320754717
USAFA,CO_GrasslandOak_USAFA_21_2019,2019,38.9733,-104.87861,2019-09-03,2019-11-02,60,Forest,Wild,1,0.0166666666666667
USAFA,CO_GrasslandOak_USAFA_21_dep_01 08/29/2021_2021,2021,38.97333,-104.87861,2021-08-29,2021-09-26,28,Forest,Wild,3,0.107142857142857
USAFA,CO_GrasslandOak_USAFA_21_dep_02 08/29/2021_2021,2021,38.97363,-104.88047,2021-08-29,2021-09-14,16,Forest,Wild,1,0.0625
USAFA,CO_GrasslandOak_USAFA_21_dep_07 08/29/2021_2021,2021,39.00863,-104.9046,2021-08-29,2021-09-26,28,Forest,Wild,2,0.0714285714285714
USAFA,CO_GrasslandOak_USAFA_21_dep_10 08/29/2021_2021,2021,39.00763,-104.8991,2021-08-29,2021-09-10,12,Forest,Wild,1,0.0833333333333333
USAFA,CO_GrasslandOak_USAFA_21_dep_12 08/29/2021_2021,2021,38.98335,-104.85142,2021-08-29,2021-09-26,28,Forest,Wild,4,0.142857142857143
USAFA,CO_GrasslandOak_USAFA_21_dep_14 08/29/2021_2021,2021,38.9845,-104.84615,2021-08-29,2021-09-26,28,Forest,Wild,4,0.142857142857143
USAFA,CO_GrasslandOak_USAFA_21_dep_15 08/29/2021_2021,2021,39.00108,-104.9041,2021-08-29,2021-09-26,28,Forest,Wild,3,0.107142857142857
USAFA,CO_GrasslandOak_USAFA_21_dep_17 08/29/2021_2021,2021,39.01517,-104.85232,2021-08-29,2021-09-03,5,Forest,Wild,2,0.4
USAFA,CO_GrasslandOak_USAFA_21_dep_17 09/03/2021_2021,2021,39.01517,-104.85232,2021-09-03,2021-09-26,23,Forest,Wild,2,0.0869565217391304
USAFA,CO_GrasslandOak_USAFA_21_dep_18 08/29/2021_2021,2021,39.01088,-104.85245,2021-08-29,2021-09-26,28,Forest,Wild,2,0.0714285714285714
USAFA,CO_GrasslandOak_USAFA_21_dep_20 08/29/2021_2021,2021,39.02988,-104.84945,2021-08-29,2021-09-26,28,Forest,Wild,3,0.107142857142857
USAFA,CO_GrasslandOak_USAFA_21_dep_21 08/29/2021_2021,2021,39.02872,-104.8545,2021-08-29,2021-09-26,28,Forest,Wild,3,0.107142857142857
USAFA,CO_GrasslandOak_USAFA_21_dep_22 08/29/2021_2021,2021,39.03328,-104.87277,2021-08-29,2021-09-26,28,Forest,Wild,3,0.107142857142857
USAFA,CO_GrasslandOak_USAFA_21_dep_23 08/29/2021_2021,2021,39.03133,-104.86812,2021-08-29,2021-09-26,28,Forest,Wild,4,0.142857142857143
USAFA,CO_GrasslandOak_USAFA_21_dep_24 08/29/2021_2021,2021,39.03565,-104.85213,2021-08-29,2021-09-26,28,Forest,Wild,4,0.142857142857143
USAFA,CO_GrasslandOak_USAFA_21_deployment_03 08/29/2021_2021,2021,38.9734,-104.88262,2021-08-29,2021-09-26,28,Forest,Wild,2,0.0714285714285714
USAFA,CO_GrasslandOak_USAFA_21_deployment_04 08/29/2021_2021,2021,38.97417,-104.88515,2021-08-29,2021-09-26,28,Forest,Wild,3,0.107142857142857
USAFA,CO_GrasslandOak_USAFA_21_deployment_05 08/29/2021_2021,2021,38.97593,-104.88602,2021-08-29,2021-09-26,28,Forest,Wild,2,0.0714285714285714
USAFA,CO_GrasslandOak_USAFA_21_deployment_06 08/29/2021_2021,2021,39.0064,-104.90447,2021-08-29,2021-09-26,28,Forest,Wild,2,0.0714285714285714
USAFA,CO_GrasslandOak_USAFA_21_deployment_08 08/29/2021_2021,2021,39.00955,-104.9065,2021-08-29,2021-09-26,28,Forest,Wild,1,0.0357142857142857
USAFA,CO_GrasslandOak_USAFA_22_2019,2019,39.02872,-104.8545,2019-10-01,2019-11-06,36,Forest,Wild,1,0.0277777777777778
USAFA,CO_GrasslandOak_USAFA_23_2019,2019,39.03133,-104.86812,2019-10-01,2019-11-08,38,Forest,Wild,9,0.236842105263158
USAFA,CO_GrasslandOak_USAFA_24_2019,2019,39.03565,-104.85213,2019-10-01,2019-11-08,38,Forest,Wild,3,0.0789473684210526
USAFA,CO_GrasslandOak_USAFA_24_2023,2023,39.03565,-104.85213,2023-08-27,2023-11-05,70,Forest,Wild,7,0.1
USAFA,CO_GrasslandOak_USAFA_25_2019,2019,38.97362,-104.87798,2019-09-11,2019-09-19,8,Forest,Wild,2,0.25
USAFA,CO_GrasslandOak_USAFA_26_2019,2019,38.97598,-104.88602,2019-09-20,2019-11-03,44,Forest,Wild,4,0.0909090909090909
USAFA,CO_GrasslandOak_USAFA_27_2019,2019,39.00095,-104.90383,2019-10-03,2019-11-08,36,Forest,Wild,6,0.166666666666667
USAFA,CO_GrasslandOak_USAFA_29_2019,2019,38.97417,-104.88515,2019-09-03,2019-11-03,61,Forest,Wild,11,0.180327868852459
USAFA,CO_GrasslandOak_USAFA_2_2019,2019,38.97363,-104.88047,2019-09-03,2019-11-03,61,Forest,Wild,10,0.163934426229508
USAFA,CO_GrasslandOak_USAFA_3B_2019,2019,38.9734,-104.88262,2019-09-03,2019-11-02,60,Forest,Wild,0,0
USAFA,CO_GrasslandOak_USAFA_5_2019,2019,38.97593,-104.88605,2019-09-03,2019-09-19,16,Forest,Wild,2,0.125
USAFA,CO_GrasslandOak_USAFA_6_2019,2019,39.0064,-104.90447,2019-09-05,2019-11-03,59,Forest,Wild,9,0.152542372881356
USAFA,CO_GrasslandOak_USAFA_7_2019,2019,39.00863,-104.9046,2019-09-05,2019-11-03,59,Forest,Wild,7,0.11864406779661
USAFA,CO_GrasslandOak_USAFA_8_2019,2019,39.00955,-104.9065,2019-09-05,2019-11-03,59,Forest,Wild,8,0.135593220338983
USAFA,CO_GrasslandOak_USAFA_9_2019,2019,39.00772,-104.90155,2019-09-05,2019-11-03,59,Forest,Wild,8,0.135593220338983
USAFA,CO_Grassland_USAFA_22_dep_01 08/26/2022_2022,2022,38.97333,-104.87861,2022-08-26,2022-11-03,69,Forest,Wild,7,0.101449275362319
USAFA,CO_Grassland_USAFA_22_dep_04 08/26/2022_2022,2022,38.97417,-104.88515,2022-08-26,2022-11-03,69,Forest,Wild,4,0.0579710144927536
USAFA,CO_Grassland_USAFA_22_dep_05 08/26/2022_2022,2022,38.97593,-104.88602,2022-08-26,2022-11-03,69,Forest,Wild,4,0.0579710144927536
USAFA,CO_Grassland_USAFA_22_dep_06 08/27/2022_2022,2022,39.0064,-104.90447,2022-08-27,2022-11-03,68,Forest,Wild,5,0.0735294117647059
USAFA,CO_Grassland_USAFA_22_dep_07 08/27/2022_2022,2022,39.00863,-104.9046,2022-08-27,2022-11-03,68,Forest,Wild,5,0.0735294117647059
USAFA,CO_Grassland_USAFA_22_dep_11 08/26/2022_2022,2022,38.98338,-104.85388,2022-08-26,2022-11-03,69,Forest,Wild,4,0.0579710144927536
USAFA,CO_Grassland_USAFA_22_dep_16 08/27/2022_2022,2022,39.0169,-104.833521,2022-08-27,2022-11-03,68,Forest,Wild,4,0.0588235294117647
USAFA,CO_Grassland_USAFA_22_dep_18 08/26/2022_2022,2022,39.01088,-104.85245,2022-08-26,2022-11-03,69,Forest,Wild,4,0.0579710144927536
Storrs,CT_Anthropogenic_Forest_Storrs_21_dep_01_2021,2021,41.799433,-72.230827,2021-09-01,2021-10-02,31,Forest,Suburban,2,0.0645161290322581
Storrs,CT_Anthropogenic_Forest_Storrs_21_dep_02_2021,2021,41.799791,-72.229611,2021-09-01,2021-10-02,31,Forest,Suburban,2,0.0645161290322581
Storrs,CT_Anthropogenic_Forest_Storrs_21_dep_03_2021,2021,41.800138,-72.228531,2021-09-01,2021-10-02,31,Forest,Suburban,2,0.0645161290322581
Storrs,CT_Anthropogenic_Forest_Storrs_21_dep_04_2021,2021,41.80028,-72.227481,2021-09-01,2021-10-02,31,Forest,Suburban,2,0.0645161290322581
Storrs,CT_Anthropogenic_Forest_Storrs_21_dep_05_2021,2021,41.800909,-72.229637,2021-09-01,2021-09-20,19,Forest,Suburban,35,1.84210526315789
Storrs,CT_Anthropogenic_Forest_Storrs_21_dep_06_2021,2021,41.801419,-72.230495,2021-09-01,2021-10-02,31,Forest,Suburban,2,0.0645161290322581
Storrs,CT_Anthropogenic_Forest_Storrs_21_dep_07_2021,2021,41.800076,-72.230879,2021-09-01,2021-10-02,31,Forest,Suburban,2,0.0645161290322581
Storrs,CT_Anthropogenic_Forest_Storrs_21_dep_08_2021,2021,41.799671,-72.2321,2021-09-03,2021-10-02,29,Forest,Suburban,1,0.0344827586206897
Storrs,CT_Anthropogenic_Forest_Storrs_21_dep_09_2021,2021,41.800317,-72.233724,2021-09-01,2021-10-02,31,Forest,Suburban,3,0.0967741935483871
Storrs,CT_Anthropogenic_Forest_Storrs_21_dep_10_2021,2021,41.799022,-72.232339,2021-09-01,2021-10-02,31,Forest,Suburban,4,0.129032258064516
Storrs,CT_Anthropogenic_Forest_Storrs_21_dep_11_2021,2021,41.816147,-72.258838,2021-10-03,2021-11-14,42,Forest,Suburban,2,0.0476190476190476
Storrs,CT_Anthropogenic_Forest_Storrs_21_dep_12_2021,2021,41.814921,-72.258726,2021-10-03,2021-11-14,42,Forest,Suburban,2,0.0476190476190476
Storrs,CT_Anthropogenic_Forest_Storrs_21_dep_13_2021,2021,41.815709,-72.258062,2021-10-03,2021-11-14,42,Forest,Suburban,3,0.0714285714285714
Storrs,CT_Anthropogenic_Forest_Storrs_21_dep_14_2021,2021,41.815608,-72.257098,2021-10-03,2021-11-14,42,Forest,Suburban,2,0.0476190476190476
Storrs,CT_Anthropogenic_Forest_Storrs_21_dep_15_2021,2021,41.815259,-72.256753,2021-10-03,2021-11-14,42,Forest,Suburban,2,0.0476190476190476
Storrs,CT_Anthropogenic_Forest_Storrs_21_dep_16_2021,2021,41.814644,-72.257152,2021-10-03,2021-10-10,7,Forest,Suburban,1,0.142857142857143
Storrs,CT_Anthropogenic_Forest_Storrs_21_dep_17_2021,2021,41.814532,-72.255934,2021-10-03,2021-11-14,42,Forest,Suburban,2,0.0476190476190476
Storrs,CT_Anthropogenic_Forest_Storrs_21_dep_18_2021,2021,41.813713,-72.2564,2021-10-03,2021-11-14,42,Forest,Suburban,2,0.0476190476190476
Storrs,CT_Anthropogenic_Forest_Storrs_21_dep_19_2021,2021,41.813279,-72.254896,2021-10-03,2021-11-14,42,Forest,Suburban,2,0.0476190476190476
Storrs,CT_Anthropogenic_Forest_Storrs_21_dep_20_2021,2021,41.812334,-72.255377,2021-10-03,2021-11-14,42,Forest,Suburban,2,0.0476190476190476
Storrs,CT_Anthropogenic_Kuprewicz_22_dep_01B_2022,2022,41.799433,-72.230827,2022-09-28,2022-10-04,6,Forest,Suburban,6,1
Storrs,CT_Anthropogenic_Kuprewicz_22_dep_02B_2022,2022,41.799791,-72.229611,2022-09-28,2022-10-04,6,Forest,Suburban,1,0.166666666666667
Storrs,CT_Anthropogenic_Kuprewicz_22_dep_05B_2022,2022,41.800909,-72.229637,2022-09-28,2022-09-30,2,Forest,Suburban,0,0
Storrs,CT_Anthropogenic_Kuprewicz_22_dep_06B_2022,2022,41.801419,-72.230495,2022-09-28,2022-10-04,6,Forest,Suburban,1,0.166666666666667
Storrs,CT_Anthropogenic_Rural_Storrs_23_dep_01_2023,2023,41.799433,-72.230827,2023-09-03,2023-10-08,35,Forest,Suburban,2,0.0571428571428571
Storrs,CT_Anthropogenic_Rural_Storrs_23_dep_02_2023,2023,41.799791,-72.229611,2023-09-03,2023-10-08,35,Forest,Suburban,2,0.0571428571428571
Storrs,CT_Anthropogenic_Rural_Storrs_23_dep_03_2023,2023,41.800138,-72.228531,2023-09-03,2023-10-08,35,Forest,Suburban,3,0.0857142857142857
Storrs,CT_Anthropogenic_Rural_Storrs_23_dep_04_2023,2023,41.80028,-72.227481,2023-09-03,2023-10-08,35,Forest,Suburban,2,0.0571428571428571
Storrs,CT_Anthropogenic_Rural_Storrs_23_dep_05A_2023,2023,41.800909,-72.229637,2023-09-03,2023-09-20,17,Forest,Suburban,3,0.176470588235294
Storrs,CT_Anthropogenic_Rural_Storrs_23_dep_05BB_2023,2023,41.800909,-72.229637,2023-09-21,2023-10-08,17,Forest,Suburban,3,0.176470588235294
Storrs,CT_Anthropogenic_Rural_Storrs_23_dep_06_2023,2023,41.801419,-72.230495,2023-09-03,2023-10-08,35,Forest,Suburban,3,0.0857142857142857
Storrs,CT_Anthropogenic_Rural_Storrs_23_dep_07B_2023,2023,41.800076,-72.230879,2023-09-21,2023-10-08,17,Forest,Suburban,1,0.0588235294117647
Storrs,CT_Anthropogenic_Rural_Storrs_23_dep_07_2023,2023,41.800076,-72.230879,2023-09-03,2023-09-21,18,Forest,Suburban,2,0.111111111111111
Storrs,CT_Anthropogenic_Rural_Storrs_23_dep_08_2023,2023,41.799671,-72.2321,2023-09-03,2023-09-18,15,Forest,Suburban,1,0.0666666666666667
Storrs,CT_Anthropogenic_Rural_Storrs_23_dep_09B_2023,2023,41.800317,-72.233724,2023-09-03,2023-09-21,18,Forest,Suburban,10,0.555555555555556
Storrs,CT_Anthropogenic_Rural_Storrs_23_dep_09_2023,2023,41.800317,-72.233724,2023-09-21,2023-10-08,17,Forest,Suburban,209,12.2941176470588
Storrs,CT_Anthropogenic_Rural_Storrs_23_dep_10_2023,2023,41.799022,-72.232339,2023-09-04,2023-10-08,34,Forest,Suburban,3,0.0882352941176471
Storrs,CT_Anthropogenic_Rural_Storrs_23_dep_11_2023,2023,41.816147,-72.258838,2023-10-10,2023-11-24,45,Forest,Suburban,2,0.0444444444444444
Storrs,CT_Anthropogenic_Rural_Storrs_23_dep_12_2023,2023,41.814921,-72.258726,2023-10-10,2023-11-24,45,Forest,Suburban,2,0.0444444444444444
Storrs,CT_Anthropogenic_Rural_Storrs_23_dep_13_2023,2023,41.815709,-72.258062,2023-10-10,2023-11-24,45,Forest,Suburban,2,0.0444444444444444
Storrs,CT_Anthropogenic_Rural_Storrs_23_dep_14_2023,2023,41.815608,-72.257098,2023-10-10,2023-11-24,45,Forest,Suburban,2,0.0444444444444444
Storrs,CT_Anthropogenic_Rural_Storrs_23_dep_15_2023,2023,41.815259,-72.256753,2023-10-10,2023-11-24,45,Forest,Suburban,3,0.0666666666666667
Storrs,CT_Anthropogenic_Rural_Storrs_23_dep_16_2023,2023,41.814644,-72.257152,2023-10-10,2023-10-16,6,Forest,Suburban,1,0.166666666666667
Storrs,CT_Anthropogenic_Rural_Storrs_23_dep_17_2023,2023,41.814532,-72.255934,2023-10-10,2023-11-24,45,Forest,Suburban,9,0.2
Storrs,CT_Anthropogenic_Rural_Storrs_23_dep_18_2023,2023,41.813713,-72.2564,2023-10-10,2023-11-13,34,Forest,Suburban,2,0.0588235294117647
Storrs,CT_Anthropogenic_Rural_Storrs_23_dep_19_2023,2023,41.813279,-72.254896,2023-10-10,2023-11-24,45,Forest,Suburban,4,0.0888888888888889
Storrs,CT_Anthropogenic_Rural_Storrs_23_dep_20_2023,2023,41.812334,-72.255377,2023-10-10,2023-11-22,43,Forest,Suburban,3,0.0697674418604651
Storrs,CT_Anthropogenic_Storrs_22_dep_01_2022,2022,41.799433,-72.230827,2022-09-01,2022-09-28,27,Forest,Suburban,46,1.7037037037037
Storrs,CT_Anthropogenic_Storrs_22_dep_02_2022,2022,41.799791,-72.229611,2022-09-01,2022-09-28,27,Forest,Suburban,2,0.0740740740740741
Storrs,CT_Anthropogenic_Storrs_22_dep_04_2022,2022,41.80028,-72.227481,2022-09-01,2022-10-04,33,Forest,Suburban,2,0.0606060606060606
Storrs,CT_Anthropogenic_Storrs_22_dep_05_2022,2022,41.800909,-72.229637,2022-09-01,2022-09-28,27,Forest,Suburban,20,0.740740740740741
Storrs,CT_Anthropogenic_Storrs_22_dep_06_2022,2022,41.801419,-72.230495,2022-09-01,2022-09-28,27,Forest,Suburban,4,0.148148148148148
Storrs,CT_Anthropogenic_Storrs_22_dep_07_2022,2022,41.800076,-72.230879,2022-09-01,2022-10-04,33,Forest,Suburban,1,0.0303030303030303
Storrs,CT_Anthropogenic_Storrs_22_dep_08_2022,2022,41.799671,-72.2321,2022-09-01,2022-10-04,33,Forest,Suburban,2,0.0606060606060606
Storrs,CT_Anthropogenic_Storrs_22_dep_09_2022,2022,41.800317,-72.233724,2022-09-01,2022-10-04,33,Forest,Suburban,7,0.212121212121212
Storrs,CT_Anthropogenic_Storrs_22_dep_10_2022,2022,41.799022,-72.232339,2022-09-01,2022-10-04,33,Forest,Suburban,5,0.151515151515152
Storrs,CT_Anthropogenic_Storrs_22_dep_11_2022,2022,41.816147,-72.258838,2022-10-06,2022-11-04,29,Forest,Suburban,1,0.0344827586206897
Storrs,CT_Anthropogenic_Storrs_22_dep_12_2022,2022,41.814291,-72.258726,2022-10-06,2022-11-21,46,Forest,Suburban,2,0.0434782608695652
Storrs,CT_Anthropogenic_Storrs_22_dep_13_2022,2022,41.815709,-72.258062,2022-10-06,2022-11-21,46,Forest,Suburban,3,0.0652173913043478
Storrs,CT_Anthropogenic_Storrs_22_dep_14_2022,2022,41.815608,-72.257098,2022-10-06,2022-11-21,46,Forest,Suburban,2,0.0434782608695652
Storrs,CT_Anthropogenic_Storrs_22_dep_15_2022,2022,41.815259,-72.256753,2022-10-06,2022-11-21,46,Forest,Suburban,2,0.0434782608695652
Storrs,CT_Anthropogenic_Storrs_22_dep_16_2022,2022,41.814644,-72.257152,2022-10-06,2022-11-21,46,Forest,Suburban,2,0.0434782608695652
Storrs,CT_Anthropogenic_Storrs_22_dep_17_2022,2022,41.814532,-72.255934,2022-10-06,2022-11-21,46,Forest,Suburban,2,0.0434782608695652
Storrs,CT_Anthropogenic_Storrs_22_dep_18_2022,2022,41.813713,-72.2564,2022-10-06,2022-11-21,46,Forest,Suburban,2,0.0434782608695652
Storrs,CT_Anthropogenic_Storrs_22_dep_19_2022,2022,41.813279,-72.254896,2022-10-06,2022-11-21,46,Forest,Suburban,2,0.0434782608695652
Storrs,CT_Anthropogenic_Storrs_22_dep_20_2022,2022,41.812334,-72.255377,2022-10-06,2022-11-21,46,Forest,Suburban,3,0.0652173913043478
NyeHolman,CT_Forest_Davis_21.01 09/03/2021_2021,2021,41.88351,-72.32718,2021-09-01,2021-10-11,40,Forest,Rural,3,0.075
NyeHolman,CT_Forest_Davis_21.03 09/03/2021_2021,2021,41.88541,-72.3246,2021-09-03,2021-10-11,38,Forest,Rural,2,0.0526315789473684
NyeHolman,CT_Forest_Davis_21.04 09/03/2021_2021,2021,41.88347,-72.32477,2021-09-03,2021-10-11,38,Forest,Rural,2,0.0526315789473684
NyeHolman,CT_Forest_Davis_21.05 09/03/2021_2021,2021,41.88178,-72.32366,2021-09-03,2021-10-13,40,Forest,Rural,3,0.075
NyeHolman,CT_Forest_Davis_21.06 09/04/2021_2021,2021,41.88892,-72.32623,2021-09-04,2021-10-15,41,Forest,Rural,2,0.048780487804878
NyeHolman,CT_Forest_Davis_21.07 09/04/2021_2021,2021,41.88907,-72.32864,2021-09-04,2021-10-15,41,Forest,Rural,2,0.048780487804878
NyeHolman,CT_Forest_Davis_21.08 09/04/2021_2021,2021,41.89105,-72.32874,2021-09-04,2021-09-26,22,Forest,Rural,2,0.0909090909090909
NyeHolman,CT_Forest_Davis_21.09 09/04/2021_2021,2021,41.89105,-72.32593,2021-09-04,2021-10-15,41,Forest,Rural,3,0.0731707317073171
NyeHolman,CT_Forest_Davis_21.10 09/04/2021_2021,2021,41.89096,-72.32314,2021-09-04,2021-10-15,41,Forest,Rural,2,0.048780487804878
NyeHolman,CT_Forest_Davis_21.11 09/04/2021_2021,2021,41.88921,-72.32355,2021-09-04,2021-09-28,24,Forest,Rural,1,0.0416666666666667
NyeHolman,CT_Forest_Davis_21.12 09/06/2021_2021,2021,41.89799,-72.30968,2021-09-06,2021-10-03,27,Forest,Rural,1,0.037037037037037
NyeHolman,CT_Forest_Davis_21.13 09/06/2021_2021,2021,41.89829,-72.30669,2021-09-06,2021-10-22,46,Forest,Rural,2,0.0434782608695652
NyeHolman,CT_Forest_Davis_21.14 09/06/2021_2021,2021,41.89798,-72.30395,2021-09-06,2021-10-22,46,Forest,Rural,3,0.0652173913043478
NyeHolman,CT_Forest_Davis_21.15 09/06/2021_2021,2021,41.90006,-72.30396,2021-09-06,2021-10-05,29,Forest,Rural,2,0.0689655172413793
NyeHolman,CT_Forest_Davis_21.16 09/06/2021_2021,2021,41.89998,-72.30716,2021-09-06,2021-10-22,46,Forest,Rural,2,0.0434782608695652
NyeHolman,CT_Forest_Davis_21.17 09/06/2021_2021,2021,41.90203,-72.30704,2021-09-06,2021-10-20,44,Forest,Rural,1,0.0227272727272727
NyeHolman,CT_Forest_Davis_22.01 09/09/2022_2022,2022,41.88351,-72.327,2022-09-09,2022-10-21,42,Forest,Rural,1,0.0238095238095238
NyeHolman,CT_Forest_Davis_22.02 09/09/2022_2022,2022,41.88572,-72.32747,2022-09-09,2022-10-11,32,Forest,Rural,1,0.03125
NyeHolman,CT_Forest_Davis_22.03 09/09/2022_2022,2022,41.88556,-72.32463,2022-09-09,2022-10-05,26,Forest,Rural,1,0.0384615384615385
NyeHolman,CT_Forest_Davis_22.04 09/09/2022_2022,2022,41.88315,-72.32456,2022-09-09,2022-10-21,42,Forest,Rural,3,0.0714285714285714
NyeHolman,CT_Forest_Davis_22.05 09/09/2022_2022,2022,41.881767,-72.323517,2022-09-09,2022-10-21,42,Forest,Rural,2,0.0476190476190476
NyeHolman,CT_Forest_Davis_22.06 09/16/2022_2022,2022,41.88871,-72.32599,2022-09-16,2022-10-21,35,Forest,Rural,2,0.0571428571428571
NyeHolman,CT_Forest_Davis_22.07 09/16/2022_2022,2022,41.88897,-72.32885,2022-09-16,2022-10-03,17,Forest,Rural,2,0.117647058823529
NyeHolman,CT_Forest_Davis_22.08 09/16/2022_2022,2022,41.89101,-72.32896,2022-09-16,2022-10-08,22,Forest,Rural,1,0.0454545454545455
NyeHolman,CT_Forest_Davis_22.09 09/16/2022_2022,2022,41.89104,-72.3259,2022-09-16,2022-10-21,35,Forest,Rural,4,0.114285714285714
NyeHolman,CT_Forest_Davis_22.10 09/16/2022_2022,2022,41.89103,-72.32311,2022-09-16,2022-10-21,35,Forest,Rural,2,0.0571428571428571
NyeHolman,CT_Forest_Davis_22.11 09/16/2022_2022,2022,41.88908,-72.3224,2022-09-17,2022-10-22,35,Forest,Rural,3,0.0857142857142857
NyeHolman,CT_Forest_Davis_22.12 09/10/2022_2022,2022,41.898267,-72.309417,2022-09-10,2022-10-22,42,Forest,Rural,3,0.0714285714285714
NyeHolman,CT_Forest_Davis_22.13 09/10/2022_2022,2022,41.89784,-72.30694,2022-09-10,2022-10-22,42,Forest,Rural,3,0.0714285714285714
NyeHolman,CT_Forest_Davis_22.14 09/10/2022_2022,2022,41.89833,-72.30437,2022-09-10,2022-10-22,42,Forest,Rural,3,0.0714285714285714
NyeHolman,CT_Forest_Davis_22.15 09/10/2022_2022,2022,41.90002,-72.30378,2022-09-10,2022-10-04,24,Forest,Rural,3,0.125
NyeHolman,CT_Forest_Davis_22.16 09/10/2022_2022,2022,41.90004,-72.30742,2022-09-10,2022-10-22,42,Forest,Rural,2,0.0476190476190476
NyeHolman,CT_Forest_Davis_22.17 09/10/2022_2022,2022,41.90165,-72.30705,2022-09-10,2022-10-22,42,Forest,Rural,2,0.0476190476190476
NyeHolman,CT_Forest_Davis_22.18 09/10/2022_2022,2022,41.90216,-72.30425,2022-09-10,2022-10-25,45,Forest,Rural,2,0.0444444444444444
NyeHolman,CT_Forest_Davis_22.19 09/10/2022_2022,2022,41.9005,-72.309983,2022-09-10,2022-10-22,42,Forest,Rural,2,0.0476190476190476
NyeHolman,CT_Forest_Davis_22.20 09/10/2022_2022,2022,41.902233,-72.310033,2022-09-10,2022-10-22,42,Forest,Rural,3,0.0714285714285714
NyeHolman,CT_Forest_Davis_23.01 09/01/2023_2023,2023,41.88350333,-72.32722,2023-09-01,2023-10-09,38,Forest,Rural,3,0.0789473684210526
NyeHolman,CT_Forest_Davis_23.02 09/01/2023_2023,2023,41.88555556,-72.32722222,2023-09-01,2023-10-09,38,Forest,Rural,2,0.0526315789473684
NyeHolman,CT_Forest_Davis_23.03 09/01/2023_2023,2023,41.88557833,-72.32454167,2023-09-01,2023-10-09,38,Forest,Rural,3,0.0789473684210526
NyeHolman,CT_Forest_Davis_23.04 09/01/2023_2023,2023,41.88333333,-72.32444444,2023-09-01,2023-10-09,38,Forest,Rural,2,0.0526315789473684
NyeHolman,CT_Forest_Davis_23.05 09/01/2023_2023,2023,41.88166667,-72.32333333,2023-09-01,2023-10-09,38,Forest,Rural,4,0.105263157894737
NyeHolman,CT_Forest_Davis_23.06 09/01/2023_2023,2023,41.88888889,-72.32583333,2023-09-01,2023-10-05,34,Forest,Rural,1,0.0294117647058824
NyeHolman,CT_Forest_Davis_23.07 09/01/2023_2023,2023,41.88916667,-72.32888889,2023-09-01,2023-09-24,23,Forest,Rural,2,0.0869565217391304
NyeHolman,CT_Forest_Davis_23.08 09/01/2023_2023,2023,41.89111111,-72.32861111,2023-09-01,2023-10-16,45,Forest,Rural,2,0.0444444444444444
NyeHolman,CT_Forest_Davis_23.09 09/01/2023_2023,2023,41.89111111,-72.32583333,2023-09-01,2023-10-16,45,Forest,Rural,2,0.0444444444444444
NyeHolman,CT_Forest_Davis_23.10 09/1/2023_2023,2023,41.89111111,-72.32333333,2023-09-01,2023-10-16,45,Forest,Rural,2,0.0444444444444444
NyeHolman,CT_Forest_Davis_23.11 09/1/2023_2023,2023,41.88901,-72.32348,2023-09-01,2023-10-16,45,Forest,Rural,2,0.0444444444444444
NyeHolman,CT_Forest_Davis_23.12 09/02/2023_2023,2023,41.89861111,-72.31027778,2023-09-02,2023-09-17,15,Forest,Rural,1,0.0666666666666667
NyeHolman,CT_Forest_Davis_23.13 09/02/2023_2023,2023,41.898079,-72.306803,2023-09-03,2023-10-14,41,Forest,Rural,3,0.0731707317073171
NyeHolman,CT_Forest_Davis_23.14 09/02/2023_2023,2023,41.89805556,-72.30388889,2023-09-02,2023-10-13,41,Forest,Rural,3,0.0731707317073171
NyeHolman,CT_Forest_Davis_23.15 09/15/2023_2023,2023,41.90027778,-72.30388889,2023-09-02,2023-09-21,19,Forest,Rural,1,0.0526315789473684
NyeHolman,CT_Forest_Davis_23.16 09/03/2023_2023,2023,41.90009,-72.30708333,2023-09-03,2023-09-30,27,Forest,Rural,1,0.037037037037037
NyeHolman,CT_Forest_Davis_23.17 09/03/2023_2023,2023,41.901915,-72.30690667,2023-09-03,2023-10-13,40,Forest,Rural,2,0.05
NyeHolman,CT_Forest_Davis_23.18 09/02/2023_2023,2023,41.90222222,-72.30416667,2023-09-02,2023-10-13,41,Forest,Rural,2,0.048780487804878
NyeHolman,CT_Forest_Davis_23.19 09/02/2023_2023,2023,41.90027778,-72.31,2023-09-02,2023-10-13,41,Forest,Rural,6,0.146341463414634
NyeHolman,CT_Forest_Davis_23.20 09/02/23_2023,2023,41.9025,-72.31055556,2023-09-02,2023-10-13,41,Forest,Rural,2,0.048780487804878
NyeHolman,CT_Forest_Nye_Holman_10_2019,2019,41.89103,-72.32311,2019-09-12,2019-10-17,35,Forest,Rural,1,0.0285714285714286
NyeHolman,CT_Forest_Nye_Holman_11_2019,2019,41.88908,-72.3234,2019-09-12,2019-10-17,35,Forest,Rural,2,0.0571428571428571
NyeHolman,CT_Forest_Nye_Holman_12_2019,2019,41.89824,-72.3093,2019-09-08,2019-09-28,20,Forest,Rural,1,0.05
NyeHolman,CT_Forest_Nye_Holman_13_2019,2019,41.89825,-72.30688,2019-09-08,2019-10-29,51,Forest,Rural,3,0.0588235294117647
NyeHolman,CT_Forest_Nye_Holman_14_2019,2019,41.89801,-72.30387,2019-09-08,2019-10-18,40,Forest,Rural,3,0.075
NyeHolman,CT_Forest_Nye_Holman_15_2019,2019,41.90014,-72.30394,2019-09-08,2019-10-18,40,Forest,Rural,4,0.1
NyeHolman,CT_Forest_Nye_Holman_16_2019,2019,41.9,-72.30711,2019-09-11,2019-09-22,11,Forest,Rural,1,0.0909090909090909
NyeHolman,CT_Forest_Nye_Holman_17_2019,2019,41.90181,-72.30695,2019-09-08,2019-10-18,40,Forest,Rural,5,0.125
NyeHolman,CT_Forest_Nye_Holman_1_2019,2019,41.88349,-72.32731,2019-09-06,2019-10-05,29,Forest,Rural,0,0
NyeHolman,CT_Forest_Nye_Holman_20_01_2020,2020,41.88353,-72.32721,2020-09-03,2020-10-15,42,Forest,Rural,3,0.0714285714285714
NyeHolman,CT_Forest_Nye_Holman_20_02_2020,2020,41.88569,-72.32744,2020-09-05,2020-10-15,40,Forest,Rural,2,0.05
NyeHolman,CT_Forest_Nye_Holman_20_05_2020,2020,41.88171,-72.32355,2020-09-05,2020-10-14,39,Forest,Rural,1,0.0256410256410256
NyeHolman,CT_Forest_Nye_Holman_20_06_2020,2020,41.8988,-72.32593,2020-09-05,2020-10-17,42,Forest,Rural,2,0.0476190476190476
NyeHolman,CT_Forest_Nye_Holman_20_08_reupload_2020,2020,41.89112,-72.32881,2020-09-05,2020-10-17,42,Forest,Rural,2,0.0476190476190476
NyeHolman,CT_Forest_Nye_Holman_20_10_2020,2020,41.89102,-72.32294,2020-09-08,2020-10-17,39,Forest,Rural,3,0.0769230769230769
NyeHolman,CT_Forest_Nye_Holman_20_11_2020,2020,41.889,-72.32333,2020-09-08,2020-10-17,39,Forest,Rural,2,0.0512820512820513
NyeHolman,CT_Forest_Nye_Holman_20_12_2020,2020,41.89824,-72.3093,2020-09-06,2020-10-10,34,Forest,Rural,3,0.0882352941176471
NyeHolman,CT_Forest_Nye_Holman_20_13_2020,2020,41.89819,-72.30697,2020-09-06,2020-10-10,34,Forest,Rural,2,0.0588235294117647
NyeHolman,CT_Forest_Nye_Holman_20_14_2020,2020,41.89801,-72.30387,2020-09-06,2020-10-10,34,Forest,Rural,3,0.0882352941176471
NyeHolman,CT_Forest_Nye_Holman_20_15_2020,2020,41.90014,-72.30394,2020-09-06,2020-10-10,34,Forest,Rural,3,0.0882352941176471
NyeHolman,CT_Forest_Nye_Holman_20_16_2020,2020,41.89991,-72.30717,2020-09-06,2020-10-10,34,Forest,Rural,3,0.0882352941176471
NyeHolman,CT_Forest_Nye_Holman_20_17_2020,2020,41.90179,-72.30691,2020-09-06,2020-10-10,34,Forest,Rural,2,0.0588235294117647
NyeHolman,CT_Forest_Nye_Holman_20_20_2020,2020,41.88556,-72.32455,2020-09-05,2020-10-15,40,Forest,Rural,2,0.05
NyeHolman,CT_Forest_Nye_Holman_2_2019,2019,41.88564,-72.32735,2019-09-06,2019-10-08,32,Forest,Rural,407,12.71875
NyeHolman,CT_Forest_Nye_Holman_3_2019,2019,41.88563,-72.32459,2019-09-06,2019-10-08,32,Forest,Rural,3,0.09375
NyeHolman,CT_Forest_Nye_Holman_4_2019,2019,41.88347,-72.32462,2019-09-06,2019-10-08,32,Forest,Rural,2,0.0625
NyeHolman,CT_Forest_Nye_Holman_5_2019,2019,41.88171,-72.32355,2019-09-06,2019-10-08,32,Forest,Rural,2,0.0625
NyeHolman,CT_Forest_Nye_Holman_6_2019,2019,41.8889,-72.32593,2019-09-10,2019-10-17,37,Forest,Rural,5,0.135135135135135
NyeHolman,CT_Forest_Nye_Holman_8_2019,2019,41.89105,-72.32874,2019-09-10,2019-10-17,37,Forest,Rural,3,0.0810810810810811
Storrs,CT_Forest_Storrs_10_2019,2019,41.79902,-72.23234,2019-09-01,2019-10-12,41,Forest,Suburban,12,0.292682926829268
Storrs,CT_Forest_Storrs_1_2019,2019,41.79943,-72.23083,2019-09-04,2019-10-12,38,Forest,Suburban,10,0.263157894736842
Storrs,CT_Forest_Storrs_20_01_2020,2020,41.79943,-72.23082,2020-09-02,2020-10-26,54,Forest,Suburban,6,0.111111111111111
Storrs,CT_Forest_Storrs_20_02_2020,2020,41.79979,-72.22961,2020-09-02,2020-10-26,54,Forest,Suburban,5,0.0925925925925926
Storrs,CT_Forest_Storrs_20_03_2020,2020,41.80013,-72.22853,2020-09-02,2020-10-14,42,Forest,Suburban,2,0.0476190476190476
Storrs,CT_Forest_Storrs_20_04_2020,2020,41.80028,-72.22748,2020-09-02,2020-10-17,45,Forest,Suburban,5,0.111111111111111
Storrs,CT_Forest_Storrs_20_05_2020,2020,41.8009,-72.22963,2020-09-02,2020-10-03,31,Forest,Suburban,35,1.12903225806452
Storrs,CT_Forest_Storrs_20_06_2020,2020,41.80141,-72.23049,2020-09-30,2020-10-26,26,Forest,Suburban,3,0.115384615384615
Storrs,CT_Forest_Storrs_20_07_2020,2020,41.80007,-72.23087,2020-09-02,2020-10-11,39,Forest,Suburban,1,0.0256410256410256
Storrs,CT_Forest_Storrs_20_08_2020,2020,41.79967,-72.2321,2020-09-02,2020-09-20,18,Forest,Suburban,1,0.0555555555555556
Storrs,CT_Forest_Storrs_20_09_2020,2020,41.80031,-72.23372,2020-09-02,2020-10-06,34,Forest,Suburban,4,0.117647058823529
Storrs,CT_Forest_Storrs_20_10_2020,2020,41.79902,-72.23233,2020-09-02,2020-10-01,29,Forest,Suburban,1,0.0344827586206897
Storrs,CT_Forest_Storrs_2_2019,2019,41.79979,-72.22961,2019-09-02,2019-10-12,40,Forest,Suburban,7,0.175
Storrs,CT_Forest_Storrs_3_2019,2019,41.80014,-72.22853,2019-09-01,2019-10-12,41,Forest,Suburban,9,0.219512195121951
Storrs,CT_Forest_Storrs_4_2019,2019,41.80028,-72.22748,2019-09-02,2019-10-12,40,Forest,Suburban,4,0.1
Storrs,CT_Forest_Storrs_5_2019,2019,41.80091,-72.22964,2019-09-01,2019-10-12,41,Forest,Suburban,6,0.146341463414634
Storrs,CT_Forest_Storrs_6_2019,2019,41.80142,-72.2305,2019-09-01,2019-10-12,41,Forest,Suburban,12,0.292682926829268
Storrs,CT_Forest_Storrs_7_2019,2019,41.80008,-72.23088,2019-09-02,2019-10-12,40,Forest,Suburban,2,0.05
Storrs,CT_Forest_Storrs_8_2019,2019,41.79967,-72.2321,2019-09-02,2019-10-12,40,Forest,Suburban,13,0.325
Storrs,CT_Forest_Storrs_9_2019,2019,41.80032,-72.23372,2019-09-02,2019-10-12,40,Forest,Suburban,27,0.675
SLC,Creekside Park.USA.2019_2019,2019,40.66553,-111.84855,2019-09-07,2019-09-29,22,Desert,Urban,247,11.2272727272727
SLC,Creekside Park.USA.2020_2020,2020,40.66558,-111.84845,2020-09-05,2020-10-08,33,Desert,Urban,485,14.6969696969697
SLC,Crestwood Park.USA.2019_2019,2019,40.61364,-111.84496,2019-09-07,2019-09-29,22,Desert,Urban,24,1.09090909090909
SLC,Crestwood Park.USA.2020_2020,2020,40.61363,-111.84483,2020-09-09,2020-10-04,25,Desert,Urban,48,1.92
Rothrock,Crow1_2023 09/02/2023_2023,2023,40.74873,-77.66755,2023-09-02,2023-09-16,14,Forest,Wild,2,0.142857142857143
Herrera,DC-RCNP-01-2021_2021,2021,38.982335,-77.049771,2021-09-03,2021-10-17,44,Forest,Urban,4,0.0909090909090909
Herrera,DC-RCNP-02 09/03/2021_2021,2021,38.973558,-77.044881,2021-09-03,2021-10-17,44,Forest,Urban,4,0.0909090909090909
Herrera,DC-RCNP-03 09/07/2021_2021,2021,38.958102,-77.046863,2021-09-07,2021-10-16,39,Forest,Urban,3,0.0769230769230769
Herrera,DC-RCNP-04 09/07/2021_2021,2021,38.944775,-77.046865,2021-09-07,2021-10-16,39,Forest,Urban,7,0.17948717948718
Herrera,DC_Arboretum1 09/03/2021_2021,2021,38.90965,-76.97235,2021-09-03,2021-10-01,28,Forest,Urban,2,0.0714285714285714
Herrera,DC_Arboretum2 09/03/2021_2021,2021,38.90783,-76.96419,2021-09-03,2021-10-01,28,Forest,Urban,12,0.428571428571429
Herrera,DC_Arboretum3 09/03/2021_2021,2021,38.91602,-76.95528,2021-09-03,2021-10-01,28,Forest,Urban,2,0.0714285714285714
Herrera,DC_ArlingtonNationalCemetery 10/12/2021_2021,2021,38.88252478,-77.07668246,2021-10-12,2021-11-17,36,Forest,Urban,3,0.0833333333333333
Herrera,DC_ArmyNavyCountryClub 10/12/2021_2021,2021,38.85268765,-77.08247447,2021-10-12,2021-11-19,38,Forest,Urban,4,0.105263157894737
Herrera,DC_BaldEagleHill 10/08/2021_2021,2021,38.81856115,-77.00917295,2021-10-08,2021-10-16,8,Forest,Urban,1,0.125
Herrera,DC_BarnardHillPark 10/04/2023_2023,2023,38.93894995,-76.9715876,2023-10-04,2023-10-31,27,Forest,Urban,3,0.111111111111111
Herrera,DC_BarnardHillPark 10/15/2021_2021,2021,38.93894995,-76.9715876,2021-10-15,2021-10-24,9,Forest,Urban,1,0.111111111111111
Herrera,DC_Ben_Brenman_Park 10/12/2021_2021,2021,38.8112899,-77.11480335,2021-10-12,2021-11-16,35,Forest,Urban,2,0.0571428571428571
Herrera,DC_BerkshirePark 10/08/2021_2021,2021,38.8451427,-76.90151089,2021-10-08,2021-11-14,37,Forest,Urban,1,0.027027027027027
Herrera,DC_BluemontPark 10/13/2021_2021,2021,38.86717456,-77.1285257,2021-10-13,2021-11-05,23,Forest,Urban,7,0.304347826086957
Herrera,DC_BrenMarPark 10/12/2021_2021,2021,38.807468,-77.1502,2021-10-12,2021-11-13,32,Forest,Urban,3,0.09375
Herrera,DC_COCanal1 09/03/2021_2021,2021,38.93367,-77.11538,2021-09-03,2021-10-01,28,Forest,Urban,2,0.0714285714285714
Herrera,DC_COCanal2 09/03/2021_2021,2021,38.91678,-77.10038,2021-09-03,2021-10-01,28,Forest,Urban,2,0.0714285714285714
Herrera,DC_CapViewHomewoodPark 10/11/2021_2021,2021,39.02836006,-77.05858125,2021-10-11,2021-11-12,32,Forest,Urban,10,0.3125
Herrera,DC_ColumbiaCountryClub 10/11/2021_2021,2021,38.99385476,-77.08375527,2021-10-11,2021-11-15,35,Forest,Urban,2,0.0571428571428571
Herrera,DC_CongressCemetery_2021,2021,38.88156194,-76.9764441,2021-10-08,2021-11-14,37,Forest,Urban,9,0.243243243243243
Herrera,DC_Congressional_Cemetery 10/04/2023_2023,2023,38.88156194,-76.9764441,2023-10-04,2023-10-31,27,Forest,Urban,9,0.333333333333333
Herrera,DC_CricketGrounds 10/08/2021_2021,2021,38.81452216,-76.9871888,2021-10-08,2021-11-05,28,Forest,Urban,1,0.0357142857142857
Herrera,DC_DaingerfieldIsland 10/13/2021_2021,2021,38.8289536,-77.03860874,2021-10-13,2021-10-21,8,Forest,Urban,1,0.125
Herrera,DC_DoraKelleyPark 10/12/2021_2021,2021,38.83280956,-77.13049648,2021-10-12,2021-11-16,35,Forest,Urban,8,0.228571428571429
Herrera,DC_ForDupontPark_2021,2021,38.8744773,-76.94223263,2021-10-08,2021-11-14,37,Forest,Urban,2,0.0540540540540541
Herrera,DC_Forest_Herrera_ArmyNavyCountryClub 10/04/2023_2023,2023,38.85262,-77.03264,2023-10-04,2023-11-01,28,Forest,Urban,4,0.142857142857143
Herrera,DC_Forest_Herrera_BaldEagleHill 10/03/2023_2023,2023,38.81856115,-77.00917295,2023-10-03,2023-10-29,26,Forest,Urban,2,0.0769230769230769
Herrera,DC_Forest_Herrera_BerkshirePark 10/03/2023_2023,2023,38.8451427,-76.90151089,2023-10-03,2023-10-17,14,Forest,Urban,1,0.0714285714285714
Herrera,DC_Forest_Herrera_BluemontPark 10/03/2023_2023,2023,38.8672,-77.12868,2023-10-03,2023-10-23,20,Forest,Urban,2,0.1
Herrera,DC_Forest_Herrera_BrenMarPark 10/03/2023_2023,2023,38.80737,-77.15044,2023-10-03,2023-10-10,7,Forest,Urban,1,0.142857142857143
Herrera,DC_Forest_Herrera_BushHill 10/03/2023_2023,2023,38.79372648,-77.10944841,2023-10-03,2023-10-17,14,Forest,Urban,1,0.0714285714285714
Herrera,DC_Forest_Herrera_CapViewHomewoodPark 10/02/2023_2023,2023,39.02836006,-77.05858125,2023-10-02,2023-10-30,28,Forest,Urban,9,0.321428571428571
Herrera,DC_Forest_Herrera_CricketGrounds 10/03/2023_2023,2023,38.81452216,-76.9871888,2023-10-03,2023-10-31,28,Forest,Urban,3,0.107142857142857
Herrera,DC_Forest_Herrera_DaingerfieldIsland 10/03/2023_2023,2023,38.82888,-77.03859,2023-10-03,2023-11-01,29,Forest,Urban,24,0.827586206896552
Herrera,DC_Forest_Herrera_DoraKelleyPark 10/03/2023_2023,2023,38.83241,-77.13169,2023-10-03,2023-10-27,24,Forest,Urban,9,0.375
Herrera,DC_Forest_Herrera_FortFootePark 10/03/2023_2023,2023,38.7699292,-77.0286056,2023-10-03,2023-10-31,28,Forest,Urban,5,0.178571428571429
Herrera,DC_Forest_Herrera_FortWardPark 10/03/2023_2023,2023,38.83048,-77.10081,2023-10-03,2023-10-11,8,Forest,Urban,1,0.125
Herrera,DC_Forest_Herrera_FortWilliamsCulvert 10/03/2023_2023,2023,38.81011101,-77.09522,2023-10-03,2023-10-31,28,Forest,Urban,18,0.642857142857143
Herrera,DC_Forest_Herrera_FoundryBranch 10/04/2023_2023,2023,38.90521742,-77.0774244,2023-10-04,2023-10-30,26,Forest,Urban,46,1.76923076923077
Herrera,DC_Forest_Herrera_IndianSpringPark 10/02/2023_2023,2023,39.01605887,-77.00964707,2023-10-02,2023-10-14,12,Forest,Urban,1,0.0833333333333333
Herrera,DC_Forest_Herrera_JeffersonDistrictPark 10/02/2023_2023,2023,38.87642,-77.21871,2023-10-02,2023-10-10,8,Forest,Urban,1,0.125
Herrera,DC_Forest_Herrera_JonesPointPark 10/04/2023_2023,2023,38.79564575,-77.04201139,2023-10-04,2023-10-25,21,Forest,Urban,0,0
Herrera,DC_Forest_Herrera_LadybirdJohnsonPark 10/03/2023_2023,2023,38.88030925,-77.05422013,2023-10-03,2023-10-30,27,Forest,Urban,8,0.296296296296296
Herrera,DC_Forest_Herrera_LeeDistPark 10/03/2023_2023,2023,38.77238327,-77.10881939,2023-10-03,2023-10-31,28,Forest,Urban,75,2.67857142857143
Herrera,DC_Forest_Herrera_LittleFallsPark_Res 10/04/2023_2023,2023,38.94723946,-77.1156194,2023-10-04,2023-10-30,26,Forest,Urban,2,0.0769230769230769
Herrera,DC_Forest_Herrera_LittleFallsPark_SVU1 10/04/2023_2023,2023,38.97342974,-77.1022823,2023-10-04,2023-10-24,20,Forest,Urban,3,0.15
Herrera,DC_Forest_Herrera_LittleFallsPark_SVU2 10/04/2023_2023,2023,38.95786938,-77.16484168,2023-10-04,2023-10-30,26,Forest,Urban,2,0.0769230769230769
Herrera,DC_Forest_Herrera_LoftridgePark 10/02/2023_2023,2023,38.83365,-77.10561,2023-10-03,2023-10-31,28,Forest,Urban,2,0.0714285714285714
Herrera,DC_Forest_Herrera_MarieButlerLevinPreserve 10/03/2023_2023,2023,38.92887,-77.14623,2023-10-03,2023-10-31,28,Forest,Urban,5,0.178571428571429
Herrera,DC_Forest_Herrera_MasonDistrictPark 10/02/2023_2023,2023,38.83205,-77.17303,2023-10-02,2023-10-31,29,Forest,Urban,4,0.137931034482759
Herrera,DC_Forest_Herrera_McCleanPark 10/03/2023_2023,2023,38.94009534,-77.18547117,2023-10-03,2023-10-31,28,Forest,Urban,2,0.0714285714285714
Herrera,DC_Forest_Herrera_MillwoodRecCenter 10/03/2023_2023,2023,38.88388597,-76.87937169,2023-10-03,2023-10-31,28,Forest,Urban,2,0.0714285714285714
Herrera,DC_Forest_Herrera_NormanstoneParkway 10/02/2023_2023,2023,38.92155027,-77.06080724,2023-10-02,2023-11-01,30,Forest,Urban,45,1.5
Herrera,DC_Forest_Herrera_NorthwestSVP 10/02/2023_2023,2023,39.04891651,-77.01135241,2023-10-02,2023-10-30,28,Forest,Urban,5,0.178571428571429
Herrera,DC_Forest_Herrera_PaintBranchSVP 10/02/2023_2023,2023,38.98657557,-76.930816,2023-10-02,2023-11-01,30,Forest,Urban,2,0.0666666666666667
Herrera,DC_Forest_Herrera_PopeBranch 10/03/2023_2023,2023,38.87716289,-76.96481818,2023-10-03,2023-10-31,28,Forest,Urban,3,0.107142857142857
Herrera,DC_Forest_Herrera_PotomacOverlookPark 10/03/2023_2023,2023,38.91233,-77.10529,2023-10-03,2023-10-31,28,Forest,Urban,2,0.0714285714285714
Herrera,DC_Forest_Herrera_PrinceGeorgeMall 10/02/2023_2023,2023,38.97077342,-76.9652329,2023-10-02,2023-10-31,29,Forest,Urban,2,0.0689655172413793
Herrera,DC_Forest_Herrera_ProvidenceRecCenter 10/02/2023_2023,2023,38.86058104,-77.21178644,2023-10-02,2023-10-12,10,Forest,Urban,3,0.3
Herrera,DC_Forest_Herrera_RCPPineyBranch 10/02/2023_2023,2023,38.93681881,-77.04309063,2023-10-02,2023-11-01,30,Forest,Urban,3,0.1
Herrera,DC_Forest_Herrera_RCPStables 10/02/2023_2023,2023,38.96622362,-77.05156421,2023-10-02,2023-11-01,30,Forest,Urban,4,0.133333333333333
Herrera,DC_Forest_Herrera_RollingcrestPool 10/02/2023_2023,2023,38.96465673,-76.98590733,2023-10-02,2023-10-31,29,Forest,Urban,2,0.0689655172413793
Herrera,DC_Forest_Herrera_RooseveltIsland 10/03/2023_2023,2023,38.89486768,-77.06152,2023-10-03,2023-10-18,15,Forest,Urban,1,0.0666666666666667
Herrera,DC_Forest_Herrera_RoundTreePark 10/02/2023_2023,2023,38.84861809,-77.19158624,2023-10-02,2023-10-22,20,Forest,Urban,1,0.05
Herrera,DC_Forest_Herrera_ShepherdsParkway 10/03/2023_2023,2023,38.85071202,-77.00488067,2023-10-03,2023-10-31,28,Forest,Urban,1,0.0357142857142857
Herrera,DC_Forest_Herrera_SligoCreekGolf 10/02/2023_2023,2023,39.01381096,-77.03018717,2023-10-02,2023-10-30,28,Forest,Urban,2,0.0714285714285714
Herrera,DC_Forest_Herrera_SligoSVU1 10/02/2023_2023,2023,39.03417137,-77.03033085,2023-10-02,2023-10-21,19,Forest,Urban,2,0.105263157894737
Herrera,DC_Forest_Herrera_SoapstoneValley 10/02/2023_2023,2023,38.94647687,-77.06260209,2023-10-02,2023-11-01,30,Forest,Urban,3,0.1
Herrera,DC_Forest_Herrera_SuitlandParkway 10/03/2023_2023,2023,38.83810165,-76.92975687,2023-10-03,2023-10-31,28,Forest,Urban,2,0.0714285714285714
Herrera,DC_Forest_Herrera_Sycamore_Island 10/04/2023_2023,2023,38.95678,-77.1314,2023-10-04,2023-10-30,26,Forest,Urban,2,0.0769230769230769
Herrera,DC_Forest_Herrera_TakomaPineyBranch 10/02/2023_2023,2023,38.98362725,-77.00935287,2023-10-02,2023-11-01,30,Forest,Urban,9,0.3
Herrera,DC_Forest_Herrera_Tuckahoe 10/03/2023_2023,2023,38.89123,-77.15726,2023-10-03,2023-10-10,7,Forest,Urban,4,0.571428571428571
Herrera,DC_Forest_Herrera_TuckerComCenter 10/03/2023_2023,2023,38.78396526,-76.98255258,2023-10-03,2023-10-20,17,Forest,Urban,2,0.117647058823529
Herrera,DC_Forest_Herrera_UptonHill 10/03/2023_2023,2023,38.8726,-77.14204,2023-10-03,2023-10-14,11,Forest,Urban,1,0.0909090909090909
Herrera,DC_Forest_Herrera_WalkerMillsPark 10/03/2023_2023,2023,38.87236197,-76.86755316,2023-10-03,2023-10-30,27,Forest,Urban,1,0.037037037037037
Herrera,DC_Forest_Herrera_barcroftPark 10/03/2023_2023,2023,38.84698,-77.10181,2023-10-03,2023-10-19,16,Forest,Urban,5,0.3125
Herrera,DC_Forest_Urban_Arboretum 10/03/2022_2022,2022,38.90926534,-76.95794197,2022-10-03,2022-10-21,18,Forest,Urban,1,0.0555555555555556
Herrera,DC_Forest_Urban_ArlingtonNationalCemetery 09/30/2022_2022,2022,38.88265,-77.07657,2022-09-30,2022-10-28,28,Forest,Urban,10,0.357142857142857
Herrera,DC_Forest_Urban_ArmyNavyCountryClub 09/30/2022_2022,2022,38.85262,-77.08264,2022-09-30,2022-10-15,15,Forest,Urban,2,0.133333333333333
Herrera,DC_Forest_Urban_BaldEagleHill 10/03/2022_2022,2022,38.81856115,-77.00917295,2022-10-03,2022-11-04,32,Forest,Urban,12,0.375
Herrera,DC_Forest_Urban_BarnardHillPark 10/03/2022_2022,2022,38.93894995,-76.9715876,2022-10-03,2022-10-16,13,Forest,Urban,1,0.0769230769230769
Herrera,DC_Forest_Urban_Ben_Brenman_Park 10/03/2022_2022,2022,38.81129,-77.11480335,2022-10-03,2022-10-28,25,Forest,Urban,2,0.08
Herrera,DC_Forest_Urban_BrenMarPark 10/03/2022_2022,2022,38.80737,-77.15044,2022-10-03,2022-10-11,8,Forest,Urban,1,0.125
Herrera,DC_Forest_Urban_BushHill 10/03/2022_2022,2022,38.79372648,-77.10944841,2022-10-03,2022-10-22,19,Forest,Urban,2,0.105263157894737
Herrera,DC_Forest_Urban_ColumbiaCountryClub 10/03/2022_2022,2022,38.99385476,-77.08375527,2022-10-03,2022-10-31,28,Forest,Urban,9,0.321428571428571
Herrera,DC_Forest_Urban_Congressional_Cemetery 10/03/2022_2022,2022,38.88156194,-76.9764441,2022-10-03,2022-10-21,18,Forest,Urban,3,0.166666666666667
Herrera,DC_Forest_Urban_CricketGrounds 10/04/2022_2022,2022,38.81452216,-76.9871888,2022-10-04,2022-10-15,11,Forest,Urban,2,0.181818181818182
Herrera,DC_Forest_Urban_DaingerfieldIsland 09/30/2022_2022,2022,38.79564575,-77.04201139,2022-09-30,2022-10-03,3,Forest,Urban,1,0.333333333333333
Herrera,DC_Forest_Urban_DoraKelleyPark 09/30/2022_2022,2022,38.83241,-77.13169,2022-09-30,2022-10-21,21,Forest,Urban,10,0.476190476190476
Herrera,DC_Forest_Urban_FortChaplinPark 10/03/2022_2022,2022,38.89036345,-76.94597422,2022-10-03,2022-10-18,15,Forest,Urban,1,0.0666666666666667
Herrera,DC_Forest_Urban_FortDupontPark 10/03/2022_2022,2022,38.8744773,-76.94223263,2022-10-03,2022-10-22,19,Forest,Urban,1,0.0526315789473684
Herrera,DC_Forest_Urban_FortFootePark 10/04/2022_2022,2022,38.7699292,-77.0286056,2022-10-05,2022-11-03,29,Forest,Urban,1,0.0344827586206897
Herrera,DC_Forest_Urban_FortWilliamsCulvert 10/03/2022_2022,2022,38.81011101,-77.09522577,2022-10-03,2022-10-15,12,Forest,Urban,11,0.916666666666667
Herrera,DC_Forest_Urban_FoundryBranch 10/03/2022_2022,2022,38.90521742,-77.0774244,2022-10-03,2022-10-27,24,Forest,Urban,1,0.0416666666666667
Herrera,DC_Forest_Urban_GlenridgePark 10/03/2022_2022,2022,38.95522954,-76.89171032,2022-10-03,2022-11-03,31,Forest,Urban,5,0.161290322580645
Herrera,DC_Forest_Urban_IndianSpringPark 10/03/2022_2022,2022,39.01605887,-77.00964707,2022-10-03,2022-10-26,23,Forest,Urban,3,0.130434782608696
Herrera,DC_Forest_Urban_JeffersonDistrictPark 09/30/2022_2022,2022,38.87642,-77.21871,2022-09-30,2022-10-08,8,Forest,Urban,2,0.25
Herrera,DC_Forest_Urban_JonesPointPark 10/03/2022_2022,2022,38.79564575,-77.04201139,2022-10-03,2022-10-29,26,Forest,Urban,2,0.0769230769230769
Herrera,DC_Forest_Urban_KentlandPark 10/03/2022_2022,2022,38.92448941,-76.89816037,2022-10-03,2022-10-31,28,Forest,Urban,1,0.0357142857142857
Herrera,DC_Forest_Urban_LadybirdJohnsonPark 10/03/2022_2022,2022,38.88030925,-77.03859,2022-10-03,2022-10-29,26,Forest,Urban,2,0.0769230769230769
Herrera,DC_Forest_Urban_LeeDistPark 10/03/2022_2022,2022,38.77238327,-77.10944841,2022-10-03,2022-10-28,25,Forest,Urban,36,1.44
Herrera,DC_Forest_Urban_LillianCareyPark 09/30/2022_2022,2022,38.84058,-77.14091,2022-09-30,2022-10-10,10,Forest,Urban,39,3.9
Herrera,DC_Forest_Urban_LittleFallsPark_Res 10/03/2022_2022,2022,38.94723946,-77.1156194,2022-10-03,2022-10-29,26,Forest,Urban,2,0.0769230769230769
Herrera,DC_Forest_Urban_LittleFallsPark_SVU1 10/03/2022_2022,2022,38.97342974,-77.10228228,2022-10-03,2022-10-29,26,Forest,Urban,13,0.5
Herrera,DC_Forest_Urban_LittleFallsPark_SVU2 10/03/2022_2022,2022,38.95786938,-77.16484168,2022-10-03,2022-10-29,26,Forest,Urban,35,1.34615384615385
Herrera,DC_Forest_Urban_LoftridgePark 09/30/2022_2022,2022,38.79506,-77.10561,2022-09-30,2022-10-29,29,Forest,Urban,2,0.0689655172413793
Herrera,DC_Forest_Urban_MarieButlerLevinPreserve 09/30/2022_2022,2022,38.92887,-77.14623,2022-09-30,2022-10-28,28,Forest,Urban,2,0.0714285714285714
Herrera,DC_Forest_Urban_MasonDistrictPark 09/30/2022_2022,2022,38.83205,-77.17303,2022-09-30,2022-10-28,28,Forest,Urban,21,0.75
Herrera,DC_Forest_Urban_McCleanPark 09/30/2022_2022,2022,38.94009534,-77.18547117,2022-09-30,2022-10-24,24,Forest,Urban,1,0.0416666666666667
Herrera,DC_Forest_Urban_MillwoodRecCenter 10/04/2022_2022,2022,38.88388597,-76.87937169,2022-10-04,2022-10-24,20,Forest,Urban,1,0.05
Herrera,DC_Forest_Urban_MonticelloPark 09/30/2022_2022,2022,38.83365,-77.06995,2022-09-30,2022-10-27,27,Forest,Urban,2,0.0740740740740741
Herrera,DC_Forest_Urban_MtOlivetCemetery 10/03/2022_2022,2022,38.91231173,-76.98031853,2022-10-03,2022-11-03,31,Forest,Urban,3,0.0967741935483871
Herrera,DC_Forest_Urban_MtVernonPark 09/03/2022_2022,2022,38.77212483,-77.06477472,2022-10-03,2022-10-28,25,Forest,Urban,2,0.08
Herrera,DC_Forest_Urban_NormanstoneParkway 10/03/2022_2022,2022,38.92155027,-77.06080724,2022-10-03,2022-10-29,26,Forest,Urban,38,1.46153846153846
Herrera,DC_Forest_Urban_NorthwestSVP 10/03/2022_2022,2022,39.04891651,-77.01135241,2022-10-03,2022-10-31,28,Forest,Urban,2,0.0714285714285714
Herrera,DC_Forest_Urban_PaintBranchSVP 10/03/2022_2022,2022,38.98657557,-76.930816,2022-10-03,2022-10-31,28,Forest,Urban,2,0.0714285714285714
Herrera,DC_Forest_Urban_ProvidenceRecCenter 10/03/2022_2022,2022,38.86058104,-77.21178644,2022-10-03,2022-10-10,7,Forest,Urban,1,0.142857142857143
Herrera,DC_Forest_Urban_RCPPineyBranch 10/03/2022_2022,2022,38.93681881,-77.04309063,2022-10-03,2022-11-04,32,Forest,Urban,2,0.0625
Herrera,DC_Forest_Urban_RCPStables 10/03/2022_2022,2022,38.96622362,-77.05156421,2022-10-03,2022-11-03,31,Forest,Urban,4,0.129032258064516
Herrera,DC_Forest_Urban_RCPboundaryBridge 10/03/2022_2022,2022,38.98692,-77.052,2022-10-03,2022-10-19,16,Forest,Urban,1,0.0625
Herrera,DC_Forest_Urban_RoachRunLot 10/03/2022_2022,2022,38.86447323,-77.04268873,2022-10-03,2022-10-29,26,Forest,Urban,15,0.576923076923077
Herrera,DC_Forest_Urban_RockCreekCemetery 10/03/2022_2022,2022,38.94614553,-77.01661296,2022-10-03,2022-10-26,23,Forest,Urban,1,0.0434782608695652
Herrera,DC_Forest_Urban_RooseveltIsland 09/30/2022_2022,2022,38.89486768,-77.06152,2022-09-30,2022-10-15,15,Forest,Urban,2,0.133333333333333
Herrera,DC_Forest_Urban_RoundTreePark 10/03/2022_2022,2022,38.84861809,-77.19158624,2022-10-03,2022-10-27,24,Forest,Urban,2,0.0833333333333333
Herrera,DC_Forest_Urban_SligoCreekGolf 10/03/2022_2022,2022,39.01381096,-77.03018717,2022-10-03,2022-10-17,14,Forest,Urban,1,0.0714285714285714
Herrera,DC_Forest_Urban_SligoSVU1 10/03/2022_2022,2022,39.03417137,-77.03033085,2022-10-03,2022-10-15,12,Forest,Urban,2,0.166666666666667
Herrera,DC_Forest_Urban_SuitlandParkway 10/04/2022_2022,2022,38.83810165,-76.92975687,2022-10-04,2022-10-19,15,Forest,Urban,1,0.0666666666666667
Herrera,DC_Forest_Urban_Sycamore_Island 10/03/2022_2022,2022,38.95678,-77.1314,2022-10-03,2022-10-29,26,Forest,Urban,63,2.42307692307692
Herrera,DC_Forest_Urban_TakomaPineyBranch 10/04/2022_2022,2022,38.98362725,-77.00935287,2022-10-04,2022-10-18,14,Forest,Urban,1,0.0714285714285714
Herrera,DC_Forest_Urban_Tuckahoe 09/30/2022_2022,2022,38.89123,-77.15726,2022-09-30,2022-10-15,15,Forest,Urban,5,0.333333333333333
Herrera,DC_Forest_Urban_TuckerComCenter 10/04/2022_2022,2022,38.78396526,-76.98255258,2022-10-04,2022-11-03,30,Forest,Urban,2,0.0666666666666667
Herrera,DC_Forest_Urban_UptonHill 09/30/2022_2022,2022,38.8726,-77.14204,2022-09-30,2022-10-25,25,Forest,Urban,1,0.04
Herrera,DC_Forest_Urban_barcroftPark 09/30/2022_2022,2022,38.84698,-77.10181,2022-09-30,2022-10-10,10,Forest,Urban,1,0.1
Herrera,DC_FortChaplinPark 10/04/2023_2023,2023,38.89036345,-76.94597422,2023-10-04,2023-10-15,11,Forest,Urban,1,0.0909090909090909
Herrera,DC_FortChaplinPark 10/08/2021_2021,2021,38.89036345,-76.94597422,2021-10-08,2021-11-14,37,Forest,Urban,3,0.0810810810810811
Herrera,DC_FortDupontPark 10/04/2023_2023,2023,38.8744773,-76.94223263,2023-10-04,2023-10-31,27,Forest,Urban,6,0.222222222222222
Herrera,DC_FortFootePark 10/08/2021_2021,2021,38.7699292,-77.0286056,2021-10-08,2021-11-14,37,Forest,Urban,3,0.0810810810810811
Herrera,DC_FortWardPark 10/12/2021_2021,2021,38.83037511,-77.10075019,2021-10-12,2021-10-20,8,Forest,Urban,5,0.625
Herrera,DC_FortWilliamsCulvert 11/04/2021_2021,2021,38.81011101,-77.09522577,2021-11-04,2021-11-16,12,Forest,Urban,12,1
Herrera,DC_GlenridgePark 10/04/2023_2023,2023,38.95522954,-76.89171032,2023-10-04,2023-11-01,28,Forest,Urban,5,0.178571428571429
Herrera,DC_GlenridgePark 10/15/2021_2021,2021,38.95522954,-76.89171032,2021-10-15,2021-11-17,33,Forest,Urban,4,0.121212121212121
Herrera,DC_HensonCreek 10/08/2021_2021,2021,38.81424718,-76.93378868,2021-10-08,2021-11-14,37,Forest,Urban,5,0.135135135135135
Herrera,DC_IndianSpringPark 10/11/2021_2021,2021,39.01605887,-77.00964707,2021-10-11,2021-11-09,29,Forest,Urban,1,0.0344827586206897
Herrera,DC_JeffersonDistrictPark 10/12/2021_2021,2021,38.87639846,-77.21866259,2021-10-12,2021-11-02,21,Forest,Urban,1,0.0476190476190476
Herrera,DC_JonesPointPark 10/08/2021_2021,2021,38.79564575,-77.04201139,2021-10-13,2021-11-14,32,Forest,Urban,3,0.09375
Herrera,DC_KenilworthGardens 10/04/2023_2023,2023,38.91592444,-76.94227813,2023-10-04,2023-10-31,27,Forest,Urban,2,0.0740740740740741
Herrera,DC_KenilworthGardens 10/08/2021_2021,2021,38.91592444,-76.94227813,2021-10-08,2021-10-22,14,Forest,Urban,0,0
Herrera,DC_KentlandPark 10/04/2023_2023,2023,38.92448941,-76.89816037,2023-10-04,2023-11-01,28,Forest,Urban,2,0.0714285714285714
Herrera,DC_KentlandPark 10/15/2021_2021,2021,38.92448941,-76.89816037,2021-10-15,2021-11-09,25,Forest,Urban,1,0.04
Herrera,DC_LadybirdJohnsonPark 10/13/2021_2021,2021,38.88030925,-77.05422013,2021-10-13,2021-11-17,35,Forest,Urban,6,0.17142857142857101
Herrera,DC_LeeDistPark 10/12/2021_2021,2021,38.77238327,-77.10881939,2021-10-12,2021-11-13,32,Forest,Urban,42,1.3125
Herrera,DC_LillianCareyPark 10/13/2021_2021,2021,38.84055146,-77.14072756,2021-10-13,2021-10-22,9,Forest,Urban,46,5.11111111111111
Herrera,DC_LittleFallsPark_Res 10/11/2021_2021,2021,38.94723946,-77.1156194,2021-10-11,2021-11-15,35,Forest,Urban,3,0.0857142857142857
Herrera,DC_LittleFallsPark_SVU2 10/11/2021_2021,2021,38.95786938,-77.16484168,2021-10-11,2021-11-15,35,Forest,Urban,4,0.114285714285714
Herrera,DC_LoftridgePark 10/12/2021_2021,2021,38.79505723,-77.10560757,2021-10-12,2021-11-13,32,Forest,Urban,2,0.0625
Herrera,DC_MarieButlerLevinPreserve 10/12/2021_2021,2021,38.92892977,-77.14626639,2021-10-12,2021-11-15,34,Forest,Urban,2,0.0588235294117647
Herrera,DC_MasonDistrictPark 11/03/2021_2021,2021,38.83202433,-77.17310673,2021-11-03,2021-11-16,13,Forest,Urban,9,0.692307692307692
Herrera,DC_McCleanPark 10/12/2021_2021,2021,38.94009534,-77.18547117,2021-10-12,2021-11-15,34,Forest,Urban,2,0.0588235294117647
Herrera,DC_MillwoodRecCenter 10/08/2021_2021,2021,38.88388597,-76.87937169,2021-10-08,2021-11-14,37,Forest,Urban,7,0.189189189189189
Herrera,DC_MonticelloPark 10/12/2021_2021,2021,38.83371832,-77.06995219,2021-10-12,2021-11-06,25,Forest,Urban,2,0.08
Herrera,DC_MtOlivetCemetery 10/04/2023_2023,2023,38.91231173,-76.98031853,2023-10-04,2023-10-31,27,Forest,Urban,2,0.0740740740740741
Herrera,DC_MtOlivetCemetery 10/15/2021_2021,2021,38.91231173,-76.98031853,2021-10-15,2021-11-23,39,Forest,Urban,2,0.0512820512820513
Herrera,DC_MtVernonPark 10/13/2021_2021,2021,38.77212483,-77.06477472,2021-10-13,2021-11-13,31,Forest,Urban,2,0.0645161290322581
Herrera,DC_NatGeoBuilding 10/13/2021_2021,2021,38.90501505,-77.03779643,2021-10-13,2021-11-17,35,Forest,Urban,27,0.771428571428571
Herrera,DC_NormanstoneParkway 10/13/2021_2021,2021,38.92155027,-77.06080724,2021-10-13,2021-10-28,15,Forest,Urban,2,0.133333333333333
Herrera,DC_NorthwestSVP 10/11/2021_2021,2021,39.04891651,-77.01135241,2021-10-11,2021-11-17,37,Forest,Urban,3,0.0810810810810811
Herrera,DC_PaintBranchSVP 10/11/2021_2021,2021,38.98657557,-76.930816,2021-10-11,2021-10-27,16,Forest,Urban,1,0.0625
Herrera,DC_PopeBranch 10/08/2021_2021,2021,38.87716289,-76.96481818,2021-10-08,2021-11-14,37,Forest,Urban,1,0.027027027027027
Herrera,DC_PotomacOverlookPark 10/13/2021_2021,2021,38.91238114,-77.10504628,2021-10-13,2021-10-19,6,Forest,Urban,1,0.166666666666667
Herrera,DC_PrinceGeorgeMall 10/15/2021_2021,2021,38.97077342,-76.9652329,2021-10-15,2021-11-08,24,Forest,Urban,1,0.0416666666666667
Herrera,DC_ProvidenceRecCenter 10/12/2021_2021,2021,38.86058104,-77.21178644,2021-10-12,2021-10-13,1,Forest,Urban,1,1
Herrera,DC_RCPPineyBranch 10/13/2021_2021,2021,38.93681881,-77.04309063,2021-10-13,2021-11-05,23,Forest,Urban,2,0.0869565217391304
Herrera,DC_RCPStables 10/13/2021_2021,2021,38.96622362,-77.05156421,2021-10-13,2021-11-17,35,Forest,Urban,3,0.0857142857142857
Herrera,DC_RCPboundaryBridge 10/13/2021_2021,2021,38.98692,-77.052,2021-10-13,2021-11-17,35,Forest,Urban,4,0.114285714285714
Herrera,DC_RoachRunLot 10/13/2021_2021,2021,38.86447323,-77.04268873,2021-10-13,2021-11-17,35,Forest,Urban,2,0.0571428571428571
Herrera,DC_RockCreekCemetery 10/04/2023_2023,2023,38.94614553,-77.01661296,2023-10-04,2023-11-01,28,Forest,Urban,2,0.0714285714285714
Herrera,DC_RockCreekCemetery 10/17/2021_2021,2021,38.94614553,-77.01661296,2021-10-17,2021-11-23,37,Forest,Urban,3,0.0810810810810811
Herrera,DC_RollingcrestPool 10/13/2021_2021,2021,38.96465673,-76.98590733,2021-10-13,2021-11-17,35,Forest,Urban,6,0.17142857142857101
Herrera,DC_RooseveltIsland 10/13/2021_2021,2021,38.89486768,-77.06149986,2021-10-13,2021-10-20,7,Forest,Urban,1,0.142857142857143
Herrera,DC_RoundTreePark 10/12/2021_2021,2021,38.84861809,-77.19158624,2021-10-12,2021-11-17,36,Forest,Urban,4,0.111111111111111
Herrera,DC_ShepherdsParkway 10/08/2021_2021,2021,38.85071202,-77.00488067,2021-10-08,2021-10-15,7,Forest,Urban,1,0.142857142857143
Herrera,DC_SligoCreekGolf 10/11/2021_2021,2021,39.03417137,-77.03033085,2021-10-11,2021-11-17,37,Forest,Urban,2,0.0540540540540541
Herrera,DC_SoapstoneValley 10/13/2021_2021,2021,38.94647687,-77.06260209,2021-10-13,2021-11-17,35,Forest,Urban,8,0.228571428571429
Herrera,DC_SuitlandParkway 10/08/2021_2021,2021,38.83810165,-76.92975687,2021-10-08,2021-11-14,37,Forest,Urban,2,0.0540540540540541
Herrera,DC_Sycamore_Island 10/12/2021_2021,2021,38.95668361,-77.13137509,2021-10-12,2021-11-15,34,Forest,Urban,15,0.441176470588235
Herrera,DC_TakomaPineyBranch 10/13/2021_2021,2021,38.98362725,-77.00935287,2021-10-13,2021-11-17,35,Forest,Urban,15,0.428571428571429
Herrera,DC_TuckerComCenter 10/08/2021_2021,2021,38.78396526,-76.98255258,2021-10-08,2021-11-14,37,Forest,Urban,4,0.108108108108108
Herrera,DC_UWIN_Arboretum 10/15/2021_2021,2021,38.90926534,-76.95794197,2021-10-15,2021-10-31,16,Forest,Urban,1,0.0625
Herrera,DC_WalkerMillsPark 10/08/2021_2021,2021,38.87236197,-76.86755316,2021-10-08,2021-11-14,37,Forest,Urban,2,0.0540540540540541
Herrera,DC_barcroftPark 10/13/2021_2021,2021,38.84702747,-77.10167788,2021-10-13,2021-11-13,31,Forest,Urban,6,0.193548387096774
SLC,DD_01.USA.2019_2019,2019,40.56655,-111.81139,2019-10-03,2019-10-11,8,Desert,Urban,0,0
SLC,DD_01.USA.2020_2020,2020,40.56795,-111.80951,2020-09-09,2020-10-04,25,Desert,Urban,4,0.16
SLC,DD_02.USA.2019_2019,2019,40.55893,-111.81396,2019-10-03,2019-11-17,45,Desert,Urban,1,0.0222222222222222
SLC,DD_02.USA.2020_2020,2020,40.55891,-111.81397,2020-10-04,2020-11-01,28,Desert,Urban,5,0.178571428571429
SLC,DD_03.USA.2019_2019,2019,40.55909,-111.8269,2019-10-03,2019-11-16,44,Desert,Urban,43,0.977272727272727
SLC,DD_04.USA.2019_2019,2019,40.55971,-111.83898,2019-10-02,2019-11-16,45,Desert,Urban,21,0.466666666666667
SLC,DD_05.USA.2020_2020,2020,40.56101,-111.84911,2020-10-04,2020-11-02,29,Desert,Urban,699,24.1034482758621
SLC,DD_07.USA.2019_2019,2019,40.56902,-111.87101,2019-10-05,2019-11-17,43,Desert,Urban,76,1.76744186046512
SLC,DD_07.USA.2020_2020,2020,40.56912,-111.87093,2020-10-09,2020-11-03,25,Desert,Urban,186,7.44
SLC,DD_08.USA.2019_2019,2019,40.56938,-111.88038,2019-10-04,2019-11-17,44,Desert,Urban,76,1.72727272727273
UDFarm,DE_Forest_Suburban_UDFarm_23_Loc1_D1_2023,2023,39.66789,-75.75186,2023-09-08,2023-10-09,31,Forest,Suburban,2,0.0645161290322581
UDFarm,DE_Forest_Suburban_UDFarm_23_Loc2_D1_2023,2023,39.66793,-75.74455,2023-09-07,2023-09-12,5,Forest,Suburban,1,0.2
UDFarm,DE_Forest_Suburban_UDFarm_23_Loc3_D1_2023,2023,39.67,-75.7452,2023-09-07,2023-11-01,55,Forest,Suburban,7,0.127272727272727
UDFarm,DE_Forest_Suburban_UDFarm_23_Loc4_D1_2023,2023,39.6707,-75.74267999999998,2023-09-07,2023-09-21,14,Forest,Suburban,1,0.0714285714285714
UDFarm,DE_Forest_Suburban_UDFarm_23_Loc5_D1_2023,2023,39.66174,-75.74335,2023-09-07,2023-09-25,18,Forest,Suburban,1,0.0555555555555556
UDFarm,DE_Forest_Suburban_UDFarm_23_Loc6_D1_2023,2023,39.66361,-75.74374,2023-09-07,2023-10-11,34,Forest,Suburban,1,0.0294117647058824
UDFarm,DE_Forest_Suburban_UDFarm_23_Loc7_D1_2023,2023,39.662183,-75.7456,2023-09-07,2023-10-05,28,Forest,Suburban,9,0.321428571428571
UDFarm,DE_Forest_Suburban_UDFarm_23_Loc8_D1_2023,2023,39.663908,-75.7462803,2023-09-08,2023-10-30,52,Forest,Suburban,2,0.0384615384615385
Wilmington,DE_Forest_Wilmington_10_2019,2019,39.76002,-75.51743,2019-08-31,2019-10-11,41,Forest,Suburban,7,0.170731707317073
Wilmington,DE_Forest_Wilmington_11_2019,2019,39.61871,-75.73917,2019-08-27,2019-10-09,43,Forest,Suburban,4,0.0930232558139535
Wilmington,DE_Forest_Wilmington_12_2019,2019,39.80163,-75.59646,2019-08-28,2019-10-11,44,Forest,Suburban,5,0.113636363636364
Wilmington,DE_Forest_Wilmington_13_2019,2019,39.77303,-75.56484,2019-08-31,2019-09-28,28,Forest,Suburban,2,0.0714285714285714
Wilmington,DE_Forest_Wilmington_14_2019,2019,39.64268,-75.67967,2019-08-27,2019-09-28,32,Forest,Suburban,2,0.0625
Wilmington,DE_Forest_Wilmington_1_2019,2019,39.7362,-75.58108,2019-09-05,2019-10-15,40,Forest,Suburban,4,0.1
Wilmington,DE_Forest_Wilmington_20_01_2020,2020,39.7356,-75.5811,2020-08-31,2020-10-03,33,Forest,Suburban,6,0.181818181818182
Wilmington,DE_Forest_Wilmington_20_02_2020,2020,39.6953,-75.5924,2020-08-31,2020-10-03,33,Forest,Suburban,39,1.18181818181818
Wilmington,DE_Forest_Wilmington_20_03_2020,2020,39.6789,-75.6359,2020-08-31,2020-10-02,32,Forest,Suburban,1,0.03125
Wilmington,DE_Forest_Wilmington_20_04_2020,2020,39.812,-75.6463,2020-08-31,2020-10-04,34,Forest,Suburban,5,0.147058823529412
Wilmington,DE_Forest_Wilmington_20_05_2020,2020,39.8002,-75.6629,2020-08-31,2020-10-01,31,Forest,Suburban,11,0.354838709677419
Wilmington,DE_Forest_Wilmington_20_06_2020,2020,39.8285,-75.6085,2020-08-31,2020-10-01,31,Forest,Suburban,7,0.225806451612903
Wilmington,DE_Forest_Wilmington_20_07_2020,2020,39.6116,-75.73,2020-08-30,2020-10-03,34,Forest,Suburban,16,0.470588235294118
Wilmington,DE_Forest_Wilmington_20_08_2020,2020,39.6619,-75.6825,2020-08-30,2020-10-03,34,Forest,Suburban,4,0.117647058823529
Wilmington,DE_Forest_Wilmington_20_09_2020,2020,39.6361,-75.689,2020-08-30,2020-10-03,34,Forest,Suburban,9,0.264705882352941
Wilmington,DE_Forest_Wilmington_20_10_2020,2020,39.7595,-75.517,2020-08-31,2020-10-03,33,Forest,Suburban,15,0.454545454545455
Wilmington,DE_Forest_Wilmington_20_11_2020,2020,39.6187,-75.7392,2020-08-30,2020-10-03,34,Forest,Suburban,10,0.294117647058824
Wilmington,DE_Forest_Wilmington_20_12_2020,2020,39.8013,-75.5962,2020-08-31,2020-10-15,45,Forest,Suburban,11,0.244444444444444
Wilmington,DE_Forest_Wilmington_20_13_2020,2020,39.7719,-75.5667,2020-08-21,2020-10-04,44,Forest,Suburban,18,0.409090909090909
Wilmington,DE_Forest_Wilmington_20_14_2020,2020,39.6417,-75.6774,2020-08-30,2020-10-17,48,Forest,Suburban,12,0.25
Wilmington,DE_Forest_Wilmington_21_loc_01_2021,2021,39.735692,-75.581121,2021-08-27,2021-10-01,35,Forest,Suburban,6,0.17142857142857101
Wilmington,DE_Forest_Wilmington_21_loc_02_2021,2021,39.695364,-75.592477,2021-08-27,2021-10-01,35,Forest,Suburban,2,0.0571428571428571
Wilmington,DE_Forest_Wilmington_21_loc_03 08/31/2021_2021,2021,39.6788439,-75.6362474,2021-08-31,2021-09-26,26,Forest,Suburban,1,0.0384615384615385
Wilmington,DE_Forest_Wilmington_21_loc_04 09/07/2021_2021,2021,39.8120068,-75.6463103,2021-09-07,2021-09-27,20,Forest,Suburban,2,0.1
Wilmington,DE_Forest_Wilmington_21_loc_05 08/31/2021_2021,2021,39.800178,-75.662893,2021-08-31,2021-09-27,27,Forest,Suburban,4,0.148148148148148
Wilmington,DE_Forest_Wilmington_21_loc_06 08/31/2021_2021,2021,39.8284669,-75.608456,2021-08-31,2021-09-26,26,Forest,Suburban,2,0.0769230769230769
Wilmington,DE_Forest_Wilmington_21_loc_07_2021,2021,39.6119355,-75.7294645,2021-08-31,2021-09-30,30,Forest,Suburban,2,0.0666666666666667
Wilmington,DE_Forest_Wilmington_21_loc_08 08/31/2021_2021,2021,39.661908,-75.682552,2021-08-31,2021-09-30,30,Forest,Suburban,2,0.0666666666666667
Wilmington,DE_Forest_Wilmington_21_loc_09_2021,2021,39.6361069,-75.688998,2021-08-31,2021-09-08,8,Forest,Suburban,NA,NA
Wilmington,DE_Forest_Wilmington_21_loc_10_2021,2021,39.759541,-75.516994,2021-08-27,2021-10-01,35,Forest,Suburban,3,0.0857142857142857
Wilmington,DE_Forest_Wilmington_21_loc_11 08/31/2021_2021,2021,39.618709,-75.739168,2021-08-31,2021-09-30,30,Forest,Suburban,1,0.0333333333333333
Wilmington,DE_Forest_Wilmington_21_loc_12_2021,2021,39.8013499,-75.5961571,2021-09-15,2021-10-16,31,Forest,Suburban,2,0.0645161290322581
Wilmington,DE_Forest_Wilmington_21_loc_13 08/27/2021_2021,2021,39.7694579,-75.5582128,2021-08-27,2021-09-25,29,Forest,Suburban,14,0.482758620689655
Wilmington,DE_Forest_Wilmington_21_loc_14_2021,2021,39.641657,-75.677431,2021-08-31,2021-09-01,1,Forest,Suburban,1,1
Wilmington,DE_Forest_Wilmington_21_loc_15_2021,2021,39.650774,-75.674365,2021-09-02,2021-09-21,19,Forest,Suburban,1,0.0526315789473684
Wilmington,DE_Forest_Wilmington_21_loc_16_2021,2021,39.729056,-75.7669806,2021-08-29,2021-09-15,17,Forest,Suburban,0,0
Wilmington,DE_Forest_Wilmington_21_loc_17_2021,2021,39.800547,-75.5791089,2021-09-01,2021-09-18,17,Forest,Suburban,2,0.117647058823529
Wilmington,DE_Forest_Wilmington_2_2019,2019,39.69569,-75.59247,2019-08-28,2019-09-20,23,Forest,Suburban,2,0.0869565217391304
Wilmington,DE_Forest_Wilmington_3_2019,2019,39.67897,-75.63591,2019-09-05,2019-10-15,40,Forest,Suburban,5,0.125
Wilmington,DE_Forest_Wilmington_4_2019,2019,39.81224,-75.64624,2019-09-04,2019-10-11,37,Forest,Suburban,4,0.108108108108108
Wilmington,DE_Forest_Wilmington_5_2019,2019,39.79695,-75.65637,2019-09-03,2019-10-10,37,Forest,Suburban,17,0.45945945945946
Wilmington,DE_Forest_Wilmington_6_2019,2019,39.82279,-75.61494,2019-08-30,2019-10-01,32,Forest,Suburban,4,0.125
Wilmington,DE_Forest_Wilmington_7_2019,2019,39.61318,-75.72986,2019-08-27,2019-10-09,43,Forest,Suburban,4,0.0930232558139535
Wilmington,DE_Forest_Wilmington_8_2019,2019,39.66203,-75.68302,2019-08-28,2019-10-11,44,Forest,Suburban,3,0.0681818181818182
Wilmington,DE_Forest_Wilmington_9_2019,2019,39.63511,-75.68611,2019-08-27,2019-10-11,45,Forest,Suburban,3,0.0666666666666667
SUCP,DavidRodgersParkSS1_04OCT23-08NOV23_2023,2023,47.64473,-122.3583,2023-10-04,2023-11-08,35,Forest,Urban,7,0.2
SUCP,DavidRodgersParkSS1_05SEP23-04OCT23_2023,2023,47.64473,-122.3583,2023-09-05,2023-10-04,29,Forest,Urban,4,0.137931034482759
Wasatch,Days Fork Trail.USA.2020_2020,2020,40.66034,-111.62922,2020-09-03,2020-10-02,29,Forest,Wild,8,0.275862068965517
StLawrence,Deployment 2_2021,2021,44.3596717,-75.0954946,2021-08-20,2021-10-27,68,Forest,Wild,1,0.0147058823529412
Wasatch,Desolation Wasatch.USA.2020_2020,2020,40.67523,-111.7233,2020-09-03,2020-10-04,31,Forest,Wild,61,1.96774193548387
SUCP,DiscoveryParkSS1_01OCT23 - 05NOV23_2023,2023,47.660738,-122.422645,2023-10-01,2023-11-05,35,Forest,Urban,2,0.0571428571428571
SUCP,DiscoveryParkSS1_02SEP23-01OCT23_2023,2023,47.660738,-122.422645,2023-09-02,2023-10-01,29,Forest,Urban,2,0.0689655172413793
CoG,FL_Anthropogenic_COG26_2023,2023,29.68021,-82.34227,2023-08-22,2023-11-17,87,Forest,Urban,4,0.0459770114942529
CoG,FL_Anthropogenic_CoG_ALC70_2023,2023,29.62068,-82.40793,2023-10-05,2023-11-09,35,Forest,Urban,1,0.0285714285714286
CoG,FL_Anthropogenic_CoG_ALC71_2023,2023,29.62033,-82.41846,2023-10-05,2023-11-17,43,Forest,Urban,3,0.0697674418604651
CoG,FL_Anthropogenic_CoG_ALC72_2023,2023,29.62246,-82.39902,2023-10-05,2023-11-17,43,Forest,Urban,6,0.13953488372093
CoG,FL_Anthropogenic_CoG_COG31_2023,2023,29.66707698,-82.34839403,2023-08-22,2023-11-17,87,Forest,Urban,2,0.0229885057471264
CoG,FL_Anthropogenic_CoG_COG32_2023,2023,29.67179398,-82.34554703,2023-08-22,2023-11-17,87,Forest,Urban,57,0.655172413793103
CoG,FL_Anthropogenic_CoG_COG4.2_2023,2023,29.650814,-82.39959,2023-10-17,2023-11-13,27,Forest,Urban,8,0.296296296296296
CoG,FL_Anthropogenic_CoG_PRIV6_2023,2023,29.67923,-82.37891,2023-08-22,2023-11-15,85,Forest,Urban,8,0.0941176470588235
CoG,FL_Anthropogenic_CoG_PRIV7_2023,2023,29.67435,-82.3736,2023-08-22,2023-11-03,73,Forest,Urban,2,0.0273972602739726
CoG,FL_Anthropogenic_CoG_UF10.1_2023,2023,29.637249,-82.355315,2023-09-01,2023-10-12,41,Forest,Urban,2,0.048780487804878
CoG,FL_Anthropogenic_CoG_UF10.2_2023,2023,29.637249,-82.355315,2023-10-17,2023-11-06,20,Forest,Urban,2,0.1
CoG,FL_Anthropogenic_CoG_UF11_2023,2023,29.629311,-82.35249,2023-09-01,2023-11-04,64,Forest,Urban,4,0.0625
CoG,FL_Anthropogenic_CoG_UF4.2_2023,2023,29.653351,-82.357318,2023-10-17,2023-11-04,18,Forest,Urban,4,0.222222222222222
CoG,FL_Anthropogenic_CoG_UF5_2023,2023,29.623809,-82.351561,2023-09-01,2023-11-01,61,Forest,Urban,2,0.0327868852459016
CoG,FL_Anthropogenic_CoG_UF6_2023,2023,29.629406,-82.345057,2023-09-01,2023-11-04,64,Forest,Urban,267,4.171875
CoG,FL_Anthropogenic_CoG_UF7.2_2023,2023,29.641778,-82.363231,2023-10-17,2023-11-06,20,Forest,Urban,4,0.2
CoG,FL_Anthropogenic_CoG_UF8.1_2023,2023,29.643121,-82.35589,2023-09-01,2023-10-12,41,Forest,Urban,15,0.365853658536585
CoG,FL_Anthropogenic_CoG_UF8.2_2023,2023,29.643121,-82.35589,2023-10-17,2023-11-06,20,Forest,Urban,32,1.6
CoG,FL_Anthropogenic_Urban_COG1.2_2023,2023,29.652872,-82.388082,2023-10-11,2023-11-13,33,Forest,Urban,5,0.151515151515152
CoG,FL_Anthropogenic_Urban_COG10_2023,2023,29.696398,-82.380733,2023-09-01,2023-10-27,56,Forest,Urban,4,0.0714285714285714
CoG,FL_Anthropogenic_Urban_COG11_2023,2023,29.720303,-82.38598,2023-09-01,2023-10-27,56,Forest,Urban,2,0.0357142857142857
CoG,FL_Anthropogenic_Urban_COG17.2_2023,2023,29.661966,-82.395144,2023-10-17,2023-11-05,19,Forest,Urban,9,0.473684210526316
CoG,FL_Anthropogenic_Urban_COG17_1_2023,2023,29.661966,-82.395144,2023-08-28,2023-10-17,50,Forest,Urban,40,0.8
CoG,FL_Anthropogenic_Urban_COG1_1_2023,2023,29.652872,-82.388082,2023-08-28,2023-10-11,44,Forest,Urban,2,0.0454545454545455
CoG,FL_Anthropogenic_Urban_COG2.2_2023,2023,29.645074,-82.378354,2023-10-11,2023-11-16,36,Forest,Urban,9,0.25
CoG,FL_Anthropogenic_Urban_COG21.2_2023,2023,29.66040197,-82.36591598,2023-10-11,2023-11-09,29,Forest,Urban,13,0.448275862068966
CoG,FL_Anthropogenic_Urban_COG21_1_2023,2023,29.66040197,-82.36591598,2023-08-22,2023-10-11,50,Forest,Urban,19,0.38
CoG,FL_Anthropogenic_Urban_COG22.2_2023,2023,29.65793903,-82.36113201,2023-10-11,2023-11-16,36,Forest,Urban,3,0.0833333333333333
CoG,FL_Anthropogenic_Urban_COG22_1_2023,2023,29.65793903,-82.36113201,2023-08-22,2023-09-21,30,Forest,Urban,1,0.0333333333333333
CoG,FL_Anthropogenic_Urban_COG23.2_2023,2023,29.66268,-82.35723501,2023-10-11,2023-11-16,36,Forest,Urban,4,0.111111111111111
CoG,FL_Anthropogenic_Urban_COG23_1_2023,2023,29.66268,-82.35723501,2023-08-22,2023-10-11,50,Forest,Urban,4,0.08
CoG,FL_Anthropogenic_Urban_COG24.2_2023,2023,29.66528803,-82.36298399,2023-10-11,2023-11-16,36,Forest,Urban,6,0.166666666666667
CoG,FL_Anthropogenic_Urban_COG24_1_2023,2023,29.66528803,-82.36298399,2023-08-22,2023-10-11,50,Forest,Urban,2,0.04
CoG,FL_Anthropogenic_Urban_COG25_1_2023,2023,29.65526797,-82.37047297,2023-08-22,2023-09-03,12,Forest,Urban,1,0.0833333333333333
CoG,FL_Anthropogenic_Urban_COG27_2023,2023,29.63321996,-82.39359998,2023-08-28,2023-11-13,77,Forest,Urban,1,0.012987012987013
CoG,FL_Anthropogenic_Urban_COG28_2023,2023,29.63859703,-82.39404598,2023-08-28,2023-11-13,77,Forest,Urban,5,0.0649350649350649
CoG,FL_Anthropogenic_Urban_COG29.2_2023,2023,29.61321504,-82.40419496,2023-10-05,2023-11-17,43,Forest,Urban,2,0.0465116279069767
CoG,FL_Anthropogenic_Urban_COG2_1_2023,2023,29.645074,-82.378354,2023-08-28,2023-09-11,14,Forest,Urban,1,0.0714285714285714
CoG,FL_Anthropogenic_Urban_COG3.2_2023,2023,29.645281,-82.389872,2023-10-11,2023-10-20,9,Forest,Urban,1,0.111111111111111
CoG,FL_Anthropogenic_Urban_COG33_2023,2023,29.63772699,-82.40218397,2023-08-28,2023-11-01,65,Forest,Urban,2,0.0307692307692308
CoG,FL_Anthropogenic_Urban_COG34_2023,2023,29.63227398,-82.398924,2023-08-28,2023-11-01,65,Forest,Urban,2,0.0307692307692308
CoG,FL_Anthropogenic_Urban_COG35_2023,2023,29.63166302,-82.40699099,2023-08-28,2023-08-29,1,Forest,Urban,1,1
CoG,FL_Anthropogenic_Urban_COG36_2023,2023,29.63162304,-82.41289797,2023-08-28,2023-11-01,65,Forest,Urban,2,0.0307692307692308
CoG,FL_Anthropogenic_Urban_COG37_2023,2023,29.63661304,-82.409077,2023-08-28,2023-09-12,15,Forest,Urban,3,0.2
CoG,FL_Anthropogenic_Urban_COG38_2023,2023,29.70175099,-82.34611298,2023-08-22,2023-11-05,75,Forest,Urban,3,0.04
CoG,FL_Anthropogenic_Urban_COG39_2023,2023,29.69616503,-82.34143102,2023-08-22,2023-10-06,45,Forest,Urban,3,0.0666666666666667
CoG,FL_Anthropogenic_Urban_COG3_1_2023,2023,29.645281,-82.389872,2023-08-28,2023-10-11,44,Forest,Urban,2,0.0454545454545455
CoG,FL_Anthropogenic_Urban_COG4_1_2023,2023,29.650814,-82.39959,2023-08-28,2023-10-17,50,Forest,Urban,11,0.22
CoG,FL_Anthropogenic_Urban_COG5_2023,2023,29.701753,-82.381799,2023-09-01,2023-10-27,56,Forest,Urban,12,0.214285714285714
CoG,FL_Anthropogenic_Urban_COG7_2023,2023,29.716225,-82.393619,2023-09-01,2023-10-27,56,Forest,Urban,64,1.14285714285714
CoG,FL_Anthropogenic_Urban_COG8_2023,2023,29.709549,-82.391909,2023-09-01,2023-10-27,56,Forest,Urban,2,0.0357142857142857
CoG,FL_Anthropogenic_Urban_CofGNV24.2_2023,2023,29.66528803,-82.36298399,2023-10-11,2023-11-16,36,Forest,Urban,6,0.166666666666667
CoG,FL_Anthropogenic_Urban_UF4.1_2023,2023,29.653351,-82.357318,2023-09-01,2023-10-04,33,Forest,Urban,9,0.272727272727273
CoG,FL_Anthropogenic_Urban_UF7.1_2023,2023,29.641778,-82.363231,2023-09-01,2023-10-12,41,Forest,Urban,10,0.24390243902439
DeLuca,FL_DeLuca_007 09/14/2023_2023,2023,27.692842,-80.959044,2023-09-14,2023-11-07,54,Grassland,Rural,4,0.0740740740740741
DeLuca,FL_DeLuca_010 09/13/2023_2023,2023,27.691832,-80.926317,2023-09-13,2023-10-31,48,Grassland,Rural,4,0.0833333333333333
DeLuca,FL_DeLuca_011 09/13/2023_2023,2023,27.691312,-80.91473,2023-09-13,2023-10-31,48,Grassland,Rural,17,0.354166666666667
DeLuca,FL_DeLuca_012 09/13/2023_2023,2023,27.691787,-80.90498,2023-09-13,2023-10-31,48,Grassland,Rural,6,0.125
DeLuca,FL_DeLuca_019 09/13/2023_2023,2023,27.681365,-80.95542,2023-09-14,2023-10-31,47,Grassland,Rural,7,0.148936170212766
DeLuca,FL_DeLuca_022 09/13/2023_2023,2023,27.682748,-80.936905,2023-09-13,2023-10-31,48,Grassland,Rural,6,0.125
DeLuca,FL_DeLuca_023 09/13/2023_2023,2023,27.682632,-80.916362,2023-09-13,2023-10-31,48,Grassland,Rural,27,0.5625
DeLuca,FL_DeLuca_024 09/13/2023_2023,2023,27.682175,-80.907717,2023-09-13,2023-10-31,48,Grassland,Rural,4,0.0833333333333333
DeLuca,FL_DeLuca_033 09/13/2023_2023,2023,27.673803,-80.936758,2023-09-13,2023-10-31,48,Grassland,Rural,35,0.729166666666667
DeLuca,FL_DeLuca_034 09/13/2023_2023,2023,27.673449,-80.926595,2023-09-13,2023-10-31,48,Grassland,Rural,8,0.166666666666667
DeLuca,FL_DeLuca_035 09/13/2023_2023,2023,27.673453,-80.916059,2023-09-13,2023-10-31,48,Grassland,Rural,10,0.208333333333333
DeLuca,FL_DeLuca_036 09/14/2023_2023,2023,27.673592,-80.904616,2023-09-14,2023-10-31,47,Grassland,Rural,4,0.0851063829787234
DeLuca,FL_DeLuca_046 09/14/2023_2023,2023,27.66432,-80.92826,2023-09-14,2023-10-31,47,Grassland,Rural,10,0.212765957446809
DeLuca,FL_DeLuca_047 09/14/2023_2023,2023,27.664506,-80.916378,2023-09-14,2023-10-31,47,Grassland,Rural,4,0.0851063829787234
DeLuca,FL_Deluca_Preserve_21_D2_2021,2021,27.644475,-80.883045,2021-10-13,2021-10-27,14,Grassland,Rural,1,0.0714285714285714
DeLuca,FL_Deluca_Preserve_21_loc10 10/13/2021_2021,2021,27.65699,-80.888729,2021-10-13,2021-11-03,21,Grassland,Rural,1,0.0476190476190476
DeLuca,FL_Deluca_Preserve_21_loc11 10/13/2021_2021,2021,27.650081,-80.89074,2021-10-13,2021-10-17,4,Grassland,Rural,1,0.25
DeLuca,FL_Deluca_Preserve_21_loc12 10/13/2021_2021,2021,27.650474,-80.892335,2021-10-13,2021-10-14,1,Grassland,Rural,NA,NA
DeLuca,FL_Deluca_Preserve_21_loc13 10/13/2021_2021,2021,27.650936,-80.896542,2021-10-13,2021-11-04,22,Grassland,Rural,1,0.0454545454545455
DeLuca,FL_Deluca_Preserve_21_loc14 10/13/2021_2021,2021,27.659076,-80.892032,2021-10-13,2021-11-05,23,Grassland,Rural,0,0
DeLuca,FL_Deluca_Preserve_21_loc15 10/13/2021_2021,2021,27.661342,-80.893189,2021-10-13,2021-11-05,23,Grassland,Rural,1,0.0434782608695652
DeLuca,FL_Deluca_Preserve_21_loc16 10/13/2021_2021,2021,27.663402,-80.88989,2021-10-13,2021-10-30,17,Grassland,Rural,0,0
DeLuca,FL_Deluca_Preserve_21_loc17 10/14/2021_2021,2021,27.662605,-80.896296,2021-10-14,2021-11-05,22,Grassland,Rural,2,0.0909090909090909
DeLuca,FL_Deluca_Preserve_21_loc18 10/14/2021_2021,2021,27.664889,-80.899406,2021-10-14,2021-10-29,15,Grassland,Rural,1,0.0666666666666667
DeLuca,FL_Deluca_Preserve_21_loc19 10/14/2021_2021,2021,27.668482,-80.902831,2021-10-14,2021-11-05,22,Grassland,Rural,1,0.0454545454545455
DeLuca,FL_Deluca_Preserve_21_loc1_2021,2021,27.644603,-80.885518,2021-10-13,2021-10-18,5,Grassland,Rural,1,0.2
DeLuca,FL_Deluca_Preserve_21_loc20 10/14/2021_2021,2021,27.665045,-80.913463,2021-10-14,2021-11-05,22,Grassland,Rural,1,0.0454545454545455
DeLuca,FL_Deluca_Preserve_21_loc21 10/14/2021_2021,2021,27.661777,-80.915213,2021-10-14,2021-10-27,13,Grassland,Rural,1,0.0769230769230769
DeLuca,FL_Deluca_Preserve_21_loc22 10/14/2021_2021,2021,27.660324,-80.925047,2021-10-14,2021-10-17,3,Grassland,Rural,1,0.333333333333333
DeLuca,FL_Deluca_Preserve_21_loc23 10/14/2021_2021,2021,27.659793,-80.927532,2021-10-14,2021-10-29,15,Grassland,Rural,0,0
DeLuca,FL_Deluca_Preserve_21_loc24 10/14/2021_2021,2021,27.648461,-80.929025,2021-10-14,2021-11-03,20,Grassland,Rural,1,0.05
DeLuca,FL_Deluca_Preserve_21_loc25 10/14/2021_2021,2021,27.658339,-80.929017,2021-10-14,2021-11-05,22,Grassland,Rural,1,0.0454545454545455
DeLuca,FL_Deluca_Preserve_21_loc26 10/14/2021_2021,2021,27.672647,-80.905917,2021-10-14,2021-11-05,22,Grassland,Rural,1,0.0454545454545455
DeLuca,FL_Deluca_Preserve_21_loc27 10/14/2021_2021,2021,27.674289,-80.909373,2021-10-14,2021-11-05,22,Grassland,Rural,2,0.0909090909090909
DeLuca,FL_Deluca_Preserve_21_loc28 10/14/2021_2021,2021,27.676366,-80.912259,2021-10-14,2021-11-05,22,Grassland,Rural,1,0.0454545454545455
DeLuca,FL_Deluca_Preserve_21_loc29 10/14/2021_2021,2021,27.680225,-80.912544,2021-10-14,2021-10-16,2,Grassland,Rural,1,0.5
DeLuca,FL_Deluca_Preserve_21_loc30 10/14/2021_2021,2021,27.683025,-80.911052,2021-10-14,2021-11-05,22,Grassland,Rural,1,0.0454545454545455
DeLuca,FL_Deluca_Preserve_21_loc4 10/13/2021_2021,2021,27.650268,-80.88295,2021-10-13,2021-10-19,6,Grassland,Rural,1,0.166666666666667
DeLuca,FL_Deluca_Preserve_21_loc5 10/13/2021_2021,2021,27.652027,-80.885932,2021-10-13,2021-10-30,17,Grassland,Rural,1,0.0588235294117647
DeLuca,FL_Deluca_Preserve_21_loc6 10/13/2021_2021,2021,27.652474,-80.88377,2021-10-13,2021-11-05,23,Grassland,Rural,1,0.0434782608695652
DeLuca,FL_Deluca_Preserve_21_loc7 10/13/2021_2021,2021,27.653991,-80.888377,2021-10-13,2021-11-03,21,Grassland,Rural,1,0.0476190476190476
DeLuca,FL_Deluca_Preserve_21_loc8 10/13/2021_2021,2021,27.655173,-80.886791,2021-10-13,2021-10-21,8,Grassland,Rural,1,0.125
DeLuca,FL_Deluca_Preserve_21_loc9 10/13/2021_2021,2021,27.655615,-80.889861,2021-10-13,2021-11-04,22,Grassland,Rural,1,0.0454545454545455
DeLuca,FL_Deluca_Preserve_loc3 10/13/2021_2021,2021,27.649218,-80.884913,2021-10-13,2021-10-18,5,Grassland,Rural,1,0.2
Alto,FL_Forest_Alto_ALC38_2022,2022,29.792976,-82.137032,2022-09-01,2022-10-04,33,Forest,Rural,2,0.0606060606060606
Alto,FL_Forest_Alto_ALC39_2022,2022,29.786677,-82.138056,2022-09-01,2022-10-16,45,Forest,Rural,6,0.133333333333333
Alto,FL_Forest_Alto_ALC40_2022,2022,29.790745,-82.130831,2022-09-01,2022-10-22,51,Forest,Rural,3,0.0588235294117647
Alto,FL_Forest_Alto_ALC41_2022,2022,29.77933296,-82.13741197,2022-09-01,2022-10-16,45,Forest,Rural,2,0.0444444444444444
Alto,FL_Forest_Alto_ALC47_2022,2022,29.774968,-82.12664198,2022-09-01,2022-09-07,6,Forest,Rural,1,0.166666666666667
Alto,FL_Forest_Alto_ALC48_2022,2022,29.76781396,-82.11928904,2022-09-02,2022-10-22,50,Forest,Rural,4,0.08
Alto,FL_Forest_Alto_ALC49_2022,2022,29.78263602,-82.13394899,2022-09-01,2022-10-16,45,Forest,Rural,4,0.0888888888888889
Alto,FL_Forest_Alto_ALC51_2022,2022,29.76966,-82.12843,2022-09-01,2022-10-22,51,Forest,Rural,4,0.0784313725490196
Alto,FL_Forest_Alto_ALC59_2022,2022,29.78824,-82.1202,2022-09-06,2022-10-30,54,Forest,Rural,4,0.0740740740740741
Alto,FL_Forest_Alto_ALC60_2022,2022,29.79126,-82.12541,2022-09-06,2022-10-30,54,Forest,Rural,3,0.0555555555555556
Alto,FL_Forest_Alto_ALC61_2022,2022,29.78461,-82.12613,2022-09-06,2022-10-30,54,Forest,Rural,4,0.0740740740740741
Alto,FL_Forest_Alto_ALC62_2022,2022,29.78209,-82.1294,2022-09-06,2022-10-30,54,Forest,Rural,6,0.111111111111111
Alto,FL_Forest_Alto_ALC63_2022,2022,29.78014,-82.12484,2022-09-06,2022-10-30,54,Forest,Rural,5,0.0925925925925926
Alto,FL_Forest_Alto_ALC64_2022,2022,29.79247,-82.15119,2022-09-06,2022-10-30,54,Forest,Rural,2,0.037037037037037
Alto,FL_Forest_Alto_ALC65_2022,2022,29.7939,-82.15908,2022-09-06,2022-10-06,30,Forest,Rural,1,0.0333333333333333
Alto,FL_Forest_Alto_ALC66_2022,2022,29.79162,-82.16362,2022-09-06,2022-10-30,54,Forest,Rural,4,0.0740740740740741
Balu,FL_Forest_Balu_ALC20_2022,2022,29.717978,-82.159761,2022-08-31,2022-10-20,50,Forest,Rural,15,0.3
Balu,FL_Forest_Balu_ALC21_2022,2022,29.72602,-82.158256,2022-08-30,2022-10-25,56,Forest,Rural,5,0.0892857142857143
Balu,FL_Forest_Balu_ALC22_2022,2022,29.734068,-82.161045,2022-09-05,2022-10-07,32,Forest,Rural,0,0
Balu,FL_Forest_Balu_ALC23_2022,2022,29.723227,-82.168051,2022-09-02,2022-10-26,54,Forest,Rural,4,0.0740740740740741
Balu,FL_Forest_Balu_ALC24_2022,2022,29.730607,-82.171538,2022-09-02,2022-09-12,10,Forest,Rural,1,0.1
Balu,FL_Forest_Balu_ALC25_2022,2022,29.725992,-82.148683,2022-09-01,2022-10-25,54,Forest,Rural,4,0.0740740740740741
Balu,FL_Forest_Balu_ALC26_2022,2022,29.732465,-82.1479,2022-09-03,2022-10-18,45,Forest,Rural,0,0
Balu,FL_Forest_Balu_ALC27_2022,2022,29.738378,-82.153434,2022-08-31,2022-10-26,56,Forest,Rural,2,0.0357142857142857
Balu,FL_Forest_Balu_ALC29_2022,2022,29.710541,-82.158904,2022-09-01,2022-10-25,54,Forest,Rural,3,0.0555555555555556
Balu,FL_Forest_Balu_ALC30_2022,2022,29.71712,-82.15187,2022-09-01,2022-09-24,23,Forest,Rural,1,0.0434782608695652
Balu,FL_Forest_Balu_ALC52_2022,2022,29.71401,-82.16905,2022-09-01,2022-10-24,53,Forest,Rural,2,0.0377358490566038
Balu,FL_Forest_Balu_ALC53_2022,2022,29.71328,-82.17905,2022-09-01,2022-09-13,12,Forest,Rural,5,0.416666666666667
Balu,FL_Forest_Balu_ALC54_2022,2022,29.70746,-82.18738,2022-09-01,2022-10-24,53,Forest,Rural,4,0.0754716981132075
Balu,FL_Forest_Balu_ALC55_2022,2022,29.70826,-82.17524,2022-09-01,2022-10-24,53,Forest,Rural,2,0.0377358490566038
Balu,FL_Forest_Balu_ALC56_2022,2022,29.71562,-82.18584,2022-09-01,2022-10-22,51,Forest,Rural,4,0.0784313725490196
Balu,FL_Forest_Balu_ALC57_2022,2022,29.70248,-82.18218,2022-09-01,2022-10-22,51,Forest,Rural,3,0.0588235294117647
Balu,FL_Forest_Balu_ALC58_2022,2022,29.69739,-82.18719,2022-09-01,2022-10-22,51,Forest,Rural,2,0.0392156862745098
CrocLake,FL_Forest_CrocLake_22_10_Keystone_2022,2022,25.1935883,-80.3601937,2022-09-01,2022-10-21,50,Forest,Wild,42,0.84
CrocLake,FL_Forest_CrocLake_22_11_Valois_2022,2022,25.193339,-80.351218,2022-08-30,2022-10-31,62,Forest,Wild,6,0.0967741935483871
CrocLake,FL_Forest_CrocLake_22_12_Banyan_2022,2022,25.1959668,-80.3526778,2022-09-01,2022-10-03,32,Forest,Wild,29,0.90625
CrocLake,FL_Forest_CrocLake_22_12_Banyan_2_2022,2022,25.1959668,-80.3526778,2022-10-11,2022-10-31,20,Forest,Wild,10,0.5
CrocLake,FL_Forest_CrocLake_22_13_Harrison_2022,2022,25.226028,-80.3321075,2022-09-01,2022-10-31,60,Forest,Wild,45,0.75
CrocLake,FL_Forest_CrocLake_22_14_Car_Dump_2022,2022,25.2576796,-80.3131468,2022-09-01,2022-10-31,60,Forest,Wild,77,1.28333333333333
CrocLake,FL_Forest_CrocLake_22_15_Blues_2022,2022,25.230661,-80.327808,2022-09-01,2022-10-31,60,Forest,Wild,41,0.683333333333333
CrocLake,FL_Forest_CrocLake_22_15_Blues_2_2022,2022,25.230661,-80.327808,2022-10-11,2022-10-21,10,Forest,Wild,8,0.8
CrocLake,FL_Forest_CrocLake_22_16_Mile_6_2022,2022,25.242032,-80.321289,2022-09-07,2022-10-31,54,Forest,Wild,7,0.12962962962963
CrocLake,FL_Forest_CrocLake_22_17_Hidden_Rock_2022,2022,25.251452,-80.31647,2022-09-01,2022-10-31,60,Forest,Wild,2,0.0333333333333333
CrocLake,FL_Forest_CrocLake_22_18_Carysfort_2022,2022,25.256454,-80.313962,2022-09-02,2022-11-08,67,Forest,Wild,10,0.149253731343284
CrocLake,FL_Forest_CrocLake_22_19_Nike_2022,2022,25.2621191,-80.3117014,2022-09-01,2022-10-31,60,Forest,Wild,214,3.56666666666667
CrocLake,FL_Forest_CrocLake_22_1_Gas_Station_2022,2022,25.172142,-80.373073,2022-08-30,2022-10-24,55,Forest,Wild,27,0.490909090909091
CrocLake,FL_Forest_CrocLake_22_20_Nike_back_2022,2022,25.26269444,-80.31438889,2022-09-01,2022-10-31,60,Forest,Wild,45,0.75
CrocLake,FL_Forest_CrocLake_22_21_Cockfighting_2022,2022,25.2657559,-80.3092578,2022-09-01,2022-10-31,60,Forest,Wild,34,0.566666666666667
CrocLake,FL_Forest_CrocLake_22_22_Beeyard_2022,2022,25.2693034,-80.307033,2022-09-01,2022-10-31,60,Forest,Wild,7,0.116666666666667
CrocLake,FL_Forest_CrocLake_22_23_Radar_Line_2022,2022,25.2746372,-80.3044403,2022-09-01,2022-10-31,60,Forest,Wild,2,0.0333333333333333
CrocLake,FL_Forest_CrocLake_22_24_Skeet_Range_2022,2022,25.2930523,-80.2935182,2022-08-29,2022-10-31,63,Forest,Wild,38,0.603174603174603
CrocLake,FL_Forest_CrocLake_22_25_Pole_6_2022,2022,25.2892651,-80.3041781,2022-09-01,2022-10-31,60,Forest,Wild,2,0.0333333333333333
CrocLake,FL_Forest_CrocLake_22_26_Dis_West_2022,2022,25.3039681,-80.2950245,2022-09-07,2022-10-31,54,Forest,Wild,27,0.5
CrocLake,FL_Forest_CrocLake_22_2_Intus_2022,2022,25.1738324,-80.3735248,2022-09-01,2022-10-31,60,Forest,Wild,98,1.63333333333333
CrocLake,FL_Forest_CrocLake_22_3_Drift_Fence_2022,2022,25.1738902,-80.372444,2022-09-01,2022-10-31,60,Forest,Wild,5,0.0833333333333333
CrocLake,FL_Forest_CrocLake_22_4_Heliport_2022,2022,25.1750536,-80.3718812,2022-09-01,2022-10-31,60,Forest,Wild,71,1.18333333333333
CrocLake,FL_Forest_CrocLake_22_5_Boat_Basin_2022,2022,25.1768963,-80.398573,2022-09-01,2022-10-31,60,Forest,Wild,49,0.816666666666667
CrocLake,FL_Forest_CrocLake_22_6_Retention_Pond_2022,2022,25.180038,-80.367773,2022-09-01,2022-10-24,53,Forest,Wild,30,0.566037735849057
CrocLake,FL_Forest_CrocLake_22_7_HQ1_2022,2022,25.19188333,-80.35676667,2022-08-30,2022-10-29,60,Forest,Wild,20,0.333333333333333
CrocLake,FL_Forest_CrocLake_22_8_HQ2_2022,2022,25.1924162,-80.3564482,2022-09-01,2022-10-31,60,Forest,Wild,10,0.166666666666667
CrocLake,FL_Forest_CrocLake_22_9_HQ3_2022,2022,25.19238333,-80.35575,2022-08-30,2022-10-31,62,Forest,Wild,11,0.17741935483871
DeLuca,FL_Forest_DeLuca_007 09/01/2022_2022,2022,27.692842,-80.959044,2022-08-31,2022-10-31,61,Grassland,Rural,1,0.0163934426229508
DeLuca,FL_Forest_DeLuca_010 09/01/2022_2022,2022,27.691832,-80.926317,2022-08-30,2022-11-01,63,Grassland,Rural,5,0.0793650793650794
DeLuca,FL_Forest_DeLuca_011 09/01/2022_2022,2022,27.691312,-80.91473,2022-08-30,2022-11-01,63,Grassland,Rural,18,0.285714285714286
DeLuca,FL_Forest_DeLuca_012 09/01/2022_2022,2022,27.691787,-80.90498,2022-08-30,2022-11-01,63,Grassland,Rural,17,0.26984126984127
DeLuca,FL_Forest_DeLuca_019 09/01/2022_2022,2022,27.681365,-80.95542,2022-08-30,2022-10-31,62,Grassland,Rural,9,0.145161290322581
DeLuca,FL_Forest_DeLuca_022 09/01/2022_2022,2022,27.682748,-80.936905,2022-08-30,2022-11-01,63,Grassland,Rural,5,0.0793650793650794
DeLuca,FL_Forest_DeLuca_023 09/01/2022_2022,2022,27.682632,-80.916362,2022-08-30,2022-10-31,62,Grassland,Rural,24,0.387096774193548
DeLuca,FL_Forest_DeLuca_034 09/01/2022_2022,2022,27.673449,-80.926595,2022-08-30,2022-11-01,63,Grassland,Rural,5,0.0793650793650794
DeLuca,FL_Forest_DeLuca_035 09/01/2022_2022,2022,27.673453,-80.916059,2022-08-30,2022-10-31,62,Grassland,Rural,5,0.0806451612903226
DeLuca,FL_Forest_DeLuca_036 09/01/2022_2022,2022,27.673592,-80.904616,2022-08-30,2022-11-01,63,Grassland,Rural,7,0.111111111111111
DeLuca,FL_Forest_DeLuca_047 09/01/2022_2022,2022,27.664506,-80.916378,2022-08-30,2022-10-31,62,Grassland,Rural,4,0.0645161290322581
DeLuca,FL_Forest_DeLuca_048 09/01/2022_2022,2022,27.664782,-80.90596,2022-08-30,2022-11-01,63,Grassland,Rural,6,0.0952380952380952
Ellington,FL_Forest_Ellington_RCREC_075 09/01/2023_2023,2023,27.40187,-81.9352188,2023-09-01,2023-10-31,60,Grassland,Rural,3,0.05
CrocLake,FL_Forest_Key_Largo_2019_10_2019,2019,25.2693,-80.307,2019-09-09,2019-11-04,56,Forest,Wild,21,0.375
CrocLake,FL_Forest_Key_Largo_2019_11_2019,2019,25.2307,-80.3278,2019-09-10,2019-11-04,55,Forest,Wild,13,0.236363636363636
CrocLake,FL_Forest_Key_Largo_2019_12_2019,2019,25.1769,-80.3699,2019-09-09,2019-11-04,56,Forest,Wild,14,0.25
CrocLake,FL_Forest_Key_Largo_2019_13_2019,2019,25.2576,-80.3131,2019-09-12,2019-11-04,53,Forest,Wild,16,0.30188679245283
CrocLake,FL_Forest_Key_Largo_2019_14_2019,2019,25.2658,-80.3093,2019-09-09,2019-11-04,56,Forest,Wild,11,0.196428571428571
CrocLake,FL_Forest_Key_Largo_2019_15_2019,2019,25.304,-80.295,2019-09-09,2019-11-04,56,Forest,Wild,5,0.0892857142857143
CrocLake,FL_Forest_Key_Largo_2019_17_2019,2019,25.2746,-80.3044,2019-09-14,2019-11-04,51,Forest,Wild,11,0.215686274509804
CrocLake,FL_Forest_Key_Largo_2019_18_2019,2019,25.180038,-80.367773,2019-09-10,2019-11-04,55,Forest,Wild,14,0.254545454545455
CrocLake,FL_Forest_Key_Largo_2019_19_2019,2019,25.2931,-80.2935,2019-09-09,2019-11-04,56,Forest,Wild,28,0.5
CrocLake,FL_Forest_Key_Largo_2019_1_2019,2019,25.19604,-80.35303,2019-09-10,2019-11-04,55,Forest,Wild,2,0.0363636363636364
CrocLake,FL_Forest_Key_Largo_2019_20_2019,2019,25.1933,-80.3512,2019-09-12,2019-11-04,53,Forest,Wild,5,0.0943396226415094
CrocLake,FL_Forest_Key_Largo_2019_21_2019,2019,25.2893,-80.3042,2019-09-09,2019-11-04,56,Forest,Wild,8,0.142857142857143
CrocLake,FL_Forest_Key_Largo_2019_2_2019,2019,25.1721,-80.3731,2019-09-09,2019-11-04,56,Forest,Wild,32,0.571428571428571
CrocLake,FL_Forest_Key_Largo_2019_4_2019,2019,25.1738,-80.3735,2019-09-09,2019-11-04,56,Forest,Wild,38,0.678571428571429
CrocLake,FL_Forest_Key_Largo_2019_8_2019,2019,25.1751,-80.3719,2019-09-12,2019-11-04,53,Forest,Wild,28,0.528301886792453
CrocLake,FL_Forest_Key_Largo_2020_10_Keystone_2020,2020,25.19358,-80.3547,2020-09-21,2020-10-31,40,Forest,Wild,30,0.75
CrocLake,FL_Forest_Key_Largo_2020_11_Valois_2020,2020,25.19334,-80.35122,2020-09-21,2020-10-31,40,Forest,Wild,2,0.05
CrocLake,FL_Forest_Key_Largo_2020_12_Banyan_2020,2020,25.19597,-80.35268,2020-09-22,2020-10-30,38,Forest,Wild,11,0.289473684210526
CrocLake,FL_Forest_Key_Largo_2020_13_Harrison_2020,2020,25.22603,-80.33211,2020-09-21,2020-10-31,40,Forest,Wild,15,0.375
CrocLake,FL_Forest_Key_Largo_2020_16_Mile_6_2020,2020,25.24203,-80.32129,2020-09-21,2020-10-28,37,Forest,Wild,5,0.135135135135135
CrocLake,FL_Forest_Key_Largo_2020_1_Retention_Pond_B_2020,2020,25.18004,-80.36777,2020-09-21,2020-10-31,40,Forest,Wild,1,0.025
CrocLake,FL_Forest_Key_Largo_2020_21_Cockfighting_2020,2020,25.26576,-80.30926,2020-09-23,2020-10-30,37,Forest,Wild,16,0.432432432432432
CrocLake,FL_Forest_Key_Largo_2020_22_Beeyard_2020,2020,25.2693,-80.30703,2020-09-22,2020-10-31,39,Forest,Wild,8,0.205128205128205
CrocLake,FL_Forest_Key_Largo_2020_23_Radar_Line_2020,2020,25.27464,-80.30444,2020-09-22,2020-10-31,39,Forest,Wild,5,0.128205128205128
CrocLake,FL_Forest_Key_Largo_2020_24_Skeet_Range_2020,2020,25.29305,-80.29352,2020-09-21,2020-10-26,35,Forest,Wild,31,0.885714285714286
CrocLake,FL_Forest_Key_Largo_2020_26_Dispatch_West_.5_2020,2020,25.30397,-80.29502,2020-09-22,2020-10-31,39,Forest,Wild,5,0.128205128205128
CrocLake,FL_Forest_Key_Largo_2020_3_Drift_Fence_2020,2020,25.17389,-80.37224,2020-09-21,2020-10-27,36,Forest,Wild,1,0.0277777777777778
CrocLake,FL_Forest_Key_Largo_2020_4_Heliport_2020,2020,25.17505,-80.37188,2020-09-24,2020-10-29,35,Forest,Wild,8,0.228571428571429
CrocLake,FL_Forest_Key_Largo_2020_5_Boat_Basin_2020,2020,25.1796,-80.36986,2020-09-22,2020-10-31,39,Forest,Wild,3,0.0769230769230769
CrocLake,FL_Forest_Key_Largo_2020_7_HQ_#1_2020,2020,25.19242,-80.35645,2020-09-22,2020-10-31,39,Forest,Wild,28,0.717948717948718
Melrose,FL_Forest_Melrose_10_2019,2019,29.6947,-81.97179,2019-09-25,2019-11-04,40,Forest,Wild,0,0
Melrose,FL_Forest_Melrose_11_2019,2019,29.69976,-81.99015,2019-09-26,2019-11-04,39,Forest,Wild,1,0.0256410256410256
Melrose,FL_Forest_Melrose_12_2019,2019,29.6996,-81.98692,2019-09-25,2019-11-04,40,Forest,Wild,1,0.025
Melrose,FL_Forest_Melrose_12_54/FL20_N26_2022,2022,26.699873,-81.968096,2022-10-05,2022-11-02,28,Forest,Wild,1,0.0357142857142857
Melrose,FL_Forest_Melrose_13_2019,2019,29.70594,-81.9674,2019-09-25,2019-11-04,40,Forest,Wild,3,0.075
Melrose,FL_Forest_Melrose_13_FL01/404_442_2022,2022,29.702658,-81.967254,2022-10-05,2022-11-02,28,Forest,Wild,0,0
Melrose,FL_Forest_Melrose_14_FL07/FL14_FL45_2022,2022,29.705924,-81.967401,2022-10-05,2022-11-02,28,Forest,Wild,14,0.5
Melrose,FL_Forest_Melrose_1_2019,2019,29.69489,-81.97547,2019-09-25,2019-11-04,40,Forest,Wild,1,0.025
Melrose,FL_Forest_Melrose_1_FL08/D3_N16_2022,2022,29.706962,-81.985413,2022-10-05,2022-11-02,28,Forest,Wild,4,0.142857142857143
Melrose,FL_Forest_Melrose_20_02_2020,2020,29.7039,-81.98953,2020-10-03,2020-11-01,29,Forest,Wild,5,0.172413793103448
Melrose,FL_Forest_Melrose_20_03_2020,2020,29.69976,-81.99015,2020-10-04,2020-11-01,28,Forest,Wild,1,0.0357142857142857
Melrose,FL_Forest_Melrose_20_04_2020,2020,29.70594,-81.9674,2020-10-03,2020-11-01,29,Forest,Wild,0,0
Melrose,FL_Forest_Melrose_20_05_2020,2020,29.70696,-81.98541,2020-10-03,2020-11-01,29,Forest,Wild,2,0.0689655172413793
Melrose,FL_Forest_Melrose_20_06_2020,2020,29.6947,-81.97179,2020-10-03,2020-11-01,29,Forest,Wild,1,0.0344827586206897
Melrose,FL_Forest_Melrose_20_08_2020,2020,29.69987,-81.96809,2020-10-03,2020-11-01,29,Forest,Wild,2,0.0689655172413793
Melrose,FL_Forest_Melrose_20_09_2020,2020,29.70266,-81.96725,2020-10-03,2020-11-01,29,Forest,Wild,2,0.0689655172413793
Melrose,FL_Forest_Melrose_20_11_2020,2020,29.6996,-81.98692,2020-10-03,2020-11-01,29,Forest,Wild,2,0.0689655172413793
Melrose,FL_Forest_Melrose_20_13_2020,2020,29.70885,-81.96803,2020-10-03,2020-11-01,29,Forest,Wild,1,0.0344827586206897
Melrose,FL_Forest_Melrose_20_14_2020,2020,29.70546,-81.98752,2020-10-03,2020-11-01,29,Forest,Wild,2,0.0689655172413793
Melrose,FL_Forest_Melrose_20_15_2020,2020,29.69838,-81.98401,2020-10-03,2020-11-01,29,Forest,Wild,1,0.0344827586206897
Melrose,FL_Forest_Melrose_21_dep10_2021,2021,29.694699,-81.971788,2021-09-15,2021-10-15,30,Forest,Wild,2,0.0666666666666667
Melrose,FL_Forest_Melrose_21_dep11 09/15/2021_2021,2021,29.696537,-81.969134,2021-09-15,2021-10-15,30,Forest,Wild,2,0.0666666666666667
Melrose,FL_Forest_Melrose_21_dep12_2021,2021,29.69987,-81.968094,2021-09-15,2021-10-15,30,Forest,Wild,1,0.0333333333333333
Melrose,FL_Forest_Melrose_21_dep13_2021,2021,29.702655,-81.967252,2021-09-15,2021-10-15,30,Forest,Wild,1,0.0333333333333333
Melrose,FL_Forest_Melrose_21_dep14_2021,2021,29.705939,-81.9674,2021-09-15,2021-10-15,30,Forest,Wild,1,0.0333333333333333
Melrose,FL_Forest_Melrose_21_dep15 09/15/2021_2021,2021,29.70885,-81.968035,2021-09-15,2021-10-15,30,Forest,Wild,2,0.0666666666666667
Melrose,FL_Forest_Melrose_21_dep2_2021,2021,29.702655,-81.967252,2021-09-15,2021-10-15,30,Forest,Wild,2,0.0666666666666667
Melrose,FL_Forest_Melrose_21_dep4 09/15/2021_2021,2021,29.702018,-81.991033,2021-09-15,2021-10-15,30,Forest,Wild,1,0.0333333333333333
Melrose,FL_Forest_Melrose_21_dep5 09/15/2021_2021,2021,29.699764,-81.990149,2021-09-15,2021-10-15,30,Forest,Wild,2,0.0666666666666667
Melrose,FL_Forest_Melrose_21_dep6_2021,2021,29.699604,-81.986924,2021-09-17,2021-10-15,28,Forest,Wild,1,0.0357142857142857
Melrose,FL_Forest_Melrose_21_dep7 09/15/2021_2021,2021,29.69838,-81.984006,2021-09-15,2021-10-15,30,Forest,Wild,2,0.0666666666666667
Melrose,FL_Forest_Melrose_21_dep8 09/15/2021_2021,2021,29.695332,-81.978271,2021-09-13,2021-10-13,30,Forest,Wild,2,0.0666666666666667
Melrose,FL_Forest_Melrose_21_dep9 09/15/2021_2021,2021,29.694892,-81.975466,2021-09-15,2021-10-15,30,Forest,Wild,1,0.0333333333333333
Melrose,FL_Forest_Melrose_21_loc1 09/15/2021_2021,2021,29.706955,-81.985414,2021-09-15,2021-10-15,30,Forest,Wild,1,0.0333333333333333
Melrose,FL_Forest_Melrose_253/C10_384_2022,2022,29.699607,-81.986926,2022-10-05,2022-10-09,4,Forest,Wild,1,0.25
Melrose,FL_Forest_Melrose_2_2019,2019,29.70696,-81.98541,2019-09-25,2019-11-04,40,Forest,Wild,0,0
Melrose,FL_Forest_Melrose_3_2019,2019,29.7039,-81.98953,2019-09-27,2019-11-04,38,Forest,Wild,2,0.0526315789473684
Melrose,FL_Forest_Melrose_4_2019,2019,29.70202,-81.99103,2019-09-25,2019-11-04,40,Forest,Wild,0,0
Melrose,FL_Forest_Melrose_5_2019,2019,29.70524,-81.98745,2019-09-25,2019-10-08,13,Forest,Wild,0,0
Melrose,FL_Forest_Melrose_5_FL09/FL17_432_2022,2022,29.699767,-81.99015,2022-10-05,2022-11-02,28,Forest,Wild,4,0.142857142857143
Melrose,FL_Forest_Melrose_6_2019,2019,29.69654,-81.96913,2019-09-25,2019-11-04,40,Forest,Wild,2,0.05
Melrose,FL_Forest_Melrose_7_2019,2019,29.69533,-81.97827,2019-09-25,2019-11-04,40,Forest,Wild,2,0.05
Melrose,FL_Forest_Melrose_8_2019,2019,29.70266,-81.96725,2019-09-25,2019-11-04,40,Forest,Wild,11,0.275
Melrose,FL_Forest_Melrose_9_2019,2019,29.69838,-81.98401,2019-09-25,2019-11-04,40,Forest,Wild,2,0.05
Melrose,FL_Forest_Melrose_9_FL06/466_C11_2022,2022,29.694895,-81.975468,2022-10-05,2022-11-02,28,Forest,Wild,1,0.0357142857142857
Melrose,FL_Forest_Melrose_C12_FL_C12_2022,2022,29.710455,-81.986665,2022-10-06,2022-11-02,27,Forest,Wild,1,0.037037037037037
Melrose,FL_Forest_Melrose_FL02/F19_FL23_2022,2022,29.698383,-81.984008,2022-10-05,2022-11-02,28,Forest,Wild,2,0.0714285714285714
Melrose,FL_Forest_Melrose_FL_04_FL_2022,2022,29.702021,-81.991035,2022-10-05,2022-10-30,25,Forest,Wild,2,0.08
Melrose,FL_Forest_Melrose_dep3_2021,2021,29.703905,-81.989534,2021-09-15,2021-10-15,30,Forest,Wild,1,0.0333333333333333
KeyDeerRefuge,FL_Forest_NKDR_23.01_D1_2023,2023,24.70602,-81.38565,2023-08-16,2023-10-04,49,Forest,Rural,4,0.0816326530612245
KeyDeerRefuge,FL_Forest_NKDR_23.02_D1_2023,2023,24.71323,-81.38203,2023-08-16,2023-11-03,79,Forest,Rural,8,0.10126582278481
KeyDeerRefuge,FL_Forest_NKDR_23.03_D1_2023,2023,24.71654,-81.38714,2023-08-16,2023-11-03,79,Forest,Rural,8,0.10126582278481
KeyDeerRefuge,FL_Forest_NKDR_23.04_D1_2023,2023,24.70643,-81.37897,2023-08-16,2023-10-28,73,Forest,Rural,9,0.123287671232877
KeyDeerRefuge,FL_Forest_NKDR_23.05_D1_2023,2023,24.71094,-81.38723,2023-08-30,2023-11-03,65,Forest,Rural,8,0.123076923076923
KeyDeerRefuge,FL_Forest_NKDR_23.06_D1_2023,2023,24.71019,-81.37615,2023-10-17,2023-11-03,17,Forest,Rural,2,0.117647058823529
KeyDeerRefuge,FL_Forest_NKDR_23.07_D1_2023,2023,24.69953,-81.37414,2023-09-06,2023-10-12,36,Forest,Rural,4,0.111111111111111
KeyDeerRefuge,FL_Forest_NKDR_23.07_D2_2023,2023,24.69953,-81.37414,2023-10-16,2023-11-03,18,Forest,Rural,2,0.111111111111111
KeyDeerRefuge,FL_Forest_NKDR_23.08_D1_2023,2023,24.70306,-81.37597,2023-08-30,2023-10-12,43,Forest,Rural,4,0.0930232558139535
KeyDeerRefuge,FL_Forest_NKDR_23.08_D2_2023,2023,24.70306,-81.37597,2023-10-16,2023-11-03,18,Forest,Rural,2,0.111111111111111
KeyDeerRefuge,FL_Forest_NKDR_23.09_D1_2023,2023,24.69968,-81.38028,2023-08-30,2023-11-02,64,Forest,Rural,6,0.09375
KeyDeerRefuge,FL_Forest_NKDR_23.10_D1_2023,2023,24.6968,-81.32907,2023-08-16,2023-11-02,78,Forest,Rural,9,0.115384615384615
KeyDeerRefuge,FL_Forest_NKDR_23.11_D1_2023,2023,24.69727,-81.32137,2023-08-16,2023-11-02,78,Forest,Rural,6,0.0769230769230769
KeyDeerRefuge,FL_Forest_NKDR_23.12_D1_2023,2023,24.69486,-81.325,2023-09-06,2023-11-02,57,Forest,Rural,8,0.140350877192982
Ordway,FL_Forest_Ordway_ORD1.1_2023,2023,29.69080498,-82.00543698,2023-08-18,2023-10-04,47,Forest,Wild,2,0.0425531914893617
Ordway,FL_Forest_Ordway_ORD1.2_2023,2023,29.69080498,-82.00543698,2023-10-04,2023-11-08,35,Forest,Wild,2,0.0571428571428571
Ordway,FL_Forest_Ordway_ORD10.1_2023,2023,29.71475601,-81.99779696,2023-08-15,2023-10-04,50,Forest,Wild,17,0.34
Ordway,FL_Forest_Ordway_ORD10.2_2023,2023,29.71475601,-81.99779696,2023-10-04,2023-11-08,35,Forest,Wild,10,0.285714285714286
Melrose,FL_Forest_Ordway_ORD10_2022,2022,29.71475601,-81.99779696,2022-08-26,2022-11-02,68,Forest,Wild,22,0.323529411764706
Ordway,FL_Forest_Ordway_ORD11.1_2023,2023,29.72418599,-81.98590203,2023-08-15,2023-09-24,40,Forest,Wild,1,0.025
Ordway,FL_Forest_Ordway_ORD11.2_2023,2023,29.72418599,-81.98590203,2023-10-04,2023-11-08,35,Forest,Wild,2,0.0571428571428571
Melrose,FL_Forest_Ordway_ORD11_2022,2022,29.72418599,-81.98590203,2022-08-26,2022-11-02,68,Forest,Wild,3,0.0441176470588235
Ordway,FL_Forest_Ordway_ORD12.1_2023,2023,29.72766599,-81.97131903,2023-08-15,2023-10-04,50,Forest,Wild,2,0.04
Melrose,FL_Forest_Ordway_ORD12_2022,2022,29.72766599,-81.97131903,2022-10-19,2022-11-02,14,Forest,Wild,2,0.142857142857143
Ordway,FL_Forest_Ordway_ORD13.1_2023,2023,29.71380098,-81.96872399,2023-08-18,2023-10-03,46,Forest,Wild,50,1.08695652173913
Ordway,FL_Forest_Ordway_ORD13.2_2023,2023,29.71380098,-81.96872399,2023-10-04,2023-10-07,3,Forest,Wild,5,1.66666666666667
Melrose,FL_Forest_Ordway_ORD13_2022,2022,29.71380098,-81.96872399,2022-08-26,2022-10-19,54,Forest,Wild,51,0.944444444444444
Ordway,FL_Forest_Ordway_ORD14.1_2023,2023,29.69951897,-81.95928102,2023-08-18,2023-10-09,52,Forest,Wild,23,0.442307692307692
Ordway,FL_Forest_Ordway_ORD14.2_2023,2023,29.69951897,-81.95928102,2023-10-09,2023-11-08,30,Forest,Wild,24,0.8
Melrose,FL_Forest_Ordway_ORD14_2022,2022,29.69951897,-81.95928102,2022-08-26,2022-10-20,55,Forest,Wild,15,0.272727272727273
Ordway,FL_Forest_Ordway_ORD15.1_2023,2023,29.69958804,-81.943041,2023-08-15,2023-10-09,55,Forest,Wild,2,0.0363636363636364
Ordway,FL_Forest_Ordway_ORD15.2_2023,2023,29.69958804,-81.943041,2023-10-09,2023-11-08,30,Forest,Wild,1,0.0333333333333333
Melrose,FL_Forest_Ordway_ORD15_2022,2022,29.69958804,-81.943041,2022-09-01,2022-11-02,62,Forest,Wild,1,0.0161290322580645
Ordway,FL_Forest_Ordway_ORD16.1_2023,2023,29.69137897,-81.94971702,2023-08-15,2023-09-18,34,Forest,Wild,1,0.0294117647058824
Ordway,FL_Forest_Ordway_ORD16.2_2023,2023,29.69137897,-81.94971702,2023-10-09,2023-11-08,30,Forest,Wild,2,0.0666666666666667
Melrose,FL_Forest_Ordway_ORD16_2022,2022,29.69137897,-81.94971702,2022-08-26,2022-11-02,68,Forest,Wild,6,0.0882352941176471
Ordway,FL_Forest_Ordway_ORD17.1_2023,2023,29.69115098,-81.96035902,2023-08-15,2023-10-09,55,Forest,Wild,5,0.0909090909090909
Ordway,FL_Forest_Ordway_ORD17.2_2023,2023,29.69115098,-81.96035902,2023-10-09,2023-11-08,30,Forest,Wild,4,0.133333333333333
Melrose,FL_Forest_Ordway_ORD17_2022,2022,29.69115098,-81.96035902,2022-08-26,2022-11-02,68,Forest,Wild,12,0.176470588235294
Ordway,FL_Forest_Ordway_ORD18.1_2023,2023,29.67547397,-82.027789,2023-08-15,2023-10-07,53,Forest,Wild,1,0.0188679245283019
Ordway,FL_Forest_Ordway_ORD18.2_2023,2023,29.67547397,-82.027789,2023-10-09,2023-11-10,32,Forest,Wild,2,0.0625
Melrose,FL_Forest_Ordway_ORD18_2022,2022,29.67547397,-82.027789,2022-08-26,2022-11-09,75,Forest,Wild,4,0.0533333333333333
Ordway,FL_Forest_Ordway_ORD19.1_2023,2023,29.67363498,-82.00804501,2023-08-15,2023-09-20,36,Forest,Wild,1,0.0277777777777778
Ordway,FL_Forest_Ordway_ORD19.2_2023,2023,29.67363498,-82.00804501,2023-10-09,2023-10-23,14,Forest,Wild,0,0
Melrose,FL_Forest_Ordway_ORD19_2022,2022,29.67363498,-82.00804501,2022-09-01,2022-11-09,69,Forest,Wild,3,0.0434782608695652
Melrose,FL_Forest_Ordway_ORD1_2022,2022,29.69080498,-82.00543698,2022-09-01,2022-11-06,66,Forest,Wild,4,0.0606060606060606
Ordway,FL_Forest_Ordway_ORD2.1_2023,2023,29.70097298,-81.99299497,2023-08-15,2023-10-04,50,Forest,Wild,2,0.04
Ordway,FL_Forest_Ordway_ORD2.2_2023,2023,29.70097298,-81.99299497,2023-10-04,2023-11-05,32,Forest,Wild,0,0
Ordway,FL_Forest_Ordway_ORD20.1_2023,2023,29.696892,-81.97053499,2023-08-15,2023-10-04,50,Forest,Wild,2,0.04
Ordway,FL_Forest_Ordway_ORD20.2_2023,2023,29.696892,-81.97053499,2023-10-04,2023-11-08,35,Forest,Wild,2,0.0571428571428571
Melrose,FL_Forest_Ordway_ORD20_2022,2022,29.696892,-81.97053499,2022-08-26,2022-11-02,68,Forest,Wild,3,0.0441176470588235
Ordway,FL_Forest_Ordway_ORD21.1_2023,2023,29.69485503,-81.98676897,2023-08-18,2023-10-09,52,Forest,Wild,2,0.0384615384615385
Ordway,FL_Forest_Ordway_ORD21.2_2023,2023,29.69485503,-81.98676897,2023-10-09,2023-11-08,30,Forest,Wild,2,0.0666666666666667
Melrose,FL_Forest_Ordway_ORD21_2022,2022,29.69485503,-81.98676897,2022-08-26,2022-10-12,47,Forest,Wild,3,0.0638297872340425
Ordway,FL_Forest_Ordway_ORD22.1_2023,2023,29.68962204,-81.97536699,2023-08-15,2023-10-09,55,Forest,Wild,2,0.0363636363636364
Ordway,FL_Forest_Ordway_ORD22.2_2023,2023,29.68962204,-81.97536699,2023-10-09,2023-11-08,30,Forest,Wild,2,0.0666666666666667
Melrose,FL_Forest_Ordway_ORD22_2022,2022,29.68962204,-81.97536699,2022-09-01,2022-10-19,48,Forest,Wild,4,0.0833333333333333
Ordway,FL_Forest_Ordway_ORD23.1_2023,2023,29.67912697,-81.95959501,2023-08-15,2023-10-09,55,Forest,Wild,14,0.254545454545455
Ordway,FL_Forest_Ordway_ORD23.2_2023,2023,29.67912697,-81.95959501,2023-10-09,2023-11-08,30,Forest,Wild,13,0.433333333333333
Melrose,FL_Forest_Ordway_ORD23_2022,2022,29.67912697,-81.95959501,2022-08-26,2022-10-13,48,Forest,Wild,19,0.395833333333333
Ordway,FL_Forest_Ordway_ORD24.1_2023,2023,29.67899999,-81.94934998,2023-08-15,2023-10-09,55,Forest,Wild,12,0.218181818181818
Ordway,FL_Forest_Ordway_ORD24.2_2023,2023,29.67899999,-81.94934998,2023-10-10,2023-11-08,29,Forest,Wild,3,0.103448275862069
Melrose,FL_Forest_Ordway_ORD24_2022,2022,29.67899999,-81.94934998,2022-08-26,2022-11-02,68,Forest,Wild,23,0.338235294117647
Ordway,FL_Forest_Ordway_ORD25.1_2023,2023,29.68874303,-81.94024798,2023-08-15,2023-10-09,55,Forest,Wild,2,0.0363636363636364
Ordway,FL_Forest_Ordway_ORD25.2_2023,2023,29.68874303,-81.94024798,2023-10-09,2023-11-08,30,Forest,Wild,1,0.0333333333333333
Ordway,FL_Forest_Ordway_ORD26.1_2023,2023,29.67876202,-81.97806001,2023-08-18,2023-08-21,3,Forest,Wild,1,0.333333333333333
Ordway,FL_Forest_Ordway_ORD26.2_2023,2023,29.67876202,-81.97806001,2023-10-09,2023-10-17,8,Forest,Wild,1,0.125
Melrose,FL_Forest_Ordway_ORD26_2022,2022,29.67876202,-81.97806001,2022-09-04,2022-11-02,59,Forest,Wild,2,0.0338983050847458
Ordway,FL_Forest_Ordway_ORD27.1_2023,2023,29.70314397,-81.95148996,2023-08-20,2023-10-09,50,Forest,Wild,15,0.3
Ordway,FL_Forest_Ordway_ORD27.2_2023,2023,29.70314397,-81.95148996,2023-10-09,2023-11-08,30,Forest,Wild,17,0.566666666666667
Melrose,FL_Forest_Ordway_ORD27_2022,2022,29.70314397,-81.95148996,2022-08-26,2022-11-02,68,Forest,Wild,36,0.529411764705882
Ordway,FL_Forest_Ordway_ORD28.1_2023,2023,29.71402503,-81.98073903,2023-08-15,2023-10-04,50,Forest,Wild,2,0.04
Ordway,FL_Forest_Ordway_ORD28.2_2023,2023,29.71402503,-81.98073903,2023-10-04,2023-11-08,35,Forest,Wild,2,0.0571428571428571
Melrose,FL_Forest_Ordway_ORD28_2022,2022,29.71402503,-81.98073903,2022-08-26,2022-11-02,68,Forest,Wild,3,0.0441176470588235
Ordway,FL_Forest_Ordway_ORD29.1_2023,2023,29.706931,-81.98564596,2023-08-15,2023-10-04,50,Forest,Wild,2,0.04
Ordway,FL_Forest_Ordway_ORD29.2_2023,2023,29.706931,-81.98564596,2023-10-04,2023-11-08,35,Forest,Wild,2,0.0571428571428571
Melrose,FL_Forest_Ordway_ORD2_2022,2022,29.70097298,-81.99299497,2022-08-26,2022-11-02,68,Forest,Wild,20,0.294117647058824
Ordway,FL_Forest_Ordway_ORD3.1_2023,2023,29.68597197,-81.98741999,2023-08-18,2023-10-09,52,Forest,Wild,17,0.326923076923077
Ordway,FL_Forest_Ordway_ORD30.1_2023,2023,29.69852697,-82.02843298,2023-08-15,2023-10-09,55,Forest,Wild,2,0.0363636363636364
Ordway,FL_Forest_Ordway_ORD30.2_2023,2023,29.69852697,-82.02843298,2023-10-09,2023-11-10,32,Forest,Wild,2,0.0625
Melrose,FL_Forest_Ordway_ORD30_2022,2022,29.69852697,-82.02843298,2022-09-06,2022-11-09,64,Forest,Wild,1,0.015625
Ordway,FL_Forest_Ordway_ORD31.1_2023,2023,29.68957602,-82.01364798,2023-08-15,2023-08-25,10,Forest,Wild,1,0.1
Ordway,FL_Forest_Ordway_ORD31.2_2023,2023,29.68957602,-82.01364798,2023-10-09,2023-11-10,32,Forest,Wild,3,0.09375
Melrose,FL_Forest_Ordway_ORD31_2022,2022,29.68957602,-82.01364798,2022-09-01,2022-11-09,69,Forest,Wild,3,0.0434782608695652
Ordway,FL_Forest_Ordway_ORD32.1_2023,2023,29.70517399,-81.96791103,2023-08-15,2023-10-04,50,Forest,Wild,2,0.04
Ordway,FL_Forest_Ordway_ORD32.2_2023,2023,29.70517399,-81.96791103,2023-10-04,2023-11-08,35,Forest,Wild,2,0.0571428571428571
Ordway,FL_Forest_Ordway_ORD33.1_2023,2023,29.70986299,-81.95662396,2023-08-18,2023-10-09,52,Forest,Wild,4,0.0769230769230769
Ordway,FL_Forest_Ordway_ORD33.2_2023,2023,29.70986299,-81.95662396,2023-10-09,2023-11-08,30,Forest,Wild,5,0.166666666666667
Melrose,FL_Forest_Ordway_ORD33_2022,2022,29.70986299,-81.95662396,2022-08-26,2022-11-02,68,Forest,Wild,7,0.102941176470588
Ordway,FL_Forest_Ordway_ORD34.1_2023,2023,29.696527970000002,-82.01138604,2023-08-15,2023-10-03,49,Forest,Wild,5,0.102040816326531
Ordway,FL_Forest_Ordway_ORD34.2_2023,2023,29.696527970000002,-82.01138604,2023-10-09,2023-11-10,32,Forest,Wild,3,0.09375
Melrose,FL_Forest_Ordway_ORD34_2022,2022,29.696527970000002,-82.01138604,2022-09-01,2022-10-17,46,Forest,Wild,17,0.369565217391304
Ordway,FL_Forest_Ordway_ORD35.1_2023,2023,29.683029,-82.00687297,2023-08-18,2023-10-09,52,Forest,Wild,16,0.307692307692308
Ordway,FL_Forest_Ordway_ORD35.2_2023,2023,29.683029,-82.00687297,2023-10-09,2023-11-09,31,Forest,Wild,9,0.290322580645161
Melrose,FL_Forest_Ordway_ORD35_2022,2022,29.683029,-82.00687297,2022-09-01,2022-10-02,31,Forest,Wild,11,0.354838709677419
Ordway,FL_Forest_Ordway_ORD36.2_2023,2023,29.68723,-81.99645,2023-10-10,2023-11-10,31,Forest,Wild,1,0.032258064516129
Melrose,FL_Forest_Ordway_ORD36_2022,2022,29.68723,-81.99645,2022-09-01,2022-11-02,62,Forest,Wild,4,0.0645161290322581
Ordway,FL_Forest_Ordway_ORD37.1_2023,2023,29.69491,-81.99824,2023-08-15,2023-08-16,1,Forest,Wild,1,1
Ordway,FL_Forest_Ordway_ORD37.2_2023,2023,29.69491,-81.99824,2023-10-04,2023-11-08,35,Forest,Wild,4,0.114285714285714
Melrose,FL_Forest_Ordway_ORD37_2022,2022,29.69491,-81.99824,2022-09-01,2022-10-12,41,Forest,Wild,3,0.0731707317073171
Melrose,FL_Forest_Ordway_ORD38_2022,2022,29.68293,-82.02789,2022-09-01,2022-11-06,66,Forest,Wild,8,0.121212121212121
Ordway,FL_Forest_Ordway_ORD38_2023,2023,29.68293,-82.02789,2023-08-18,2023-11-10,84,Forest,Wild,2,0.0238095238095238
Melrose,FL_Forest_Ordway_ORD39_2022,2022,29.69086,-82.02837,2022-08-01,2022-11-09,100,Forest,Wild,1,0.01
Ordway,FL_Forest_Ordway_ORD39_2023,2023,29.69086,-82.02837,2023-08-18,2023-09-23,36,Forest,Wild,1,0.0277777777777778
Melrose,FL_Forest_Ordway_ORD3_2022,2022,29.68597197,-81.98741999,2022-08-26,2022-11-02,68,Forest,Wild,42,0.61764705882353
Ordway,FL_Forest_Ordway_ORD4.1_2023,2023,29.68427899,-81.96775496,2023-08-18,2023-10-09,52,Forest,Wild,27,0.519230769230769
Ordway,FL_Forest_Ordway_ORD40.1_2023,2023,29.70787,-81.99532,2023-08-15,2023-10-04,50,Forest,Wild,1,0.02
Ordway,FL_Forest_Ordway_ORD40.2_2023,2023,29.70787,-81.99532,2023-10-04,2023-11-08,35,Forest,Wild,2,0.0571428571428571
Melrose,FL_Forest_Ordway_ORD40_2022,2022,29.70787,-81.99532,2022-08-26,2022-11-02,68,Forest,Wild,3,0.0441176470588235
Melrose,FL_Forest_Ordway_ORD4_2022,2022,29.68427899,-81.96775496,2022-08-26,2022-10-19,54,Forest,Wild,35,0.648148148148148
Ordway,FL_Forest_Ordway_ORD5.1_2023,2023,29.67829498,-81.99939899,2023-08-18,2023-10-09,52,Forest,Wild,2,0.0384615384615385
Ordway,FL_Forest_Ordway_ORD5.2_2023,2023,29.67829498,-81.99939899,2023-10-09,2023-11-10,32,Forest,Wild,2,0.0625
Melrose,FL_Forest_Ordway_ORD5_2022,2022,29.67829498,-81.99939899,2022-09-01,2022-10-09,38,Forest,Wild,3,0.0789473684210526
Ordway,FL_Forest_Ordway_ORD6.1_2023,2023,29.681059,-82.01610303,2023-08-15,2023-10-09,55,Forest,Wild,303,5.50909090909091
Ordway,FL_Forest_Ordway_ORD6.2_2023,2023,29.681059,-82.01610303,2023-10-09,2023-11-10,32,Forest,Wild,339,10.59375
Melrose,FL_Forest_Ordway_ORD6_2022,2022,29.681059,-82.01610303,2022-08-26,2022-11-09,75,Forest,Wild,435,5.8
Ordway,FL_Forest_Ordway_ORD7.1_2023,2023,29.66824802,-82.01920099,2023-08-18,2023-09-27,40,Forest,Wild,1,0.025
Ordway,FL_Forest_Ordway_ORD7.2_2023,2023,29.66824802,-82.01920099,2023-10-09,2023-11-10,32,Forest,Wild,2,0.0625
Melrose,FL_Forest_Ordway_ORD7_2022,2022,29.66824802,-82.01920099,2022-09-01,2022-11-09,69,Forest,Wild,4,0.0579710144927536
Ordway,FL_Forest_Ordway_ORD8.1_2023,2023,29.69491102,-82.01958597,2023-08-15,2023-09-25,41,Forest,Wild,1,0.024390243902439
Ordway,FL_Forest_Ordway_ORD8.2_2023,2023,29.69491102,-82.01958597,2023-10-09,2023-10-25,16,Forest,Wild,0,0
Melrose,FL_Forest_Ordway_ORD8_2022,2022,29.69491102,-82.01958597,2022-09-04,2022-11-09,66,Forest,Wild,4,0.0606060606060606
Ordway,FL_Forest_Ordway_ORD9.1_2023,2023,29.70340298,-82.00767302,2023-08-18,2023-10-09,52,Forest,Wild,46,0.884615384615385
Ordway,FL_Forest_Ordway_ORD9.2_2023,2023,29.70340298,-82.00767302,2023-10-09,2023-11-10,32,Forest,Wild,18,0.5625
Melrose,FL_Forest_Ordway_ORD9_2022,2022,29.70340298,-82.00767302,2022-09-04,2022-11-09,66,Forest,Wild,52,0.787878787878788
Ellington,FL_Forest_RCREC_006 09/01/2022_2022,2022,27.40793,-81.9501648,2022-09-01,2022-10-31,60,Grassland,Rural,3,0.05
Ellington,FL_Forest_RCREC_008 09/01/2022_2022,2022,27.4076,-81.9525375,2022-09-01,2022-10-31,60,Grassland,Rural,3,0.05
Ellington,FL_Forest_RCREC_011 09/01/2022_2022,2022,27.41053,-81.9553452,2022-09-01,2022-10-31,60,Grassland,Rural,3,0.05
Ellington,FL_Forest_RCREC_018 09/01/2022_2022,2022,27.40656,-81.9563141,2022-09-01,2022-10-31,60,Grassland,Rural,4,0.0666666666666667
Ellington,FL_Forest_RCREC_020 09/01/2022_2022,2022,27.4033,-81.9545135,2022-09-02,2022-10-31,59,Grassland,Rural,3,0.0508474576271186
Ellington,FL_Forest_RCREC_021 09/01/2022_2022,2022,27.40076,-81.9563828,2022-09-03,2022-10-30,57,Grassland,Rural,3,0.0526315789473684
Ellington,FL_Forest_RCREC_022 09/01/2022_2022,2022,27.40098,-81.9513626,2022-09-01,2022-10-31,60,Grassland,Rural,2,0.0333333333333333
Ellington,FL_Forest_RCREC_026 09/01/2022_2022,2022,27.38435,-81.9457092,2022-09-01,2022-10-31,60,Grassland,Rural,3,0.05
Ellington,FL_Forest_RCREC_030 09/01/2022_2022,2022,27.38287,-81.9481964,2022-09-01,2022-10-31,60,Grassland,Rural,7,0.116666666666667
Ellington,FL_Forest_RCREC_032 09/01/2022_2022,2022,27.38257,-81.9511642,2022-09-01,2022-10-31,60,Grassland,Rural,3,0.05
Ellington,FL_Forest_RCREC_034 09/01/2022_2022,2022,27.38487,-81.9506454,2022-09-01,2022-10-31,60,Grassland,Rural,3,0.05
Ellington,FL_Forest_RCREC_037 09/01/2022_2022,2022,27.38262,-81.9562531,2022-09-01,2022-10-31,60,Grassland,Rural,7,0.116666666666667
Ellington,FL_Forest_RCREC_039 09/01/2022_2022,2022,27.38259,-81.9535599,2022-09-01,2022-10-31,60,Grassland,Rural,10,0.166666666666667
Ellington,FL_Forest_RCREC_044 09/01/2022_2022,2022,27.38886,-81.9546432,2022-09-01,2022-10-31,60,Grassland,Rural,5,0.0833333333333333
Ellington,FL_Forest_RCREC_047 09/01/2022_2022,2022,27.38676,-81.9548721,2022-09-01,2022-10-31,60,Grassland,Rural,3,0.05
Ellington,FL_Forest_RCREC_051 09/01/2022_2022,2022,27.39313,-81.9262085,2022-09-01,2022-10-31,60,Grassland,Rural,22,0.366666666666667
Ellington,FL_Forest_RCREC_054 09/01/2022_2022,2022,27.39747,-81.9255829,2022-09-01,2022-10-31,60,Grassland,Rural,3,0.05
Ellington,FL_Forest_RCREC_056 09/01/2022_2022,2022,27.3917,-81.9210892,2022-09-01,2022-10-31,60,Grassland,Rural,3,0.05
Ellington,FL_Forest_RCREC_058 09/01/2022_2022,2022,27.39492,-81.9222336,2022-08-31,2022-10-31,61,Grassland,Rural,3,0.0491803278688525
Ellington,FL_Forest_RCREC_063 09/01/2022_2022,2022,27.3944,-81.9166183,2022-09-01,2022-11-01,61,Grassland,Rural,4,0.0655737704918033
Ellington,FL_Forest_RCREC_066 09/01/2022_2022,2022,27.38955,-81.9167709,2022-09-05,2022-10-18,43,Grassland,Rural,3,0.0697674418604651
Ellington,FL_Forest_RCREC_074 09/01/2022_2022,2022,27.4002,-81.9297485,2022-09-01,2022-10-31,60,Grassland,Rural,2,0.0333333333333333
Ellington,FL_Forest_RCREC_075 09/01/2022_2022,2022,27.40187,-81.9352188,2022-09-15,2022-10-31,46,Grassland,Rural,3,0.0652173913043478
Ellington,FL_Forest_RCREC_082 09/01/2022_2022,2022,27.40764,-81.934433,2022-09-15,2022-10-31,46,Grassland,Rural,3,0.0652173913043478
Ellington,FL_Forest_RCREC_084 09/01/2022_2022,2022,27.40824,-81.9320984,2022-09-01,2022-10-31,60,Grassland,Rural,10,0.166666666666667
Ellington,FL_Forest_RCREC_087 09/01/2022_2022,2022,27.4066,-81.9391479,2022-09-01,2022-10-31,60,Grassland,Rural,73,1.21666666666667
Ellington,FL_Forest_RCREC_090 09/01/2022_2022,2022,27.40649,-81.936554,2022-09-01,2022-10-31,60,Grassland,Rural,6,0.1
Ellington,FL_Forest_RCREC_092 09/01/2022_2022,2022,27.4008,-81.9389343,2022-09-01,2022-10-30,59,Grassland,Rural,2,0.0338983050847458
Ellington,FL_Forest_RCREC_093 09/01/2022_2022,2022,27.40322,-81.9383774,2022-09-01,2022-10-30,59,Grassland,Rural,2,0.0338983050847458
NFREC,FL_Forest_Rural_NFREC_2023_WELaM-001_2023,2023,30.5389,-84.588,2023-09-05,2023-11-03,59,Forest,Rural,3,0.0508474576271186
NFREC,FL_Forest_Rural_NFREC_2023_WELaM-002_2023,2023,30.54066,-84.58615,2023-09-05,2023-11-03,59,Forest,Rural,9,0.152542372881356
NFREC,FL_Forest_Rural_NFREC_2023_WELaM-003_2023,2023,30.53747,-84.58552,2023-09-05,2023-11-02,58,Forest,Rural,2,0.0344827586206897
NFREC,FL_Forest_Rural_NFREC_2023_WELaM-004_2023,2023,30.53711,-84.5831,2023-09-05,2023-11-03,59,Forest,Rural,6,0.101694915254237
NFREC,FL_Forest_Rural_NFREC_2023_WELaM-005_2023,2023,30.53625,-84.5812,2023-09-05,2023-11-03,59,Forest,Rural,9,0.152542372881356
NFREC,FL_Forest_Rural_NFREC_2023_WELaM-006_2023,2023,30.54786,-84.596,2023-09-05,2023-10-31,56,Forest,Rural,5,0.0892857142857143
NFREC,FL_Forest_Rural_NFREC_2023_WELaM-007_2023,2023,30.54752,-84.6041,2023-09-05,2023-11-03,59,Forest,Rural,2,0.0338983050847458
NFREC,FL_Forest_Rural_NFREC_2023_WELaM-008_2023,2023,30.54441,-84.6052,2023-09-05,2023-11-03,59,Forest,Rural,9,0.152542372881356
CrocLake,FL_Forest_Wild_CrocLake_23 09/01/2023_2023,2023,25.19604121,-80.35315381,2023-09-03,2023-10-31,58,Forest,Wild,13,0.224137931034483
CrocLake,FL_Forest_Wild_CrocLake_23_10_Keystone 09/01/2023_2023,2023,25.19371877,-80.35485334,2023-09-01,2023-10-31,60,Forest,Wild,63,1.05
CrocLake,FL_Forest_Wild_CrocLake_23_13_Harrison 09/01/2023_2023,2023,25.2655,-80.3096,2023-09-04,2023-10-20,46,Forest,Wild,49,1.06521739130435
CrocLake,FL_Forest_Wild_CrocLake_23_14_Car_Dump 09/01/2023_2023,2023,25.22744384,-80.32966742,2023-09-01,2023-10-31,60,Forest,Wild,62,1.03333333333333
CrocLake,FL_Forest_Wild_CrocLake_23_15_Blues 09/01/2023_2023,2023,25.23063214,-80.32780333,2023-09-02,2023-10-28,56,Forest,Wild,9,0.160714285714286
CrocLake,FL_Forest_Wild_CrocLake_23_17_Hidden_Rock 09/01/2023_2023,2023,25.2514,-80.3163,2023-09-02,2023-10-27,55,Forest,Wild,3,0.0545454545454545
CrocLake,FL_Forest_Wild_CrocLake_23_19_Nike 09/01/2023_2023,2023,25.2621,-80.3114,2023-09-01,2023-11-02,62,Forest,Wild,160,2.58064516129032
CrocLake,FL_Forest_Wild_CrocLake_23_20_Nike_back 09/01/2023_2023,2023,25.2627,-80.3145,2023-09-01,2023-10-31,60,Forest,Wild,0,0
CrocLake,FL_Forest_Wild_CrocLake_23_21_Cockfighting 09/01/2023_2023,2023,25.2655,-80.3096,2023-09-01,2023-10-31,60,Forest,Wild,22,0.366666666666667
CrocLake,FL_Forest_Wild_CrocLake_23_25_Pole_6 10/01/2023_2023,2023,25.2892,-80.3042,2023-10-15,2023-10-31,16,Forest,Wild,0,0
CrocLake,FL_Forest_Wild_CrocLake_23_2_Intus 09/01/2023_2023,2023,25.17377004,-80.37369387,2023-09-01,2023-10-30,59,Forest,Wild,14,0.23728813559322
CrocLake,FL_Forest_Wild_CrocLake_23_3_Drift_Fence 09/01/2023_2023,2023,25.17370934,-80.37215604,2023-09-06,2023-10-29,53,Forest,Wild,1,0.0188679245283019
CrocLake,FL_Forest_Wild_CrocLake_23_4_Heliport 09/01/2023_2023,2023,25.17566441,-80.3710842,2023-09-01,2023-10-31,60,Forest,Wild,24,0.4
CrocLake,FL_Forest_Wild_CrocLake_23_5_Boat_Basin 09/01/2023_2023,2023,25.17685123,-80.36985749,2023-09-01,2023-10-31,60,Forest,Wild,5,0.0833333333333333
CrocLake,FL_Forest_Wild_CrocLake_23_8_HQ2 09/01/2023_2023,2023,25.1922,-80.3563,2023-09-01,2023-10-27,56,Forest,Wild,62,1.10714285714286
Apalachicola,FL_Grassland_Apalachicola_loc10_D1_2023,2023,30.46011,-84.97426,2023-09-04,2023-10-20,46,Grassland,Wild,6,0.130434782608696
Apalachicola,FL_Grassland_Apalachicola_loc11_D1_2023,2023,30.45855,-84.97523,2023-09-04,2023-10-20,46,Grassland,Wild,4,0.0869565217391304
Apalachicola,FL_Grassland_Apalachicola_loc12_D1_2023,2023,30.46685,-84.95944,2023-09-05,2023-10-20,45,Grassland,Wild,6,0.133333333333333
Apalachicola,FL_Grassland_Apalachicola_loc13_D1_2023,2023,30.46813,-84.96139,2023-09-05,2023-09-11,6,Grassland,Wild,1,0.166666666666667
Apalachicola,FL_Grassland_Apalachicola_loc13_D2_2023,2023,30.46813,-84.96139,2023-09-14,2023-09-25,11,Grassland,Wild,2,0.181818181818182
Apalachicola,FL_Grassland_Apalachicola_loc13_D3_2023,2023,30.46813,-84.96139,2023-09-28,2023-10-20,22,Grassland,Wild,3,0.136363636363636
Apalachicola,FL_Grassland_Apalachicola_loc14_D1_2023,2023,30.465775,-84.961644,2023-09-05,2023-09-28,23,Grassland,Wild,4,0.173913043478261
Apalachicola,FL_Grassland_Apalachicola_loc16_D1_2023,2023,30.47306,-84.97545,2023-09-06,2023-09-19,13,Grassland,Wild,3,0.230769230769231
Apalachicola,FL_Grassland_Apalachicola_loc16_D2_2023,2023,30.47306,-84.97545,2023-09-22,2023-10-20,28,Grassland,Wild,8,0.285714285714286
Apalachicola,FL_Grassland_Apalachicola_loc17_D1_2023,2023,30.47256,-84.97845,2023-09-06,2023-10-20,44,Grassland,Wild,8,0.181818181818182
Apalachicola,FL_Grassland_Apalachicola_loc18_D1_2023,2023,30.50414,-84.9745,2023-09-06,2023-10-20,44,Grassland,Wild,12,0.272727272727273
Apalachicola,FL_Grassland_Apalachicola_loc19_D1_2023,2023,30.5056,-84.97565,2023-09-06,2023-10-20,44,Grassland,Wild,7,0.159090909090909
Apalachicola,FL_Grassland_Apalachicola_loc20_D1_2023,2023,30.50421,-84.97737,2023-09-06,2023-10-20,44,Grassland,Wild,8,0.181818181818182
Apalachicola,FL_Grassland_Apalachicola_loc21_D1_2023,2023,30.47465,-84.97442,2023-09-15,2023-10-20,35,Grassland,Wild,6,0.17142857142857101
Apalachicola,FL_Grassland_Apalachicola_loc9_D1_2023,2023,30.45878,-84.97288,2023-09-04,2023-10-20,46,Grassland,Wild,7,0.152173913043478
Ellington,FL_Grassland_Ellington_RCREC_026 09/01/2023_2023,2023,27.38435,-81.9457092,2023-09-03,2023-10-03,30,Grassland,Rural,2,0.0666666666666667
Ellington,FL_Grassland_Ellington_RCREC_030 09/01/2023_2023,2023,27.38287,-81.9481964,2023-09-01,2023-10-31,60,Grassland,Rural,4,0.0666666666666667
Ellington,FL_Grassland_Ellington_RCREC_034 09/01/2023_2023,2023,27.38487,-81.9506454,2023-09-02,2023-10-31,59,Grassland,Rural,1,0.0169491525423729
Ellington,FL_Grassland_Ellington_RCREC_051 09/01/2023_2023,2023,27.39313,-81.9262085,2023-09-01,2023-10-31,60,Grassland,Rural,10,0.166666666666667
Ellington,FL_Grassland_Ellington_RCREC_054 09/01/2023_2023,2023,27.39747,-81.9255829,2023-09-01,2023-10-31,60,Grassland,Rural,1,0.0166666666666667
Ellington,FL_Grassland_Ellington_RCREC_056 09/01/2023_2023,2023,27.3917,-81.9210892,2023-09-01,2023-10-31,60,Grassland,Rural,1,0.0166666666666667
Ellington,FL_Grassland_Ellington_RCREC_058 09/01/2023_2023,2023,27.39492,-81.9222336,2023-09-01,2023-10-31,60,Grassland,Rural,2,0.0333333333333333
Ellington,FL_Grassland_Ellington_RCREC_074 09/01/2023_2023,2023,27.4002,-81.9297485,2023-09-01,2023-10-31,60,Grassland,Rural,2,0.0333333333333333
Ellington,FL_Grassland_Ellington_RCREC_090 09/01/2023_2023,2023,27.40649,-81.936554,2023-09-01,2023-10-31,60,Grassland,Rural,2,0.0333333333333333
Ellington,FL_RCREC_002 09/08/2021_2021,2021,27.40721,-81.94664,2021-09-04,2021-11-01,58,Grassland,Rural,12,0.206896551724138
Ellington,FL_RCREC_004_2021,2021,27.410553,-81.9493713,2021-09-03,2021-10-31,58,Grassland,Rural,7,0.120689655172414
Ellington,FL_RCREC_005_2021,2021,27.4105415,-81.9515915,2021-09-04,2021-11-01,58,Grassland,Rural,7,0.120689655172414
Ellington,FL_RCREC_006_2021,2021,27.4079323,-81.9501648,2021-09-04,2021-11-01,58,Grassland,Rural,6,0.103448275862069
Ellington,FL_RCREC_008_2021,2021,27.4076023,-81.9525375,2021-09-04,2021-11-01,58,Grassland,Rural,6,0.103448275862069
Ellington,FL_RCREC_011_2021,2021,27.4105339,-81.9553452,2021-09-04,2021-11-01,58,Grassland,Rural,4,0.0689655172413793
Ellington,FL_RCREC_015_2021,2021,27.4047413,-81.9558029,2021-09-04,2021-11-02,59,Grassland,Rural,14,0.23728813559322
Ellington,FL_RCREC_017_2021,2021,27.4052868,-81.9502029,2021-09-04,2021-11-01,58,Grassland,Rural,32,0.551724137931034
Ellington,FL_RCREC_018_2021,2021,27.4065628,-81.9563141,2021-09-04,2021-11-01,58,Grassland,Rural,9,0.155172413793103
Ellington,FL_RCREC_019_2021,2021,27.4022751,-81.9522018,2021-09-04,2021-11-02,59,Grassland,Rural,7,0.11864406779661
Ellington,FL_RCREC_020_2021,2021,27.4032955,-81.9545135,2021-09-04,2021-11-02,59,Grassland,Rural,7,0.11864406779661
Ellington,FL_RCREC_021_2021,2021,27.4007626,-81.9563828,2021-09-04,2021-11-02,59,Grassland,Rural,5,0.0847457627118644
Ellington,FL_RCREC_022_2021,2021,27.4009819,-81.9513626,2021-09-04,2021-11-02,59,Grassland,Rural,7,0.11864406779661
Ellington,FL_RCREC_025 09/02/2021_2021,2021,27.382349,-81.9456253,2021-09-02,2021-11-01,60,Grassland,Rural,8,0.133333333333333
Ellington,FL_RCREC_026 09/02/2021_2021,2021,27.3843479,-81.9457092,2021-09-02,2021-11-01,60,Grassland,Rural,7,0.116666666666667
Ellington,FL_RCREC_028_2021,2021,27.3846855,-81.9478378,2021-09-02,2021-11-01,60,Grassland,Rural,7,0.116666666666667
Ellington,FL_RCREC_030_2021,2021,27.3828735,-81.9481964,2021-09-02,2021-11-01,60,Grassland,Rural,4,0.0666666666666667
Ellington,FL_RCREC_032_2021,2021,27.3825665,-81.9511642,2021-09-02,2021-11-01,60,Grassland,Rural,6,0.1
Ellington,FL_RCREC_034_2021,2021,27.3848743,-81.9506454,2021-09-02,2021-11-01,60,Grassland,Rural,4,0.0666666666666667
Ellington,FL_RCREC_035 09/02/2021_2021,2021,27.3843002,-81.9524994,2021-09-02,2021-11-01,60,Grassland,Rural,5,0.0833333333333333
Ellington,FL_RCREC_037_2021,2021,27.3826237,-81.9562531,2021-09-01,2021-11-01,61,Grassland,Rural,6,0.0983606557377049
Ellington,FL_RCREC_039 09/01/2021_2021,2021,27.3825874,-81.9535599,2021-09-01,2021-11-01,61,Grassland,Rural,5,0.0819672131147541
Ellington,FL_RCREC_040 09/01/2021_2021,2021,27.3850307,-81.9560089,2021-09-01,2021-11-01,61,Grassland,Rural,6,0.0983606557377049
Ellington,FL_RCREC_044 10/06/2021_2021,2021,27.3888626,-81.9546432,2021-10-06,2021-11-02,27,Grassland,Rural,4,0.148148148148148
Ellington,FL_RCREC_047 09/01/2021_2021,2021,27.3867588,-81.9548721,2021-09-01,2021-11-02,62,Grassland,Rural,6,0.0967741935483871
Ellington,FL_RCREC_049_2021,2021,27.3993835,-81.9252472,2021-09-04,2021-11-02,59,Grassland,Rural,6,0.101694915254237
Ellington,FL_RCREC_050 09/04/2021_2021,2021,27.3959103,-81.9269791,2021-09-04,2021-11-02,59,Grassland,Rural,7,0.11864406779661
Ellington,FL_RCREC_051 09/03/2021_2021,2021,27.3931313,-81.9262085,2021-09-03,2021-11-02,60,Grassland,Rural,4,0.0666666666666667
Ellington,FL_RCREC_052 09/04/2021_2021,2021,27.3951645,-81.9249039,2021-09-04,2021-11-02,59,Grassland,Rural,5,0.0847457627118644
Ellington,FL_RCREC_054 09/04/2021_2021,2021,27.3974686,-81.9255829,2021-09-04,2021-11-02,59,Grassland,Rural,5,0.0847457627118644
Ellington,FL_RCREC_056 09/04/2021_2021,2021,27.3917046,-81.9210892,2021-09-04,2021-11-03,60,Grassland,Rural,7,0.116666666666667
Ellington,FL_RCREC_057 09/03/2021_2021,2021,27.3923969,-81.9234695,2021-09-03,2021-11-03,61,Grassland,Rural,36,0.59016393442623
Ellington,FL_RCREC_058 09/04/2021_2021,2021,27.3949223,-81.9222336,2021-09-04,2021-11-03,60,Grassland,Rural,5,0.0833333333333333
Ellington,FL_RCREC_060 09/04/2021_2021,2021,27.3937378,-81.9207535,2021-09-04,2021-11-03,60,Grassland,Rural,5,0.0833333333333333
Ellington,FL_RCREC_063 09/03/2021_2021,2021,27.3944016,-81.9166183,2021-09-03,2021-11-03,61,Grassland,Rural,6,0.0983606557377049
Ellington,FL_RCREC_065 09/03/2021_2021,2021,27.3925629,-81.9193649,2021-09-03,2021-11-03,61,Grassland,Rural,13,0.213114754098361
Ellington,FL_RCREC_066 09/03/2021_2021,2021,27.3895493,-81.9167709,2021-09-03,2021-11-03,61,Grassland,Rural,7,0.114754098360656
Ellington,FL_RCREC_067_2021,2021,27.3876419,-81.9184418,2021-09-03,2021-11-03,61,Grassland,Rural,8,0.131147540983607
Ellington,FL_RCREC_071 09/03/2021_2021,2021,27.3898239,-81.9203644,2021-09-03,2021-11-03,61,Grassland,Rural,3,0.0491803278688525
Ellington,FL_RCREC_072 09/03/2021_2021,2021,27.3883266,-81.9221268,2021-09-03,2021-11-03,61,Grassland,Rural,7,0.114754098360656
Ellington,FL_RCREC_073 09/03/2021_2021,2021,27.4008064,-81.9343262,2021-09-03,2021-11-03,61,Grassland,Rural,5,0.0819672131147541
Ellington,FL_RCREC_074 09/02/2021_2021,2021,27.4001999,-81.9297485,2021-09-02,2021-11-03,62,Grassland,Rural,5,0.0806451612903226
Ellington,FL_RCREC_075 09/02/2021_2021,2021,27.401865,-81.9352188,2021-09-02,2021-11-03,62,Grassland,Rural,6,0.0967741935483871
Ellington,FL_RCREC_076 09/02/2021_2021,2021,27.4019489,-81.9330597,2021-09-02,2021-11-03,62,Grassland,Rural,5,0.0806451612903226
Ellington,FL_RCREC_077 09/02/2021_2021,2021,27.4023876,-81.9305573,2021-09-02,2021-11-03,62,Grassland,Rural,5,0.0806451612903226
Ellington,FL_RCREC_078 10/04/2021_2021,2021,27.4001465,-81.932045,2021-10-04,2021-11-03,30,Grassland,Rural,10,0.333333333333333
Ellington,FL_RCREC_079 09/01/2021_2021,2021,27.4052315,-81.9300079,2021-09-01,2021-11-02,62,Grassland,Rural,6,0.0967741935483871
Ellington,FL_RCREC_080 09/01/2021_2021,2021,27.4079456,-81.9295197,2021-09-01,2021-11-02,62,Grassland,Rural,6,0.0967741935483871
Ellington,FL_RCREC_081 09/01/2021_2021,2021,27.406641,-81.9324722,2021-09-01,2021-10-18,47,Grassland,Rural,4,0.0851063829787234
Ellington,FL_RCREC_082 09/01/2021_2021,2021,27.4076424,-81.934433,2021-09-01,2021-11-03,63,Grassland,Rural,7,0.111111111111111
Ellington,FL_RCREC_084_2021,2021,27.4082394,-81.9320984,2021-09-01,2021-11-02,62,Grassland,Rural,5,0.0806451612903226
Ellington,FL_RCREC_086 09/03/2021_2021,2021,27.4094601,-81.9395828,2021-09-03,2021-11-02,60,Grassland,Rural,6,0.1
Ellington,FL_RCREC_087 09/03/2021_2021,2021,27.4066029,-81.9391479,2021-09-03,2021-11-02,60,Grassland,Rural,195,3.25
Ellington,FL_RCREC_090 09/03/2021_2021,2021,27.4064903,-81.936554,2021-09-03,2021-11-02,60,Grassland,Rural,10,0.166666666666667
Ellington,FL_RCREC_092 09/02/2021_2021,2021,27.400795,-81.9389343,2021-09-02,2021-11-03,62,Grassland,Rural,7,0.112903225806452
Ellington,FL_RCREC_093 09/02/2021_2021,2021,27.4032192,-81.9383774,2021-09-02,2021-11-03,62,Grassland,Rural,6,0.0967741935483871
Ellington,FL_RCREC_094 09/02/2021_2021,2021,27.4014893,-81.9372482,2021-09-02,2021-11-03,62,Grassland,Rural,8,0.129032258064516
Ellington,FL_RCREC_11 09/01/2023_2023,2023,27.4105339,-81.9553452,2023-09-02,2023-10-31,59,Grassland,Rural,1,0.0169491525423729
CrocLake,FL_Wild_CrocLake_23.1 09/01/2023_2023,2023,25.26931,-80.3071,2023-10-17,2023-11-02,16,Forest,Wild,2,0.125
Weigel,GA_Anthropogenic_Weigel_23_loc01_dep01_2023,2023,33.78035,-84.39727,2023-09-01,2023-09-13,12,Forest,Urban,2,0.166666666666667
Weigel,GA_Anthropogenic_Weigel_23_loc01_dep02_2023,2023,33.78035,-84.39727,2023-09-13,2023-09-14,1,Forest,Urban,2,2
Weigel,GA_Anthropogenic_Weigel_23_loc01_dep03_2023,2023,33.78035,-84.39727,2023-09-14,2023-09-27,13,Forest,Urban,1,0.0769230769230769
Weigel,GA_Anthropogenic_Weigel_23_loc01_dep04_2023,2023,33.78035,-84.39727,2023-09-27,2023-10-12,15,Forest,Urban,1,0.0666666666666667
Weigel,GA_Anthropogenic_Weigel_23_loc01_dep05_2023,2023,33.78035,-84.39727,2023-10-12,2023-10-26,14,Forest,Urban,3,0.214285714285714
Weigel,GA_Anthropogenic_Weigel_23_loc01_dep06_2023,2023,33.78035,-84.39727,2023-10-26,2023-11-08,13,Forest,Urban,1,0.0769230769230769
Weigel,GA_Anthropogenic_Weigel_23_loc02_dep01_2023,2023,33.7783,-84.40329,2023-09-01,2023-09-13,12,Forest,Urban,3,0.25
Weigel,GA_Anthropogenic_Weigel_23_loc02_dep02_2023,2023,33.7783,-84.40329,2023-09-13,2023-09-28,15,Forest,Urban,8,0.533333333333333
Weigel,GA_Anthropogenic_Weigel_23_loc02_dep03_2023,2023,33.7783,-84.40329,2023-09-28,2023-10-12,14,Forest,Urban,1,0.0714285714285714
Weigel,GA_Anthropogenic_Weigel_23_loc02_dep04_2023,2023,33.7783,-84.40329,2023-10-12,2023-10-26,14,Forest,Urban,2,0.142857142857143
Weigel,GA_Anthropogenic_Weigel_23_loc02_dep05_2023,2023,33.7783,-84.40329,2023-10-26,2023-11-08,13,Forest,Urban,3,0.230769230769231
Weigel,GA_Anthropogenic_Weigel_23_loc03_dep01_2023,2023,33.77343,-84.39575,2023-09-01,2023-09-13,12,Forest,Urban,2,0.166666666666667
Weigel,GA_Anthropogenic_Weigel_23_loc03_dep03_2023,2023,33.77343,-84.39575,2023-09-13,2023-10-12,29,Forest,Urban,4,0.137931034482759
Weigel,GA_Anthropogenic_Weigel_23_loc03_dep04_2023,2023,33.77343,-84.39575,2023-10-12,2023-10-22,10,Forest,Urban,1,0.1
Weigel,GA_Anthropogenic_Weigel_23_loc03_dep05_2023,2023,33.77343,-84.39575,2023-10-22,2023-11-09,18,Forest,Urban,6,0.333333333333333
Weigel,GA_Anthropogenic_Weigel_23_loc04_dep01_2023,2023,33.77343,-84.39575,2023-09-01,2023-09-13,12,Forest,Urban,2,0.166666666666667
Weigel,GA_Anthropogenic_Weigel_23_loc04_dep02_2023,2023,33.77206,-84.39402,2023-09-13,2023-09-27,14,Forest,Urban,1,0.0714285714285714
Weigel,GA_Anthropogenic_Weigel_23_loc04_dep03_2023,2023,33.77206,-84.39402,2023-09-27,2023-10-12,15,Forest,Urban,6,0.4
Weigel,GA_Anthropogenic_Weigel_23_loc04_dep04_2023,2023,33.77206,-84.39402,2023-10-12,2023-10-22,10,Forest,Urban,12,1.2
Weigel,GA_Anthropogenic_Weigel_23_loc04_dep05_2023,2023,33.77206,-84.39402,2023-10-22,2023-11-09,18,Forest,Urban,5,0.277777777777778
Weigel,GA_Anthropogenic_Weigel_23_loc05_dep01_2023,2023,33.77627,-84.39775,2023-09-01,2023-09-13,12,Forest,Urban,2,0.166666666666667
Weigel,GA_Anthropogenic_Weigel_23_loc05_dep02_2023,2023,33.77627,-84.39775,2023-09-13,2023-09-15,2,Forest,Urban,2,1
Weigel,GA_Anthropogenic_Weigel_23_loc05_dep03_2023,2023,33.77627,-84.39775,2023-09-15,2023-09-27,12,Forest,Urban,2,0.166666666666667
Weigel,GA_Anthropogenic_Weigel_23_loc05_dep04_2023,2023,33.77627,-84.39775,2023-09-27,2023-10-05,8,Forest,Urban,2,0.25
Weigel,GA_Anthropogenic_Weigel_23_loc05_dep05_2023,2023,33.77627,-84.39775,2023-10-06,2023-10-13,7,Forest,Urban,0,0
Weigel,GA_Anthropogenic_Weigel_23_loc05_dep06_2023,2023,33.77627,-84.39775,2023-10-13,2023-10-26,13,Forest,Urban,3,0.230769230769231
Weigel,GA_Anthropogenic_Weigel_23_loc05_dep07_2023,2023,33.77627,-84.39775,2023-10-26,2023-11-08,13,Forest,Urban,2,0.153846153846154
Weigel,GA_Anthropogenic_Weigel_23_loc06_dep01_2023,2023,33.77774,-84.40057,2023-09-06,2023-09-07,1,Forest,Urban,2,2
Weigel,GA_Anthropogenic_Weigel_23_loc06_dep02_2023,2023,33.77774,-84.40057,2023-09-07,2023-09-28,21,Forest,Urban,2,0.0952380952380952
Weigel,GA_Anthropogenic_Weigel_23_loc06_dep03_2023,2023,33.77774,-84.40057,2023-09-28,2023-10-12,14,Forest,Urban,2,0.142857142857143
Weigel,GA_Anthropogenic_Weigel_23_loc06_dep04_2023,2023,33.77774,-84.40057,2023-10-12,2023-10-26,14,Forest,Urban,2,0.142857142857143
Weigel,GA_Anthropogenic_Weigel_23_loc06_dep05_2023,2023,33.77774,-84.40057,2023-10-26,2023-11-07,12,Forest,Urban,2,0.166666666666667
Weigel,GA_Anthropogenic_Weigel_23_loc07B_dep01_2023,2023,33.77975,-84.40171,2023-09-18,2023-10-02,14,Forest,Urban,1,0.0714285714285714
Weigel,GA_Anthropogenic_Weigel_23_loc07B_dep02_2023,2023,33.77975,-84.40171,2023-10-02,2023-10-20,18,Forest,Urban,5,0.277777777777778
Weigel,GA_Anthropogenic_Weigel_23_loc07B_dep03_2023,2023,33.77975,-84.40171,2023-10-20,2023-11-09,20,Forest,Urban,5,0.25
Weigel,GA_Anthropogenic_Weigel_23_loc08B_dep01_2023,2023,33.777964,-84.397908,2023-09-07,2023-09-27,20,Forest,Urban,24,1.2
Weigel,GA_Anthropogenic_Weigel_23_loc08B_dep02_2023,2023,33.777964,-84.397908,2023-09-28,2023-10-16,18,Forest,Urban,4,0.222222222222222
Weigel,GA_Anthropogenic_Weigel_23_loc08B_dep03_2023,2023,33.777964,-84.397908,2023-10-17,2023-11-08,22,Forest,Urban,1,0.0454545454545455
Weigel,GA_Anthropogenic_Weigel_23_loc09B_dep01_2023,2023,33.77719,-84.40595,2023-09-28,2023-10-22,24,Forest,Urban,3,0.125
Weigel,GA_Anthropogenic_Weigel_23_loc09B_dep02_2023,2023,33.77719,-84.40595,2023-10-22,2023-11-08,17,Forest,Urban,1,0.0588235294117647
Weigel,GA_Anthropogenic_Weigel_23_loc10_dep01_2023,2023,33.77457096,-84.39234832,2023-09-08,2023-11-09,62,Forest,Urban,27,0.435483870967742
Weigel,GA_Anthropogenic_Weigel_23_loc11B_dep01_2023,2023,33.77946,-84.39958,2023-09-14,2023-09-28,14,Forest,Urban,3,0.214285714285714
Weigel,GA_Anthropogenic_Weigel_23_loc11B_dep02_2023,2023,33.77946,-84.39958,2023-09-29,2023-10-12,13,Forest,Urban,1,0.0769230769230769
Weigel,GA_Anthropogenic_Weigel_23_loc11B_dep03_2023,2023,33.77946,-84.39958,2023-10-12,2023-10-26,14,Forest,Urban,1,0.0714285714285714
Weigel,GA_Anthropogenic_Weigel_23_loc11B_dep04_2023,2023,33.77946,-84.39958,2023-10-26,2023-11-08,13,Forest,Urban,1,0.0769230769230769
Weigel,GA_Anthropogenic_Weigel_23_loc11_dep01_2023,2023,33.7792,-84.39963,2023-09-10,2023-09-15,5,Forest,Urban,3,0.6
Weigel,GA_Anthropogenic_Weigel_23_loc12B_dep01_2023,2023,33.77842,-84.39572,2023-09-15,2023-09-28,13,Forest,Urban,4,0.307692307692308
Weigel,GA_Anthropogenic_Weigel_23_loc12B_dep02_2023,2023,33.77842,-84.39572,2023-09-28,2023-10-12,14,Forest,Urban,3,0.214285714285714
Weigel,GA_Anthropogenic_Weigel_23_loc12B_dep03_2023,2023,33.77842,-84.39572,2023-10-12,2023-11-08,27,Forest,Urban,11,0.407407407407407
Weigel,GA_Anthropogenic_Weigel_23_loc12_dep01_2023,2023,33.7801,-84.3969,2023-09-08,2023-09-15,7,Forest,Urban,2,0.285714285714286
Weigel,GA_Anthropogenic_Weigel_23_loc13_dep01_2023,2023,33.782298,-84.440375,2023-09-13,2023-09-27,14,Forest,Urban,1,0.0714285714285714
Weigel,GA_Anthropogenic_Weigel_23_loc13_dep02_2023,2023,33.782298,-84.440375,2023-09-27,2023-10-19,22,Forest,Urban,4,0.181818181818182
Weigel,GA_Anthropogenic_Weigel_23_loc13_dep03_2023,2023,33.782298,-84.440375,2023-10-19,2023-11-14,26,Forest,Urban,1,0.0384615384615385
Weigel,GA_Anthropogenic_Weigel_23_loc14_dep01_2023,2023,33.807714,-84.358986,2023-09-13,2023-09-22,9,Forest,Urban,0,0
Weigel,GA_Anthropogenic_Weigel_23_loc14_dep02_2023,2023,33.807714,-84.358986,2023-09-22,2023-09-28,6,Forest,Urban,1,0.166666666666667
Weigel,GA_Anthropogenic_Weigel_23_loc14_dep03_2023,2023,33.807714,-84.358986,2023-09-29,2023-10-06,7,Forest,Urban,0,0
Weigel,GA_Anthropogenic_Weigel_23_loc14_dep04_2023,2023,33.807714,-84.358986,2023-10-06,2023-10-20,14,Forest,Urban,1,0.0714285714285714
Weigel,GA_Anthropogenic_Weigel_23_loc14_dep05_2023,2023,33.807714,-84.358986,2023-10-20,2023-11-03,14,Forest,Urban,1,0.0714285714285714
Weigel,GA_Anthropogenic_Weigel_23_loc15_dep01_2023,2023,33.808722,-84.352931,2023-09-13,2023-09-22,9,Forest,Urban,520,57.7777777777778
Weigel,GA_Anthropogenic_Weigel_23_loc15_dep02_2023,2023,33.808722,-84.352931,2023-09-22,2023-09-29,7,Forest,Urban,1,0.142857142857143
Weigel,GA_Anthropogenic_Weigel_23_loc15_dep03_2023,2023,33.808722,-84.352931,2023-09-29,2023-10-06,7,Forest,Urban,10,1.42857142857143
Weigel,GA_Anthropogenic_Weigel_23_loc15_dep04_2023,2023,33.808722,-84.352931,2023-10-06,2023-10-19,13,Forest,Urban,37,2.84615384615385
Weigel,GA_Anthropogenic_Weigel_23_loc15_dep05_2023,2023,33.808722,-84.352931,2023-10-20,2023-11-02,13,Forest,Urban,17,1.30769230769231
Weigel,GA_Anthropogenic_Weigel_23_loc16_dep01_2023,2023,33.785112,-84.360351,2023-09-13,2023-09-22,9,Forest,Urban,1,0.111111111111111
Weigel,GA_Anthropogenic_Weigel_23_loc16_dep02_2023,2023,33.785112,-84.360351,2023-09-22,2023-09-29,7,Forest,Urban,1,0.142857142857143
Weigel,GA_Anthropogenic_Weigel_23_loc16_dep03_2023,2023,33.785112,-84.360351,2023-09-29,2023-10-06,7,Forest,Urban,1,0.142857142857143
Weigel,GA_Anthropogenic_Weigel_23_loc16_dep04_2023,2023,33.785112,-84.360351,2023-10-06,2023-10-20,14,Forest,Urban,1,0.0714285714285714
Weigel,GA_Anthropogenic_Weigel_23_loc16_dep05_2023,2023,33.785112,-84.360351,2023-10-20,2023-11-03,14,Forest,Urban,2,0.142857142857143
Weigel,GA_Anthropogenic_Weigel_23_loc17_dep01_2023,2023,33.790953,-84.371922,2023-09-13,2023-09-22,9,Forest,Urban,2,0.222222222222222
Weigel,GA_Anthropogenic_Weigel_23_loc17_dep02_2023,2023,33.790953,-84.371922,2023-09-22,2023-09-29,7,Forest,Urban,4,0.571428571428571
Weigel,GA_Anthropogenic_Weigel_23_loc17_dep03_2023,2023,33.790953,-84.371922,2023-09-29,2023-10-06,7,Forest,Urban,1,0.142857142857143
Weigel,GA_Anthropogenic_Weigel_23_loc17_dep04_2023,2023,33.790953,-84.371922,2023-10-07,2023-10-20,13,Forest,Urban,4,0.307692307692308
Weigel,GA_Anthropogenic_Weigel_23_loc17_dep05_2023,2023,33.790953,-84.371922,2023-10-20,2023-11-03,14,Forest,Urban,1,0.0714285714285714
Weigel,GA_Anthropogenic_Weigel_23_loc18_dep01_2023,2023,33.78716,-84.37187,2023-09-13,2023-10-06,23,Forest,Urban,6,0.260869565217391
Weigel,GA_Anthropogenic_Weigel_23_loc18_dep02_2023,2023,33.78716,-84.37187,2023-10-09,2023-10-20,11,Forest,Urban,1,0.0909090909090909
Weigel,GA_Anthropogenic_Weigel_23_loc18_dep03_2023,2023,33.78716,-84.37187,2023-10-23,2023-11-03,11,Forest,Urban,3,0.272727272727273
Weigel,GA_Anthropogenic_Weigel_23_loc19_dep01_2023,2023,33.783744,-84.369684,2023-09-13,2023-10-06,23,Forest,Urban,407,17.695652173913
Weigel,GA_Anthropogenic_Weigel_23_loc20_dep01_2023,2023,33.78379,-84.37569,2023-09-13,2023-09-14,1,Forest,Urban,1,1
Weigel,GA_Anthropogenic_Weigel_23_loc20_dep02_2023,2023,33.78379,-84.37569,2023-09-30,2023-10-01,1,Forest,Urban,0,0
Weigel,GA_Anthropogenic_Weigel_23_loc21_dep01_2023,2023,33.7826,-84.37789,2023-09-14,2023-09-26,12,Forest,Urban,9,0.75
Weigel,GA_Anthropogenic_Weigel_23_loc21_dep02_2023,2023,33.7826,-84.37789,2023-09-26,2023-10-13,17,Forest,Urban,20,1.17647058823529
Weigel,GA_Anthropogenic_Weigel_23_loc21_dep03_2023,2023,33.7826,-84.37789,2023-10-13,2023-10-27,14,Forest,Urban,13,0.928571428571429
Weigel,GA_Anthropogenic_Weigel_23_loc22_dep01_2023,2023,33.77803,-84.38129,2023-09-13,2023-09-26,13,Forest,Urban,433,33.3076923076923
Weigel,GA_Anthropogenic_Weigel_23_loc22_dep02_2023,2023,33.77803,-84.38129,2023-09-26,2023-10-13,17,Forest,Urban,563,33.1176470588235
Weigel,GA_Anthropogenic_Weigel_23_loc22_dep03_2023,2023,33.77803,-84.38129,2023-10-13,2023-10-25,12,Forest,Urban,2,0.166666666666667
Weigel,GA_Anthropogenic_Weigel_23_loc23_dep01_2023,2023,33.7918,-84.377777,2023-09-13,2023-09-25,12,Forest,Urban,NA,NA
Weigel,GA_Anthropogenic_Weigel_23_loc23_dep03_2023,2023,33.7918,-84.377777,2023-10-14,2023-10-27,13,Forest,Urban,14,1.07692307692308
Weigel,GA_Anthropogenic_Weigel_23_loc24_dep01_2023,2023,33.79378,-84.3764216,2023-09-13,2023-09-26,13,Forest,Urban,43,3.30769230769231
Weigel,GA_Anthropogenic_Weigel_23_loc24_dep02_2023,2023,33.79378,-84.3764216,2023-09-26,2023-10-13,17,Forest,Urban,39,2.29411764705882
Weigel,GA_Anthropogenic_Weigel_23_loc24_dep03_2023,2023,33.79378,-84.3764216,2023-10-13,2023-10-27,14,Forest,Urban,34,2.42857142857143
Weigel,GA_Anthropogenic_Weigel_loc10_20220920_2022,2022,33.808459,-84.352694,2022-09-20,2022-10-02,12,Forest,Urban,2,0.166666666666667
Weigel,GA_Anthropogenic_Weigel_loc10_20221002_2022,2022,33.808459,-84.352694,2022-10-03,2022-10-13,10,Forest,Urban,1,0.1
Weigel,GA_Anthropogenic_Weigel_loc10_20221013_2022,2022,33.808459,-84.352694,2022-10-18,2022-10-26,8,Forest,Urban,1,0.125
Weigel,GA_Anthropogenic_Weigel_loc11_20220909_2022,2022,33.7792,-84.39963,2022-09-09,2022-10-06,27,Forest,Urban,7,0.259259259259259
Weigel,GA_Anthropogenic_Weigel_loc11_20221006_2022,2022,33.7792,-84.39963,2022-10-06,2022-10-20,14,Forest,Urban,1,0.0714285714285714
Weigel,GA_Anthropogenic_Weigel_loc11_20221020_2022,2022,33.7792,-84.39963,2022-10-20,2022-10-27,7,Forest,Urban,1,0.142857142857143
Weigel,GA_Anthropogenic_Weigel_loc11_20221027_2022,2022,33.7792,-84.39963,2022-10-27,2022-10-31,4,Forest,Urban,1,0.25
Weigel,GA_Anthropogenic_Weigel_loc12_20220923_2022,2022,33.78011,-84.39691,2022-09-21,2022-10-10,19,Forest,Urban,10,0.526315789473684
Weigel,GA_Anthropogenic_Weigel_loc12_20221010_2022,2022,33.78011,-84.39691,2022-10-10,2022-10-31,21,Forest,Urban,3,0.142857142857143
Weigel,GA_Anthropogenic_Weigel_loc13_20220913_2022,2022,33.77828,-84.40314,2022-09-14,2022-09-19,5,Forest,Urban,1,0.2
Weigel,GA_Anthropogenic_Weigel_loc13_20220919_2022,2022,33.77828,-84.40314,2022-09-19,2022-09-22,3,Forest,Urban,5,1.66666666666667
Weigel,GA_Anthropogenic_Weigel_loc13_20220923_2022,2022,33.77828,-84.40314,2022-09-25,2022-09-28,3,Forest,Urban,0,0
Weigel,GA_Anthropogenic_Weigel_loc13_20220929_2022,2022,33.77828,-84.40314,2022-10-04,2022-10-10,6,Forest,Urban,5,0.833333333333333
Weigel,GA_Anthropogenic_Weigel_loc13_20221010_2022,2022,33.77828,-84.40314,2022-10-10,2022-10-12,2,Forest,Urban,5,2.5
Weigel,GA_Anthropogenic_Weigel_loc13_20221025_2022,2022,33.77828,-84.40314,2022-10-25,2022-10-30,5,Forest,Urban,1,0.2
Weigel,GA_Anthropogenic_Weigel_loc14_20220912_2022,2022,33.77446,-84.39245,2022-09-12,2022-09-19,7,Forest,Urban,3,0.428571428571429
Weigel,GA_Anthropogenic_Weigel_loc14_20220919_2022,2022,33.77446,-84.39245,2022-09-19,2022-09-26,7,Forest,Urban,12,1.71428571428571
Weigel,GA_Anthropogenic_Weigel_loc14_20220926_2022,2022,33.77446,-84.39245,2022-09-26,2022-10-10,14,Forest,Urban,16,1.14285714285714
Weigel,GA_Anthropogenic_Weigel_loc14_20221010_2022,2022,33.77446,-84.39245,2022-10-10,2022-10-27,17,Forest,Urban,12,0.705882352941177
Weigel,GA_Anthropogenic_Weigel_loc14_20221027_2022,2022,33.77446,-84.39245,2022-10-27,2022-10-31,4,Forest,Urban,2,0.5
Weigel,GA_Anthropogenic_Weigel_loc15_20220922_2022,2022,33.776102,-84.397439,2022-09-22,2022-09-29,7,Forest,Urban,3,0.428571428571429
Weigel,GA_Anthropogenic_Weigel_loc15_20221007_2022,2022,33.776102,-84.397439,2022-10-07,2022-10-13,6,Forest,Urban,1,0.166666666666667
Weigel,GA_Anthropogenic_Weigel_loc15_20221013_2022,2022,33.776102,-84.397439,2022-10-13,2022-10-20,7,Forest,Urban,3,0.428571428571429
Weigel,GA_Anthropogenic_Weigel_loc15_20221020_2022,2022,33.776102,-84.397439,2022-10-20,2022-10-25,5,Forest,Urban,1,0.2
Weigel,GA_Anthropogenic_Weigel_loc15_20221025_2022,2022,33.776102,-84.397439,2022-10-25,2022-10-31,6,Forest,Urban,0,0
Weigel,GA_Anthropogenic_Weigel_loc16B_20221013_2022,2022,33.78352,-84.3741,2022-10-13,2022-10-22,9,Forest,Urban,41,4.55555555555556
Weigel,GA_Anthropogenic_Weigel_loc16B_20221022_2022,2022,33.78352,-84.3741,2022-10-22,2022-10-31,9,Forest,Urban,27,3
Weigel,GA_Anthropogenic_Weigel_loc16_20221003_2022,2022,33.78379,-84.37569,2022-10-03,2022-10-12,9,Forest,Urban,2,0.222222222222222
Weigel,GA_Anthropogenic_Weigel_loc17_20221010_2022,2022,33.77803,-84.40603,2022-10-10,2022-10-20,10,Forest,Urban,2,0.2
Weigel,GA_Anthropogenic_Weigel_loc17_20221020_2022,2022,33.77803,-84.40603,2022-10-20,2022-10-31,11,Forest,Urban,0,0
Weigel,GA_Anthropogenic_Weigel_loc18_20221006_2022,2022,33.782368,-84.440354,2022-10-06,2022-10-19,13,Forest,Urban,1,0.0769230769230769
Weigel,GA_Anthropogenic_Weigel_loc18_20221019_2022,2022,33.782368,-84.440354,2022-10-20,2022-10-27,7,Forest,Urban,1,0.142857142857143
Weigel,GA_Anthropogenic_Weigel_loc1B_20220926_2022,2022,33.79064,-84.38103,2022-09-26,2022-10-10,14,Forest,Urban,53,3.78571428571429
Weigel,GA_Anthropogenic_Weigel_loc1B_20221009_2022,2022,33.79064,-84.38103,2022-10-09,2022-10-30,21,Forest,Urban,168,8
Weigel,GA_Anthropogenic_Weigel_loc1_20220909_2022,2022,33.79036,-84.38129,2022-09-09,2022-09-19,10,Forest,Urban,166,16.6
Weigel,GA_Anthropogenic_Weigel_loc1_20220919_2022,2022,33.79036,-84.38129,2022-09-19,2022-09-26,7,Forest,Urban,251,35.8571428571429
Weigel,GA_Anthropogenic_Weigel_loc2_20220909_2022,2022,33.79181,-84.37777,2022-09-09,2022-09-19,10,Forest,Urban,19,1.9
Weigel,GA_Anthropogenic_Weigel_loc2_20220926_2022,2022,33.79181,-84.37777,2022-09-26,2022-10-09,13,Forest,Urban,32,2.46153846153846
Weigel,GA_Anthropogenic_Weigel_loc2_20221009_2022,2022,33.79181,-84.37777,2022-10-09,2022-10-31,22,Forest,Urban,40,1.81818181818182
Weigel,GA_Anthropogenic_Weigel_loc3_20220909_2022,2022,33.79378,-84.37642,2022-09-09,2022-09-19,10,Forest,Urban,32,3.2
Weigel,GA_Anthropogenic_Weigel_loc3_20220919_2022,2022,33.79378,-84.37642,2022-09-19,2022-09-28,9,Forest,Urban,43,4.77777777777778
Weigel,GA_Anthropogenic_Weigel_loc3_20220928_2022,2022,33.79378,-84.37642,2022-09-28,2022-10-10,12,Forest,Urban,47,3.91666666666667
Weigel,GA_Anthropogenic_Weigel_loc3_20221009_2022,2022,33.79378,-84.37642,2022-10-09,2022-10-31,22,Forest,Urban,104,4.72727272727273
Weigel,GA_Anthropogenic_Weigel_loc4_20220920_2022,2022,33.807875,-84.357862,2022-09-20,2022-10-02,12,Forest,Urban,7,0.583333333333333
Weigel,GA_Anthropogenic_Weigel_loc4_20221002_2022,2022,33.807875,-84.357862,2022-10-02,2022-10-13,11,Forest,Urban,13,1.18181818181818
Weigel,GA_Anthropogenic_Weigel_loc4_20221013_2022,2022,33.807875,-84.357862,2022-10-13,2022-10-26,13,Forest,Urban,3,0.230769230769231
Weigel,GA_Anthropogenic_Weigel_loc4_20221026_2022,2022,33.807875,-84.357862,2022-10-26,2022-10-31,5,Forest,Urban,0,0
Weigel,GA_Anthropogenic_Weigel_loc5_20220915_2022,2022,33.7826,-84.37789,2022-09-15,2022-09-22,7,Forest,Urban,85,12.1428571428571
Weigel,GA_Anthropogenic_Weigel_loc5_20220922_2022,2022,33.7826,-84.37789,2022-09-22,2022-10-09,17,Forest,Urban,76,4.47058823529412
Weigel,GA_Anthropogenic_Weigel_loc5_20221025_2022,2022,33.7826,-84.37789,2022-10-25,2022-10-28,3,Forest,Urban,2,0.666666666666667
Weigel,GA_Anthropogenic_Weigel_loc6B_20221013_2022,2022,33.7877,-84.37181,2022-10-13,2022-10-22,9,Forest,Urban,2,0.222222222222222
Weigel,GA_Anthropogenic_Weigel_loc6b_20221022_2022,2022,33.7877,-84.37181,2022-10-22,2022-11-02,11,Forest,Urban,0,0
Weigel,GA_Anthropogenic_Weigel_loc8B_20220922_2022,2022,33.7837,-84.369141,2022-09-23,2022-10-03,10,Forest,Urban,1,0.1
Weigel,GA_Anthropogenic_Weigel_loc8B_20221003_2022,2022,33.7837,-84.369141,2022-10-03,2022-10-13,10,Forest,Urban,2,0.2
Weigel,GA_Anthropogenic_Weigel_loc8B_20221013_2022,2022,33.7837,-84.369141,2022-10-14,2022-10-22,8,Forest,Urban,1,0.125
Weigel,GA_Anthropogenic_Weigel_loc8B_20221022_2022,2022,33.7837,-84.369141,2022-10-22,2022-10-31,9,Forest,Urban,0,0
Weigel,GA_Anthropogenic_Weigel_loc8_20220915_2022,2022,33.78374,-84.36963,2022-09-15,2022-09-22,7,Forest,Urban,15,2.14285714285714
Weigel,GA_Anthropogenic_Weigel_loc9_20220918_2022,2022,33.785123,-84.360431,2022-09-18,2022-09-27,9,Forest,Urban,12,1.33333333333333
Weigel,GA_Anthropogenic_Weigel_loc9_20220927_2022,2022,33.785123,-84.360431,2022-09-27,2022-10-10,13,Forest,Urban,3,0.230769230769231
Weigel,GA_Anthropogenic_Weigel_loc9_20221010_2022,2022,33.785123,-84.360431,2022-10-10,2022-10-26,16,Forest,Urban,0,0
Weigel,GA_Anthropogenic_Weigel_loc9_20221027_2022,2022,33.785123,-84.360431,2022-10-27,2022-10-31,4,Forest,Urban,0,0
Carrollton,GA_Forest_Carrollton_13_2019,2019,33.56447,-85.07752,2019-08-28,2019-09-29,32,Forest,Suburban,6,0.1875
Carrollton,GA_Forest_Carrollton_15_2019,2019,33.56308,-85.07727,2019-10-05,2019-11-14,40,Forest,Suburban,5,0.125
Carrollton,GA_Forest_Carrollton_1_2019,2019,33.56521,-85.08982,2019-08-29,2019-11-08,71,Forest,Suburban,42,0.591549295774648
Carrollton,GA_Forest_Carrollton_20_01_2020,2020,33.56521,-85.0898,2020-10-17,2020-10-31,14,Forest,Suburban,2,0.142857142857143
Carrollton,GA_Forest_Carrollton_20_03_2020,2020,33.5642,-85.0875,2020-09-30,2020-10-15,15,Forest,Suburban,4,0.266666666666667
Carrollton,GA_Forest_Carrollton_20_05_2020,2020,33.56451,-85.08649,2020-10-20,2020-11-03,14,Forest,Suburban,2,0.142857142857143
Carrollton,GA_Forest_Carrollton_20_07_2020,2020,33.5639,-85.08424,2020-10-20,2020-11-04,15,Forest,Suburban,8,0.533333333333333
Carrollton,GA_Forest_Carrollton_20_11_2020,2020,33.56314,-85.07927,2020-10-16,2020-10-30,14,Forest,Suburban,3,0.214285714285714
Carrollton,GA_Forest_Carrollton_20_13_2020,2020,33.56432,-85.07737,2020-10-15,2020-10-29,14,Forest,Suburban,2,0.142857142857143
Carrollton,GA_Forest_Carrollton_20_16_2020,2020,33.571709,-85.105339,2020-09-15,2020-09-29,14,Forest,Suburban,2,0.142857142857143
Carrollton,GA_Forest_Carrollton_20_19_2020,2020,33.57386,-85.10627,2020-09-15,2020-09-28,13,Forest,Suburban,0,0
Carrollton,GA_Forest_Carrollton_20_20_2020,2020,33.578360000000004,-85.10055,2020-09-14,2020-09-28,14,Forest,Suburban,6,0.428571428571429
Carrollton,GA_Forest_Carrollton_20_21_2020,2020,33.56969,-85.1071,2020-09-19,2020-09-29,10,Forest,Suburban,1,0.1
Carrollton,GA_Forest_Carrollton_20_23_2020,2020,33.57283,-85.11221,2020-10-16,2020-10-30,14,Forest,Suburban,3,0.214285714285714
Carrollton,GA_Forest_Carrollton_20_24_2020,2020,33.57456,-85.11113,2020-09-16,2020-10-02,16,Forest,Suburban,2,0.125
Carrollton,GA_Forest_Carrollton_20_25_2020,2020,33.576462,-85.112193,2020-10-04,2020-10-20,16,Forest,Suburban,4,0.25
Carrollton,GA_Forest_Carrollton_20_26_2020,2020,33.57717,-85.10961,2020-10-31,2020-11-13,13,Forest,Suburban,2,0.153846153846154
Carrollton,GA_Forest_Carrollton_20_27_2020,2020,33.576892,-85.106577,2020-10-03,2020-10-18,15,Forest,Suburban,28,1.86666666666667
Carrollton,GA_Forest_Carrollton_20_29_2020,2020,33.578,-85.113,2020-10-17,2020-11-02,16,Forest,Suburban,4,0.25
Carrollton,GA_Forest_Carrollton_20_30_2020,2020,33.57529,-85.11815,2020-09-30,2020-10-14,14,Forest,Suburban,2,0.142857142857143
Carrollton,GA_Forest_Carrollton_20_31_2020,2020,33.573746,-85.119974,2020-10-02,2020-10-16,14,Forest,Suburban,1,0.0714285714285714
Carrollton,GA_Forest_Carrollton_20_32_2020,2020,33.575799,-85.120836,2020-10-08,2020-10-15,7,Forest,Suburban,2,0.285714285714286
Carrollton,GA_Forest_Carrollton_20_34_2020,2020,33.504313,-85.168454,2020-10-19,2020-11-02,14,Forest,Suburban,2,0.142857142857143
Carrollton,GA_Forest_Carrollton_20_35_2020,2020,33.58255,-85.09905,2020-10-01,2020-10-15,14,Forest,Suburban,4,0.285714285714286
Carrollton,GA_Forest_Carrollton_20_36_2020,2020,33.5835,-85.1013,2020-10-16,2020-10-30,14,Forest,Suburban,3,0.214285714285714
Carrollton,GA_Forest_Carrollton_20_37_2020,2020,33.58583,-85.10293,2020-10-20,2020-10-31,11,Forest,Suburban,0,0
Carrollton,GA_Forest_Carrollton_20_38_2020,2020,33.5723,-85.1026,2020-10-19,2020-11-02,14,Forest,Suburban,2,0.142857142857143
Carrollton,GA_Forest_Carrollton_20_39_2020,2020,33.57089,-85.1086,2020-10-02,2020-10-16,14,Forest,Suburban,63,4.5
Carrollton,GA_Forest_Carrollton_20_40_2020,2020,33.56191,-85.10983,2020-10-21,2020-11-03,13,Forest,Suburban,6,0.461538461538462
Carrollton,GA_Forest_Carrollton_20_41_2020,2020,33.57059,-85.10296,2020-10-20,2020-11-04,15,Forest,Suburban,10,0.666666666666667
Carrollton,GA_Forest_Carrollton_21_dep_1 10/13/2021_2021,2021,33.565029,-85.08952,2021-10-13,2021-10-27,14,Forest,Suburban,2,0.142857142857143
Carrollton,GA_Forest_Carrollton_21_dep_11 10/13/2021_2021,2021,33.562988,-85.079653,2021-10-13,2021-10-27,14,Forest,Suburban,2,0.142857142857143
Carrollton,GA_Forest_Carrollton_21_dep_13 10/27/2021_2021,2021,33.564562,-85.076993,2021-10-27,2021-11-10,14,Forest,Suburban,7,0.5
Carrollton,GA_Forest_Carrollton_21_dep_16 10/27/2021_2021,2021,33.571698,-85.105345,2021-10-27,2021-11-10,14,Forest,Suburban,2,0.142857142857143
Carrollton,GA_Forest_Carrollton_21_dep_17 09/01/2021_2021,2021,33.573876,-85.101393,2021-09-01,2021-09-15,14,Forest,Suburban,2,0.142857142857143
Carrollton,GA_Forest_Carrollton_21_dep_18 09/01/2021_2021,2021,33.571352,-85.100739,2021-09-01,2021-09-15,14,Forest,Suburban,2,0.142857142857143
Carrollton,GA_Forest_Carrollton_21_dep_19 09/01/2021_2021,2021,33.574066,-85.106596,2021-09-01,2021-09-15,14,Forest,Suburban,4,0.285714285714286
Carrollton,GA_Forest_Carrollton_21_dep_20 10/13/2021_2021,2021,33.577888,-85.100903,2021-10-13,2021-10-27,14,Forest,Suburban,4,0.285714285714286
Carrollton,GA_Forest_Carrollton_21_dep_21 09/01/2021_2021,2021,33.570154,-85.107157,2021-09-01,2021-09-15,14,Forest,Suburban,2,0.142857142857143
Carrollton,GA_Forest_Carrollton_21_dep_22 09/01/2021_2021,2021,33.570806,-85.111217,2021-09-01,2021-09-15,14,Forest,Suburban,2,0.142857142857143
Carrollton,GA_Forest_Carrollton_21_dep_23 09/01/2021_2021,2021,33.572823,-85.112068,2021-09-01,2021-09-15,14,Forest,Suburban,3,0.214285714285714
Carrollton,GA_Forest_Carrollton_21_dep_24 09/01/2021_2021,2021,33.574433,-85.111054,2021-09-01,2021-09-15,14,Forest,Suburban,2,0.142857142857143
Carrollton,GA_Forest_Carrollton_21_dep_25 09/15/2021_2021,2021,33.576495,-85.112381,2021-09-15,2021-09-29,14,Forest,Suburban,2,0.142857142857143
Carrollton,GA_Forest_Carrollton_21_dep_26 09/29/2021_2021,2021,33.57731,-85.110012,2021-09-29,2021-10-13,14,Forest,Suburban,2,0.142857142857143
Carrollton,GA_Forest_Carrollton_21_dep_27 09/29/2021_2021,2021,33.576892,-85.1069359,2021-09-29,2021-10-13,14,Forest,Suburban,2,0.142857142857143
Carrollton,GA_Forest_Carrollton_21_dep_28 09/15/2021_2021,2021,33.577299,-85.104454,2021-09-15,2021-09-29,14,Forest,Suburban,3,0.214285714285714
Carrollton,GA_Forest_Carrollton_21_dep_29 09/15/2021_2021,2021,33.578925,-85.11387,2021-09-15,2021-09-29,14,Forest,Suburban,2,0.142857142857143
Carrollton,GA_Forest_Carrollton_21_dep_3 10/27/2021_2021,2021,33.564531,-85.087659,2021-10-27,2021-11-10,14,Forest,Suburban,2,0.142857142857143
Carrollton,GA_Forest_Carrollton_21_dep_30 09/15/2021_2021,2021,33.57529,-85.118155,2021-09-15,2021-09-29,14,Forest,Suburban,2,0.142857142857143
Carrollton,GA_Forest_Carrollton_21_dep_31 09/15/2021_2021,2021,33.573971,-85.119162,2021-09-15,2021-09-29,14,Forest,Suburban,3,0.214285714285714
Carrollton,GA_Forest_Carrollton_21_dep_32 09/17/2021_2021,2021,33.576552,-85.12089,2021-09-17,2021-09-29,12,Forest,Suburban,2,0.166666666666667
Carrollton,GA_Forest_Carrollton_21_dep_33 09/17/2021_2021,2021,33.577609,-85.121445,2021-09-15,2021-09-29,14,Forest,Suburban,7,0.5
Carrollton,GA_Forest_Carrollton_21_dep_34 09/29/2021_2021,2021,33.50351,-85.167968,2021-10-13,2021-10-27,14,Forest,Suburban,2,0.142857142857143
Carrollton,GA_Forest_Carrollton_21_dep_35 10/27/2021_2021,2021,33.582587,-85.098994,2021-10-27,2021-11-10,14,Forest,Suburban,2,0.142857142857143
Carrollton,GA_Forest_Carrollton_21_dep_36 09/29/2021_2021,2021,33.583558,-85.101337,2021-09-29,2021-10-13,14,Forest,Suburban,1,0.0714285714285714
Carrollton,GA_Forest_Carrollton_21_dep_37 10/27/2021_2021,2021,33.585534,-85.10278,2021-09-29,2021-10-13,14,Forest,Suburban,3,0.214285714285714
Carrollton,GA_Forest_Carrollton_21_dep_38 09/01/2021_2021,2021,33.57258,-85.102829,2021-09-01,2021-09-15,14,Forest,Suburban,3,0.214285714285714
Carrollton,GA_Forest_Carrollton_21_dep_39 09/01/2021_2021,2021,33.571316,-85.108909,2021-09-01,2021-09-15,14,Forest,Suburban,3,0.214285714285714
Carrollton,GA_Forest_Carrollton_21_dep_40 10/13/2021_2021,2021,33.562025,-85.109395,2021-10-13,2021-10-27,14,Forest,Suburban,2,0.142857142857143
Carrollton,GA_Forest_Carrollton_21_dep_41 10/13/2021_2021,2021,33.57068,-85.1031,2021-10-13,2021-10-27,14,Forest,Suburban,2,0.142857142857143
Carrollton,GA_Forest_Carrollton_21_dep_42 10/27/2021_2021,2021,33.5764625,-85.1159002,2021-10-27,2021-11-10,14,Forest,Suburban,2,0.142857142857143
Carrollton,GA_Forest_Carrollton_21_dep_5 09/29/2021_2021,2021,33.564541,-85.085959,2021-09-29,2021-10-08,9,Forest,Suburban,40,4.44444444444444
Carrollton,GA_Forest_Carrollton_21_dep_7 09/29/2021_2021,2021,33.563999,-85.08383,2021-09-29,2021-10-13,14,Forest,Suburban,2,0.142857142857143
Carrollton,GA_Forest_Carrollton_22_dep_1 10/26/2022_2022,2022,33.56498,-85.090061,2022-10-26,2022-11-03,8,Forest,Suburban,1,0.125
Carrollton,GA_Forest_Carrollton_22_dep_11 10/12/2022_2022,2022,33.563618,-85.078123,2022-10-12,2022-10-26,14,Forest,Suburban,5,0.357142857142857
Carrollton,GA_Forest_Carrollton_22_dep_13 10/26/2022_2022,2022,33.564566,-85.077476,2022-10-26,2022-11-09,14,Forest,Suburban,2,0.142857142857143
Carrollton,GA_Forest_Carrollton_22_dep_16 08/31/2022_2022,2022,33.57172,-85.10555,2022-08-31,2022-09-14,14,Forest,Suburban,3,0.214285714285714
Carrollton,GA_Forest_Carrollton_22_dep_17 10/26/2022_2022,2022,33.574041,-85.101594,2022-10-27,2022-11-09,13,Forest,Suburban,1,0.0769230769230769
Carrollton,GA_Forest_Carrollton_22_dep_18 08/31/2022_2022,2022,33.57131,-85.10078,2022-08-31,2022-09-14,14,Forest,Suburban,3,0.214285714285714
Carrollton,GA_Forest_Carrollton_22_dep_19 09/14/2022_2022,2022,33.57482,-85.10651,2022-09-14,2022-09-28,14,Forest,Suburban,8,0.571428571428571
Carrollton,GA_Forest_Carrollton_22_dep_20 09/14/2022_2022,2022,33.57834,-85.1011,2022-09-14,2022-09-28,14,Forest,Suburban,2,0.142857142857143
Carrollton,GA_Forest_Carrollton_22_dep_21 09/14/2022_2022,2022,33.569844,-85.106894,2022-09-14,2022-09-28,14,Forest,Suburban,8,0.571428571428571
Carrollton,GA_Forest_Carrollton_22_dep_22 08/31/2022_2022,2022,33.570657,-85.111899,2022-08-31,2022-09-14,14,Forest,Suburban,4,0.285714285714286
Carrollton,GA_Forest_Carrollton_22_dep_23 08/31/2022_2022,2022,33.572714,-85.111865,2022-08-31,2022-09-14,14,Forest,Suburban,2,0.142857142857143
Carrollton,GA_Forest_Carrollton_22_dep_24 09/14/2022_2022,2022,33.574348,-85.111125,2022-09-14,2022-09-28,14,Forest,Suburban,7,0.5
Carrollton,GA_Forest_Carrollton_22_dep_25 08/31/2022_2022,2022,33.576372,-85.112188,2022-09-14,2022-09-28,14,Forest,Suburban,5,0.357142857142857
Carrollton,GA_Forest_Carrollton_22_dep_26 09/28/2022_2022,2022,33.576968,-85.109295,2022-09-28,2022-10-12,14,Forest,Suburban,11,0.785714285714286
Carrollton,GA_Forest_Carrollton_22_dep_27 10/12/2022_2022,2022,33.576731,-85.105622,2022-10-12,2022-10-26,14,Forest,Suburban,14,1
Carrollton,GA_Forest_Carrollton_22_dep_28 09/28/2022_2022,2022,33.577524,-85.104367,2022-09-28,2022-10-12,14,Forest,Suburban,6,0.428571428571429
Carrollton,GA_Forest_Carrollton_22_dep_29 09/28/2022_2022,2022,33.57874,-85.113679,2022-09-28,2022-10-12,14,Forest,Suburban,5,0.357142857142857
Carrollton,GA_Forest_Carrollton_22_dep_3 09/28/2022_2022,2022,33.56494,-85.08821,2022-09-28,2022-10-17,19,Forest,Suburban,7,0.368421052631579
Carrollton,GA_Forest_Carrollton_22_dep_30 08/31/2022_2022,2022,33.575092,-85.118096,2022-08-31,2022-09-14,14,Forest,Suburban,10,0.714285714285714
Carrollton,GA_Forest_Carrollton_22_dep_31 09/14/2022_2022,2022,33.574009,-85.119986,2022-09-14,2022-09-28,14,Forest,Suburban,2,0.142857142857143
Carrollton,GA_Forest_Carrollton_22_dep_32 08/31/2022_2022,2022,33.57568,-85.120627,2022-08-31,2022-09-14,14,Forest,Suburban,2,0.142857142857143
Carrollton,GA_Forest_Carrollton_22_dep_33 09/14/2022_2022,2022,33.577834,-85.122396,2022-09-14,2022-09-28,14,Forest,Suburban,2,0.142857142857143
Carrollton,GA_Forest_Carrollton_22_dep_34 10/26/2022_2022,2022,33.50398,-85.16722,2022-10-26,2022-11-09,14,Forest,Suburban,3,0.214285714285714
Carrollton,GA_Forest_Carrollton_22_dep_35 10/12/2022_2022,2022,33.5822077,-85.0997188,2022-10-12,2022-10-26,14,Forest,Suburban,4,0.285714285714286
Carrollton,GA_Forest_Carrollton_22_dep_36 09/28/2022_2022,2022,33.58379,-85.10143,2022-09-28,2022-10-12,14,Forest,Suburban,2,0.142857142857143
Carrollton,GA_Forest_Carrollton_22_dep_37 10/26/2022_2022,2022,33.585625,-85.10282,2022-10-26,2022-11-09,14,Forest,Suburban,2,0.142857142857143
Carrollton,GA_Forest_Carrollton_22_dep_38 10/26/2022_2022,2022,33.572453,-85.102776,2022-10-26,2022-11-09,14,Forest,Suburban,6,0.428571428571429
Carrollton,GA_Forest_Carrollton_22_dep_39 09/14/2022_2022,2022,33.571279,-85.1086844,2022-09-14,2022-09-28,14,Forest,Suburban,19,1.35714285714286
Carrollton,GA_Forest_Carrollton_22_dep_40 10/12/2022_2022,2022,33.562053,-85.109659,2022-10-12,2022-10-26,14,Forest,Suburban,2,0.142857142857143
Carrollton,GA_Forest_Carrollton_22_dep_41 10/26/2022_2022,2022,33.57093,-85.103059,2022-10-26,2022-11-09,14,Forest,Suburban,11,0.785714285714286
Carrollton,GA_Forest_Carrollton_22_dep_42 10/26/2022_2022,2022,33.5766497,-85.1156028,2022-10-26,2022-11-09,14,Forest,Suburban,3,0.214285714285714
Carrollton,GA_Forest_Carrollton_22_dep_5 10/12/2022_2022,2022,33.564442,-85.085525,2022-10-12,2022-10-26,14,Forest,Suburban,2,0.142857142857143
Carrollton,GA_Forest_Carrollton_22_dep_7 10/12/2022_2022,2022,33.56348,-85.08396,2022-10-12,2022-10-26,14,Forest,Suburban,2,0.142857142857143
Carrollton,GA_Forest_Carrollton_22_dep_9 10/26/2022_2022,2022,33.561734,-85.077494,2022-10-26,2022-11-09,14,Forest,Suburban,3,0.214285714285714
Carrollton,GA_Forest_Carrollton_23_loc_1 09/27/2023_2023,2023,33.5649,-85.0904,2023-09-27,2023-10-11,14,Forest,Suburban,3,0.214285714285714
Carrollton,GA_Forest_Carrollton_23_loc_11 10/11/2023_2023,2023,33.562969,-85.079895,2023-10-11,2023-10-25,14,Forest,Suburban,4,0.285714285714286
Carrollton,GA_Forest_Carrollton_23_loc_13 10/11/2023_2023,2023,33.56453,-85.07748,2023-10-11,2023-10-25,14,Forest,Suburban,1,0.0714285714285714
Carrollton,GA_Forest_Carrollton_23_loc_16 10/02/2023_2023,2023,33.57169,-85.10548,2023-10-03,2023-10-16,13,Forest,Suburban,1,0.0769230769230769
Carrollton,GA_Forest_Carrollton_23_loc_17 08/30/2023_2023,2023,33.57398,-85.101705,2023-08-30,2023-09-13,14,Forest,Suburban,2,0.142857142857143
Carrollton,GA_Forest_Carrollton_23_loc_18 10/02/2023_2023,2023,33.571244,-85.100609,2023-10-02,2023-10-16,14,Forest,Suburban,2,0.142857142857143
Carrollton,GA_Forest_Carrollton_23_loc_19 10/02/2023_2023,2023,33.574158,-85.106596,2023-10-02,2023-10-16,14,Forest,Suburban,2,0.142857142857143
Carrollton,GA_Forest_Carrollton_23_loc_20 09/27/2023_2023,2023,33.578263,-85.101279,2023-09-27,2023-10-11,14,Forest,Suburban,3,0.214285714285714
Carrollton,GA_Forest_Carrollton_23_loc_21 10/11/2023_2023,2023,33.57012,-85.10725,2023-10-11,2023-10-25,14,Forest,Suburban,2,0.142857142857143
Carrollton,GA_Forest_Carrollton_23_loc_22 08/30/2023_2023,2023,33.570612,-85.11186,2023-08-30,2023-09-13,14,Forest,Suburban,2,0.142857142857143
Carrollton,GA_Forest_Carrollton_23_loc_23 08/30/2023_2023,2023,33.57244,-85.11223,2023-08-30,2023-09-13,14,Forest,Suburban,3,0.214285714285714
Carrollton,GA_Forest_Carrollton_23_loc_24 08/31/2023_2023,2023,33.57416,-85.11129,2023-08-30,2023-09-13,14,Forest,Suburban,2,0.142857142857143
Carrollton,GA_Forest_Carrollton_23_loc_25 11/03/2023_2023,2023,33.576406,-85.111991,2023-11-03,2023-11-15,12,Forest,Suburban,2,0.166666666666667
Carrollton,GA_Forest_Carrollton_23_loc_26 09/13/2023_2023,2023,33.57723,-85.10972,2023-09-13,2023-09-27,14,Forest,Suburban,4,0.285714285714286
Carrollton,GA_Forest_Carrollton_23_loc_27 10/11/2023_2023,2023,33.576892,-85.106582,2023-10-11,2023-10-25,14,Forest,Suburban,2,0.142857142857143
Carrollton,GA_Forest_Carrollton_23_loc_28 09/27/2023_2023,2023,33.577248,-85.104814,2023-09-27,2023-10-11,14,Forest,Suburban,3,0.214285714285714
Carrollton,GA_Forest_Carrollton_23_loc_29 10/11/2023_2023,2023,33.578429,-85.113731,2023-10-11,2023-10-25,14,Forest,Suburban,2,0.142857142857143
Carrollton,GA_Forest_Carrollton_23_loc_3 09/27/2023_2023,2023,33.5644,-85.0881,2023-09-27,2023-10-11,14,Forest,Suburban,1,0.0714285714285714
Carrollton,GA_Forest_Carrollton_23_loc_30 09/13/2023_2023,2023,33.575084,-85.118399,2023-09-13,2023-09-27,14,Forest,Suburban,2,0.142857142857143
Carrollton,GA_Forest_Carrollton_23_loc_31 09/13/2023_2023,2023,33.573606,-85.120363,2023-09-13,2023-09-27,14,Forest,Suburban,4,0.285714285714286
Carrollton,GA_Forest_Carrollton_23_loc_32 09/13/2023_2023,2023,33.57576,-85.120901,2023-09-13,2023-09-27,14,Forest,Suburban,4,0.285714285714286
Carrollton,GA_Forest_Carrollton_23_loc_33 09/13/2023_2023,2023,33.577711,-85.12253,2023-09-13,2023-09-27,14,Forest,Suburban,3,0.214285714285714
Carrollton,GA_Forest_Carrollton_23_loc_35 11/03/2023_2023,2023,33.5822607,-85.0990908,2023-11-03,2023-11-16,13,Forest,Suburban,2,0.153846153846154
Carrollton,GA_Forest_Carrollton_23_loc_36 11/03/2023_2023,2023,33.5836995,-85.1013559,2023-11-03,2023-11-16,13,Forest,Suburban,2,0.153846153846154
Carrollton,GA_Forest_Carrollton_23_loc_37 11/03/2023_2023,2023,33.5855379,-85.1028419,2023-11-03,2023-11-16,13,Forest,Suburban,2,0.153846153846154
Carrollton,GA_Forest_Carrollton_23_loc_38 10/02/2023_2023,2023,33.57236,-85.103007,2023-10-02,2023-10-16,14,Forest,Suburban,2,0.142857142857143
Carrollton,GA_Forest_Carrollton_23_loc_39 10/11/2023_2023,2023,33.57143,-85.10851,2023-10-11,2023-10-25,14,Forest,Suburban,26,1.85714285714286
Carrollton,GA_Forest_Carrollton_23_loc_40 09/27/2023_2023,2023,33.561984,-85.109479,2023-09-27,2023-10-11,14,Forest,Suburban,4,0.285714285714286
Carrollton,GA_Forest_Carrollton_23_loc_41 10/02/2023_2023,2023,33.570781,-85.103152,2023-10-02,2023-10-16,14,Forest,Suburban,2,0.142857142857143
Carrollton,GA_Forest_Carrollton_23_loc_42 11/03/2023_2023,2023,33.576524,-85.115864,2023-11-03,2023-11-15,12,Forest,Suburban,2,0.166666666666667
Carrollton,GA_Forest_Carrollton_23_loc_43 10/16/2023_2023,2023,33.58942,-85.10071,2023-10-16,2023-10-30,14,Forest,Suburban,4,0.285714285714286
Carrollton,GA_Forest_Carrollton_23_loc_44 10/16/2023_2023,2023,33.59016,-85.08812,2023-10-17,2023-10-29,12,Forest,Suburban,0,0
Carrollton,GA_Forest_Carrollton_23_loc_45 10/16/2023_2023,2023,33.599805,-85.071669,2023-10-16,2023-10-30,14,Forest,Suburban,1,0.0714285714285714
Carrollton,GA_Forest_Carrollton_23_loc_47 10/16/2023_2023,2023,33.58735,-85.04331,2023-10-16,2023-10-30,14,Forest,Suburban,2,0.142857142857143
Carrollton,GA_Forest_Carrollton_23_loc_5 09/27/2023_2023,2023,33.56463,-85.08571,2023-09-27,2023-10-11,14,Forest,Suburban,18,1.28571428571429
Carrollton,GA_Forest_Carrollton_23_loc_7 09/27/2023_2023,2023,33.56391,-85.084460000000007,2023-09-27,2023-10-11,14,Forest,Suburban,2,0.142857142857143
Carrollton,GA_Forest_Carrollton_23_loc_9 10/11/2023_2023,2023,33.5618,-85.07753,2023-10-11,2023-10-25,14,Forest,Suburban,2,0.142857142857143
Carrollton,GA_Forest_Carrollton_3_2019,2019,33.56473,-85.088,2019-09-05,2019-11-15,71,Forest,Suburban,55,0.774647887323944
Carrollton,GA_Forest_Carrollton_5_2019,2019,33.56461,-85.08582,2019-08-22,2019-10-14,53,Forest,Suburban,7,0.132075471698113
Carrollton,GA_Forest_Carrollton_7_2019,2019,33.5637,-85.08381,2019-09-05,2019-11-14,70,Forest,Suburban,18,0.257142857142857
Ceylon,GA_Forest_Ceylon_20_01_2020,2020,30.94732,-81.67117,2020-08-26,2020-10-14,49,Forest,Wild,2,0.0408163265306122
Ceylon,GA_Forest_Ceylon_20_02_2020,2020,30.94263,-81.65005,2020-08-26,2020-10-14,49,Forest,Wild,2,0.0408163265306122
Ceylon,GA_Forest_Ceylon_20_03_2020,2020,30.96399,-81.6492,2020-08-26,2020-10-14,49,Forest,Wild,3,0.0612244897959184
Ceylon,GA_Forest_Ceylon_20_04_2020,2020,30.96683,-81.63747,2020-08-26,2020-10-14,49,Forest,Wild,2,0.0408163265306122
Ceylon,GA_Forest_Ceylon_20_05_2020,2020,30.94765,-81.63296,2020-08-26,2020-10-14,49,Forest,Wild,2,0.0408163265306122
Ceylon,GA_Forest_Ceylon_20_06_2020,2020,30.93698,-81.63512,2020-08-26,2020-10-14,49,Forest,Wild,2,0.0408163265306122
JonesCenter,GA_Forest_JonesCenter_01 09/08/2023_2023,2023,31.17153889,-84.4558,2023-09-08,2023-10-09,31,Forest,Rural,22,0.709677419354839
JonesCenter,GA_Forest_JonesCenter_011 09/08/2023_2023,2023,31.23154722,-84.40633889,2023-09-08,2023-10-09,31,Forest,Rural,34,1.09677419354839
JonesCenter,GA_Forest_JonesCenter_012 09/08/2023_2023,2023,31.24155,-84.41020278,2023-09-08,2023-10-09,31,Forest,Rural,22,0.709677419354839
JonesCenter,GA_Forest_JonesCenter_013 09/08/2023_2023,2023,31.24814444,-84.41396667,2023-09-08,2023-10-09,31,Forest,Rural,20,0.645161290322581
JonesCenter,GA_Forest_JonesCenter_014 09/08/2023_2023,2023,31.25430278,-84.383825,2023-09-08,2023-10-09,31,Forest,Rural,16,0.516129032258065
JonesCenter,GA_Forest_JonesCenter_015 09/08/2023_2023,2023,31.25112222,-84.37048611,2023-09-08,2023-10-09,31,Forest,Rural,8,0.258064516129032
JonesCenter,GA_Forest_JonesCenter_016 09/08/2023_2023,2023,31.24046667,-84.37596944,2023-09-08,2023-10-08,30,Forest,Rural,1,0.0333333333333333
JonesCenter,GA_Forest_JonesCenter_016a 09/08/2023_2023,2023,31.24046667,-84.37596944,2023-09-08,2023-10-09,31,Forest,Rural,24,0.774193548387097
JonesCenter,GA_Forest_JonesCenter_017 09/08/2023_2023,2023,31.23806944,-84.39229722,2023-09-08,2023-10-09,31,Forest,Rural,11,0.354838709677419
JonesCenter,GA_Forest_JonesCenter_019 09/08/2023_2023,2023,31.20291667,-84.43278333,2023-09-08,2023-10-09,31,Forest,Rural,41,1.32258064516129
JonesCenter,GA_Forest_JonesCenter_02 09/08/2023_2023,2023,31.18341667,-84.46,2023-09-08,2023-10-09,31,Forest,Rural,9,0.290322580645161
JonesCenter,GA_Forest_JonesCenter_020 09/08/2023_2023,2023,31.20422778,-84.46359444,2023-09-08,2023-10-09,31,Forest,Rural,12,0.387096774193548
JonesCenter,GA_Forest_JonesCenter_03 09/08/2023_2023,2023,31.19587222,-84.45605278,2023-09-08,2023-09-09,1,Forest,Rural,2,2
JonesCenter,GA_Forest_JonesCenter_04 09/08/2023_2023,2023,31.19963333,-84.43566389,2023-09-08,2023-10-09,31,Forest,Rural,11,0.354838709677419
JonesCenter,GA_Forest_JonesCenter_05 09/08/2023_2023,2023,31.20027778,-84.42106111,2023-09-08,2023-10-09,31,Forest,Rural,25,0.806451612903226
JonesCenter,GA_Forest_JonesCenter_06 09/08/2023_2023,2023,31.2093,-84.41715833,2023-09-08,2023-10-09,31,Forest,Rural,20,0.645161290322581
JonesCenter,GA_Forest_JonesCenter_07 09/08/2023_2023,2023,31.21421111,-84.41139444,2023-09-08,2023-10-09,31,Forest,Rural,25,0.806451612903226
JonesCenter,GA_Forest_JonesCenter_08 09/08/2023_2023,2023,31.2195,-84.4073,2023-09-08,2023-10-09,31,Forest,Rural,3,0.0967741935483871
JonesCenter,GA_Forest_JonesCenter_09 09/08/2023_2023,2023,31.22526944,-84.40446111,2023-09-08,2023-10-09,31,Forest,Rural,17,0.548387096774194
JonesCenter,GA_Forest_JonesCenter_10 09/08/2023_2023,2023,31.22556667,-84.41078611,2023-09-08,2023-10-09,31,Forest,Rural,7,0.225806451612903
JonesCenter,GA_Forest_JonesCenter_Dep_01 08/26/2021_2021,2021,31.266807,-84.499256,2021-08-26,2021-09-20,25,Forest,Rural,2,0.08
JonesCenter,GA_Forest_JonesCenter_Dep_01_2022,2022,31.1715,-84.4558,2022-10-03,2022-10-21,18,Forest,Rural,1,0.0555555555555556
JonesCenter,GA_Forest_JonesCenter_Dep_01a_2022,2022,31.1715,-84.4558,2022-10-21,2022-10-31,10,Forest,Rural,3,0.3
JonesCenter,GA_Forest_JonesCenter_Dep_02 08/26/2021_2021,2021,31.291562,-84.467736,2021-08-26,2021-09-20,25,Forest,Rural,2,0.08
JonesCenter,GA_Forest_JonesCenter_Dep_02 10/03/2022_2022,2022,31.18341667,-84.45996944,2022-10-03,2022-10-31,28,Forest,Rural,12,0.428571428571429
JonesCenter,GA_Forest_JonesCenter_Dep_03 10/03/2022_2022,2022,31.19587222,-84.45605278,2022-10-03,2022-10-31,28,Forest,Rural,21,0.75
JonesCenter,GA_Forest_JonesCenter_Dep_04 08/26/2021_2021,2021,31.26589,-84.545335,2021-08-24,2021-09-20,27,Forest,Rural,2,0.0740740740740741
JonesCenter,GA_Forest_JonesCenter_Dep_04 10/03/2022_2022,2022,31.19963333,-84.43566389,2022-10-03,2022-10-31,28,Forest,Rural,33,1.17857142857143
JonesCenter,GA_Forest_JonesCenter_Dep_05 10/03/2022_2022,2022,31.20027778,-84.42106111,2022-10-03,2022-10-31,28,Forest,Rural,28,1
JonesCenter,GA_Forest_JonesCenter_Dep_06_2022,2022,31.2093,-84.4172,2022-10-07,2022-10-23,16,Forest,Rural,5,0.3125
JonesCenter,GA_Forest_JonesCenter_Dep_06b_2022,2022,31.2093,-84.4172,2022-10-23,2022-10-31,8,Forest,Rural,3,0.375
JonesCenter,GA_Forest_JonesCenter_Dep_07 08/24/2021_2021,2021,31.259966,-84.538172,2021-08-24,2021-09-20,27,Forest,Rural,2,0.0740740740740741
JonesCenter,GA_Forest_JonesCenter_Dep_07 10/03/2022_2022,2022,31.21421111,-84.41139444,2022-10-03,2022-10-31,28,Forest,Rural,10,0.357142857142857
JonesCenter,GA_Forest_JonesCenter_Dep_08 08/24/2021_2021,2021,31.258161,-84.536665,2021-08-24,2021-09-20,27,Forest,Rural,2,0.0740740740740741
JonesCenter,GA_Forest_JonesCenter_Dep_08 10/03/2022_2022,2022,31.2195,-84.4073,2022-10-03,2022-10-31,28,Forest,Rural,3,0.107142857142857
JonesCenter,GA_Forest_JonesCenter_Dep_09 08/25/2021_2021,2021,31.260769,-84.531806,2021-08-25,2021-09-21,27,Forest,Rural,2,0.0740740740740741
JonesCenter,GA_Forest_JonesCenter_Dep_09 10/03/2022_2022,2022,31.22526944,-84.40446111,2022-10-04,2022-11-01,28,Forest,Rural,13,0.464285714285714
JonesCenter,GA_Forest_JonesCenter_Dep_10 10/03/2022_2022,2022,31.22556667,-84.41078611,2022-10-03,2022-11-01,29,Forest,Rural,6,0.206896551724138
JonesCenter,GA_Forest_JonesCenter_Dep_11 08/25/2021_2021,2021,31.268735,-84.536585,2021-08-25,2021-09-21,27,Forest,Rural,2,0.0740740740740741
JonesCenter,GA_Forest_JonesCenter_Dep_11 10/03/2022_2022,2022,31.23154722,-84.40633889,2022-10-03,2022-10-31,28,Forest,Rural,40,1.42857142857143
JonesCenter,GA_Forest_JonesCenter_Dep_12 08/25/2021_2021,2021,31.25825,-84.524515,2021-08-25,2021-09-21,27,Forest,Rural,2,0.0740740740740741
JonesCenter,GA_Forest_JonesCenter_Dep_12 10/03/2022_2022,2022,31.24155,-84.41020278,2022-10-03,2022-10-31,28,Forest,Rural,8,0.285714285714286
JonesCenter,GA_Forest_JonesCenter_Dep_13 10/03/2022_2022,2022,31.24814444,-84.41396667,2022-10-03,2022-10-31,28,Forest,Rural,15,0.535714285714286
JonesCenter,GA_Forest_JonesCenter_Dep_13a 08/25/2021_2021,2021,31.252241,-84.517036,2021-08-25,2021-09-06,12,Forest,Rural,1,0.0833333333333333
JonesCenter,GA_Forest_JonesCenter_Dep_14 08/25/2021_2021,2021,31.249675,-84.514953,2021-08-25,2021-09-30,36,Forest,Rural,2,0.0555555555555556
JonesCenter,GA_Forest_JonesCenter_Dep_14 10/03/2022_2022,2022,31.25430278,-84.383825,2022-10-04,2022-11-01,28,Forest,Rural,23,0.821428571428571
JonesCenter,GA_Forest_JonesCenter_Dep_15 08/27/2021_2021,2021,31.243902,-84.506107,2021-08-27,2021-09-22,26,Forest,Rural,3,0.115384615384615
JonesCenter,GA_Forest_JonesCenter_Dep_15 10/03/2022_2022,2022,31.2511222,-84.37048611,2022-10-03,2022-10-31,28,Forest,Rural,17,0.607142857142857
JonesCenter,GA_Forest_JonesCenter_Dep_16 08/27/2021_2021,2021,31.242216,-84.508539,2021-08-27,2021-09-21,25,Forest,Rural,2,0.08
JonesCenter,GA_Forest_JonesCenter_Dep_16 10/03/2022_2022,2022,31.24046667,-84.37596944,2022-10-04,2022-11-01,28,Forest,Rural,31,1.10714285714286
JonesCenter,GA_Forest_JonesCenter_Dep_17 08/27/2021_2021,2021,31.229552,-84.485891,2021-08-27,2021-09-22,26,Forest,Rural,2,0.0769230769230769
JonesCenter,GA_Forest_JonesCenter_Dep_17 10/03/2022_2022,2022,31.23806944,-84.39229722,2022-10-03,2022-10-31,28,Forest,Rural,27,0.964285714285714
JonesCenter,GA_Forest_JonesCenter_Dep_18 08/27/2021_2021,2021,31.228283,-84.483752,2021-08-27,2021-09-22,26,Forest,Rural,2,0.0769230769230769
JonesCenter,GA_Forest_JonesCenter_Dep_18 10/03/2022_2022,2022,31.22717222,-84.416075,2022-10-03,2022-10-31,28,Forest,Rural,8,0.285714285714286
JonesCenter,GA_Forest_JonesCenter_Dep_19 08/27/2021_2021,2021,31.273069,-84.507215,2021-08-27,2021-09-22,26,Forest,Rural,2,0.0769230769230769
JonesCenter,GA_Forest_JonesCenter_Dep_19 10/03/2022_2022,2022,31.20291667,-84.43278333,2022-10-03,2022-10-31,28,Forest,Rural,45,1.60714285714286
JonesCenter,GA_Forest_JonesCenter_Dep_20 08/27/2021_2021,2021,31.266807,-84.499256,2021-08-27,2021-09-22,26,Forest,Rural,2,0.0769230769230769
JonesCenter,GA_Forest_JonesCenter_Dep_20 10/03/2022_2022,2022,31.20422778,-84.46359444,2022-10-03,2022-10-31,28,Forest,Rural,9,0.321428571428571
JonesCenter,GA_Forest_JonesCenter_Dep_21 08/27/2021_2021,2021,31.265241,-84.502943,2021-08-27,2021-09-23,27,Forest,Rural,2,0.0740740740740741
JonesCenter,GA_Forest_JonesCenter_Dep_22 08/27/2021_2021,2021,31.284435,-84.523048,2021-08-27,2021-09-23,27,Forest,Rural,2,0.0740740740740741
JonesCenter,GA_Forest_JonesCenter_Dep_23 08/27/2021_2021,2021,31.28299,-84.525145,2021-08-27,2021-09-23,27,Forest,Rural,2,0.0740740740740741
JonesCenter,GA_Forest_JonesCenter_Dep_24 08/27/2021_2021,2021,31.279723,-84.5205508,2021-08-27,2021-09-23,27,Forest,Rural,2,0.0740740740740741
JonesCenter,GA_Forest_JonesCenter_Dep_25 08/27/2021_2021,2021,31.277878,-84.518793,2021-08-27,2021-09-23,27,Forest,Rural,2,0.0740740740740741
JonesCenter,GA_Forest_JonesCenter_Loc_03 08/26/2021_2021,2021,31.289554,-84.469768,2021-08-26,2021-09-20,25,Forest,Rural,2,0.08
JonesCenter,GA_Forest_JonesCenter_Loc_04 08/26/2021_2021,2021,31.302076,-84.434096,2021-08-26,2021-09-20,25,Forest,Rural,2,0.08
JonesCenter,GA_Forest_JonesCenter_Loc_05 08/26/2021_2021,2021,31.305376,-84.436049,2021-08-26,2021-09-20,25,Forest,Rural,2,0.08
JonesCenter,GA_Forest_JonesCenter_Loc_06 08/24/2021_2021,2021,31.26589,-84.545335,2021-08-24,2021-09-20,27,Forest,Rural,2,0.0740740740740741
JonesCenter,GA_Forest_JonesCenter_Loc_06 10/03/2022_2022,2022,31.2093,-84.4172,2022-10-03,2022-10-07,4,Forest,Rural,2,0.5
JonesCenter,GA_Forest_Jones_Center_20_01_2020,2020,31.2668,-84.49925,2020-10-01,2020-10-25,24,Forest,Rural,4,0.166666666666667
JonesCenter,GA_Forest_Jones_Center_20_02_2020,2020,31.29156,-84.46773,2020-10-08,2020-10-25,17,Forest,Rural,2,0.117647058823529
JonesCenter,GA_Forest_Jones_Center_20_04_2020,2020,31.30207,-84.43409,2020-10-08,2020-10-25,17,Forest,Rural,2,0.117647058823529
JonesCenter,GA_Forest_Jones_Center_20_05_2020,2020,31.30538,-84.43605,2020-10-25,2020-11-19,25,Forest,Rural,2,0.08
JonesCenter,GA_Forest_Jones_Center_20_06_2020,2020,31.2659,-84.5453,2020-10-25,2020-11-20,26,Forest,Rural,2,0.0769230769230769
JonesCenter,GA_Forest_Jones_Center_20_07_2020,2020,31.2599,-84.5382,2020-10-09,2020-10-25,16,Forest,Rural,3,0.1875
JonesCenter,GA_Forest_Jones_Center_20_09_2020,2020,31.2608,-84.5318,2020-09-30,2020-11-04,35,Forest,Rural,2,0.0571428571428571
JonesCenter,GA_Forest_Jones_Center_20_10_2020,2020,31.2703,-84.5382,2020-09-30,2020-11-04,35,Forest,Rural,2,0.0571428571428571
JonesCenter,GA_Forest_Jones_Center_20_11_2020,2020,31.2687,-84.5366,2020-09-30,2020-11-04,35,Forest,Rural,2,0.0571428571428571
JonesCenter,GA_Forest_Jones_Center_20_12_2020,2020,31.2582,-84.5245,2020-09-30,2020-11-04,35,Forest,Rural,2,0.0571428571428571
JonesCenter,GA_Forest_Jones_Center_20_13_2020,2020,31.2522,-84.517,2020-10-08,2020-11-09,32,Forest,Rural,2,0.0625
JonesCenter,GA_Forest_Jones_Center_20_14_2020,2020,31.2497,-84.5149,2020-10-08,2020-11-09,32,Forest,Rural,4,0.125
JonesCenter,GA_Forest_Jones_Center_20_15_2020,2020,31.2439,-84.5061,2020-09-30,2020-11-04,35,Forest,Rural,3,0.0857142857142857
JonesCenter,GA_Forest_Jones_Center_20_16_2020,2020,31.2422,-84.5085,2020-09-30,2020-11-04,35,Forest,Rural,2,0.0571428571428571
JonesCenter,GA_Forest_Jones_Center_20_17_2020,2020,31.2295,-84.4859,2020-09-30,2020-11-04,35,Forest,Rural,2,0.0571428571428571
JonesCenter,GA_Forest_Jones_Center_20_18_2020,2020,31.2283,-84.4837,2020-09-30,2020-11-04,35,Forest,Rural,2,0.0571428571428571
JonesCenter,GA_Forest_Jones_Center_20_19_2020,2020,31.2731,-84.5072,2020-10-01,2020-10-31,30,Forest,Rural,1,0.0333333333333333
JonesCenter,GA_Forest_Jones_Center_20_20_2020,2020,31.2668,-84.4992,2020-10-01,2020-11-09,39,Forest,Rural,3,0.0769230769230769
JonesCenter,GA_Forest_Jones_Center_20_21_2020,2020,31.2652,-84.5029,2020-10-01,2020-11-09,39,Forest,Rural,3,0.0769230769230769
JonesCenter,GA_Forest_Jones_Center_20_22_2020,2020,31.2844,-84.523,2020-10-01,2020-10-31,30,Forest,Rural,2,0.0666666666666667
JonesCenter,GA_Forest_Jones_Center_20_23_2020,2020,31.283,-84.5251,2020-10-01,2020-11-09,39,Forest,Rural,2,0.0512820512820513
JonesCenter,GA_Forest_Jones_Center_20_24_2020,2020,31.2797,-84.5205,2020-10-01,2020-11-09,39,Forest,Rural,2,0.0512820512820513
JonesCenter,GA_Forest_Jones_Center_20_25_2020,2020,31.2779,-84.5188,2020-10-01,2020-11-09,39,Forest,Rural,3,0.0769230769230769
LowerAltmaha,GA_Forest_Lower Altmaha Corridor_10_2019,2019,31.32483,-81.47892,2019-08-27,2019-10-02,36,Forest,Rural,2,0.0555555555555556
LowerAltmaha,GA_Forest_Lower Altmaha Corridor_11_2019,2019,31.32228,-81.50153,2019-08-27,2019-10-02,36,Forest,Rural,2,0.0555555555555556
LowerAltmaha,GA_Forest_Lower Altmaha Corridor_12_2019,2019,31.32658,-81.52242,2019-08-27,2019-10-02,36,Forest,Rural,2,0.0555555555555556
LowerAltmaha,GA_Forest_Lower Altmaha Corridor_13_2019,2019,31.34355,-81.53585,2019-08-27,2019-10-02,36,Forest,Rural,2,0.0555555555555556
LowerAltmaha,GA_Forest_Lower Altmaha Corridor_14_2019,2019,31.35372,-81.55607,2019-08-27,2019-10-02,36,Forest,Rural,2,0.0555555555555556
LowerAltmaha,GA_Forest_Lower Altmaha Corridor_15_2019,2019,31.36008,-81.57185,2019-08-27,2019-10-02,36,Forest,Rural,27,0.75
LowerAltmaha,GA_Forest_Lower Altmaha Corridor_16_2019,2019,31.38502,-81.5857,2019-08-27,2019-10-02,36,Forest,Rural,2,0.0555555555555556
LowerAltmaha,GA_Forest_Lower Altmaha Corridor_17_2019,2019,31.38375,-81.60105,2019-08-27,2019-10-02,36,Forest,Rural,2,0.0555555555555556
LowerAltmaha,GA_Forest_Lower Altmaha Corridor_18_2019,2019,31.40383,-81.58452,2019-08-27,2019-08-28,1,Forest,Rural,1,1
LowerAltmaha,GA_Forest_Lower Altmaha Corridor_19_2019,2019,31.41248,-81.59877,2019-08-27,2019-09-20,24,Forest,Rural,1,0.0416666666666667
LowerAltmaha,GA_Forest_Lower Altmaha Corridor_1_2019,2019,31.35068,-81.4542,2019-08-27,2019-10-02,36,Forest,Rural,2,0.0555555555555556
LowerAltmaha,GA_Forest_Lower Altmaha Corridor_20_2019,2019,31.41518,-81.61733,2019-08-27,2019-09-22,26,Forest,Rural,1,0.0384615384615385
LowerAltmaha,GA_Forest_Lower Altmaha Corridor_21_2019,2019,31.4315,-81.61775,2019-08-27,2019-09-17,21,Forest,Rural,1,0.0476190476190476
LowerAltmaha,GA_Forest_Lower Altmaha Corridor_22_2019,2019,31.45163,-81.63065,2019-08-27,2019-10-02,36,Forest,Rural,2,0.0555555555555556
LowerAltmaha,GA_Forest_Lower Altmaha Corridor_23_2019,2019,31.48356,-81.64674,2019-08-27,2019-10-02,36,Forest,Rural,2,0.0555555555555556
LowerAltmaha,GA_Forest_Lower Altmaha Corridor_2_2019,2019,31.36098,-81.55328,2019-08-27,2019-10-02,36,Forest,Rural,2,0.0555555555555556
BearCreek,GA_Forest_Rural_BearCreek_23_loc01_2023,2023,33.580734,-84.707044,2023-09-07,2023-11-14,68,Forest,Rural,1,0.0147058823529412
BearCreek,GA_Forest_Rural_BearCreek_23_loc02_2023,2023,33.579195,-84.707699,2023-09-06,2023-10-13,37,Forest,Rural,1,0.027027027027027
BearCreek,GA_Forest_Rural_BearCreek_23_loc03_2023,2023,33.578919,-84.709679,2023-09-06,2023-11-14,69,Forest,Rural,1,0.0144927536231884
BearCreek,GA_Forest_Rural_BearCreek_23_loc04_2023,2023,33.580703,-84.709903,2023-09-06,2023-10-17,41,Forest,Rural,1,0.024390243902439
BearCreek,GA_Forest_Rural_BearCreek_23_loc05_2023,2023,33.582614,-84.710171,2023-09-06,2023-11-14,69,Forest,Rural,2,0.0289855072463768
BearCreek,GA_Forest_Rural_BearCreek_23_loc06_2023,2023,33.583979,-84.709913,2023-09-06,2023-11-14,69,Forest,Rural,2,0.0289855072463768
BearCreek,GA_Forest_Rural_BearCreek_23_loc08_2023,2023,33.582134,-84.706316,2023-09-08,2023-11-14,67,Forest,Rural,1,0.0149253731343284
Patterson,GA_Forest_Suburban_Patterson_23.01_D1_2023,2023,34.5139252,-84.06295941,2023-08-23,2023-10-15,53,Forest,Suburban,11,0.207547169811321
Patterson,GA_Forest_Suburban_Patterson_23.02_D1_2023,2023,34.51390868,-84.06557551,2023-08-24,2023-10-15,52,Forest,Suburban,1,0.0192307692307692
Patterson,GA_Forest_Suburban_Patterson_23.03_D1_2023,2023,34.51557227,-84.06612569,2023-08-27,2023-10-09,43,Forest,Suburban,4,0.0930232558139535
Patterson,GA_Forest_Suburban_Patterson_23.04_D1_2023,2023,34.51565093,-84.06390713,2023-09-13,2023-10-15,32,Forest,Suburban,0,0
Patterson,GA_Forest_Suburban_Patterson_23.05_D1_2023,2023,34.51715344,-84.06598697,2023-09-17,2023-10-15,28,Forest,Suburban,2,0.0714285714285714
Patterson,GA_Forest_Suburban_Patterson_23.06_D1_2023,2023,34.51859479,-84.06667027,2023-08-24,2023-10-15,52,Forest,Suburban,6,0.115384615384615
Patterson,GA_Forest_Suburban_Patterson_23.07_D1_2023,2023,34.52070199,-84.0668963,2023-08-23,2023-10-12,50,Forest,Suburban,2,0.04
Patterson,GA_Forest_Suburban_Patterson_23.08_D1_2023,2023,34.52108379,-84.06490454,2023-08-23,2023-10-14,52,Forest,Suburban,0,0
DixonMemorial,GA_Wild_Forest_DIxonMemorial_21_loc_01_2021,2021,31.11871,-82.2635,2021-09-01,2021-09-28,27,Forest,Wild,5,0.185185185185185
DixonMemorial,GA_Wild_Forest_DixonMemorial_21_dep_02_2021,2021,31.09244,-82.22852,2021-09-01,2021-09-28,27,Forest,Wild,10,0.37037037037037
DixonMemorial,GA_Wild_Forest_DixonMemorial_21_loc_03_2021,2021,31.08131,-82.21559,2021-09-01,2021-09-28,27,Forest,Wild,2,0.0740740740740741
DixonMemorial,GA_Wild_Forest_DixonMemorial_21_loc_04_2021,2021,31.07767,-82.26823,2021-09-01,2021-09-28,27,Forest,Wild,2,0.0740740740740741
DixonMemorial,GA_Wild_Forest_DixonMemorial_21_loc_05 09/01/2021_2021,2021,31.06449,-82.25361,2021-09-01,2021-09-28,27,Forest,Wild,2,0.0740740740740741
DixonMemorial,GA_Wild_Forest_DixonMemorial_21_loc_06 09/01/2021_2021,2021,31.06365,-82.21738,2021-09-01,2021-09-28,27,Forest,Wild,2,0.0740740740740741
DixonMemorial,GA_Wild_Forest_DixonMemorial_21_loc_07 09/01/2021_2021,2021,31.10496,-82.29197,2021-09-01,2021-09-28,27,Forest,Wild,2,0.0740740740740741
DixonMemorial,GA_Wild_Forest_DixonMemorial_21_loc_08 09/01/2021_2021,2021,31.10925,-82.30682,2021-09-01,2021-09-28,27,Forest,Wild,2,0.0740740740740741
DixonMemorial,GA_Wild_Forest_DixonMemorial_21_loc_09 09/01/2021_2021,2021,31.1206,-82.31419,2021-09-01,2021-09-28,27,Forest,Wild,20,0.740740740740741
DixonMemorial,GA_Wild_Forest_DixonMemorial_21_loc_10 09/01/2021_2021,2021,31.13736,-82.32857,2021-09-01,2021-09-28,27,Forest,Wild,2,0.0740740740740741
DixonMemorial,GA_Wild_Forest_DixonMemorial_21_loc_11 09/01/2021_2021,2021,31.14444,-82.30691,2021-09-01,2021-09-28,27,Forest,Wild,2,0.0740740740740741
DixonMemorial,GA_Wild_Forest_DixonMemorial_21_loc_12 09/01/2021_2021,2021,31.14661,-82.29114,2021-09-01,2021-09-28,27,Forest,Wild,2,0.0740740740740741
DixonMemorial,GA_Wild_Forest_DixonMemorial_21_loc_13 09/01/2021_2021,2021,31.15634,-82.27531,2021-09-01,2021-09-28,27,Forest,Wild,6,0.222222222222222
DixonMemorial,GA_Wild_Forest_DixonMemorial_21_loc_14 09/01/2021_2021,2021,31.13568,-82.25411,2021-09-01,2021-09-28,27,Forest,Wild,2,0.0740740740740741
DixonMemorial,GA_Wild_Forest_DixonMemorial_21_loc_15 09/01/2021_2021,2021,31.12741,-82.25613,2021-09-01,2021-09-28,27,Forest,Wild,3,0.111111111111111
DixonMemorial,GA_Wild_Forest_DixonMemorial_21_loc_17 09/01/2021_2021,2021,31.12915,-82.2421,2021-09-01,2021-09-28,27,Forest,Wild,2,0.0740740740740741
DixonMemorial,GA_Wild_Forest_DixonMemorial_21_loc_18 09/01/2021_2021,2021,31.1038,-82.23174,2021-09-01,2021-09-28,27,Forest,Wild,2,0.0740740740740741
DixonMemorial,GA_Wild_Forest_DixonMemorial_21_loc_19 09/01/2021_2021,2021,31.10333,-82.21152,2021-09-01,2021-09-28,27,Forest,Wild,2,0.0740740740740741
DixonMemorial,GA_Wild_Forest_DixonMemorial_21_loc_20 09/01/2021_2021,2021,31.1124,-82.1984,2021-09-01,2021-09-28,27,Forest,Wild,3,0.111111111111111
SLC,General Holm Park N.USA.2019_2019,2019,40.68859,-111.92125,2019-09-02,2019-09-30,28,Desert,Urban,7,0.25
SLC,General Holm Park N.USA.2020_2020,2020,40.68853,-111.92113,2020-09-07,2020-10-08,31,Desert,Urban,9,0.290322580645161
SLC,General Holm Park S.USA.2019_2019,2019,40.68505,-111.91722,2019-09-02,2019-09-30,28,Desert,Urban,9,0.321428571428571
GreenRiverPreserve,Green River Preserve Cam 01 09/01/2021_2021,2021,37.244838,-85.934326,2021-09-02,2021-10-29,57,Wetland,Rural,0,0
GreenRiverPreserve,Green River Preserve Cam 02 09/01/2021_2021,2021,37.24686,-85.935144,2021-09-04,2021-11-04,61,Wetland,Rural,0,0
GreenRiverPreserve,Green River Preserve Cam 03 09/01/2021_2021,2021,37.248538,-85.936617,2021-09-03,2021-11-03,61,Wetland,Rural,0,0
GreenRiverPreserve,Green River Preserve Cam 04 09/01/2021_2021,2021,37.250209,-85.937041,2021-09-04,2021-11-03,60,Wetland,Rural,0,0
GreenRiverPreserve,Green River Preserve Cam 05 09/01/2021_2021,2021,37.242313,-85.937635,2021-09-02,2021-11-04,63,Wetland,Rural,0,0
GreenRiverPreserve,Green River Preserve Cam 06 09/01/2021_2021,2021,37.24401,-85.938147,2021-09-02,2021-10-26,54,Wetland,Rural,0,0
GreenRiverPreserve,Green River Preserve Cam 07 09/01/2021_2021,2021,37.24304,-85.939752,2021-09-03,2021-11-02,60,Wetland,Rural,0,0
GreenRiverPreserve,Green River Preserve Cam 08 09/01/2021_2021,2021,37.246708,-85.944208,2021-09-07,2021-10-31,54,Wetland,Rural,0,0
GreenRiverPreserve,Green River Preserve Cam 09 09/01/2021_2021,2021,37.249412,-85.946066,2021-09-02,2021-10-31,59,Wetland,Rural,0,0
GreenRiverPreserve,Green River Preserve Cam 10 09/01/2021_2021,2021,37.24895,-85.945344,2021-09-03,2021-10-07,34,Wetland,Rural,0,0
Herrera,HF0403_2019,2019,38.9262,-77.08312,2019-10-28,2019-11-12,15,Forest,Urban,5,0.333333333333333
Herrera,HF0404_2019,2019,38.92883,-77.08151,2019-10-28,2019-11-12,15,Forest,Urban,2,0.133333333333333
Herrera,HF0405_2019,2019,38.92332,-77.08276,2019-10-28,2019-11-12,15,Forest,Urban,2,0.133333333333333
Herrera,HF0408_2019,2019,38.92347,-77.08625,2019-10-28,2019-11-12,15,Forest,Urban,3,0.2
Herrera,HF0409_2019,2019,38.92045,-77.0855,2019-10-28,2019-11-12,15,Forest,Urban,2,0.133333333333333
Herrera,HF1801_2019,2019,38.91771,-77.1001,2019-10-30,2019-11-14,15,Forest,Urban,7,0.466666666666667
Herrera,HF1804_2019,2019,38.9158,-77.09995,2019-10-30,2019-11-14,15,Forest,Urban,11,0.733333333333333
Herrera,HF1809_2019,2019,38.92054,-77.10395,2019-10-30,2019-11-14,15,Forest,Urban,2,0.133333333333333
Herrera,HF1811_2019,2019,38.92239,-77.10629,2019-10-30,2019-11-14,15,Forest,Urban,13,0.866666666666667
Herrera,HF1816_2019,2019,38.92192,-77.1041,2019-10-30,2019-11-14,15,Forest,Urban,3,0.2
Herrera,HH0101_2020,2020,38.9047,-77.07142,2020-09-23,2020-10-07,14,Forest,Urban,1,0.0714285714285714
Herrera,HH0102_2020,2020,38.90471,-77.07394,2020-09-23,2020-10-08,15,Forest,Urban,66,4.4
Herrera,HH0103_2020,2020,38.90484,-77.06927,2020-09-23,2020-10-08,15,Forest,Urban,8,0.533333333333333
Herrera,HH0104_2020,2020,38.90456,-77.06839,2020-09-23,2020-10-08,15,Forest,Urban,2,0.133333333333333
Herrera,HH0105_2020,2020,38.90354,-77.06369,2020-09-23,2020-10-08,15,Forest,Urban,62,4.13333333333333
Herrera,HH0106_2020,2020,38.90394,-77.06192,2020-09-23,2020-10-08,15,Forest,Urban,30,2
Herrera,HH0107_2020,2020,38.90474,-77.06249,2020-09-23,2020-10-06,13,Forest,Urban,446,34.3076923076923
Herrera,HH0108_2020,2020,38.90601,-77.06038,2020-09-23,2020-10-08,15,Forest,Urban,64,4.26666666666667
Herrera,HH0109_2020,2020,38.90566,-77.06222,2020-09-23,2020-10-08,15,Forest,Urban,176,11.7333333333333
Herrera,HH0110_2020,2020,38.90732,-77.06612,2020-09-23,2020-10-07,14,Forest,Urban,7,0.5
Herrera,HH0111_2020,2020,38.90638,-77.0683,2020-09-23,2020-10-08,15,Forest,Urban,38,2.53333333333333
Herrera,HH0112_2020,2020,38.90646,-77.06636,2020-09-23,2020-10-08,15,Forest,Urban,8,0.533333333333333
Herrera,HH0113_2020,2020,38.90445,-77.06561,2020-10-08,2020-10-23,15,Forest,Urban,153,10.2
Herrera,HH0114_2020,2020,38.90771,-77.06495,2020-10-08,2020-10-23,15,Forest,Urban,2,0.133333333333333
Herrera,HH0115_2020,2020,38.90581,-77.05846,2020-10-08,2020-10-23,15,Forest,Urban,2,0.133333333333333
Herrera,HH0116_2020,2020,38.90172,-77.06162,2020-10-08,2020-10-23,15,Forest,Urban,12,0.8
Herrera,HH0117_2020,2020,38.90252,-77.06505,2020-10-08,2020-10-23,15,Forest,Urban,11,0.733333333333333
Herrera,HH0118_2020,2020,38.90341,-77.06707,2020-10-08,2020-10-23,15,Forest,Urban,8,0.533333333333333
Herrera,HH0119_2020,2020,38.90089,-77.05779,2020-10-08,2020-10-23,15,Forest,Urban,17,1.13333333333333
Herrera,HH0120_2020,2020,38.90205,-77.05781,2020-10-08,2020-10-23,15,Forest,Urban,2,0.133333333333333
Herrera,HH0121_2020,2020,38.9029,-77.05708,2020-10-08,2020-10-23,15,Forest,Urban,6,0.4
Herrera,HH0122_2020,2020,38.90376,-77.05634,2020-10-08,2020-10-23,15,Forest,Urban,2,0.133333333333333
Oahu,HI_Forest_O'ahu_10_2019,2019,21.36077,-157.7448,2019-09-19,2019-11-01,43,Forest,Wild,2,0.0465116279069767
Oahu,HI_Forest_O'ahu_1_2019,2019,21.3619,-157.74675,2019-09-19,2019-11-01,43,Forest,Wild,1,0.0232558139534884
Oahu,HI_Forest_O'ahu_20_01_2020,2020,21.3619,-157.74675,2020-09-17,2020-10-07,20,Forest,Wild,1,0.05
Oahu,HI_Forest_O'ahu_20_02_2020,2020,21.36436,-157.74588,2020-09-17,2020-10-09,22,Forest,Wild,2,0.0909090909090909
Oahu,HI_Forest_O'ahu_20_03_2020,2020,21.3627,-157.74509,2020-09-23,2020-10-16,23,Forest,Wild,1,0.0434782608695652
Oahu,HI_Forest_O'ahu_20_05_2020,2020,21.36502,-157.74408,2020-09-17,2020-10-07,20,Forest,Wild,1,0.05
Oahu,HI_Forest_O'ahu_20_06_2020,2020,21.36688,-157.74391,2020-09-17,2020-10-11,24,Forest,Wild,1,0.0416666666666667
Oahu,HI_Forest_O'ahu_20_07_2020,2020,21.36574,-157.74779,2020-09-23,2020-10-20,27,Forest,Wild,1,0.037037037037037
Oahu,HI_Forest_O'ahu_20_08_2020,2020,21.36363,-157.74786,2020-09-23,2020-10-15,22,Forest,Wild,1,0.0454545454545455
Oahu,HI_Forest_O'ahu_20_09_2020,2020,21.3619,-157.74675,2020-09-23,2020-10-18,25,Forest,Wild,1,0.04
Oahu,HI_Forest_O'ahu_20_10_2020,2020,21.36077,-157.7448,2020-09-23,2020-10-12,19,Forest,Wild,1,0.0526315789473684
Oahu,HI_Forest_O'ahu_2_2019,2019,21.36436,-157.74588,2019-09-18,2019-11-01,44,Forest,Wild,2,0.0454545454545455
Oahu,HI_Forest_O'ahu_3_2019,2019,21.3627,-157.74509,2019-09-18,2019-11-01,44,Forest,Wild,2,0.0454545454545455
Oahu,HI_Forest_O'ahu_4_2019,2019,21.36342,-157.74335,2019-09-18,2019-10-31,43,Forest,Wild,2,0.0465116279069767
Oahu,HI_Forest_O'ahu_5_2019,2019,21.36502,-157.74408,2019-09-18,2019-11-01,44,Forest,Wild,2,0.0454545454545455
Oahu,HI_Forest_O'ahu_6_2019,2019,21.36688,-157.74391,2019-09-18,2019-11-01,44,Forest,Wild,1,0.0227272727272727
Oahu,HI_Forest_O'ahu_7_2019,2019,21.36574,-157.74779,2019-09-19,2019-11-01,43,Forest,Wild,2,0.0465116279069767
Oahu,HI_Forest_O'ahu_8_2019,2019,21.36363,-157.74786,2019-09-23,2019-10-31,38,Forest,Wild,0,0
Oahu,HI_Forest_Oahu_Cam10 09/19/2022_2022,2022,21.35699,-157.74408,2022-09-19,2022-11-22,64,Forest,Wild,4,0.0625
Oahu,HI_Forest_Oahu_Cam11 09/19/2022_2022,2022,21.35622,-157.74559,2022-09-19,2022-11-22,64,Forest,Wild,4,0.0625
Oahu,HI_Forest_Oahu_Cam2_2022,2022,21.36308,-157.74962,2022-09-21,2022-12-05,75,Forest,Wild,7,0.0933333333333333
Oahu,HI_Forest_Oahu_Cam4 09/21/2022_2022,2022,21.36325,-157.74571,2022-09-21,2022-11-22,62,Forest,Wild,2,0.032258064516129
Oahu,HI_Forest_Oahu_Cam5_2022,2022,21.36349,-157.74382,2022-09-30,2022-12-04,65,Forest,Wild,2,0.0307692307692308
Oahu,HI_Forest_Oahu_Cam6 09/21/2022_2022,2022,21.36183,-157.74675,2022-09-21,2022-10-22,31,Forest,Wild,2,0.0645161290322581
Oahu,HI_Forest_Oahu_Cam7 09/19/2022_2022,2022,21.35948,-157.74583,2022-09-19,2022-10-12,23,Forest,Wild,2,0.0869565217391304
Oahu,HI_Forest_Oahu_Cam8 09/19/2022_2022,2022,21.35934,-157.74382,2022-09-19,2022-11-22,64,Forest,Wild,3,0.046875
Oahu,HI_Forest_Oahu_Cam9 09/19/2022_2022,2022,21.35763,-157.7458,2022-09-19,2022-11-22,64,Forest,Wild,3,0.046875
Oahu,HI_Forest_Oahu_21_dep_01_2021,2021,21.361894,-157.746759,2021-09-01,2021-11-02,62,Forest,Wild,2,0.032258064516129
Oahu,HI_Forest_Oahu_21_loc_0 09/01/2021_2021,2021,21.361894,-157.746759,2021-09-01,2021-11-02,62,Forest,Wild,8,0.129032258064516
Oahu,HI_Forest_Oahu_21_loc_04 11/01/2021_2021,2021,21.364844,-157.743821,2021-09-01,2021-11-04,64,Forest,Wild,3,0.046875
Oahu,HI_Forest_Oahu_21_loc_05 09/08/2021_2021,2021,21.355811,-157.743898,2021-09-08,2021-11-04,57,Forest,Wild,3,0.0526315789473684
Oahu,HI_Forest_Oahu_21_loc_06 09/01/2021_2021,2021,21.366665,-157.745734,2021-09-01,2021-11-02,62,Forest,Wild,2,0.032258064516129
Oahu,HI_Forest_Oahu_21_loc_07 09/01/2021_2021,2021,21.363038,-157.743837,2021-09-01,2021-11-04,64,Forest,Wild,2,0.03125
Oahu,HI_Forest_Oahu_21_loc_08 09/08/2021_2021,2021,21.359439,-157.745796,2021-09-08,2021-11-04,57,Forest,Wild,2,0.0350877192982456
Oahu,HI_Forest_Oahu_21_loc_09 09/08/2021_2021,2021,21.35934,-157.74382,2021-09-08,2021-11-04,57,Forest,Wild,3,0.0526315789473684
Oahu,HI_Forest_Oahu_21_loc_10 09/08/2021_2021,2021,21.357618,-157.743883,2021-09-08,2021-11-04,57,Forest,Wild,2,0.0350877192982456
Oahu,HI_Forest_Oahu_21_loc_11 09/08/2021_2021,2021,21.357632,-157.745811,2021-09-08,2021-11-04,57,Forest,Wild,3,0.0526315789473684
Oahu,HI_Forest_Oahu_21_loc_12 10/17/2021_2021,2021,21.364859,-157.74575,2021-10-17,2021-11-12,26,Forest,Wild,0,0
Oahu,HI_Forest_Oahu_21_loc_3 09/01/2021_2021,2021,21.363052,-157.745765,2021-09-01,2021-11-02,62,Forest,Wild,2,0.032258064516129
Oahu,HI_Forest_Wild_Oahu_dep01_2023,2023,21.36643,-157.74555,2023-09-20,2023-10-21,31,Forest,Wild,1,0.032258064516129
Oahu,HI_Forest_Wild_Oahu_dep03_2023,2023,21.36335,-157.74372,2023-09-20,2023-11-24,65,Forest,Wild,3,0.0461538461538462
Oahu,HI_Forest_Wild_Oahu_dep04_2023,2023,21.36325,-157.74571,2023-09-20,2023-10-19,29,Forest,Wild,2,0.0689655172413793
Oahu,HI_Forest_Wild_Oahu_dep05_2023,2023,21.365,-157.7484,2023-10-13,2023-11-08,26,Forest,Wild,2,0.0769230769230769
Oahu,HI_Forest_Wild_Oahu_dep06_2023,2023,21.36191,-157.74667,2023-10-13,2023-11-06,24,Forest,Wild,1,0.0416666666666667
Oahu,HI_Forest_Wild_Oahu_dep07_2023,2023,21.35948,-157.74583,2023-10-13,2023-11-28,46,Forest,Wild,2,0.0434782608695652
Oahu,HI_Forest_Wild_Oahu_dep08_2023,2023,21.35941,-157.7443,2023-10-13,2023-11-10,28,Forest,Wild,2,0.0714285714285714
Oahu,HI_Forest_Wild_Oahu_dep09_2023,2023,21.35772,-157.74578,2023-10-15,2023-12-12,58,Forest,Wild,1,0.0172413793103448
Oahu,HI_Forest_Wild_Oahu_dep10_2023,2023,21.35703,-157.74405,2023-10-13,2023-11-03,21,Forest,Wild,1,0.0476190476190476
Oahu,HI_Forest_Wild_Oahu_dep11_2023,2023,21.35622,-157.74559,2023-10-13,2023-12-12,60,Forest,Wild,2,0.0333333333333333
Herrera,HL0301_2020,2020,38.93523,-77.06053,2020-09-21,2020-10-06,15,Forest,Urban,414,27.6
Herrera,HL0302_2020,2020,38.93683,-77.06168,2020-09-21,2020-10-06,15,Forest,Urban,112,7.46666666666667
Herrera,HL0303_2020,2020,38.93613,-77.05803,2020-09-21,2020-10-06,15,Forest,Urban,64,4.26666666666667
Herrera,HL0304_2020,2020,38.93649,-77.06624,2020-09-21,2020-10-06,15,Forest,Urban,21,1.4
Herrera,HL0305_2020,2020,38.93579,-77.06703,2020-09-21,2020-10-06,15,Forest,Urban,96,6.4
Herrera,HL0306_2020,2020,38.93675,-77.06824,2020-09-21,2020-10-06,15,Forest,Urban,36,2.4
Herrera,HL0307_2020,2020,38.93682,-77.06971,2020-09-21,2020-10-06,15,Forest,Urban,67,4.46666666666667
Herrera,HL0308_2020,2020,38.93642,-77.06739,2020-09-21,2020-10-06,15,Forest,Urban,2,0.133333333333333
Herrera,HL0309_2020,2020,38.93158,-77.07574,2020-09-21,2020-10-06,15,Forest,Urban,186,12.4
Herrera,HL0310_2020,2020,38.93273,-77.07532,2020-09-21,2020-10-06,15,Forest,Urban,72,4.8
Herrera,HL0311_2020,2020,38.93534,-77.07645,2020-09-21,2020-10-06,15,Forest,Urban,6,0.4
Herrera,HL0312_2020,2020,38.93457,-77.07547,2020-09-21,2020-10-05,14,Forest,Urban,81,5.78571428571429
Herrera,HL0313_2020,2020,38.92727,-77.07262,2020-09-21,2020-10-06,15,Forest,Urban,7,0.466666666666667
Herrera,HL0314_2020,2020,38.92437,-77.06913,2020-09-21,2020-10-06,15,Forest,Urban,30,2
Herrera,HL0315_2020,2020,38.92713,-77.06716,2020-09-21,2020-10-06,15,Forest,Urban,160,10.6666666666667
Herrera,HL0316_2020,2020,38.92798,-77.06558,2020-09-21,2020-10-06,15,Forest,Urban,158,10.5333333333333
Herrera,HL0317_2020,2020,38.93781,-77.07219,2020-10-06,2020-10-21,15,Forest,Urban,4,0.266666666666667
Herrera,HL0318_2020,2020,38.93956,-77.07076,2020-10-06,2020-10-21,15,Forest,Urban,196,13.0666666666667
Herrera,HL0319_2020,2020,38.93493,-77.07869,2020-10-06,2020-10-21,15,Forest,Urban,9,0.6
Herrera,HL0320_2020,2020,38.93544,-77.07903,2020-10-06,2020-10-21,15,Forest,Urban,3,0.2
Herrera,HL0321_2020,2020,38.93559,-77.0799,2020-10-06,2020-10-21,15,Forest,Urban,2,0.133333333333333
Herrera,HL0322_2020,2020,38.93845,-77.07909,2020-10-06,2020-10-21,15,Forest,Urban,3,0.2
Herrera,HL0323_2020,2020,38.92847,-77.08522,2020-10-06,2020-10-21,15,Forest,Urban,2,0.133333333333333
Herrera,HL0324_2020,2020,38.92804,-77.07528,2020-10-06,2020-10-21,15,Forest,Urban,67,4.46666666666667
Herrera,HL0325_2020,2020,38.94189,-77.0553,2020-10-06,2020-10-21,15,Forest,Urban,12,0.8
Herrera,HL0326_2020,2020,38.9395,-77.0673,2020-10-06,2020-10-21,15,Forest,Urban,6,0.4
Herrera,HL0327_2020,2020,38.93991,-77.06709,2020-10-06,2020-10-21,15,Forest,Urban,162,10.8
Herrera,HL0328_2020,2020,38.93979,-77.06416,2020-10-06,2020-10-21,15,Forest,Urban,27,1.8
Herrera,HL0329_2020,2020,38.92959,-77.06239,2020-10-06,2020-10-21,15,Forest,Urban,23,1.53333333333333
Herrera,HL0330_2020,2020,38.92963,-77.05985,2020-10-06,2020-10-21,15,Forest,Urban,9,0.6
Herrera,HL0331_2020,2020,38.93026,-77.05906,2020-10-06,2020-10-21,15,Forest,Urban,3,0.2
Herrera,HL0332_2020,2020,38.93235,-77.05661,2020-10-06,2020-10-21,15,Forest,Urban,7,0.466666666666667
Herrera,HL0333_2020,2020,38.93042,-77.05668,2020-10-06,2020-10-21,15,Forest,Urban,5,0.333333333333333
Herrera,HL0334_2020,2020,38.93083,-77.06557,2020-10-06,2020-10-21,15,Forest,Urban,53,3.53333333333333
Herrera,HL0801_2020,2020,38.9097,-77.05965,2020-09-23,2020-10-08,15,Forest,Urban,86,5.73333333333333
Herrera,HL0802_2020,2020,38.90809,-77.06008,2020-09-23,2020-10-08,15,Forest,Urban,728,48.5333333333333
Herrera,HL0803_2020,2020,38.90712,-77.05854,2020-09-23,2020-10-08,15,Forest,Urban,8,0.533333333333333
Herrera,HL0805_2020,2020,38.90893,-77.05381,2020-09-23,2020-10-08,15,Forest,Urban,5,0.333333333333333
Herrera,HL0806_2020,2020,38.91018,-77.05458,2020-09-23,2020-10-08,15,Forest,Urban,144,9.6
Herrera,HL0807_2020,2020,38.91088,-77.05885,2020-09-23,2020-10-06,13,Forest,Urban,710,54.6153846153846
Herrera,HL0808_2020,2020,38.91285,-77.06364,2020-09-23,2020-10-06,13,Forest,Urban,134,10.3076923076923
Herrera,HL0809_2020,2020,38.91383,-77.06174,2020-09-23,2020-10-08,15,Forest,Urban,341,22.7333333333333
Herrera,HL0810_2020,2020,38.91626,-77.0602,2020-09-23,2020-10-08,15,Forest,Urban,7,0.466666666666667
Herrera,HL0811_2020,2020,38.91613,-77.06303,2020-09-23,2020-10-08,15,Forest,Urban,344,22.9333333333333
Herrera,HL0812_2020,2020,38.91687,-77.0657,2020-09-23,2020-10-08,15,Forest,Urban,3,0.2
Herrera,HL0813_2020,2020,38.91483,-77.06775,2020-09-23,2020-10-08,15,Forest,Urban,624,41.6
Herrera,HL0814_2020,2020,38.90557,-77.05602,2020-10-08,2020-10-23,15,Forest,Urban,439,29.2666666666667
Herrera,HL0815_2020,2020,38.90979,-77.06347,2020-10-08,2020-10-23,15,Forest,Urban,7,0.466666666666667
Herrera,HL0816_2020,2020,38.91057,-77.06771,2020-10-08,2020-10-23,15,Forest,Urban,20,1.33333333333333
Herrera,HL0817_2020,2020,38.91245,-77.06682,2020-10-08,2020-10-23,15,Forest,Urban,50,3.33333333333333
Herrera,HL0818_2020,2020,38.91283,-77.06555,2020-10-08,2020-10-23,15,Forest,Urban,5,0.333333333333333
Herrera,HL0820_2020,2020,38.91831,-77.06546,2020-10-08,2020-10-23,15,Forest,Urban,39,2.6
Herrera,HL0821_2020,2020,38.91677,-77.07174,2020-10-08,2020-10-23,15,Forest,Urban,201,13.4
Herrera,HL0822_2020,2020,38.91809,-77.07242,2020-10-08,2020-10-23,15,Forest,Urban,4,0.266666666666667
Herrera,HL0823_2020,2020,38.90626,-77.05478,2020-10-08,2020-10-23,15,Forest,Urban,66,4.4
Herrera,HL0824_2020,2020,38.90868,-77.05133,2020-10-08,2020-10-23,15,Forest,Urban,350,23.3333333333333
Herrera,HL0825_2020,2020,38.90823,-77.05004,2020-10-08,2020-10-23,15,Forest,Urban,80,5.33333333333333
Sovie,Harrods Hill 08/06/2022_2022,2022,38.0164,-84.5642,2022-09-01,2022-10-29,58,Forest,Urban,0,0
SLC,Hidden Hollow.USA.2019_2019,2019,40.72443,-111.85717,2019-10-04,2019-11-17,44,Desert,Urban,98,2.22727272727273
Rentz,IA_Anthropogenic_Ames_10_2019,2019,42.10656,-93.56876,2019-09-26,2019-11-02,37,Forest,Rural,2,0.0540540540540541
Rentz,IA_Anthropogenic_Ames_12_2019,2019,42.1,-93.5859,2019-09-26,2019-10-23,27,Forest,Rural,2,0.0740740740740741
Rentz,IA_Anthropogenic_Ames_13_2019,2019,42.10258,-93.58598,2019-09-26,2019-10-24,28,Forest,Rural,2,0.0714285714285714
Rentz,IA_Anthropogenic_Ames_14_2019,2019,42.10091,-93.57024,2019-09-26,2019-10-24,28,Forest,Rural,0,0
Rentz,IA_Anthropogenic_Ames_15_2019,2019,42.0891,-93.5926,2019-11-01,2019-11-02,1,Forest,Rural,1,1
Rentz,IA_Anthropogenic_Ames_16_2019,2019,42.08718,-93.59324,2019-10-25,2019-11-02,8,Forest,Rural,24,3
Rentz,IA_Anthropogenic_Ames_17_2019,2019,42.09661,-93.56991,2019-10-24,2019-11-02,9,Forest,Rural,2,0.222222222222222
Rentz,IA_Anthropogenic_Ames_18_2019,2019,42.0934,-93.57596,2019-10-24,2019-11-02,9,Forest,Rural,1,0.111111111111111
Rentz,IA_Anthropogenic_Ames_19_2019,2019,42.099850000000004,-93.5729,2019-10-24,2019-11-02,9,Forest,Rural,2,0.222222222222222
Rentz,IA_Anthropogenic_Ames_1_2019,2019,42.10823,-93.56691,2019-09-06,2019-09-25,19,Forest,Rural,12,0.631578947368421
Rentz,IA_Anthropogenic_Ames_20_01_reupload_2020,2020,42.10823,-93.56691,2020-08-29,2020-09-15,17,Forest,Rural,3,0.176470588235294
Rentz,IA_Anthropogenic_Ames_20_02A_2020,2020,42.11104,-93.56465,2020-08-29,2020-09-15,17,Forest,Rural,2,0.117647058823529
Rentz,IA_Anthropogenic_Ames_20_02B_2020,2020,42.11104,-93.56465,2020-09-15,2020-09-26,11,Forest,Rural,2,0.181818181818182
Rentz,IA_Anthropogenic_Ames_20_03A_2020,2020,42.1105,-93.56171,2020-08-29,2020-09-15,17,Forest,Rural,4,0.235294117647059
Rentz,IA_Anthropogenic_Ames_20_03B_2020,2020,42.1105,-93.56171,2020-09-15,2020-09-26,11,Forest,Rural,2,0.181818181818182
Rentz,IA_Anthropogenic_Ames_20_04A_2020,2020,42.11244,-93.56088,2020-08-29,2020-09-15,17,Forest,Rural,2,0.117647058823529
Rentz,IA_Anthropogenic_Ames_20_04B_2020,2020,42.11244,-93.56088,2020-09-15,2020-09-26,11,Forest,Rural,2,0.181818181818182
Rentz,IA_Anthropogenic_Ames_20_05_2020,2020,42.1138,-93.56283,2020-08-29,2020-09-15,17,Forest,Rural,2,0.117647058823529
Rentz,IA_Anthropogenic_Ames_20_06_2020,2020,42.09581,-93.57294,2020-09-18,2020-10-11,23,Forest,Rural,4,0.173913043478261
Rentz,IA_Anthropogenic_Ames_20_07_2020,2020,42.12272,-93.56083,2020-10-23,2020-10-31,8,Forest,Rural,3,0.375
Rentz,IA_Anthropogenic_Ames_20_08_2020,2020,42.09678,-93.57554,2020-09-18,2020-10-11,23,Forest,Rural,3,0.130434782608696
Rentz,IA_Anthropogenic_Ames_20_10_2020,2020,42.10656,-93.56876,2020-08-29,2020-10-17,49,Forest,Rural,3,0.0612244897959184
Rentz,IA_Anthropogenic_Ames_20_11B_2020,2020,42.10258,-93.58598,2020-09-13,2020-09-26,13,Forest,Rural,2,0.153846153846154
Rentz,IA_Anthropogenic_Ames_20_12A_2020,2020,42.10006,-93.58586,2020-08-29,2020-09-13,15,Forest,Rural,4,0.266666666666667
Rentz,IA_Anthropogenic_Ames_20_13_2020,2020,42.099850000000004,-93.5729,2020-09-18,2020-10-11,23,Forest,Rural,2,0.0869565217391304
Rentz,IA_Anthropogenic_Ames_20_14_2020,2020,42.10091,-93.57024,2020-09-18,2020-10-11,23,Forest,Rural,5,0.217391304347826
Rentz,IA_Anthropogenic_Ames_20_15_2020,2020,42.0891,-93.59262,2020-09-19,2020-10-14,25,Forest,Rural,7,0.28
Rentz,IA_Anthropogenic_Ames_20_16_2020,2020,42.08718,-93.59324,2020-09-19,2020-10-14,25,Forest,Rural,20,0.8
Rentz,IA_Anthropogenic_Ames_20_18_2020,2020,42.0934,-93.57596,2020-09-18,2020-10-11,23,Forest,Rural,3,0.130434782608696
Rentz,IA_Anthropogenic_Ames_20_19_2020,2020,42.12773,-93.56279,2020-10-23,2020-10-31,8,Forest,Rural,2,0.25
Rentz,IA_Anthropogenic_Ames_20_21_2020,2020,42.12272,-93.56083,2020-10-23,2020-11-01,9,Forest,Rural,4,0.444444444444444
Rentz,IA_Anthropogenic_Ames_20_22_2020,2020,42.12272,-93.56083,2020-10-23,2020-10-31,8,Forest,Rural,3,0.375
Rentz,IA_Anthropogenic_Ames_20_24_2020,2020,42.15574,-93.57317,2020-09-24,2020-10-09,15,Forest,Rural,3,0.2
Rentz,IA_Anthropogenic_Ames_20_25_2020,2020,42.16222,-93.57472,2020-09-25,2020-10-10,15,Forest,Rural,4,0.266666666666667
Rentz,IA_Anthropogenic_Ames_20_26_2020,2020,42.16414,-93.5741,2020-09-24,2020-10-09,15,Forest,Rural,3,0.2
Rentz,IA_Anthropogenic_Ames_20_27_2020,2020,42.09144,-93.59264,2020-10-14,2020-10-31,17,Forest,Rural,2,0.117647058823529
Rentz,IA_Anthropogenic_Ames_20_28_2020,2020,42.0819,-93.59349,2020-10-14,2020-10-31,17,Forest,Rural,4,0.235294117647059
Rentz,IA_Anthropogenic_Ames_20_29_2020,2020,42.10006,-93.58586,2020-09-13,2020-09-26,13,Forest,Rural,2,0.153846153846154
Rentz,IA_Anthropogenic_Ames_20_30_2020,2020,42.15609,-93.57654,2020-10-10,2020-11-01,22,Forest,Rural,2,0.0909090909090909
Rentz,IA_Anthropogenic_Ames_20_33_2020,2020,42.1584,-93.57572,2020-10-09,2020-10-31,22,Forest,Rural,4,0.181818181818182
Rentz,IA_Anthropogenic_Ames_2_2019,2019,42.111,-93.56483,2019-09-05,2019-10-24,49,Forest,Rural,3,0.0612244897959184
Rentz,IA_Anthropogenic_Ames_3_2019,2019,42.11052,-93.56191,2019-09-05,2019-09-26,21,Forest,Rural,2,0.0952380952380952
Rentz,IA_Anthropogenic_Ames_4_2019,2019,42.11244,-93.56088,2019-09-05,2019-09-26,21,Forest,Rural,1,0.0476190476190476
Rentz,IA_Anthropogenic_Ames_6_2019,2019,42.09581,-93.57294,2019-09-07,2019-10-24,47,Forest,Rural,3,0.0638297872340425
Rentz,IA_Anthropogenic_Ames_7_2019,2019,42.10124,-93.57885,2019-09-07,2019-09-26,19,Forest,Rural,63,3.31578947368421
Rentz,IA_Anthropogenic_Ames_8_2019,2019,42.09678,-93.57554,2019-09-08,2019-09-26,18,Forest,Rural,1,0.0555555555555556
Rentz,IA_Anthropogenic_Ames_9_2019,2019,42.09739,-93.57263,2019-09-07,2019-10-24,47,Forest,Rural,6,0.127659574468085
Rentz,IA_Forest_Ames_10_2023,2023,42.10656,-93.56876,2023-09-09,2023-11-03,55,Forest,Rural,7,0.127272727272727
Rentz,IA_Forest_Ames_11_2023,2023,42.10258,-93.58598,2023-08-31,2023-11-03,64,Forest,Rural,5,0.078125
Rentz,IA_Forest_Ames_12_2023,2023,42.10006,-93.58586,2023-08-31,2023-10-27,57,Forest,Rural,8,0.140350877192982
Rentz,IA_Forest_Ames_13_2023,2023,42.099850000000004,-93.5729,2023-09-16,2023-11-11,56,Forest,Rural,5,0.0892857142857143
Rentz,IA_Forest_Ames_14_2023,2023,42.10091,-93.57024,2023-09-16,2023-11-11,56,Forest,Rural,3,0.0535714285714286
Rentz,IA_Forest_Ames_15_2023,2023,42.0891,-93.59262,2023-08-31,2023-10-31,61,Forest,Rural,4,0.0655737704918033
Rentz,IA_Forest_Ames_16_2023,2023,42.08718,-93.59324,2023-08-31,2023-10-31,61,Forest,Rural,36,0.59016393442623
Rentz,IA_Forest_Ames_17_2023,2023,42.09661,-93.56991,2023-09-16,2023-11-11,56,Forest,Rural,4,0.0714285714285714
Rentz,IA_Forest_Ames_18_2023,2023,42.0934,-93.57596,2023-09-09,2023-11-11,63,Forest,Rural,4,0.0634920634920635
Rentz,IA_Forest_Ames_19_2023,2023,42.12773,-93.56279,2023-09-09,2023-11-05,57,Forest,Rural,20,0.350877192982456
Rentz,IA_Forest_Ames_1_2023,2023,42.10823,-93.56691,2023-09-16,2023-11-03,48,Forest,Rural,4,0.0833333333333333
Rentz,IA_Forest_Ames_20_2023,2023,42.14227,-93.57064,2023-08-31,2023-11-05,66,Forest,Rural,7,0.106060606060606
Rentz,IA_Forest_Ames_21_2023,2023,42.14749,-93.57172,2023-08-31,2023-11-05,66,Forest,Rural,15,0.227272727272727
Rentz,IA_Forest_Ames_22_2023,2023,42.12272,-93.56083,2023-10-24,2023-11-05,12,Forest,Rural,5,0.416666666666667
Rentz,IA_Forest_Ames_23_2023,2023,42.09679,-93.57906,2023-08-31,2023-10-31,61,Forest,Rural,12,0.19672131147541
Rentz,IA_Forest_Ames_24_2023,2023,42.13963,-93.569208,2023-09-12,2023-11-04,53,Forest,Rural,12,0.226415094339623
Rentz,IA_Forest_Ames_25_2023,2023,42.15574,-93.57317,2023-09-15,2023-10-06,21,Forest,Rural,5,0.238095238095238
Rentz,IA_Forest_Ames_26_2023,2023,42.162222,-93.574722,2023-08-29,2023-09-17,19,Forest,Rural,3,0.157894736842105
Rentz,IA_Forest_Ames_27_2023,2023,42.164167,-93.574167,2023-08-29,2023-10-08,40,Forest,Rural,5,0.125
Rentz,IA_Forest_Ames_28_2023,2023,42.1537,-93.57224,2023-08-29,2023-11-07,70,Forest,Rural,7,0.1
Rentz,IA_Forest_Ames_29_2023,2023,42.15609,-93.57654,2023-08-30,2023-10-08,39,Forest,Rural,4,0.102564102564103
Rentz,IA_Forest_Ames_2_2023,2023,42.11104,-93.56465,2023-09-16,2023-11-03,48,Forest,Rural,6,0.125
Rentz,IA_Forest_Ames_30_2023,2023,42.15803,-93.57644,2023-08-29,2023-11-07,70,Forest,Rural,7,0.1
Rentz,IA_Forest_Ames_31_2023,2023,42.09038,-93.57537,2023-08-31,2023-10-31,61,Forest,Rural,16,0.262295081967213
Rentz,IA_Forest_Ames_32_2023,2023,42.09144,-93.59264,2023-09-09,2023-10-31,52,Forest,Rural,5,0.0961538461538462
Rentz,IA_Forest_Ames_33_2023,2023,42.0819,-93.59349,2023-08-31,2023-11-05,66,Forest,Rural,6,0.0909090909090909
Rentz,IA_Forest_Ames_3_2023,2023,42.1105,-93.56171,2023-09-16,2023-11-03,48,Forest,Rural,8,0.166666666666667
Rentz,IA_Forest_Ames_4_2023,2023,42.11244,-93.56088,2023-09-16,2023-10-30,44,Forest,Rural,5,0.113636363636364
Rentz,IA_Forest_Ames_5_2023,2023,42.1138,-93.56283,2023-09-01,2023-11-05,65,Forest,Rural,5,0.0769230769230769
Rentz,IA_Forest_Ames_6_2023,2023,42.09581,-93.57294,2023-09-17,2023-12-12,86,Forest,Rural,7,0.0813953488372093
Rentz,IA_Forest_Ames_8_2023,2023,42.09678,-93.57554,2023-09-16,2023-10-03,17,Forest,Rural,3,0.176470588235294
Rentz,IA_Forest_Ames_9_2023,2023,42.09739,-93.57263,2023-09-16,2023-11-11,56,Forest,Rural,6,0.107142857142857
Rentz,IA_Forest_Rentz_10 10/22/2022_2022,2022,42.10656,-93.56876,2022-10-22,2022-11-11,20,Forest,Rural,2,0.1
Rentz,IA_Forest_Rentz_11_2022,2022,42.10258,-93.58598,2022-08-30,2022-09-25,26,Forest,Rural,1,0.0384615384615385
Rentz,IA_Forest_Rentz_12 08/30/2022_2022,2022,42.10006,-93.58586,2022-08-30,2022-09-26,27,Forest,Rural,4,0.148148148148148
Rentz,IA_Forest_Rentz_13 09/29/2022_2022,2022,42.099850000000004,-93.5729,2022-09-29,2022-11-08,40,Forest,Rural,2,0.05
Rentz,IA_Forest_Rentz_14 09/29/2022_2022,2022,42.10091,-93.57024,2022-09-29,2022-11-13,45,Forest,Rural,2,0.0444444444444444
Rentz,IA_Forest_Rentz_15 08/30/2022_2022,2022,42.0891,-93.59262,2022-08-30,2022-09-12,13,Forest,Rural,1,0.0769230769230769
Rentz,IA_Forest_Rentz_16 08/30/2022_2022,2022,42.08718,-93.59324,2022-08-30,2022-09-26,27,Forest,Rural,13,0.481481481481481
Rentz,IA_Forest_Rentz_17 09/29/2022_2022,2022,42.09661,-93.56991,2022-09-27,2022-11-13,47,Forest,Rural,8,0.170212765957447
Rentz,IA_Forest_Rentz_18 10/17/2022_2022,2022,42.0934,-93.57596,2022-10-17,2022-11-13,27,Forest,Rural,2,0.0740740740740741
Rentz,IA_Forest_Rentz_19 08/31/2022_2022,2022,42.12773,-93.56279,2022-08-31,2022-09-28,28,Forest,Rural,2,0.0714285714285714
Rentz,IA_Forest_Rentz_1_2022,2022,42.10823,-93.56691,2022-09-27,2022-11-12,46,Forest,Rural,2,0.0434782608695652
Rentz,IA_Forest_Rentz_20 09/18/2022_2022,2022,42.14227,-93.57064,2022-09-18,2022-10-17,29,Forest,Rural,1,0.0344827586206897
Rentz,IA_Forest_Rentz_21 09/18/2022_2022,2022,42.14749,-93.57172,2022-09-18,2022-11-12,55,Forest,Rural,9,0.163636363636364
Rentz,IA_Forest_Rentz_22 08/31/2022_2022,2022,42.12272,-93.56083,2022-08-31,2022-09-28,28,Forest,Rural,2,0.0714285714285714
Rentz,IA_Forest_Rentz_23 08/31/2022_2022,2022,42.09679,-93.57906,2022-08-31,2022-09-18,18,Forest,Rural,2,0.111111111111111
Rentz,IA_Forest_Rentz_24_2022,2022,42.13963,-93.569208,2022-09-18,2022-10-17,29,Forest,Rural,2,0.0689655172413793
Rentz,IA_Forest_Rentz_25 10/20/2022_2022,2022,42.15574,-93.57317,2022-10-20,2022-11-12,23,Forest,Rural,3,0.130434782608696
Rentz,IA_Forest_Rentz_26 09/20/2022_2022,2022,42.162222,-93.574722,2022-09-20,2022-10-20,30,Forest,Rural,5,0.166666666666667
Rentz,IA_Forest_Rentz_27 09/20/2022_2022,2022,42.164167,-93.574084,2022-09-20,2022-10-17,27,Forest,Rural,25,0.925925925925926
Rentz,IA_Forest_Rentz_28 10/20/2022_2022,2022,42.1537,-93.57224,2022-10-20,2022-11-12,23,Forest,Rural,2,0.0869565217391304
Rentz,IA_Forest_Rentz_29_2022,2022,42.15609,-93.57654,2022-10-20,2022-11-12,23,Forest,Rural,2,0.0869565217391304
Rentz,IA_Forest_Rentz_2_2022,2022,42.11104,-93.56465,2022-09-27,2022-11-13,47,Forest,Rural,2,0.0425531914893617
Rentz,IA_Forest_Rentz_30_2022,2022,42.15803,-93.57644,2022-09-20,2022-11-12,53,Forest,Rural,6,0.113207547169811
Rentz,IA_Forest_Rentz_31 10/20/2022_2022,2022,42.09038,-93.57537,2022-10-20,2022-11-02,13,Forest,Rural,2,0.153846153846154
Rentz,IA_Forest_Rentz_32 09/18/2022_2022,2022,42.09144,-93.59264,2022-09-18,2022-10-20,32,Forest,Rural,1,0.03125
Rentz,IA_Forest_Rentz_33 08/31/2022_2022,2022,42.0819,-93.59349,2022-08-31,2022-09-18,18,Forest,Rural,2,0.111111111111111
Rentz,IA_Forest_Rentz_3_2022,2022,42.1105,-93.56171,2022-09-27,2022-11-13,47,Forest,Rural,3,0.0638297872340425
Rentz,IA_Forest_Rentz_4_2022,2022,42.11244,-93.56088,2022-09-27,2022-11-13,47,Forest,Rural,3,0.0638297872340425
Rentz,IA_Forest_Rentz_5_2022,2022,42.1138,-93.56283,2022-08-31,2022-09-28,28,Forest,Rural,2,0.0714285714285714
Rentz,IA_Forest_Rentz_6_2022,2022,42.09581,-93.57294,2022-09-29,2022-11-13,45,Forest,Rural,4,0.0888888888888889
Rentz,IA_Forest_Rentz_8 09/18/2022_2022,2022,42.09678,-93.57554,2022-09-18,2022-09-29,11,Forest,Rural,2,0.181818181818182
Rentz,IA_Forest_Rentz_9_2022,2022,42.09739,-93.57263,2022-09-29,2022-11-13,45,Forest,Rural,3,0.0666666666666667
Galena,ID_Forest_Galena_1_2019,2019,43.85301,-114.61059,2019-09-15,2019-10-19,34,Forest,Wild,2,0.0588235294117647
Galena,ID_Forest_Galena_2_2019,2019,43.83749,-114.61117,2019-09-01,2019-10-16,45,Forest,Wild,2,0.0444444444444444
Galena,ID_Forest_Galena_3_2019,2019,43.87335,-114.63296,2019-09-01,2019-10-24,53,Forest,Wild,1,0.0188679245283019
Galena,ID_Forest_Galena_4_2019,2019,43.82284,-114.6235,2019-09-15,2019-10-24,39,Forest,Wild,5,0.128205128205128
Galena,ID_Forest_Galena_5_2019,2019,43.83664,-114.63902,2019-09-15,2019-10-19,34,Forest,Wild,2,0.0588235294117647
Galena,ID_Forest_Galena_6_2019,2019,43.88966,-114.68813,2019-09-01,2019-10-16,45,Forest,Wild,3,0.0666666666666667
Galena,ID_Forest_Galena_7_2019,2019,43.9053,-114.67992,2019-09-01,2019-10-16,45,Forest,Wild,1,0.0222222222222222
Galena,ID_Forest_Galena_8_2019,2019,43.87229,-114.70593,2019-09-01,2019-10-16,45,Forest,Wild,1,0.0222222222222222
Hailey,ID_Forest_Hailey_10_2019,2019,43.49928,-114.4926,2019-09-01,2019-10-23,52,Forest,Wild,1,0.0192307692307692
Hailey,ID_Forest_Hailey_1_2019,2019,43.53206,-114.5214,2019-09-01,2019-10-24,53,Forest,Wild,13,0.245283018867925
Hailey,ID_Forest_Hailey_2_2019,2019,43.55942,-114.49716,2019-09-01,2019-10-24,53,Forest,Wild,3,0.0566037735849057
Hailey,ID_Forest_Hailey_4_2019,2019,43.62649,-114.4029,2019-09-01,2019-10-17,46,Forest,Wild,18,0.391304347826087
Hailey,ID_Forest_Hailey_5_2019,2019,43.61499,-114.4136,2019-09-01,2019-10-17,46,Forest,Wild,16,0.347826086956522
Hailey,ID_Forest_Hailey_6_2019,2019,43.55825,-114.51784,2019-09-01,2019-09-27,26,Forest,Wild,2,0.0769230769230769
Hailey,ID_Forest_Hailey_7_2019,2019,43.54676,-114.48647,2019-09-01,2019-10-23,52,Forest,Wild,4,0.0769230769230769
Hailey,ID_Forest_Hailey_8_2019,2019,43.54587,-114.4413,2019-09-01,2019-10-24,53,Forest,Wild,6,0.113207547169811
Hailey,ID_Forest_Hailey_9_2019,2019,43.58169,-114.4318,2019-09-01,2019-10-17,46,Forest,Wild,4,0.0869565217391304
Rachlow,ID_Forest_Rachlow_UIEF_22_01_01_2022,2022,46.799473,-116.810692,2022-09-04,2022-10-30,56,Forest,Wild,2,0.0357142857142857
Rachlow,ID_Forest_Rachlow_UIEF_22_02_01_2022,2022,46.799697,-116.818914,2022-09-04,2022-10-30,56,Forest,Wild,2,0.0357142857142857
Rachlow,ID_Forest_Rachlow_UIEF_22_03_01_2022,2022,46.801289,-116.818899,2022-09-04,2022-10-26,52,Forest,Wild,1,0.0192307692307692
Rachlow,ID_Forest_Rachlow_UIEF_22_04_01_2022,2022,46.802438,-116.819905,2022-09-04,2022-10-30,56,Forest,Wild,4,0.0714285714285714
Rachlow,ID_Forest_Rachlow_UIEF_22_05_01_2022,2022,46.801736,-116.822134,2022-09-04,2022-10-30,56,Forest,Wild,2,0.0357142857142857
Rachlow,ID_Forest_Rachlow_UIEF_22_07_01_2022,2022,46.802499,-116.82473,2022-09-04,2022-10-30,56,Forest,Wild,4,0.0714285714285714
Rachlow,ID_Forest_Rachlow_UIEF_22_08_01_2022,2022,46.803606,-116.826468,2022-09-04,2022-10-30,56,Forest,Wild,2,0.0357142857142857
Rachlow,ID_Forest_Rachlow_UIEF_22_09_01_2022,2022,46.80194,-116.827928,2022-09-04,2022-10-30,56,Forest,Wild,3,0.0535714285714286
Rachlow,ID_Forest_Rachlow_UIEF_22_10_01_2022,2022,46.802162,-116.830659,2022-09-04,2022-10-30,56,Forest,Wild,2,0.0357142857142857
Rachlow,ID_Forest_Rachlow_UIEF_22_11_01_2022,2022,46.799473,-116.810692,2022-09-04,2022-10-30,56,Forest,Wild,4,0.0714285714285714
Rachlow,ID_Forest_Rachlow_UIEF_22_12_01_2022,2022,46.798573,-116.80953,2022-09-04,2022-10-30,56,Forest,Wild,2,0.0357142857142857
Rachlow,ID_Forest_Rachlow_UIEF_22_13_01_2022,2022,46.797668,-116.80785,2022-09-04,2022-10-30,56,Forest,Wild,2,0.0357142857142857
Rachlow,ID_Forest_Rachlow_UIEF_22_14_01_2022,2022,46.79664,-116.8069,2022-09-03,2022-10-29,56,Forest,Wild,2,0.0357142857142857
Rachlow,ID_Forest_Rachlow_UIEF_22_15_01_2022,2022,46.794849,-116.807267,2022-09-04,2022-10-30,56,Forest,Wild,3,0.0535714285714286
Rachlow,ID_Forest_Rachlow_UIEF_22_16_01_2022,2022,46.796754,-116.810388,2022-09-04,2022-10-30,56,Forest,Wild,2,0.0357142857142857
Rachlow,ID_Forest_Rachlow_UIEF_22_17_01_2022,2022,46.798678,-116.814242,2022-09-04,2022-10-30,56,Forest,Wild,3,0.0535714285714286
Rachlow,ID_Forest_Rachlow_UIEF_22_18_01_2022,2022,46.796997,-116.814592,2022-09-04,2022-10-30,56,Forest,Wild,2,0.0357142857142857
Rachlow,ID_Forest_Rachlow_UIEF_22_19_01_2022,2022,46.799635,-116.816468,2022-09-04,2022-10-30,56,Forest,Wild,1,0.0178571428571429
Rachlow,ID_Forest_Rachlow_UIEF_22_20_01_2022,2022,46.795676,-116.812503,2022-09-04,2022-10-31,57,Forest,Wild,2,0.0350877192982456
Rachlow,ID_Forest_Rachlow_UIEF_22_31_01_2022,2022,46.798611,-116.810911,2022-09-04,2022-10-31,57,Forest,Wild,2,0.0350877192982456
Rachlow,ID_Forest_Rachlow_UIEF_22_32_01_2022,2022,46.800889,-116.809329,2022-09-06,2022-10-30,54,Forest,Wild,0,0
Rachlow,ID_Forest_Rachlow_UIEF_22_33_01_2022,2022,46.797719,-116.807379,2022-09-04,2022-09-09,5,Forest,Wild,1,0.2
Rachlow,ID_Forest_Rachlow_UIEF_22_34_01_2022,2022,46.79967,-116.809584,2022-09-04,2022-10-30,56,Forest,Wild,2,0.0357142857142857
Rachlow,ID_Forest_Rachlow_UIEF_22_35_01_2022,2022,46.79977,-116.814297,2022-09-04,2022-10-30,56,Forest,Wild,2,0.0357142857142857
Rachlow,ID_Forest_Rachlow_UIEF_22_36_01_2022,2022,46.79672,-116.814924,2022-09-04,2022-10-30,56,Forest,Wild,2,0.0357142857142857
Rachlow,ID_Forest_Rachlow_UIEF_22_37_01_2022,2022,46.794855,-116.815934,2022-09-04,2022-10-30,56,Forest,Wild,2,0.0357142857142857
Rachlow,ID_Forest_Rachlow_UIEF_22_38_01_2022,2022,46.793971,-116.818541,2022-09-04,2022-10-11,37,Forest,Wild,1,0.027027027027027
Rachlow,ID_Forest_Rachlow_UIEF_22_39_01_2022,2022,46.800732000000004,-116.810221,2022-09-04,2022-10-30,56,Forest,Wild,5,0.0892857142857143
Rachlow,ID_Forest_Rachlow_UIEF_22_40_01_2022,2022,46.802614,-116.81182,2022-09-07,2022-10-30,53,Forest,Wild,1,0.0188679245283019
Rachlow,ID_Forest_Rachlow_UIEF_22_41_01_2022,2022,46.797086,-116.80805,2022-09-04,2022-10-30,56,Forest,Wild,2,0.0357142857142857
Rachlow,ID_Forest_Rachlow_UIEF_22_42_01_2022,2022,46.799959,-116.808047,2022-09-04,2022-10-30,56,Forest,Wild,2,0.0357142857142857
Rachlow,ID_Forest_Rachlow_UIEF_22_43_01_2022,2022,46.794056,-116.812206,2022-09-04,2022-10-30,56,Forest,Wild,2,0.0357142857142857
Rachlow,ID_Forest_Rachlow_UIEF_22_44_01_2022,2022,46.791904,-116.816095,2022-09-04,2022-10-30,56,Forest,Wild,2,0.0357142857142857
Rachlow,ID_Forest_Rachlow_UIEF_22_54_01_2022,2022,46.798254,-116.807822,2022-09-04,2022-10-30,56,Forest,Wild,2,0.0357142857142857
Rachlow,ID_Forest_Rachlow_UIEF_22_55_01_2022,2022,46.797809,-116.809912,2022-09-04,2022-10-30,56,Forest,Wild,3,0.0535714285714286
Rachlow,ID_Forest_Rural_Rachlow_23_13_2023,2023,46.798135,-116.810909,2023-08-28,2023-10-23,56,Forest,Wild,3,0.0535714285714286
Rachlow,ID_Forest_Rural_Rachlow_23_15_2023,2023,46.786126,-116.793778,2023-08-29,2023-10-24,56,Forest,Wild,3,0.0535714285714286
Rachlow,ID_Forest_Rural_Rachlow_23_16_2023,2023,46.78168,-116.794878,2023-08-29,2023-10-24,56,Forest,Wild,4,0.0714285714285714
Rachlow,ID_Forest_Rural_Rachlow_23_17_2023,2023,46.8026,-116.813315,2023-08-28,2023-10-22,55,Forest,Wild,2,0.0363636363636364
Rachlow,ID_Forest_Rural_Rachlow_23_18_2023,2023,46.802151,-116.811939,2023-08-28,2023-10-23,56,Forest,Wild,7,0.125
Rachlow,ID_Forest_Rural_Rachlow_23_19_2023,2023,46.79926,-116.812648,2023-08-28,2023-10-23,56,Forest,Wild,18,0.321428571428571
Rachlow,ID_Forest_Rural_Rachlow_23_1_2023,2023,46.783266,-116.793047,2023-08-29,2023-10-24,56,Forest,Wild,1,0.0178571428571429
Rachlow,ID_Forest_Rural_Rachlow_23_20_2023,2023,46.787477,-116.79255,2023-08-29,2023-10-24,56,Forest,Wild,2,0.0357142857142857
Rachlow,ID_Forest_Rural_Rachlow_23_2_2023,2023,46.781055,-116.792325,2023-08-29,2023-10-24,56,Forest,Wild,4,0.0714285714285714
Rachlow,ID_Forest_Rural_Rachlow_23_31_2023,2023,46.802186,-116.819133,2023-08-28,2023-10-23,56,Forest,Wild,2,0.0357142857142857
Rachlow,ID_Forest_Rural_Rachlow_23_32_2023,2023,46.798782,-116.820746,2023-08-28,2023-10-23,56,Forest,Wild,2,0.0357142857142857
Rachlow,ID_Forest_Rural_Rachlow_23_33_2023,2023,46.802101,-116.808831,2023-08-28,2023-10-23,56,Forest,Wild,2,0.0357142857142857
Rachlow,ID_Forest_Rural_Rachlow_23_35_2023,2023,46.801324,-116.81803,2023-08-28,2023-09-15,18,Forest,Wild,1,0.0555555555555556
Rachlow,ID_Forest_Rural_Rachlow_23_36_2023,2023,46.801769,-116.815812,2023-08-28,2023-10-23,56,Forest,Wild,5,0.0892857142857143
Rachlow,ID_Forest_Rural_Rachlow_23_38_2023,2023,46.782677,-116.794891,2023-08-29,2023-10-24,56,Forest,Wild,2,0.0357142857142857
Rachlow,ID_Forest_Rural_Rachlow_23_39_2023,2023,46.80367,-116.81166,2023-08-28,2023-10-22,55,Forest,Wild,2,0.0363636363636364
Rachlow,ID_Forest_Rural_Rachlow_23_3_2023,2023,46.781689,-116.794878,2023-08-28,2023-10-23,56,Forest,Wild,3,0.0535714285714286
Rachlow,ID_Forest_Rural_Rachlow_23_43_2023,2023,46.80149,-116.81345,2023-08-28,2023-10-23,56,Forest,Wild,4,0.0714285714285714
Rachlow,ID_Forest_Rural_Rachlow_23_44_2023,2023,46.797673,-116.813708,2023-08-28,2023-09-04,7,Forest,Wild,1,0.142857142857143
Rachlow,ID_Forest_Rural_Rachlow_23_45_2023,2023,46.786531,-116.793764,2023-08-29,2023-10-24,56,Forest,Wild,3,0.0535714285714286
Rachlow,ID_Forest_Rural_Rachlow_23_46_2023,2023,46.800034,-116.81192,2023-08-28,2023-10-23,56,Forest,Wild,4,0.0714285714285714
Rachlow,ID_Forest_Rural_Rachlow_23_48_2023,2023,46.80473,-116.813295,2023-08-28,2023-09-27,30,Forest,Wild,1,0.0333333333333333
Rachlow,ID_Forest_Rural_Rachlow_23_54_2023,2023,46.799727,-116.816551,2023-08-28,2023-10-22,55,Forest,Wild,3,0.0545454545454545
Rachlow,ID_Forest_Rural_Rachlow_23_55_2023,2023,46.798331,-116.813699,2023-08-28,2023-10-23,56,Forest,Wild,5,0.0892857142857143
Rachlow,ID_Forest_Rural_Rachlow_23_57_2023,2023,46.786819,-116.797072,2023-08-29,2023-10-24,56,Forest,Wild,0,0
Rachlow,ID_Forest_Rural_Rachlow_23_5_2023,2023,46.785391,-116.793889,2023-08-29,2023-10-30,62,Forest,Wild,7,0.112903225806452
Rachlow,ID_Forest_Rural_Rachlow_23_9_2023,2023,46.785652,-116.797948,2023-08-29,2023-10-24,56,Forest,Wild,2,0.0357142857142857
SunValley,ID_Forest_Sun_Valley_10_2019,2019,43.7002,-114.27441,2019-09-01,2019-10-17,46,Forest,Wild,18,0.391304347826087
SunValley,ID_Forest_Sun_Valley_11_2019,2019,43.60068,-114.2006,2019-09-01,2019-10-22,51,Forest,Wild,3,0.0588235294117647
SunValley,ID_Forest_Sun_Valley_1_2019,2019,43.76833,-114.25939,2019-09-01,2019-10-18,47,Forest,Wild,4,0.0851063829787234
SunValley,ID_Forest_Sun_Valley_2_2019,2019,43.75554,-114.22144,2019-09-01,2019-10-18,47,Forest,Wild,2,0.0425531914893617
SunValley,ID_Forest_Sun_Valley_3_2019,2019,43.74519,-114.2242,2019-09-03,2019-10-18,45,Forest,Wild,1,0.0222222222222222
SunValley,ID_Forest_Sun_Valley_4_2019,2019,43.73635,-114.22157,2019-09-03,2019-10-25,52,Forest,Wild,9,0.173076923076923
SunValley,ID_Forest_Sun_Valley_5_2019,2019,43.71683,-114.25973,2019-09-01,2019-10-17,46,Forest,Wild,4,0.0869565217391304
SunValley,ID_Forest_Sun_Valley_6_2019,2019,43.69706,-114.20373,2019-09-01,2019-10-20,49,Forest,Wild,3,0.0612244897959184
SunValley,ID_Forest_Sun_Valley_7_2019,2019,43.68891,-114.22162,2019-09-01,2019-10-20,49,Forest,Wild,1,0.0204081632653061
SunValley,ID_Forest_Sun_Valley_8_2019,2019,43.66397,-114.14082,2019-09-01,2019-10-22,51,Forest,Wild,2,0.0392156862745098
SunValley,ID_Forest_Sun_Valley_9_2019,2019,43.67903,-114.16431,2019-09-04,2019-10-20,46,Forest,Wild,2,0.0434782608695652
Aurora,IL_Anthropogenic_Aurora_20_01_2020,2020,41.74843,-88.35332,2020-08-27,2020-10-03,37,Forest,Urban,135,3.64864864864865
Aurora,IL_Anthropogenic_Aurora_20_02_2020,2020,41.748,-88.367,2020-08-28,2020-10-09,42,Forest,Urban,24,0.571428571428571
Aurora,IL_Anthropogenic_Aurora_20_03_2020,2020,41.747,-88.3549,2020-08-27,2020-10-01,35,Forest,Urban,10,0.285714285714286
Aurora,IL_Anthropogenic_Aurora_20_04_2020,2020,41.7481,-88.35,2020-08-27,2020-10-20,54,Forest,Urban,65,1.2037037037037
Aurora,IL_Anthropogenic_Aurora_20_05_2020,2020,41.7458,-88.3479,2020-08-27,2020-10-16,50,Forest,Urban,19,0.38
Aurora,IL_Anthropogenic_Aurora_20_06_2020,2020,41.745,-88.355,2020-08-28,2020-10-20,53,Forest,Urban,190,3.58490566037736
Aurora,IL_Anthropogenic_Aurora_20_07_2020,2020,41.7511,-88.3554,2020-09-01,2020-10-25,54,Forest,Urban,25,0.462962962962963
Aurora,IL_Anthropogenic_Aurora_20_09_2020,2020,41.7511,-88.3505,2020-08-27,2020-10-20,54,Forest,Urban,16,0.296296296296296
Deshwal,IL_Forest_Deshwal_C13_2022,2022,40.813416,-89.807195,2022-09-25,2022-11-03,39,Forest,Wild,2,0.0512820512820513
Deshwal,IL_Forest_Deshwal_CAMC10NH_2022,2022,40.83164,-89.82246,2022-10-06,2022-11-01,26,Forest,Wild,1,0.0384615384615385
Deshwal,IL_Forest_Deshwal_CAMC10_2022,2022,40.83062,-89.82531,2022-10-06,2022-11-01,26,Forest,Wild,2,0.0769230769230769
Deshwal,IL_Forest_Deshwal_CAMC11NH_2022,2022,40.84038,-89.80782,2022-10-15,2022-11-01,17,Forest,Wild,1,0.0588235294117647
Deshwal,IL_Forest_Deshwal_CAMC11_2022,2022,40.83694,-89.80828,2022-10-15,2022-11-01,17,Forest,Wild,1,0.0588235294117647
Deshwal,IL_Forest_Deshwal_CAMC14_2022,2022,40.816278,-89.800215,2022-09-24,2022-11-01,38,Forest,Wild,0,0
Deshwal,IL_Forest_Deshwal_CAMC15_2022,2022,40.815881,-89.793352,2022-09-24,2022-11-02,39,Forest,Wild,2,0.0512820512820513
Deshwal,IL_Forest_Deshwal_CAMC17_2022,2022,40.81785,-89.78398,2022-10-05,2022-11-01,27,Forest,Wild,11,0.407407407407407
Deshwal,IL_Forest_Deshwal_CAMC18_2022,2022,40.82199,-89.78073,2022-10-05,2022-11-01,27,Forest,Wild,3,0.111111111111111
Deshwal,IL_Forest_Deshwal_CAMC23_2022,2022,40.819657,-89.802114,2022-09-24,2022-11-02,39,Forest,Wild,2,0.0512820512820513
Deshwal,IL_Forest_Deshwal_CAMC24_2022,2022,40.8334,-89.80523,2022-10-15,2022-11-01,17,Forest,Wild,1,0.0588235294117647
Deshwal,IL_Forest_Deshwal_CAMC26A_2022,2022,40.82952,-89.8055,2022-10-15,2022-11-01,17,Forest,Wild,1,0.0588235294117647
Deshwal,IL_Forest_Deshwal_CAMC26H_2022,2022,40.83101,-89.80002,2022-10-15,2022-11-01,17,Forest,Wild,2,0.117647058823529
Deshwal,IL_Forest_Deshwal_CAMC28_2022,2022,40.82526,-89.80629,2022-10-05,2022-10-26,21,Forest,Wild,0,0
Deshwal,IL_Forest_Deshwal_CAMC3NH_2022,2022,40.84895,-89.81319,2022-10-15,2022-11-01,17,Forest,Wild,1,0.0588235294117647
Deshwal,IL_Forest_Deshwal_CAMC4NH_2022,2022,40.84444,-89.81513,2022-10-15,2022-11-01,17,Forest,Wild,1,0.0588235294117647
Deshwal,IL_Forest_Deshwal_CAMC9NH_2022,2022,40.83413,-89.82823,2022-10-06,2022-10-29,23,Forest,Wild,0,0
Deshwal,IL_Forest_Deshwal_CAMC9_2022,2022,40.83506,-89.82702,2022-10-06,2022-11-01,26,Forest,Wild,2,0.0769230769230769
Deshwal,IL_Forest_Deshwal_CAMCPC1_2022,2022,40.834438,-89.83562,2022-10-06,2022-11-01,26,Forest,Wild,0,0
Deshwal,IL_Forest_Deshwal_CAMCPC2_2022,2022,40.83646,-89.83431,2022-10-05,2022-11-01,27,Forest,Wild,2,0.0740740740740741
Deshwal,IL_Forest_Deshwal_CAMPC3_2022,2022,40.81289,-89.81121,2022-10-05,2022-11-01,27,Forest,Wild,2,0.0740740740740741
Deshwal,IL_Forest_Deshwal_FarmdaleReservoir_FD1 07/01/2023_2023,2023,40.67474,-89.49809,2023-10-23,2023-11-11,19,Forest,Wild,0,0
Deshwal,IL_Forest_Deshwal_FarmdaleResevoire_FD4 07/01/2023_2023,2023,40.678,-89.49373,2023-10-29,2023-11-15,17,Forest,Wild,0,0
Deshwal,IL_Forest_Deshwal_ForestPark_FP1 07/01/2023_2023,2023,40.7509,-89.57987,2023-10-05,2023-11-18,44,Forest,Wild,2,0.0454545454545455
Deshwal,IL_Forest_Deshwal_ForestPark_FP11 07/01/2023_2023,2023,40.7632,-89.58119,2023-10-05,2023-11-16,42,Forest,Wild,0,0
Deshwal,IL_Forest_Deshwal_ForestPark_FP16 07/01/2023_2023,2023,40.75833,-89.5827,2023-10-05,2023-11-18,44,Forest,Wild,4,0.0909090909090909
Deshwal,IL_Forest_Deshwal_ForestPark_FP28 07/01/2023_2023,2023,40.76151,-89.57682,2023-10-05,2023-11-18,44,Forest,Wild,0,0
Deshwal,IL_Forest_Deshwal_JubileeStatePark_BA1 07/01/2023_2023,2023,40.82849,-89.802,2023-08-01,2023-11-04,95,Forest,Wild,2,0.0210526315789474
Deshwal,IL_Forest_Deshwal_JubileeStatePark_BA10 07/01/2023_2023,2023,40.8466,-89.81435,2023-08-01,2023-11-15,106,Forest,Wild,1,0.00943396226415094
Deshwal,IL_Forest_Deshwal_JubileeStatePark_BA11 07/01/2023_2023,2023,40.84878,-89.81779,2023-08-03,2023-10-20,78,Forest,Wild,0,0
Deshwal,IL_Forest_Deshwal_JubileeStatePark_BA12 07/01/2023_2023,2023,40.84515,-89.81657,2023-08-01,2023-11-15,106,Forest,Wild,2,0.0188679245283019
Deshwal,IL_Forest_Deshwal_JubileeStatePark_BA15 07/01/2023_2023,2023,40.83674,-89.80886,2023-08-08,2023-10-22,75,Forest,Wild,2,0.0266666666666667
Deshwal,IL_Forest_Deshwal_JubileeStatePark_BA16 07/01/2023_2023,2023,40.82723,-89.8011,2023-10-21,2023-11-16,26,Forest,Wild,0,0
Deshwal,IL_Forest_Deshwal_JubileeStatePark_BA2 07/01/2023_2023,2023,40.82975,-89.805503,2023-08-01,2023-10-07,67,Forest,Wild,1,0.0149253731343284
Deshwal,IL_Forest_Deshwal_JubileeStatePark_BA22 07/01/2023_2023,2023,40.83585,-89.83459,2023-08-01,2023-09-30,60,Forest,Wild,0,0
Deshwal,IL_Forest_Deshwal_JubileeStatePark_BA23 07/01/2023_2023,2023,40.83471,-89.8357,2023-09-29,2023-10-21,22,Forest,Wild,2,0.0909090909090909
Deshwal,IL_Forest_Deshwal_JubileeStatePark_BA3 07/01/2023_2023,2023,40.81332,-89.81125,2023-08-01,2023-11-16,107,Forest,Wild,1,0.00934579439252336
Deshwal,IL_Forest_Deshwal_JubileeStatePark_BA4 07/01/2023_2023,2023,40.83077,-89.79956,2023-08-01,2023-11-14,105,Forest,Wild,3,0.0285714285714286
Deshwal,IL_Forest_Deshwal_JubileeStatePark_BA5 07/01/2023_2023,2023,40.82957,-89.79662,2023-08-02,2023-10-11,70,Forest,Wild,1,0.0142857142857143
Deshwal,IL_Forest_Deshwal_JubileeStatePark_BA9 07/01/2023_2023,2023,40.84456,-89.81503,2023-08-01,2023-10-21,81,Forest,Wild,2,0.0246913580246914
Deshwal,IL_Forest_Deshwal_Jubilee_2022,2022,40.82653,-89.79942,2022-10-05,2022-11-01,27,Forest,Wild,1,0.037037037037037
Deshwal,IL_Forest_Deshwal_SingingWoods_SW1 07/01/2023_2023,2023,40.86315,-89.59351,2023-10-05,2023-11-18,44,Forest,Wild,0,0
Deshwal,IL_Forest_Deshwal_SingingWoods_SW10 07/01/2023_2023,2023,40.86031,-89.596,2023-10-05,2023-11-18,44,Forest,Wild,1,0.0227272727272727
Deshwal,IL_Forest_Deshwal_SingingWoods_SW18 07/01/2023_2023,2023,40.8605,-89.59345,2023-10-05,2023-11-17,43,Forest,Wild,0,0
Deshwal,IL_Forest_Deshwal_SingingWoods_SW4 07/01/2023_2023,2023,40.85964,-89.59864,2023-10-22,2023-11-18,27,Forest,Wild,1,0.037037037037037
Deshwal,IL_Forest_Deshwal_SingingWoods_SW5 07/01/2023_2023,2023,40.86135,-89.59943,2023-10-10,2023-11-18,39,Forest,Wild,0,0
SIUE,IL_Forest_SIUE_23.01_John_2023,2023,38.7946,-90.0075,2023-08-29,2023-10-26,58,Forest,Suburban,3,0.0517241379310345
SIUE,IL_Forest_SIUE_23.02_Tanks_2023,2023,38.7862983,-89.9870081,2023-08-24,2023-10-26,63,Forest,Suburban,5,0.0793650793650794
SIUE,IL_Forest_SIUE_23.03_Chicken_2023,2023,38.7905058,-90.0097414,2023-08-29,2023-10-26,58,Forest,Suburban,4,0.0689655172413793
SIUE,IL_Forest_SIUE_23.04_Evergreen_2023,2023,38.7887839,-90.0005026,2023-08-28,2023-10-26,59,Forest,Suburban,8,0.135593220338983
SIUE,IL_Forest_SIUE_23.05_Tom_2023,2023,38.78839,-90.00915,2023-08-29,2023-10-26,58,Forest,Suburban,10,0.172413793103448
SIUE,IL_Forest_SIUE_23.06_Creek_2023,2023,38.7990099,-89.9970476,2023-08-24,2023-10-27,64,Forest,Suburban,15,0.234375
SIUE,IL_Forest_SIUE_23.07_Cars_2023,2023,38.7984053,-89.9885751,2023-08-24,2023-10-26,63,Forest,Suburban,642,10.1904761904762
SIUE,IL_Forest_SIUE_23.08_XC_2023,2023,38.8052926,-89.9887273,2023-08-24,2023-10-26,63,Forest,Suburban,6,0.0952380952380952
SIUE,IL_Forest_SIUE_23.09_Lake_2023,2023,38.800767,-89.998801,2023-09-05,2023-10-27,52,Forest,Suburban,13,0.25
TON,IL_Forest_TON_21_dep_01_2021,2021,37.63366965,-89.18784832,2021-09-17,2021-09-27,10,Forest,Rural,2,0.2
TON,IL_Forest_TON_21_dep_02_2021,2021,37.63377457,-89.18218558,2021-09-17,2021-10-22,35,Forest,Rural,3,0.0857142857142857
TON,IL_Forest_TON_21_dep_03 09/17/2021_2021,2021,37.63387921,-89.17652282,2021-09-17,2021-10-22,35,Forest,Rural,2,0.0571428571428571
TON,IL_Forest_TON_21_dep_06_2021,2021,37.634191,-89.159534,2021-09-17,2021-10-22,35,Forest,Rural,2,0.0571428571428571
TON,IL_Forest_TON_21_dep_08_2021,2021,37.62927111,-89.18205384,2021-09-17,2021-10-22,35,Forest,Rural,2,0.0571428571428571
TON,IL_Forest_TON_21_dep_09_2021,2021,37.629375,-89.176391,2021-09-17,2021-09-24,7,Forest,Rural,1,0.142857142857143
TON,IL_Forest_TON_21_dep_10_2021,2021,37.62948,-89.170728,2021-09-23,2021-09-30,7,Forest,Rural,1,0.142857142857143
TON,IL_Forest_TON_21_dep_12_2021,2021,37.624662,-89.187584,2021-09-19,2021-10-22,33,Forest,Rural,3,0.0909090909090909
TON,IL_Forest_TON_21_dep_13_2021,2021,37.62476765,-89.18192213,2021-09-17,2021-10-22,35,Forest,Rural,2,0.0571428571428571
TON,IL_Forest_TON_21_dep_14_2021,2021,37.624872,-89.17626,2021-09-17,2021-10-22,35,Forest,Rural,2,0.0571428571428571
TON,IL_Forest_TON_21_dep_17_2021,2021,37.625184,-89.159273,2021-09-17,2021-10-22,35,Forest,Rural,3,0.0857142857142857
TON,IL_Forest_TON_21_dep_18_2021,2021,37.62015932,-89.18745215,2021-09-17,2021-10-22,35,Forest,Rural,2,0.0571428571428571
TON,IL_Forest_TON_21_dep_19_2021,2021,37.62026419,-89.18179044,2021-09-17,2021-10-22,35,Forest,Rural,2,0.0571428571428571
TON,IL_Forest_TON_21_dep_22_2021,2021,37.62057716,-89.16480514,2021-09-17,2021-09-27,10,Forest,Rural,1,0.1
TON,IL_Forest_TON_21_dep_23_2021,2021,37.62068094,-89.15914331,2021-09-17,2021-10-22,35,Forest,Rural,3,0.0857142857142857
TON,IL_Forest_TON_21_dep_25_2021,2021,37.61576344,-89.18143995,2021-09-20,2021-10-22,32,Forest,Rural,3,0.09375
TON,IL_Forest_TON_21_dep_28_2021,2021,37.61617741,-89.15901302,2021-09-17,2021-10-22,35,Forest,Rural,2,0.0571428571428571
TON,IL_Forest_TON_21_dep_31_2021,2021,37.6114661,-89.17020502,2021-09-17,2021-10-22,35,Forest,Rural,3,0.0857142857142857
TON,IL_Forest_TON_21_dep_33_2021,2021,37.61167387,-89.15888276,2021-09-17,2021-10-22,35,Forest,Rural,2,0.0571428571428571
TON,IL_Forest_TON_21_loc_16_2021,2021,37.625132,-89.165791,2021-09-17,2021-10-22,35,Forest,Rural,11,0.314285714285714
TON,IL_Forest_TON_21_loc_25 09/22/2021_2021,2021,37.615865,-89.175997,2021-09-22,2021-10-22,30,Forest,Rural,2,0.0666666666666667
TON,IL_Forest_TON_21_loc_26 09/22/2021_2021,2021,37.615969,-89.170335,2021-09-22,2021-10-22,30,Forest,Rural,2,0.0666666666666667
TON,IL_Forest_TON_21_loc_27 09/22/2021_2021,2021,37.616073,-89.164674,2021-09-17,2021-10-22,35,Forest,Rural,1,0.0285714285714286
TON,IL_Forest_TON_21_loc_29 08/17/2021_2021,2021,37.6112572,-89.18152716,2021-09-17,2021-10-22,35,Forest,Rural,2,0.0571428571428571
TON,IL_Forest_TON_21_loc_29 09/17/2021_2021,2021,37.6112572,-89.18152716,2021-09-17,2021-10-22,35,Forest,Rural,2,0.0571428571428571
TON,IL_Forest_TON_21_loc_30 09/17/2021_2021,2021,37.61136181,-89.17586611,2021-09-17,2021-10-13,26,Forest,Rural,2,0.0769230769230769
TON,IL_Forest_TON_21_loc_6_2021,2021,37.6291662,-89.1877162,2021-09-19,2021-10-22,33,Forest,Rural,2,0.0606060606060606
Urbana,IL_Forest_Urbana21_BR1_2021,2021,40.147222,-88.163611,2021-09-01,2021-09-28,27,Forest,Rural,0,0
Urbana,IL_Forest_Urbana21_BR2_2021,2021,40.14329,-88.166865,2021-09-01,2021-09-30,29,Forest,Rural,0,0
Urbana,IL_Forest_Urbana21_BR3_2021,2021,40.145423,-88.166372,2021-09-01,2021-09-30,29,Forest,Rural,0,0
Urbana,IL_Forest_Urbana21_BR4_2021,2021,40.147312,-88.167458,2021-09-03,2021-09-30,27,Forest,Rural,0,0
Urbana,IL_Forest_Urbana21_BR5_2021,2021,40.144167,-88.163889,2021-09-01,2021-09-30,29,Forest,Rural,0,0
Urbana,IL_Forest_Urbana21_PT1_2021,2021,40.128975,-88.146833,2021-09-01,2021-09-30,29,Forest,Rural,0,0
Urbana,IL_Forest_Urbana21_PT2_2021,2021,40.128889,-88.150833,2021-09-01,2021-09-30,29,Forest,Rural,0,0
Urbana,IL_Forest_Urbana21_PT3_2021,2021,40.131006,-88.148143,2021-09-01,2021-09-30,29,Forest,Rural,13,0.448275862068966
Urbana,IL_Forest_Urbana21_PT4_2021,2021,40.130973,-88.151302,2021-09-01,2021-09-15,14,Forest,Rural,0,0
Urbana,IL_Forest_Urbana21_PT5_2021,2021,40.134605,-88.151874,2021-09-01,2021-09-30,29,Forest,Rural,0,0
Urbana,IL_Forest_Urbana21_TR1_2021,2021,40.134102,-88.142516,2021-09-01,2021-09-30,29,Forest,Rural,3,0.103448275862069
Urbana,IL_Forest_Urbana21_TR2_2021,2021,40.132432,-88.140852,2021-09-01,2021-09-30,29,Forest,Rural,7,0.241379310344828
Urbana,IL_Forest_Urbana21_TR3_2021,2021,40.130034,-88.139273,2021-09-01,2021-09-30,29,Forest,Rural,0,0
Urbana,IL_Forest_Urbana21_TR4_2021,2021,40.130788,-88.142316,2021-09-01,2021-09-30,29,Forest,Rural,9,0.310344827586207
Urbana,IL_Forest_Urbana21_TR5_2021,2021,40.134167,-88.139722,2021-09-01,2021-09-30,29,Forest,Rural,2,0.0689655172413793
Urbana,IL_Forest_Urbana_10_2019,2019,40.13079,-88.14232,2019-09-01,2019-09-30,29,Forest,Rural,2,0.0689655172413793
Urbana,IL_Forest_Urbana_11_2019,2019,40.14385,-88.16365,2019-09-01,2019-09-30,29,Forest,Rural,2,0.0689655172413793
Urbana,IL_Forest_Urbana_12_2019,2019,40.14329,-88.16687,2019-09-01,2019-09-26,25,Forest,Rural,1,0.04
Urbana,IL_Forest_Urbana_13_2019,2019,40.14542,-88.16637,2019-09-01,2019-09-30,29,Forest,Rural,1,0.0344827586206897
Urbana,IL_Forest_Urbana_14_2019,2019,40.14731,-88.16746,2019-09-01,2019-09-30,29,Forest,Rural,0,0
Urbana,IL_Forest_Urbana_1_2019,2019,40.13461,-88.15197,2019-09-01,2019-09-29,28,Forest,Rural,0,0
Urbana,IL_Forest_Urbana_20_01_2020,2020,40.1347,-88.1519,2020-09-01,2020-09-30,29,Forest,Rural,0,0
Urbana,IL_Forest_Urbana_20_02_2020,2020,40.129,-88.1467,2020-09-01,2020-09-30,29,Forest,Rural,0,0
Urbana,IL_Forest_Urbana_20_03_2020,2020,40.1292,-88.1513,2020-09-01,2020-09-30,29,Forest,Rural,0,0
Urbana,IL_Forest_Urbana_20_05_2020,2020,40.131,-88.1514,2020-09-01,2020-09-30,29,Forest,Rural,0,0
Urbana,IL_Forest_Urbana_20_06_2020,2020,40.1341,-88.1397,2020-09-01,2020-09-30,29,Forest,Rural,0,0
Urbana,IL_Forest_Urbana_20_08_2020,2020,40.1325,-88.1408,2020-09-01,2020-09-30,29,Forest,Rural,6,0.206896551724138
Urbana,IL_Forest_Urbana_20_09_2020,2020,40.1301812,-88.1392001,2020-09-01,2020-09-30,29,Forest,Rural,1,0.0344827586206897
Urbana,IL_Forest_Urbana_20_10_2020,2020,40.1308,-88.1422,2020-09-01,2020-09-30,29,Forest,Rural,0,0
Urbana,IL_Forest_Urbana_20_11_2020,2020,40.1441,-88.1638,2020-09-01,2020-09-30,29,Forest,Rural,0,0
Urbana,IL_Forest_Urbana_20_12_2020,2020,40.1432,-88.1664,2020-09-01,2020-09-30,29,Forest,Rural,0,0
Urbana,IL_Forest_Urbana_20_13_2020,2020,40.1456,-88.1664,2020-09-01,2020-09-30,29,Forest,Rural,0,0
Urbana,IL_Forest_Urbana_20_14_2020,2020,40.1473,-88.1675,2020-09-01,2020-09-30,29,Forest,Rural,0,0
Urbana,IL_Forest_Urbana_20_15_2020,2020,40.1468,-88.1637,2020-09-01,2020-09-30,29,Forest,Rural,0,0
Urbana,IL_Forest_Urbana_2_2019,2019,40.12898,-88.14683,2019-09-06,2019-09-29,23,Forest,Rural,0,0
Urbana,IL_Forest_Urbana_3_2019,2019,40.12911,-88.15123,2019-09-01,2019-09-29,28,Forest,Rural,0,0
Urbana,IL_Forest_Urbana_4_2019,2019,40.13101,-88.14814,2019-09-01,2019-09-29,28,Forest,Rural,0,0
Urbana,IL_Forest_Urbana_5_2019,2019,40.13097,-88.1513,2019-09-01,2019-09-29,28,Forest,Rural,1,0.0357142857142857
Urbana,IL_Forest_Urbana_7_2019,2019,40.1341,-88.14252,2019-09-01,2019-09-30,29,Forest,Rural,68,2.3448275862069
Urbana,IL_Forest_Urbana_8_2019,2019,40.13243,-88.14085,2019-09-01,2019-09-30,29,Forest,Rural,4,0.137931034482759
Urbana,IL_Forest_Urbana_9_2019,2019,40.13003,-88.13927,2019-09-01,2019-09-30,29,Forest,Rural,2,0.0689655172413793
Urbana,IL_Forest_Urbana_BR1_2022_2022,2022,40.147174,-88.163666,2022-09-03,2022-10-08,35,Forest,Rural,2,0.0571428571428571
Urbana,IL_Forest_Urbana_BR1_2023,2023,40.14702,-88.1638,2023-09-02,2023-10-07,35,Forest,Rural,2,0.0571428571428571
Urbana,IL_Forest_Urbana_BR2_2022_2022,2022,40.143263,-88.166652,2022-09-03,2022-10-08,35,Forest,Rural,3,0.0857142857142857
Urbana,IL_Forest_Urbana_BR2_2023,2023,40.14333,-88.16692,2023-09-02,2023-10-07,35,Forest,Rural,2,0.0571428571428571
Urbana,IL_Forest_Urbana_BR3_2022_2022,2022,40.14495,-88.16533,2022-09-03,2022-10-08,35,Forest,Rural,3,0.0857142857142857
Urbana,IL_Forest_Urbana_BR3_2023,2023,40.14495,-88.16533,2023-09-02,2023-11-01,60,Forest,Rural,6,0.1
Urbana,IL_Forest_Urbana_BR4_2022_2022,2022,40.146963,-88.166886,2022-09-03,2022-10-08,35,Forest,Rural,4,0.114285714285714
Urbana,IL_Forest_Urbana_BR4_2023,2023,40.14728,-88.1674,2023-09-02,2023-10-07,35,Forest,Rural,2,0.0571428571428571
Urbana,IL_Forest_Urbana_BR5_2022_2022,2022,40.143389,-88.163373000000007,2022-09-03,2022-10-08,35,Forest,Rural,4,0.114285714285714
Urbana,IL_Forest_Urbana_BR5_2023,2023,40.14342,-88.1634,2023-09-02,2023-10-07,35,Forest,Rural,2,0.0571428571428571
Urbana,IL_Forest_Urbana_PT1_2022_2022,2022,40.128955,-88.146732,2022-09-04,2022-10-08,34,Forest,Rural,2,0.0588235294117647
Urbana,IL_Forest_Urbana_PT1_2023,2023,40.1291,-88.14669,2023-09-01,2023-10-07,36,Forest,Rural,2,0.0555555555555556
Urbana,IL_Forest_Urbana_PT2_2022_2022,2022,40.129249,-88.150609,2022-09-04,2022-10-08,34,Forest,Rural,2,0.0588235294117647
Urbana,IL_Forest_Urbana_PT2_2023,2023,40.1291,-88.1507,2023-09-01,2023-10-07,36,Forest,Rural,2,0.0555555555555556
Urbana,IL_Forest_Urbana_PT3_2022_2022,2022,40.131039,-88.148151,2022-09-04,2022-10-08,34,Forest,Rural,6,0.176470588235294
Urbana,IL_Forest_Urbana_PT3_2023,2023,40.131100000000004,-88.14807,2023-09-01,2023-10-07,36,Forest,Rural,2,0.0555555555555556
Urbana,IL_Forest_Urbana_PT4_2022_2022,2022,40.130973,-88.151302,2022-09-04,2022-10-08,34,Forest,Rural,2,0.0588235294117647
Urbana,IL_Forest_Urbana_PT4_2023,2023,40.13097,-88.1513,2023-09-01,2023-11-01,61,Forest,Rural,2,0.0327868852459016
Urbana,IL_Forest_Urbana_PT5_2022_2022,2022,40.134698,-88.151902,2022-09-04,2022-10-08,34,Forest,Rural,3,0.0882352941176471
Urbana,IL_Forest_Urbana_PT5_2023,2023,40.1347,-88.15179,2023-09-02,2023-10-07,35,Forest,Rural,1,0.0285714285714286
Urbana,IL_Forest_Urbana_TR1_2022_2022,2022,40.133918,-88.14232,2022-09-04,2022-10-08,34,Forest,Rural,9,0.264705882352941
Urbana,IL_Forest_Urbana_TR2_2022_2022,2022,40.131969,-88.141011,2022-09-04,2022-10-08,34,Forest,Rural,4,0.117647058823529
Urbana,IL_Forest_Urbana_TR3_2022_2022,2022,40.130189,-88.139201,2022-09-04,2022-10-08,34,Forest,Rural,11,0.323529411764706
Urbana,IL_Forest_Urbana_TR4_2022_2022,2022,40.130212,-88.142175,2022-09-04,2022-10-08,34,Forest,Rural,12,0.352941176470588
Urbana,IL_Forest_Urbana_TR5_2022_2022,2022,40.133907,-88.139687,2022-09-03,2022-10-07,34,Forest,Rural,5,0.147058823529412
Urbana,IL_Forest_Urbana_TW1_2023,2023,40.13428,-88.14266,2023-09-01,2023-10-07,36,Forest,Rural,72,2
Urbana,IL_Forest_Urbana_TW2_2023,2023,40.13248,-88.14071,2023-09-01,2023-10-07,36,Forest,Rural,3,0.0833333333333333
Urbana,IL_Forest_Urbana_TW3_2023,2023,40.13019,-88.1392,2023-09-01,2023-11-01,61,Forest,Rural,5,0.0819672131147541
Urbana,IL_Forest_Urbana_TW4_2023,2023,40.1304,-88.14217,2023-09-01,2023-10-07,36,Forest,Rural,5,0.138888888888889
Urbana,IL_Forest_Urbana_TW5_2023,2023,40.13425,-88.13964,2023-09-01,2023-10-07,36,Forest,Rural,1,0.0277777777777778
Vermillion,IL_Forest_Vermillion_dep01_2023,2023,40.059036,-87.563986,2023-09-01,2023-10-06,35,Forest,Rural,7,0.2
Vermillion,IL_Forest_Vermillion_dep02_2023,2023,40.059937,-87.566081,2023-09-01,2023-10-06,35,Forest,Rural,3,0.0857142857142857
Vermillion,IL_Forest_Vermillion_dep03_2023,2023,40.062931,-87.567443,2023-09-01,2023-10-06,35,Forest,Rural,2,0.0571428571428571
Vermillion,IL_Forest_Vermillion_dep04_2023,2023,40.0667,-87.571377,2023-09-01,2023-10-06,35,Forest,Rural,2,0.0571428571428571
Vermillion,IL_Forest_Vermillion_dep05_2023,2023,40.05776,-87.561769,2023-09-01,2023-10-06,35,Forest,Rural,2,0.0571428571428571
Vermillion,IL_Forest_Vermillion_dep06_2023,2023,40.05624,-87.559858,2023-09-01,2023-10-06,35,Forest,Rural,4,0.114285714285714
Vermillion,IL_Forest_Vermillion_dep07_2023,2023,40.060207,-87.559331,2023-09-01,2023-10-06,35,Forest,Rural,2,0.0571428571428571
Vermillion,IL_Forest_Vermillion_dep08_2023,2023,40.067087,-87.568438,2023-09-01,2023-10-06,35,Forest,Rural,2,0.0571428571428571
Vermillion,IL_Forest_Vermillion_dep09_2023,2023,40.064307,-87.570898,2023-09-01,2023-10-06,35,Forest,Rural,2,0.0571428571428571
Vermillion,IL_Forest_Vermillion_dep10_2023,2023,40.064998,-87.567452,2023-09-01,2023-10-06,35,Forest,Rural,2,0.0571428571428571
Vermillion,IL_Forest_Vermillion_dep11_2023,2023,40.065851,-87.565129,2023-09-01,2023-10-06,35,Forest,Rural,3,0.0857142857142857
Vermillion,IL_Forest_Vermillion_dep12_2023,2023,40.066458,-87.561715,2023-09-01,2023-10-06,35,Forest,Rural,2,0.0571428571428571
Vermillion,IL_Forest_Vermillion_dep13_2023,2023,40.06863,-87.560012,2023-09-01,2023-10-06,35,Forest,Rural,2,0.0571428571428571
Vermillion,IL_Forest_Vermillion_dep14_2023,2023,40.069966,-87.558309,2023-09-01,2023-10-06,35,Forest,Rural,2,0.0571428571428571
Vermillion,IL_Forest_Vermillion_dep15_2023,2023,40.063652,-87.556542,2023-09-01,2023-10-06,35,Forest,Rural,2,0.0571428571428571
Vermillion,IL_Forest_Vermillion_dep16_2023,2023,40.063396,-87.559405,2023-09-01,2023-10-06,35,Forest,Rural,2,0.0571428571428571
Vermillion,IL_Forest_Vermillion_dep17_2023,2023,40.065814,-87.558505,2023-09-01,2023-10-06,35,Forest,Rural,2,0.0571428571428571
Vermillion,IL_Forest_Vermillion_dep18_2023,2023,40.062493,-87.563199,2023-09-01,2023-10-06,35,Forest,Rural,2,0.0571428571428571
Nachusa,IL_Grassland_Nachusa_Grasslands_10_2019,2019,41.91724,-89.35413,2019-08-30,2019-10-27,58,Grassland,Rural,47,0.810344827586207
Nachusa,IL_Grassland_Nachusa_Grasslands_11_2019,2019,41.90988,-89.32638,2019-08-30,2019-10-27,58,Grassland,Rural,17,0.293103448275862
Nachusa,IL_Grassland_Nachusa_Grasslands_1_2019,2019,41.89188,-89.30743,2019-08-30,2019-09-19,20,Grassland,Rural,8,0.4
Nachusa,IL_Grassland_Nachusa_Grasslands_2_2019,2019,41.88398,-89.34576,2019-08-30,2019-09-12,13,Grassland,Rural,152,11.6923076923077
Nachusa,IL_Grassland_Nachusa_Grasslands_3_2019,2019,41.90453,-89.33676,2019-08-30,2019-09-18,19,Grassland,Rural,99,5.21052631578947
Nachusa,IL_Grassland_Nachusa_Grasslands_4_2019,2019,41.89239,-89.31053,2019-09-19,2019-10-27,38,Grassland,Rural,1,0.0263157894736842
Nachusa,IL_Grassland_Nachusa_Grasslands_5_2019,2019,41.89184,-89.33795,2019-09-02,2019-10-05,33,Grassland,Rural,7,0.212121212121212
Nachusa,IL_Grassland_Nachusa_Grasslands_6_2019,2019,41.86275,-89.35878,2019-09-02,2019-10-05,33,Grassland,Rural,58,1.75757575757576
Nachusa,IL_Grassland_Nachusa_Grasslands_7_2019,2019,41.90245,-89.34041,2019-09-19,2019-10-18,29,Grassland,Rural,3,0.103448275862069
Nachusa,IL_Grassland_Nachusa_Grasslands_9_2019,2019,41.89337,-89.37701,2019-09-02,2019-10-27,55,Grassland,Rural,86,1.56363636363636
Brooke,IN_Forest_Purdue_Brooke_22_Lugar10_20220909_2022,2022,40.42378,-86.96894,2022-09-09,2022-10-30,51,Forest,Rural,2,0.0392156862745098
Brooke,IN_Forest_Purdue_Brooke_22_Lugar1_20220909_2022,2022,40.43012,-86.95977,2022-09-09,2022-10-29,50,Forest,Rural,12,0.24
Brooke,IN_Forest_Purdue_Brooke_22_Lugar2_20220909_2022,2022,40.4297,-86.95113,2022-09-09,2022-10-29,50,Forest,Rural,1,0.02
Brooke,IN_Forest_Purdue_Brooke_22_Lugar3_20220909_2022,2022,40.42448,-86.94897,2022-09-09,2022-10-29,50,Forest,Rural,2,0.04
Brooke,IN_Forest_Purdue_Brooke_22_Lugar4_20220909_2022,2022,40.42209,-86.96,2022-09-09,2022-10-30,51,Forest,Rural,5,0.0980392156862745
Brooke,IN_Forest_Purdue_Brooke_22_Lugar5_20220909_2022,2022,40.42469,-86.96555,2022-09-09,2022-10-29,50,Forest,Rural,3,0.06
Brooke,IN_Forest_Purdue_Brooke_22_Lugar6_20220909_2022,2022,40.42073,-86.96889,2022-09-09,2022-10-30,51,Forest,Rural,2,0.0392156862745098
Brooke,IN_Forest_Purdue_Brooke_22_Lugar7_20220909_2022,2022,40.42641,-86.96795,2022-09-09,2022-10-30,51,Forest,Rural,3,0.0588235294117647
Brooke,IN_Forest_Purdue_Brooke_22_Lugar8_20220909_2022,2022,40.42726,-86.96214,2022-09-09,2022-10-29,50,Forest,Rural,17,0.34
Brooke,IN_Forest_Purdue_Brooke_22_Lugar9_20220909_2022,2022,40.42324,-86.96236,2022-09-09,2022-10-30,51,Forest,Rural,3,0.0588235294117647
Brooke,IN_Forest_Purdue_Lugar_1_2019,2019,40.43021,-86.9596,2019-09-08,2019-09-29,21,Forest,Rural,5,0.238095238095238
Brooke,IN_Forest_Purdue_Lugar_1_2021,2021,40.43012,-86.95977,2021-09-03,2021-10-22,49,Forest,Rural,5,0.102040816326531
Brooke,IN_Forest_Purdue_Lugar_20_01_2020,2020,40.43032,-86.95975,2020-09-03,2020-10-21,48,Forest,Rural,4,0.0833333333333333
Brooke,IN_Forest_Purdue_Lugar_20_02_2020,2020,40.42976,-86.95134,2020-09-03,2020-10-21,48,Forest,Rural,4,0.0833333333333333
Brooke,IN_Forest_Purdue_Lugar_20_03_2020,2020,40.42447,-86.94901,2020-09-03,2020-10-21,48,Forest,Rural,2,0.0416666666666667
Brooke,IN_Forest_Purdue_Lugar_20_04_2020,2020,40.42191,-86.95999,2020-09-04,2020-10-22,48,Forest,Rural,6,0.125
Brooke,IN_Forest_Purdue_Lugar_20_05_2020,2020,40.42073,-86.96889,2020-09-03,2020-10-21,48,Forest,Rural,2,0.0416666666666667
Brooke,IN_Forest_Purdue_Lugar_20_06_2020,2020,40.42641,-86.96795,2020-09-03,2020-10-21,48,Forest,Rural,2,0.0416666666666667
Brooke,IN_Forest_Purdue_Lugar_20_07_2020,2020,40.42469,-86.96555,2020-09-03,2020-10-21,48,Forest,Rural,2,0.0416666666666667
Brooke,IN_Forest_Purdue_Lugar_20_08_2020,2020,40.42732,-86.96163,2020-09-03,2020-10-21,48,Forest,Rural,3,0.0625
Brooke,IN_Forest_Purdue_Lugar_2_2019,2019,40.42961,-86.95079,2019-09-08,2019-09-28,20,Forest,Rural,0,0
Brooke,IN_Forest_Purdue_Lugar_3_2019,2019,40.42447,-86.94899,2019-09-08,2019-09-09,1,Forest,Rural,0,0
Brooke,IN_Forest_Purdue_Lugar_5_2019,2019,40.42075,-86.96889,2019-09-08,2019-11-07,60,Forest,Rural,2,0.0333333333333333
Brooke,IN_Forest_Purdue_Lugar_6_2019,2019,40.42621,-86.96797,2019-09-08,2019-11-07,60,Forest,Rural,2,0.0333333333333333
Brooke,IN_Forest_Purdue_Lugar_8_2019,2019,40.42726,-86.96214,2019-09-08,2019-11-07,60,Forest,Rural,18,0.3
Brooke,IN_Forest_Purdue_Lugar_9_2019,2019,40.42212,-86.95991,2019-11-03,2019-11-06,3,Forest,Rural,2,0.666666666666667
PWAMartell,IN_Forest_Purdue_PWA_Martell_10_2019,2019,40.43005,-87.03427,2019-09-07,2019-10-29,52,Forest,Rural,6,0.115384615384615
PWAMartell,IN_Forest_Purdue_PWA_Martell_11_2019,2019,40.44506,-87.03326,2019-09-07,2019-10-29,52,Forest,Rural,19,0.365384615384615
PWAMartell,IN_Forest_Purdue_PWA_Martell_1_2019,2019,40.45058,-87.05056,2019-09-08,2019-10-29,51,Forest,Rural,4,0.0784313725490196
PWAMartell,IN_Forest_Purdue_PWA_Martell_20_01_2020,2020,40.45001,-87.05053,2020-09-01,2020-10-13,42,Forest,Rural,15,0.357142857142857
PWAMartell,IN_Forest_Purdue_PWA_Martell_20_02_2020,2020,40.44965,-87.05447,2020-09-01,2020-10-13,42,Forest,Rural,5,0.119047619047619
PWAMartell,IN_Forest_Purdue_PWA_Martell_20_04_2020,2020,40.45835,-87.05692,2020-09-01,2020-10-13,42,Forest,Rural,13,0.30952380952381
PWAMartell,IN_Forest_Purdue_PWA_Martell_20_05_2020,2020,40.42735,-87.0367,2020-09-01,2020-10-13,42,Forest,Rural,20,0.476190476190476
PWAMartell,IN_Forest_Purdue_PWA_Martell_20_06_2020,2020,40.43898,-87.03263,2020-09-01,2020-10-13,42,Forest,Rural,7,0.166666666666667
PWAMartell,IN_Forest_Purdue_PWA_Martell_20_09_2020,2020,40.43632,-87.03896,2020-09-01,2020-10-15,44,Forest,Rural,6,0.136363636363636
PWAMartell,IN_Forest_Purdue_PWA_Martell_22_loc_01_2022,2022,40.45001,-87.05053,2022-09-01,2022-10-20,49,Forest,Rural,25,0.510204081632653
PWAMartell,IN_Forest_Purdue_PWA_Martell_22_loc_02_2022,2022,40.44965,-87.05447,2022-09-01,2022-10-20,49,Forest,Rural,39,0.795918367346939
PWAMartell,IN_Forest_Purdue_PWA_Martell_22_loc_03_2022,2022,40.45292,-87.05466,2022-09-01,2022-10-20,49,Forest,Rural,45,0.918367346938776
PWAMartell,IN_Forest_Purdue_PWA_Martell_22_loc_04_2022,2022,40.45835,-87.05692,2022-09-01,2022-10-20,49,Forest,Rural,70,1.42857142857143
PWAMartell,IN_Forest_Purdue_PWA_Martell_22_loc_05_2022,2022,40.42735,-87.0367,2022-09-01,2022-10-20,49,Forest,Rural,95,1.93877551020408
PWAMartell,IN_Forest_Purdue_PWA_Martell_22_loc_06_2022,2022,40.43898,-87.03263,2022-09-01,2022-10-20,49,Forest,Rural,59,1.20408163265306
PWAMartell,IN_Forest_Purdue_PWA_Martell_22_loc_07_2022,2022,40.43325,-87.029,2022-09-01,2022-10-20,49,Forest,Rural,29,0.591836734693878
PWAMartell,IN_Forest_Purdue_PWA_Martell_22_loc_08_2022,2022,40.43486,-87.0367,2022-09-01,2022-10-20,49,Forest,Rural,27,0.551020408163265
PWAMartell,IN_Forest_Purdue_PWA_Martell_22_loc_09_2022,2022,40.43607,-87.03923,2022-09-01,2022-10-11,40,Forest,Rural,4,0.1
PWAMartell,IN_Forest_Purdue_PWA_Martell_22_loc_10_2022,2022,40.4303,-87.03471,2022-09-01,2022-09-27,26,Forest,Rural,8,0.307692307692308
PWAMartell,IN_Forest_Purdue_PWA_Martell_22_loc_11_2022,2022,40.44506,-87.03326,2022-09-01,2022-10-20,49,Forest,Rural,17,0.346938775510204
PWAMartell,IN_Forest_Purdue_PWA_Martell_22_loc_12_2022,2022,40.44781,-87.05538,2022-09-01,2022-10-20,49,Forest,Rural,16,0.326530612244898
PWAMartell,IN_Forest_Purdue_PWA_Martell_23_loc_01_2023,2023,40.45001,-87.05053,2023-08-01,2023-09-08,38,Forest,Rural,1,0.0263157894736842
PWAMartell,IN_Forest_Purdue_PWA_Martell_23_loc_02_2023,2023,40.44965,-87.05447,2023-08-01,2023-09-08,38,Forest,Rural,2,0.0526315789473684
PWAMartell,IN_Forest_Purdue_PWA_Martell_23_loc_03_2023,2023,40.45292,-87.05466,2023-08-01,2023-10-20,80,Forest,Rural,24,0.3
PWAMartell,IN_Forest_Purdue_PWA_Martell_23_loc_04_2023,2023,40.45835,-87.05692,2023-08-01,2023-10-20,80,Forest,Rural,56,0.7
PWAMartell,IN_Forest_Purdue_PWA_Martell_23_loc_05_2023,2023,40.42735,-87.0367,2023-08-01,2023-10-20,80,Forest,Rural,69,0.8625
PWAMartell,IN_Forest_Purdue_PWA_Martell_23_loc_06_2023,2023,40.43898,-87.03263,2023-08-01,2023-10-20,80,Forest,Rural,79,0.9875
PWAMartell,IN_Forest_Purdue_PWA_Martell_23_loc_07_2023,2023,40.43325,-87.029,2023-08-01,2023-10-20,80,Forest,Rural,22,0.275
PWAMartell,IN_Forest_Purdue_PWA_Martell_23_loc_08_2023,2023,40.43486,-87.0367,2023-08-01,2023-10-20,80,Forest,Rural,31,0.3875
PWAMartell,IN_Forest_Purdue_PWA_Martell_23_loc_09_2023,2023,40.43607,-87.03923,2023-08-01,2023-10-20,80,Forest,Rural,37,0.4625
PWAMartell,IN_Forest_Purdue_PWA_Martell_23_loc_10_2023,2023,40.4303,-87.03471,2023-08-01,2023-10-20,80,Forest,Rural,15,0.1875
PWAMartell,IN_Forest_Purdue_PWA_Martell_23_loc_11_2023,2023,40.44506,-87.03326,2023-08-01,2023-10-20,80,Forest,Rural,63,0.7875
PWAMartell,IN_Forest_Purdue_PWA_Martell_23_loc_12_2023,2023,40.44781,-87.05538,2023-08-01,2023-10-20,80,Forest,Rural,25,0.3125
PWAMartell,IN_Forest_Purdue_PWA_Martell_2_2019,2019,40.44965,-87.05447,2019-09-07,2019-10-29,52,Forest,Rural,10,0.192307692307692
PWAMartell,IN_Forest_Purdue_PWA_Martell_3_2019,2019,40.45292,-87.05466,2019-09-07,2019-10-29,52,Forest,Rural,16,0.307692307692308
PWAMartell,IN_Forest_Purdue_PWA_Martell_4_2019,2019,40.45835,-87.05692,2019-09-07,2019-10-29,52,Forest,Rural,9,0.173076923076923
PWAMartell,IN_Forest_Purdue_PWA_Martell_5B_2019,2019,40.42735,-87.0367,2019-09-07,2019-10-29,52,Forest,Rural,17,0.326923076923077
PWAMartell,IN_Forest_Purdue_PWA_Martell_6_2019,2019,40.43898,-87.03263,2019-09-07,2019-10-29,52,Forest,Rural,37,0.711538461538462
PWAMartell,IN_Forest_Purdue_PWA_Martell_7_2019,2019,40.43325,-87.029,2019-09-07,2019-10-29,52,Forest,Rural,30,0.576923076923077
PWAMartell,IN_Forest_Purdue_PWA_Martell_8_2019,2019,40.43486,-87.0367,2019-09-08,2019-10-29,51,Forest,Rural,35,0.686274509803922
PWAMartell,IN_Forest_Purdue_PWA_Martell_9_2019,2019,40.43632,-87.03896,2019-09-07,2019-10-29,52,Forest,Rural,17,0.326923076923077
PWAMartell,IN_Forest_Purdue_PWA_Martell_loc_01 09/02/2021_2021,2021,40.45001,-87.05053,2021-09-02,2021-10-21,49,Forest,Rural,4,0.0816326530612245
PWAMartell,IN_Forest_Purdue_PWA_Martell_loc_02 09/02/2021_2021,2021,40.44965,-87.05447,2021-09-02,2021-10-21,49,Forest,Rural,8,0.163265306122449
PWAMartell,IN_Forest_Purdue_PWA_Martell_loc_03 09/02/2021_2021,2021,40.45292,-87.05466,2021-09-02,2021-10-21,49,Forest,Rural,16,0.326530612244898
PWAMartell,IN_Forest_Purdue_PWA_Martell_loc_04 09/02/2021_2021,2021,40.45835,-87.05692,2021-09-02,2021-10-21,49,Forest,Rural,12,0.244897959183673
PWAMartell,IN_Forest_Purdue_PWA_Martell_loc_05 09/02/2021_2021,2021,40.42735,-87.0367,2021-09-02,2021-10-21,49,Forest,Rural,34,0.693877551020408
PWAMartell,IN_Forest_Purdue_PWA_Martell_loc_06 09/02/2021_2021,2021,40.43898,-87.03263,2021-09-02,2021-10-21,49,Forest,Rural,27,0.551020408163265
PWAMartell,IN_Forest_Purdue_PWA_Martell_loc_07 09/02/2021_2021,2021,40.43325,-87.029,2021-09-02,2021-10-21,49,Forest,Rural,6,0.122448979591837
PWAMartell,IN_Forest_Purdue_PWA_Martell_loc_08 09/02/2021_2021,2021,40.43486,-87.0367,2021-09-02,2021-10-21,49,Forest,Rural,9,0.183673469387755
PWAMartell,IN_Forest_Purdue_PWA_Martell_loc_09 09/02/2021_2021,2021,40.43632,-87.03263,2021-09-02,2021-10-21,49,Forest,Rural,11,0.224489795918367
PWAMartell,IN_Forest_Purdue_PWA_Martell_loc_10 09/02/2021_2021,2021,40.43005,-87.03427,2021-09-02,2021-10-21,49,Forest,Rural,29,0.591836734693878
PWAMartell,IN_Forest_Purdue_PWA_Martell_loc_11 09/02/2021_2021,2021,40.44506,-87.03326,2021-09-02,2021-10-21,49,Forest,Rural,18,0.36734693877551
Brooke,IN_Forest_Rural_Brooke_23_loc_01_2023,2023,40.430185,-86.959798,2023-09-08,2023-10-16,38,Forest,Rural,15,0.394736842105263
Brooke,IN_Forest_Rural_Brooke_23_loc_02_2023,2023,40.42953,-86.950682,2023-09-08,2023-10-24,46,Forest,Rural,3,0.0652173913043478
Brooke,IN_Forest_Rural_Brooke_23_loc_03_2023,2023,40.424537,-86.949256,2023-09-08,2023-10-24,46,Forest,Rural,2,0.0434782608695652
Brooke,IN_Forest_Rural_Brooke_23_loc_06_2023,2023,40.420773,-86.969004,2023-09-08,2023-10-24,46,Forest,Rural,2,0.0434782608695652
Brooke,IN_Forest_Rural_Brooke_23_loc_07_2023,2023,40.426264,-86.968138,2023-09-08,2023-10-27,49,Forest,Rural,5,0.102040816326531
Brooke,IN_Forest_Rural_Brooke_23_loc_08_2023,2023,40.427366,-86.962117,2023-09-09,2023-10-24,45,Forest,Rural,1,0.0222222222222222
Brooke,IN_Forest_Rural_Brooke_23_loc_10_2023,2023,40.423796,-86.969066,2023-09-05,2023-10-24,49,Forest,Rural,2,0.0408163265306122
Brooke,IN_Forest_Rural_Brooke__23_loc_05_2023,2023,40.424748,-86.965486,2023-09-08,2023-10-24,46,Forest,Rural,11,0.239130434782609
Brooke,IN_Purdue_Brooke_21_10_2021,2021,40.42378,-86.96894,2021-09-03,2021-10-22,49,Forest,Rural,4,0.0816326530612245
Brooke,IN_Purdue_Brooke_21_2_2021,2021,40.4297,-86.95113,2021-09-03,2021-10-22,49,Forest,Rural,4,0.0816326530612245
Brooke,IN_Purdue_Brooke_21_3_2021,2021,40.42448,-86.94897,2021-09-03,2021-10-22,49,Forest,Rural,2,0.0408163265306122
Brooke,IN_Purdue_Brooke_21_4_2021,2021,40.42209,-86.96,2021-09-03,2021-10-22,49,Forest,Rural,2,0.0408163265306122
Brooke,IN_Purdue_Brooke_21_5_2021,2021,40.42469,-86.96555,2021-09-03,2021-10-22,49,Forest,Rural,2,0.0408163265306122
Brooke,IN_Purdue_Brooke_21_6_2021,2021,40.42073,-86.96889,2021-09-03,2021-10-22,49,Forest,Rural,2,0.0408163265306122
Brooke,IN_Purdue_Brooke_21_7_2021,2021,40.42641,-86.96795,2021-09-03,2021-10-22,49,Forest,Rural,2,0.0408163265306122
Brooke,IN_Purdue_Brooke_21_8_2021,2021,40.42726,-86.96214,2021-09-03,2021-10-22,49,Forest,Rural,7,0.142857142857143
Brooke,IN_Purdue_Brooke_21_9_2021,2021,40.42324,-86.96236,2021-09-03,2021-10-22,49,Forest,Rural,6,0.122448979591837
Sovie,Idle Hour 08/06/2022_2022,2022,38.02,-84.4586,2022-09-01,2022-10-28,57,Forest,Urban,0,0
SUCP,InvernessRavineParkSS1_08OCT23-12NOV23_2023,2023,47.69039,-122.28094,2023-10-08,2023-11-12,35,Forest,Urban,5,0.142857142857143
SUCP,InvernessRavineParkSS1_17SEP23-08OCT23_2023,2023,47.69039,-122.28094,2023-09-17,2023-10-08,21,Forest,Urban,7,0.333333333333333
SLC,JRP_02.USA.2019_2019,2019,40.593,-111.92174,2019-09-08,2019-09-29,21,Desert,Urban,1,0.0476190476190476
SLC,JRUSA_01.USA.2020_2020,2020,40.62142,-111.92319,2020-09-09,2020-10-04,25,Desert,Urban,5,0.2
SLC,JRUSA_02.USA.2020_2020,2020,40.64158,-111.92133,2020-09-09,2020-10-04,25,Desert,Urban,3,0.12
SLC,JR_01.USA.2019_2019,2019,40.62135,-111.92287,2019-09-09,2019-09-29,20,Desert,Urban,6,0.3
SLC,JR_02.USA.2019_2019,2019,40.64228,-111.92069,2019-09-08,2019-09-28,20,Desert,Urban,2,0.1
SLC,JR_06.USA.2020_2020,2020,40.79193,-111.9371,2020-09-09,2020-09-27,18,Desert,Urban,6,0.333333333333333
SLC,JR_07.USA.2019_2019,2019,40.7495,-111.91842,2019-09-02,2019-09-30,28,Desert,Urban,8,0.285714285714286
SLC,JR_07.USA.2020_2020,2020,40.7473,-111.92227,2020-09-07,2020-10-06,29,Desert,Urban,16,0.551724137931034
SLC,JR_08.USA.2019_2019,2019,40.73642,-111.92496,2019-09-01,2019-09-19,18,Desert,Urban,23,1.27777777777778
SLC,JR_08.USA.2020_2020,2020,40.73561,-111.92426,2020-09-16,2020-09-30,14,Desert,Urban,55,3.92857142857143
SLC,JR_09.USA.2019_2019,2019,40.72897,-111.925,2019-09-01,2019-09-19,18,Desert,Urban,39,2.16666666666667
Sovie,Jacobson Park 08/06/2022_2022,2022,37.9886,-84.4158,2022-09-01,2022-10-29,58,Forest,Urban,0,0
SUCP,JuanitaBayParkSS1_29AUG23-29SEP23_2023,2023,47.69621,-122.20211,2023-08-29,2023-09-29,31,Forest,Urban,20,0.645161290322581
SUCP,JuanitaBayParkSS1_29SEP23-07OCT23_2023,2023,47.69621,-122.20211,2023-09-29,2023-10-07,8,Forest,Urban,5,0.625
Ahlers,KS_Forest_Ahlers_20B-2_2022,2022,39.0752853,-96.5744937,2022-10-10,2022-10-13,3,Forest,Rural,1,0.333333333333333
Ahlers,KS_Forest_Ahlers_20B-4_2022,2022,39.0755871,-96.5785983,2022-09-19,2022-10-23,34,Forest,Rural,44,1.29411764705882
Ahlers,KS_Forest_Ahlers_2C-8_2022,2022,39.06654963,-96.58332209,2022-09-19,2022-11-02,44,Forest,Rural,70,1.59090909090909
Ahlers,KS_Forest_Ahlers_4FB-10_2022,2022,39.078721,-96.6688958,2022-09-19,2022-11-02,44,Forest,Rural,2,0.0454545454545455
Ahlers,KS_Forest_Ahlers_ALE 10 PART 2_2022,2022,39.101833,-96.56947092,2022-10-10,2022-11-02,23,Forest,Rural,3,0.130434782608696
Ahlers,KS_Forest_Ahlers_ALE-10_2022,2022,39.101833,-96.5947092,2022-09-14,2022-10-10,26,Forest,Rural,2,0.0769230769230769
Ahlers,KS_Forest_Ahlers_ALE-4_2022,2022,39.1021884,-96.5853427,2022-09-14,2022-11-02,49,Forest,Rural,4,0.0816326530612245
Ahlers,KS_Forest_Ahlers_ALE-5_2022,2022,39.099212,-96.5756624,2022-09-14,2022-11-02,49,Forest,Rural,2,0.0408163265306122
Ahlers,KS_Forest_Ahlers_ALE-6_2022,2022,39.1021328,-96.5883047,2022-09-14,2022-11-02,49,Forest,Rural,1,0.0204081632653061
Ahlers,KS_Forest_Ahlers_ALE-8_2022,2022,39.1016144,-96.5915484,2022-09-14,2022-11-02,49,Forest,Rural,3,0.0612244897959184
Ahlers,KS_Forest_Ahlers_ALE1_2022,2022,39.1008793,-96.5808779,2022-09-14,2022-11-02,49,Forest,Rural,3,0.0612244897959184
Ahlers,KS_Forest_Ahlers_ALE2_2022,2022,39.1012676,-96.5830847,2022-09-14,2022-10-10,26,Forest,Rural,2,0.0769230769230769
Ahlers,KS_Forest_Ahlers_ALE3_2022,2022,39.100269,-96.5779618,2022-09-14,2022-09-19,5,Forest,Rural,1,0.2
Ahlers,KS_Forest_Ahlers_FA-6_2022,2022,39.0732278,-96.5803896,2022-09-19,2022-10-21,32,Forest,Rural,2,0.0625
Ahlers,KS_Forest_Ahlers_FB-1_2022,2022,39.071329,-96.5692664,2022-09-14,2022-09-17,3,Forest,Rural,1,0.333333333333333
Ahlers,KS_Forest_Ahlers_FB1_2022,2022,39.071329,-96.5692664,2022-10-10,2022-10-12,2,Forest,Rural,1,0.5
Ahlers,KS_Forest_Ahlers_K1B-5_2022,2022,39.0866232,-96.563909,2022-09-19,2022-10-18,29,Forest,Rural,9,0.310344827586207
Ahlers,KS_Forest_Ahlers_K1B-9_2022,2022,39.0962486,-96.5576232,2022-09-19,2022-10-11,22,Forest,Rural,2,0.0909090909090909
Ahlers,KS_Forest_Ahlers_K1B1_2022,2022,39.0936628,-96.5636319,2022-09-14,2022-11-02,49,Forest,Rural,2,0.0408163265306122
Ahlers,KS_Forest_Ahlers_K1B3_2022,2022,39.0856056,-96.5617822,2022-09-14,2022-10-22,38,Forest,Rural,2,0.0526315789473684
Ahlers,KS_Forest_Ahlers_K1B7_2022,2022,39.0866232,-96.5601429,2022-09-19,2022-10-18,29,Forest,Rural,4,0.137931034482759
Ahlers,KS_Forest_Ahlers_K2A-11_2022,2022,39.097237,-96.5635089,2022-09-14,2022-09-26,12,Forest,Rural,1,0.0833333333333333
Ahlers,KS_Forest_Ahlers_K2A-13_2022,2022,39.0986169,-96.5601429,2022-09-19,2022-10-13,24,Forest,Rural,5,0.208333333333333
Ahlers,KS_Forest_Ahlers_K2A-1_2022,2022,39.0977389,-96.5732848,2022-09-14,2022-11-02,49,Forest,Rural,4,0.0816326530612245
Ahlers,KS_Forest_Ahlers_K2A-3_2022,2022,39.0960224,-96.5709041,2022-09-14,2022-11-02,49,Forest,Rural,3,0.0612244897959184
Ahlers,KS_Forest_Ahlers_K2A-5_2022,2022,39.0953185,-96.5686968,2022-09-14,2022-11-02,49,Forest,Rural,3,0.0612244897959184
Ahlers,KS_Forest_Ahlers_K2A-9_2022,2022,39.0968945,-96.5673708,2022-09-14,2022-10-06,22,Forest,Rural,1,0.0454545454545455
Ahlers,KS_Forest_Ahlers_K2A7_2022,2022,39.0939616,-96.565853,2022-09-14,2022-11-02,49,Forest,Rural,5,0.102040816326531
Ahlers,KS_Forest_Ahlers_R1A-3_2022,2022,39.075369,-96.6085426,2022-09-14,2022-11-02,49,Forest,Rural,3,0.0612244897959184
Ahlers,KS_Forest_Ahlers_R1A1_2022,2022,39.0755256,-96.6144091,2022-09-14,2022-10-18,34,Forest,Rural,3,0.0882352941176471
Ahlers,KS_Forest_Ahlers_R20-A7_2022,2022,39.0728515,-96.60704411,2022-09-14,2022-10-10,26,Forest,Rural,1,0.0384615384615385
Ahlers,KS_Forest_Ahlers_R20A-1_2022,2022,39.0662397,-96.6136817,2022-09-14,2022-09-25,11,Forest,Rural,3,0.272727272727273
Ahlers,KS_Forest_Ahlers_R20A-3_2022,2022,39.0673438,-96.6112868,2022-09-14,2022-11-02,49,Forest,Rural,3,0.0612244897959184
Ahlers,KS_Forest_Ahlers_R20A-5 PART 2_2022,2022,39.0698635,-96.6098265,2022-10-10,2022-10-12,2,Forest,Rural,4,2
Ahlers,KS_Forest_Ahlers_R20A-5_2022,2022,39.0698635,-96.6098265,2022-09-14,2022-09-16,2,Forest,Rural,1,0.5
Ahlers,KS_Forest_Ahlers_SPA 1 PART 2_2022,2022,39.0753043,-96.5897042,2022-09-14,2022-09-17,3,Forest,Rural,1,0.333333333333333
Ahlers,KS_Forest_Ahlers_SPA-1_2022,2022,39.0753043,-96.5897042,2022-10-10,2022-10-17,7,Forest,Rural,1,0.142857142857143
Ahlers,KS_Forest_Ahlers_SUB1_2022,2022,39.0735136,-96.5677466,2022-09-14,2022-10-20,36,Forest,Rural,3,0.0833333333333333
Lawrence,KS_Forest_Lawrence_10_2019,2019,39.03811,-95.21374,2019-09-16,2019-10-24,38,Forest,Rural,14,0.368421052631579
Lawrence,KS_Forest_Lawrence_11_2019,2019,39.03776,-95.20995,2019-09-27,2019-10-27,30,Forest,Rural,4,0.133333333333333
Lawrence,KS_Forest_Lawrence_12_2019,2019,39.05323,-95.1897,2019-09-16,2019-10-24,38,Forest,Rural,39,1.02631578947368
Lawrence,KS_Forest_Lawrence_1_2019,2019,39.05004,-95.1983,2019-09-17,2019-10-23,36,Forest,Rural,6,0.166666666666667
Lawrence,KS_Forest_Lawrence_20_01_2020,2020,39.04997,-95.19832,2020-09-22,2020-10-23,31,Forest,Rural,6,0.193548387096774
Lawrence,KS_Forest_Lawrence_20_02_2020,2020,39.0377,-95.20992,2020-09-23,2020-10-23,30,Forest,Rural,4,0.133333333333333
Lawrence,KS_Forest_Lawrence_20_03_2020,2020,39.04593,-95.20681,2020-09-22,2020-10-23,31,Forest,Rural,5,0.161290322580645
Lawrence,KS_Forest_Lawrence_20_04_2020,2020,39.04429,-95.20361,2020-09-23,2020-10-23,30,Forest,Rural,4,0.133333333333333
Lawrence,KS_Forest_Lawrence_20_05_2020,2020,39.04445,-95.19533,2020-09-23,2020-10-24,31,Forest,Rural,3,0.0967741935483871
Lawrence,KS_Forest_Lawrence_20_06_2020,2020,39.04386,-95.19179,2020-09-23,2020-10-24,31,Forest,Rural,7,0.225806451612903
Lawrence,KS_Forest_Lawrence_20_07_2020,2020,39.04689,-95.19823,2020-09-22,2020-10-17,25,Forest,Rural,3,0.12
Lawrence,KS_Forest_Lawrence_20_08_2020,2020,39.0448,-95.2059,2020-09-22,2020-10-17,25,Forest,Rural,3,0.12
Lawrence,KS_Forest_Lawrence_20_09_2020,2020,39.04469,-95.21385,2020-09-23,2020-10-09,16,Forest,Rural,10,0.625
Lawrence,KS_Forest_Lawrence_20_10_2020,2020,39.03804,-95.21372,2020-09-23,2020-09-28,5,Forest,Rural,1,0.2
Lawrence,KS_Forest_Lawrence_20_11_2020,2020,39.0377,-95.20992,2020-09-23,2020-10-23,30,Forest,Rural,4,0.133333333333333
Lawrence,KS_Forest_Lawrence_20_12_2020,2020,39.05326,-95.1897,2020-09-22,2020-10-24,32,Forest,Rural,5,0.15625
Lawrence,KS_Forest_Lawrence_20_13_2020,2020,39.05257,-95.19701,2020-10-22,2020-11-22,31,Forest,Rural,3,0.0967741935483871
Lawrence,KS_Forest_Lawrence_20_14_2020,2020,39.05571,-95.20235,2020-09-22,2020-10-23,31,Forest,Rural,5,0.161290322580645
Lawrence,KS_Forest_Lawrence_2_2019,2019,39.0483,-95.20214,2019-09-16,2019-10-25,39,Forest,Rural,6,0.153846153846154
Lawrence,KS_Forest_Lawrence_3_2019,2019,39.04606,-95.20826,2019-09-19,2019-10-25,36,Forest,Rural,7,0.194444444444444
Lawrence,KS_Forest_Lawrence_4_2019,2019,39.04436,-95.20361,2019-09-16,2019-10-24,38,Forest,Rural,7,0.184210526315789
Lawrence,KS_Forest_Lawrence_5_2019,2019,39.04442,-95.19539,2019-09-16,2019-10-24,38,Forest,Rural,8,0.210526315789474
Lawrence,KS_Forest_Lawrence_6_2019,2019,39.04376,-95.19166,2019-09-16,2019-10-24,38,Forest,Rural,7,0.184210526315789
Lawrence,KS_Forest_Lawrence_7_2019,2019,39.04684,-95.19821,2019-09-16,2019-10-23,37,Forest,Rural,20,0.540540540540541
Lawrence,KS_Forest_Lawrence_8_2019,2019,39.04481,-95.20586,2019-09-19,2019-10-22,33,Forest,Rural,7,0.212121212121212
Lawrence,KS_Forest_Lawrence_9_2019,2019,39.04478,-95.21398,2019-09-16,2019-10-24,38,Forest,Rural,28,0.736842105263158
Pittsburg,KS_Forest_Pittsburg_11_2019,2019,37.4311,-94.6756,2019-08-28,2019-10-20,53,Forest,Suburban,6,0.113207547169811
Pittsburg,KS_Forest_Pittsburg_12_2019,2019,37.4297,-94.6726,2019-09-25,2019-10-29,34,Forest,Suburban,12,0.352941176470588
Pittsburg,KS_Forest_Pittsburg_13_2019,2019,37.432,-94.6834,2019-09-25,2019-10-29,34,Forest,Suburban,8,0.235294117647059
Pittsburg,KS_Forest_Pittsburg_14_2019,2019,37.4087,-94.6956,2019-09-27,2019-11-02,36,Forest,Suburban,8,0.222222222222222
Pittsburg,KS_Forest_Pittsburg_15_2019,2019,37.4181,-94.7221,2019-09-23,2019-11-02,40,Forest,Suburban,9,0.225
Pittsburg,KS_Forest_Pittsburg_17_2019,2019,37.452,-94.7136,2019-09-30,2019-10-29,29,Forest,Suburban,10,0.344827586206897
Pittsburg,KS_Forest_Pittsburg_1_2019,2019,37.4542,-94.713,2019-08-30,2019-09-22,23,Forest,Suburban,4,0.173913043478261
Pittsburg,KS_Forest_Pittsburg_20_01A_2020,2020,37.40869,-94.6956,2020-09-25,2020-10-17,22,Forest,Suburban,8,0.363636363636364
Pittsburg,KS_Forest_Pittsburg_20_01B_2020,2020,37.40869,-94.6956,2020-08-29,2020-09-25,27,Forest,Suburban,22,0.814814814814815
Pittsburg,KS_Forest_Pittsburg_20_02_2020,2020,37.4463005,-94.7115021,2020-08-29,2020-10-31,63,Forest,Suburban,13,0.206349206349206
Pittsburg,KS_Forest_Pittsburg_20_03_2020,2020,37.4310989,-94.6755981,2020-08-29,2020-10-31,63,Forest,Suburban,13,0.206349206349206
Pittsburg,KS_Forest_Pittsburg_20_04_2020,2020,37.4491997,-94.7099991,2020-08-29,2020-10-31,63,Forest,Suburban,10,0.158730158730159
Pittsburg,KS_Forest_Pittsburg_20_05_2020,2020,37.4319992,-94.683403,2020-08-29,2020-09-25,27,Forest,Suburban,7,0.259259259259259
Pittsburg,KS_Forest_Pittsburg_20_06_2020,2020,37.4319992,-94.683403,2020-09-25,2020-10-17,22,Forest,Suburban,8,0.363636363636364
Pittsburg,KS_Forest_Pittsburg_20_07_2020,2020,37.4490013,-94.7129974,2020-08-29,2020-10-31,63,Forest,Suburban,13,0.206349206349206
Pittsburg,KS_Forest_Pittsburg_20_08_2020,2020,37.4180984,-94.7220993,2020-08-29,2020-10-17,49,Forest,Suburban,5,0.102040816326531
Pittsburg,KS_Forest_Pittsburg_20_10_2020,2020,37.4329987,-94.6727982,2020-08-29,2020-10-31,63,Forest,Suburban,18,0.285714285714286
Pittsburg,KS_Forest_Pittsburg_20_16_2020,2020,37.4519997,-94.7136002,2020-08-29,2020-10-31,63,Forest,Suburban,12,0.19047619047619
Pittsburg,KS_Forest_Pittsburg_20_2019,2019,37.4463,-94.7115,2019-09-24,2019-10-29,35,Forest,Suburban,11,0.314285714285714
Pittsburg,KS_Forest_Pittsburg_21_EndStreet_2021,2021,37.4180984,-94.7220993,2021-08-28,2021-10-31,64,Forest,Suburban,7,0.109375
Pittsburg,KS_Forest_Pittsburg_21_IP1_2021,2021,37.4329987,-94.6727982,2021-08-28,2021-10-31,64,Forest,Suburban,8,0.125
Pittsburg,KS_Forest_Pittsburg_21_IP2_2021,2021,37.4310989,-94.6755981,2021-08-28,2021-10-31,64,Forest,Suburban,7,0.109375
Pittsburg,KS_Forest_Pittsburg_21_IP3_2021,2021,37.4296989,-94.6725998,2021-08-28,2021-10-03,36,Forest,Suburban,4,0.111111111111111
Pittsburg,KS_Forest_Pittsburg_21_Railroad_2021,2021,37.408699,-94.6956024,2021-08-28,2021-10-31,64,Forest,Suburban,7,0.109375
Pittsburg,KS_Forest_Pittsburg_21_Rouse_2021,2021,37.4319992,-94.683403,2021-08-28,2021-10-03,36,Forest,Suburban,3,0.0833333333333333
Pittsburg,KS_Forest_Pittsburg_21_WP2NEW_2021,2021,37.4519997,-94.7136002,2021-08-28,2021-10-03,36,Forest,Suburban,3,0.0833333333333333
Pittsburg,KS_Forest_Pittsburg_21_WP3NEW_2021,2021,37.4490013,-94.7129974,2021-08-28,2021-10-17,50,Forest,Suburban,7,0.14
Pittsburg,KS_Forest_Pittsburg_21_WP4Oct17_2021,2021,37.4463005,-94.7115021,2021-09-19,2021-10-17,28,Forest,Suburban,4,0.142857142857143
Pittsburg,KS_Forest_Pittsburg_21_WP4Sept19_2021,2021,37.4463005,-94.7115021,2021-08-28,2021-09-19,22,Forest,Suburban,2,0.0909090909090909
Pittsburg,KS_Forest_Pittsburg_21_WP6_2021,2021,37.4491997,-94.7099991,2021-08-28,2021-10-03,36,Forest,Suburban,4,0.111111111111111
Pittsburg,KS_Forest_Pittsburg_22_EndStreet_2022,2022,37.4180984,-94.7220993,2022-08-27,2022-10-29,63,Forest,Suburban,7,0.111111111111111
Pittsburg,KS_Forest_Pittsburg_22_IP1_2022,2022,37.4329987,-94.6727982,2022-08-27,2022-10-16,50,Forest,Suburban,6,0.12
Pittsburg,KS_Forest_Pittsburg_22_IP2_2022,2022,37.4310989,-94.6755981,2022-08-27,2022-09-16,20,Forest,Suburban,2,0.1
Pittsburg,KS_Forest_Pittsburg_22_IP3_2022,2022,37.4296989,-94.6725998,2022-08-27,2022-10-16,50,Forest,Suburban,7,0.14
Pittsburg,KS_Forest_Pittsburg_22_Railroad_2022,2022,37.408699,-94.6956024,2022-08-27,2022-09-16,20,Forest,Suburban,3,0.15
Pittsburg,KS_Forest_Pittsburg_22_Rouse_2022,2022,37.4319992,-94.683403,2022-08-27,2022-10-29,63,Forest,Suburban,8,0.126984126984127
Pittsburg,KS_Forest_Pittsburg_22_WP2NEW_2022,2022,37.4519997,-94.7136002,2022-08-27,2022-10-29,63,Forest,Suburban,7,0.111111111111111
Pittsburg,KS_Forest_Pittsburg_22_WP3NEW_2022,2022,37.4490013,-94.7129974,2022-08-27,2022-10-29,63,Forest,Suburban,7,0.111111111111111
Pittsburg,KS_Forest_Pittsburg_22_WP4_2022,2022,37.4463005,-94.7115021,2022-08-27,2022-10-29,63,Forest,Suburban,10,0.158730158730159
Pittsburg,KS_Forest_Pittsburg_22_WP6_2022,2022,37.4491997,-94.7099991,2022-08-27,2022-10-29,63,Forest,Suburban,7,0.111111111111111
Pittsburg,KS_Forest_Pittsburg_23_EndStreet_2023,2023,37.4180984,-94.7220993,2023-08-26,2023-10-22,57,Forest,Suburban,5,0.087719298245614
Pittsburg,KS_Forest_Pittsburg_23_IP1_2023,2023,37.4329987,-94.6727982,2023-08-26,2023-09-20,25,Forest,Suburban,3,0.12
Pittsburg,KS_Forest_Pittsburg_23_IP3_2023,2023,37.4296989,-94.6725998,2023-08-26,2023-10-22,57,Forest,Suburban,4,0.0701754385964912
Pittsburg,KS_Forest_Pittsburg_23_Railroad_2023,2023,37.408699,-94.6956024,2023-08-26,2023-09-25,30,Forest,Suburban,2,0.0666666666666667
Pittsburg,KS_Forest_Pittsburg_23_Rouse_2023,2023,37.4319992,-94.683403,2023-08-26,2023-10-22,57,Forest,Suburban,4,0.0701754385964912
Pittsburg,KS_Forest_Pittsburg_23_WP2NEW_2023,2023,37.4519997,-94.7136002,2023-09-17,2023-10-22,35,Forest,Suburban,2,0.0571428571428571
Pittsburg,KS_Forest_Pittsburg_23_WP3NEW_2023,2023,37.4490013,-94.7129974,2023-08-26,2023-10-22,57,Forest,Suburban,4,0.0701754385964912
Pittsburg,KS_Forest_Pittsburg_23_WP4_2023,2023,37.4463005,-94.7115021,2023-08-26,2023-10-22,57,Forest,Suburban,3,0.0526315789473684
Pittsburg,KS_Forest_Pittsburg_23_WP6_2023,2023,37.4491997,-94.7099991,2023-08-26,2023-10-22,57,Forest,Suburban,4,0.0701754385964912
Pittsburg,KS_Forest_Pittsburg_23_WP7_2023,2023,37.45461,-94.71314,2023-08-26,2023-09-20,25,Forest,Suburban,2,0.08
Pittsburg,KS_Forest_Pittsburg_2_2019,2019,37.452,-94.7131,2019-08-30,2019-09-21,22,Forest,Suburban,1,0.0454545454545455
Pittsburg,KS_Forest_Pittsburg_3_2019,2019,37.4491,-94.7129,2019-08-27,2019-09-22,26,Forest,Suburban,3,0.115384615384615
Pittsburg,KS_Forest_Pittsburg_5_2019,2019,37.4442,-94.7107,2019-08-29,2019-09-24,26,Forest,Suburban,6,0.230769230769231
Pittsburg,KS_Forest_Pittsburg_6_2019,2019,37.4492,-94.71,2019-08-28,2019-10-18,51,Forest,Suburban,8,0.156862745098039
Pittsburg,KS_Forest_Pittsburg_7_2019,2019,37.4307,-94.6938,2019-08-31,2019-09-08,8,Forest,Suburban,1,0.125
Pittsburg,KS_Forest_Pittsburg_8_2019,2019,37.429,-94.6918,2019-08-30,2019-09-08,9,Forest,Suburban,1,0.111111111111111
Pittsburg,KS_Forest_Pittsburg_9_2019,2019,37.433,-94.6728,2019-08-26,2019-10-20,55,Forest,Suburban,7,0.127272727272727
Ahlers,KS_Forest_Rural_Ahlers_23_105_2023,2023,37.755153,-95.668642,2023-09-01,2023-09-18,17,Forest,Rural,2,0.117647058823529
Ahlers,KS_Forest_Rural_Ahlers_23_108_2023,2023,37.199715,-95.051033,2023-09-05,2023-09-21,16,Forest,Rural,4,0.25
Ahlers,KS_Forest_Rural_Ahlers_23_109_2023,2023,37.162546,-95.984146,2023-09-26,2023-10-12,16,Forest,Rural,3,0.1875
Ahlers,KS_Forest_Rural_Ahlers_23_113_2023,2023,38.054577,-94.439856,2023-10-03,2023-10-17,14,Forest,Rural,3,0.214285714285714
Ahlers,KS_Forest_Rural_Ahlers_23_141_2023,2023,37.271632,-95.987988,2023-09-12,2023-09-26,14,Forest,Rural,3,0.214285714285714
Ahlers,KS_Forest_Rural_Ahlers_23_148_2023,2023,38.138321,-94.618806,2023-10-18,2023-11-01,14,Forest,Rural,3,0.214285714285714
Ahlers,KS_Forest_Rural_Ahlers_23_158_2023,2023,37.097374,-94.653751,2023-09-25,2023-10-09,14,Forest,Rural,2,0.142857142857143
Ahlers,KS_Forest_Rural_Ahlers_23_230_2023,2023,37.137329,-90.017104,2023-09-27,2023-10-12,15,Forest,Rural,2,0.133333333333333
Ahlers,KS_Forest_Rural_Ahlers_23_234_2023,2023,37.145482,-95.998311,2023-10-13,2023-10-27,14,Forest,Rural,2,0.142857142857143
Ahlers,KS_Forest_Rural_Ahlers_23_269_2023,2023,37.461943,-90.191032,2023-09-14,2023-09-28,14,Forest,Rural,2,0.142857142857143
Ahlers,KS_Forest_Rural_Ahlers_23_26_2023,2023,37.49993,-95.881983,2023-09-07,2023-09-21,14,Forest,Rural,3,0.214285714285714
Ahlers,KS_Forest_Rural_Ahlers_23_277_2023,2023,37.418313,-94.761477,2023-10-10,2023-10-25,15,Forest,Rural,1,0.0666666666666667
Ahlers,KS_Forest_Rural_Ahlers_23_278_2023,2023,38.380101,-94.665257,2023-10-17,2023-10-31,14,Forest,Rural,3,0.214285714285714
Ahlers,KS_Forest_Rural_Ahlers_23_279_2023,2023,37.004703,-95.897581,2023-09-13,2023-09-27,14,Forest,Rural,3,0.214285714285714
Ahlers,KS_Forest_Rural_Ahlers_23_296_2023,2023,37.504504,-95.154266,2023-10-11,2023-10-25,14,Forest,Rural,2,0.142857142857143
Ahlers,KS_Forest_Rural_Ahlers_23_302_2023,2023,37.644034,-94.805965,2023-08-31,2023-09-15,15,Forest,Rural,3,0.2
Ahlers,KS_Forest_Rural_Ahlers_23_316_2023,2023,37.39969,-95.883517,2023-10-13,2023-10-27,14,Forest,Rural,4,0.285714285714286
Ahlers,KS_Forest_Rural_Ahlers_23_31_2023,2023,37.182851,-94.648933,2023-09-08,2023-09-25,17,Forest,Rural,3,0.176470588235294
Ahlers,KS_Forest_Rural_Ahlers_23_344_2023,2023,37.479409,-90.164021,2023-09-14,2023-09-28,14,Forest,Rural,1,0.0714285714285714
Ahlers,KS_Forest_Rural_Ahlers_23_354_2023,2023,37.287558,-95.22086,2023-10-02,2023-10-19,17,Forest,Rural,2,0.117647058823529
Ahlers,KS_Forest_Rural_Ahlers_23_356_2023,2023,37.41511,-90.142816,2023-09-28,2023-10-13,15,Forest,Rural,2,0.133333333333333
Ahlers,KS_Forest_Rural_Ahlers_23_360_2023,2023,37.29854,-95.039884,2023-09-05,2023-09-21,16,Forest,Rural,3,0.1875
Ahlers,KS_Forest_Rural_Ahlers_23_362_2023,2023,37.01136,-95.97304,2023-09-13,2023-09-27,14,Forest,Rural,1,0.0714285714285714
Ahlers,KS_Forest_Rural_Ahlers_23_367_2023,2023,37.819424,-95.498842,2023-09-18,2023-10-02,14,Forest,Rural,3,0.214285714285714
Ahlers,KS_Forest_Rural_Ahlers_23_381_2023,2023,37.071548,-90.12871,2023-09-27,2023-10-12,15,Forest,Rural,2,0.133333333333333
Ahlers,KS_Forest_Rural_Ahlers_23_388_2023,2023,37.686692,-94.881856,2023-08-31,2023-09-15,15,Forest,Rural,1,0.0666666666666667
Ahlers,KS_Forest_Rural_Ahlers_23_68_2023,2023,37.846347,-95.253896,2023-09-01,2023-09-18,17,Forest,Rural,2,0.117647058823529
Ahlers,KS_Forest_Rural_Ahlers_23_72_2023,2023,37.086789,-95.762711,2023-09-12,2023-09-26,14,Forest,Rural,3,0.214285714285714
Ahlers,KS_Forest_Rural_Ahlers_23_9_2023,2023,37.321206,-90.119333,2023-09-28,2023-10-13,15,Forest,Rural,2,0.133333333333333
FortHays,KS_Grassland_Fort_Hays_01_2023,2023,38.83647,-101.01113,2023-09-15,2023-10-20,35,Grassland,Rural,27,0.771428571428571
FortHays,KS_Grassland_Fort_Hays_02_2023,2023,38.83649,-100.99486,2023-09-15,2023-10-20,35,Grassland,Rural,1,0.0285714285714286
FortHays,KS_Grassland_Fort_Hays_03_2023,2023,38.83902,-100.98408,2023-09-15,2023-10-20,35,Grassland,Rural,2,0.0571428571428571
FortHays,KS_Grassland_Fort_Hays_04_2023,2023,38.83521,-100.95902,2023-09-15,2023-10-20,35,Grassland,Rural,2,0.0571428571428571
FortHays,KS_Grassland_Fort_Hays_05_2023,2023,38.82961,-100.94878,2023-09-15,2023-10-21,36,Grassland,Rural,2,0.0555555555555556
FortHays,KS_Grassland_Fort_Hays_07_2023,2023,38.84644,-100.96195,2023-09-15,2023-10-19,34,Grassland,Rural,2,0.0588235294117647
FortHays,KS_Grassland_Fort_Hays_08_2023,2023,38.85247,-100.97849,2023-09-16,2023-10-24,38,Grassland,Rural,2,0.0526315789473684
FortHays,KS_Grassland_Fort_Hays_09_2023,2023,38.8536,-100.99473,2023-09-15,2023-10-19,34,Grassland,Rural,7,0.205882352941176
FortHays,KS_Grassland_Fort_Hays_10_2023,2023,38.85729,-101.00644,2023-09-15,2023-10-21,36,Grassland,Rural,5,0.138888888888889
FortHays,KS_Grassland_Fort_Hays_11_2023,2023,38.86433,-100.96498,2023-09-15,2023-10-20,35,Grassland,Rural,4,0.114285714285714
FortHays,KS_Grassland_Fort_Hays_12_2023,2023,38.87017,-100.96258,2023-09-15,2023-10-20,35,Grassland,Rural,2,0.0571428571428571
FortHays,KS_Grassland_Fort_Hays_13_2023,2023,38.89156,-100.93315,2023-09-15,2023-10-20,35,Grassland,Rural,0,0
FortHays,KS_Grassland_Fort_Hays_14_2023,2023,38.90028,-100.95806,2023-09-15,2023-10-20,35,Grassland,Rural,6,0.17142857142857101
FortHays,KS_Grassland_Fort_Hays_15_2023,2023,38.89471,-100.96963,2023-09-15,2023-10-20,35,Grassland,Rural,3,0.0857142857142857
FortHays,KS_Grassland_Fort_Hays_16_2023,2023,38.89463,-100.99533,2023-09-15,2023-10-09,24,Grassland,Rural,1,0.0416666666666667
FortHays,KS_Grassland_Fort_Hays_17_2023,2023,38.89844,-101.01676,2023-09-15,2023-10-16,31,Grassland,Rural,0,0
FortHays,KS_Grassland_Fort_Hays_19_2023,2023,38.83466,-100.9733,2023-09-15,2023-10-06,21,Grassland,Rural,6,0.285714285714286
FortHays,KS_Grassland_Fort_Hays_Blue Knob_F2022_2022,2022,38.84908,-101.00119,2022-10-02,2022-11-03,32,Grassland,Rural,5,0.15625
FortHays,KS_Grassland_Fort_Hays_Buffalo Jump_F2022_2022,2022,38.87392,-101.00743,2022-10-01,2022-11-03,33,Grassland,Rural,5,0.151515151515152
FortHays,KS_Grassland_Fort_Hays_East Tank_F2022_2022,2022,38.83523,-100.93676,2022-10-02,2022-11-03,32,Grassland,Rural,5,0.15625
FortHays,KS_Grassland_Fort_Hays_Far North_F2022_2022,2022,38.91369,-100.97077,2022-10-02,2022-11-03,32,Grassland,Rural,2,0.0625
FortHays,KS_Grassland_Fort_Hays_Far West (deerstand)_F2022_2022,2022,38.8679,-101.01101,2022-10-01,2022-10-01,0,Grassland,Rural,1,1
FortHays,KS_Grassland_Fort_Hays_Far West_F2022_2022,2022,38.85864,-101.00893,2022-10-01,2022-11-02,32,Grassland,Rural,0,0
FortHays,KS_Grassland_Fort_Hays_Fishing Pond_F2022_2022,2022,38.83716,-100.9942,2022-10-01,2022-11-03,33,Grassland,Rural,2,0.0606060606060606
FortHays,KS_Grassland_Fort_Hays_Long pasture (tank)_F2022_2022,2022,38.5152,-100.5754,2022-10-01,2022-11-03,33,Grassland,Rural,4,0.121212121212121
FortHays,KS_Grassland_Fort_Hays_North Trap_F2022_2022,2022,38.85968,-100.97701,2022-10-11,2022-11-03,23,Grassland,Rural,1,0.0434782608695652
FortHays,KS_Grassland_Fort_Hays_Prairie dog (tank)_F2022_2022,2022,38.533,-100.5559,2022-10-01,2022-11-03,33,Grassland,Rural,12,0.363636363636364
FortHays,KS_Grassland_Fort_Hays_Pride Rock_F2022_2022,2022,38.82214,-101.01055,2022-10-01,2022-11-03,33,Grassland,Rural,6,0.181818181818182
FortHays,KS_Grassland_Fort_Hays_School House (split tank)_F2022_2022,2022,38.8698,-101.01114,2022-10-01,2022-11-03,33,Grassland,Rural,2,0.0606060606060606
FortHays,KS_Grassland_Fort_Hays_South River_F2022_2022,2022,38.82065,-100.95646,2022-10-02,2022-11-03,32,Grassland,Rural,1,0.03125
FortHays,KS_Grassland_Fort_Hays_Spring Pasture_F2022_2022,2022,38.89461,-101.00864,2022-10-02,2022-11-02,31,Grassland,Rural,0,0
Lawrence,KS_Grassland_Hagen_21_dep_01_2021,2021,39.04997,-95.19832,2021-09-23,2021-10-24,31,Forest,Rural,2,0.0645161290322581
Lawrence,KS_Grassland_Hagen_21_dep_02 09/22/2021_2021,2021,39.04836,-95.2022,2021-09-22,2021-10-23,31,Forest,Rural,2,0.0645161290322581
Lawrence,KS_Grassland_Hagen_21_dep_03 09/22/2021_2021,2021,39.04593,-95.20681,2021-09-22,2021-10-23,31,Forest,Rural,6,0.193548387096774
Lawrence,KS_Grassland_Hagen_21_dep_05 09/21/2021_2021,2021,39.04445,-95.1953,2021-09-21,2021-10-24,33,Forest,Rural,2,0.0606060606060606
Lawrence,KS_Grassland_Hagen_21_dep_06 09/21/2021_2021,2021,39.04386,-95.1918,2021-09-21,2021-10-24,33,Forest,Rural,3,0.0909090909090909
Lawrence,KS_Grassland_Hagen_21_dep_07 09/21/2021_2021,2021,39.04689,-95.19823,2021-09-21,2021-10-23,32,Forest,Rural,22,0.6875
Lawrence,KS_Grassland_Hagen_21_dep_08 09/22/2021_2021,2021,39.04483,-95.20586,2021-09-22,2021-10-23,31,Forest,Rural,6,0.193548387096774
Lawrence,KS_Grassland_Hagen_21_dep_09 09/23/2021_2021,2021,39.04469,-95.2139,2021-09-23,2021-10-12,19,Forest,Rural,21,1.10526315789474
Lawrence,KS_Grassland_Hagen_21_dep_11 09/21/2021_2021,2021,39.0377,-95.20992,2021-09-21,2021-10-22,31,Forest,Rural,2,0.0645161290322581
Lawrence,KS_Grassland_Hagen_21_dep_12 09/21/2021_2021,2021,39.05326,-95.1897,2021-09-21,2021-10-24,33,Forest,Rural,26,0.787878787878788
Lawrence,KS_Grassland_Hagen_21_dep_13 09/21/2021_2021,2021,39.05257,-95.19701,2021-09-21,2021-10-23,32,Forest,Rural,3,0.09375
Lawrence,KS_Grassland_Hagen_21_dep_14 09/21/2021_2021,2021,39.05571,-95.2024,2021-09-21,2021-10-24,33,Forest,Rural,2,0.0606060606060606
Lawrence,KS_Grassland_Hagen_21_dep_16 09/21/2021_2021,2021,39.04442,-95.1891,2021-09-21,2021-10-24,33,Forest,Rural,3,0.0909090909090909
Lawrence,KS_Grassland_Hagen_21_det_10 09/23/2021_2021,2021,39.03804,-95.2137,2021-09-23,2021-10-22,29,Forest,Rural,5,0.172413793103448
Lawrence,KS_Grassland_Hagen_21_loc_04 09/21/2021_2021,2021,39.04429,-95.20361,2021-09-21,2021-10-23,32,Forest,Rural,3,0.09375
Lawrence,KS_Grassland_Hagen_21_loc_15 09/21/2021_2021,2021,39.04372,-95.1987,2021-09-21,2021-10-23,32,Forest,Rural,9,0.28125
Darracq,KY_Forest_Darracq_21_dep_01_2021,2021,36.72614,-88.86406,2021-09-27,2021-11-08,42,Forest,Wild,2,0.0476190476190476
Darracq,KY_Forest_Darracq_21_dep_02_2021,2021,36.72614,-88.85846,2021-09-27,2021-11-08,42,Forest,Wild,2,0.0476190476190476
Darracq,KY_Forest_Darracq_21_dep_03_2021,2021,36.73175,-88.88087,2021-09-27,2021-11-08,42,Forest,Wild,2,0.0476190476190476
Darracq,KY_Forest_Darracq_21_dep_04_2021,2021,36.73175,-88.87527,2021-09-27,2021-11-08,42,Forest,Wild,3,0.0714285714285714
Darracq,KY_Forest_Darracq_21_dep_05_2021,2021,36.73175,-88.86967,2021-09-27,2021-11-08,42,Forest,Wild,3,0.0714285714285714
Darracq,KY_Forest_Darracq_21_dep_06_2021,2021,36.73175,-88.86406,2021-09-28,2021-11-09,42,Forest,Wild,4,0.0952380952380952
Darracq,KY_Forest_Darracq_21_dep_07_2021,2021,36.73735,-88.88648,2021-09-27,2021-11-08,42,Forest,Wild,4,0.0952380952380952
Darracq,KY_Forest_Darracq_21_dep_08_2021,2021,36.73735,-88.88648,2021-09-27,2021-11-08,42,Forest,Wild,2,0.0476190476190476
Darracq,KY_Forest_Darracq_21_dep_09_2021,2021,36.73735,-88.88087,2021-09-27,2021-11-08,42,Forest,Wild,2,0.0476190476190476
Darracq,KY_Forest_Darracq_21_dep_10_2021,2021,36.73735,-88.87527,2021-09-27,2021-11-08,42,Forest,Wild,3,0.0714285714285714
Darracq,KY_Forest_Darracq_21_dep_11_2021,2021,36.73735,-88.86967,2021-09-27,2021-11-08,42,Forest,Wild,13,0.30952380952381
Darracq,KY_Forest_Darracq_21_dep_12_2021,2021,36.74118,-88.8293,2021-09-28,2021-11-09,42,Forest,Wild,2,0.0476190476190476
Darracq,KY_Forest_Darracq_21_dep_14_2021,2021,36.74295,-88.87527,2021-09-27,2021-11-08,42,Forest,Wild,2,0.0476190476190476
Darracq,KY_Forest_Darracq_22_loc_10_2022,2022,36.73735,-88.87527,2022-09-05,2022-10-09,34,Forest,Wild,3,0.0882352941176471
Darracq,KY_Forest_Darracq_22_loc_11_2022,2022,36.73735,-88.86967,2022-09-05,2022-10-09,34,Forest,Wild,13,0.382352941176471
Darracq,KY_Forest_Darracq_22_loc_12_2022,2022,36.74118,-88.8793,2022-09-05,2022-09-21,16,Forest,Wild,1,0.0625
Darracq,KY_Forest_Darracq_22_loc_14_2022,2022,36.74295,-88.87527,2022-09-05,2022-10-09,34,Forest,Wild,5,0.147058823529412
Darracq,KY_Forest_Darracq_22_loc_15_2022,2022,36.74303,-88.86961,2022-09-05,2022-10-09,34,Forest,Wild,2,0.0588235294117647
Darracq,KY_Forest_Darracq_22_loc_1_2022,2022,36.72614,-88.86406,2022-09-04,2022-10-08,34,Forest,Wild,2,0.0588235294117647
Darracq,KY_Forest_Darracq_22_loc_3_2022,2022,36.73175,-88.85846,2022-09-05,2022-10-09,34,Forest,Wild,2,0.0588235294117647
Darracq,KY_Forest_Darracq_22_loc_4_2022,2022,36.73037,-88.87428,2022-09-10,2022-10-09,29,Forest,Wild,3,0.103448275862069
Darracq,KY_Forest_Darracq_22_loc_5 09/05/2022_2022,2022,36.73144,-88.86987,2022-09-06,2022-10-09,33,Forest,Wild,0,0
Darracq,KY_Forest_Darracq_22_loc_6_2022,2022,36.73175,-88.86406,2022-09-10,2022-10-09,29,Forest,Wild,2,0.0689655172413793
Darracq,KY_Forest_Darracq_22_loc_7_2022,2022,36.73175,-88.85846,2022-09-10,2022-10-09,29,Forest,Wild,2,0.0689655172413793
Darracq,KY_Forest_Darracq_22_loc_8_2022,2022,36.73735,-88.88648,2022-09-05,2022-10-09,34,Forest,Wild,2,0.0588235294117647
Darracq,KY_Forest_Darracq_22_loc_9_2022,2022,36.73735,-88.88087,2022-09-05,2022-10-09,34,Forest,Wild,2,0.0588235294117647
KentuckyNaturalLandsTrust,KY_Forest_KentuckyNaturalLandsTrust_Calloway_21_loc_01_2021,2021,36.79713,-83.53785,2021-08-30,2021-11-01,63,Forest,Wild,2,0.0317460317460317
KentuckyNaturalLandsTrust,KY_Forest_KentuckyNaturalLandsTrust_Calloway_21_loc_02_2021,2021,36.79877,-83.53591,2021-08-30,2021-11-01,63,Forest,Wild,3,0.0476190476190476
KentuckyNaturalLandsTrust,KY_Forest_KentuckyNaturalLandsTrust_Calloway_21_loc_03_2021,2021,36.80003,-83.53805,2021-08-30,2021-11-01,63,Forest,Wild,3,0.0476190476190476
KentuckyNaturalLandsTrust,KY_Forest_KentuckyNaturalLandsTrust_Calloway_21_loc_04_2021,2021,36.80377,-83.53638,2021-08-30,2021-11-01,63,Forest,Wild,4,0.0634920634920635
KentuckyNaturalLandsTrust,KY_Forest_KentuckyNaturalLandsTrust_Calloway_21_loc_05_2021,2021,36.80547,-83.53505,2021-08-30,2021-11-01,63,Forest,Wild,2,0.0317460317460317
KentuckyNaturalLandsTrust,KY_Forest_KentuckyNaturalLandsTrust_Calloway_21_loc_06 09/02/2022_2022,2022,36.806339,-83.544111,2022-09-30,2022-11-01,32,Forest,Wild,1,0.03125
KentuckyNaturalLandsTrust,KY_Forest_KentuckyNaturalLandsTrust_Calloway_21_loc_06_2021,2021,36.80703,-83.53619,2021-08-30,2021-10-03,34,Forest,Wild,1,0.0294117647058824
KentuckyNaturalLandsTrust,KY_Forest_KentuckyNaturalLandsTrust_Calloway_21_loc_07_2021,2021,36.80803,-83.54044,2021-09-05,2021-11-01,57,Forest,Wild,1,0.0175438596491228
KentuckyNaturalLandsTrust,KY_Forest_KentuckyNaturalLandsTrust_Calloway_22_loc_01 09/02/2022_2022,2022,36.798761,-83.536211,2022-09-02,2022-09-30,28,Forest,Wild,1,0.0357142857142857
KentuckyNaturalLandsTrust,KY_Forest_KentuckyNaturalLandsTrust_Calloway_22_loc_02 09/30/2022_2022,2022,36.8078,-83.541728,2022-09-30,2022-11-01,32,Forest,Wild,1,0.03125
KentuckyNaturalLandsTrust,KY_Forest_KentuckyNaturalLandsTrust_Calloway_22_loc_03 09/02/2022_2022,2022,36.805431,-83.5351,2022-09-02,2022-09-30,28,Forest,Wild,1,0.0357142857142857
KentuckyNaturalLandsTrust,KY_Forest_KentuckyNaturalLandsTrust_Calloway_22_loc_04 09/30/2022_2022,2022,36.805469,-83.546369,2022-09-30,2022-11-01,32,Forest,Wild,1,0.03125
KentuckyNaturalLandsTrust,KY_Forest_KentuckyNaturalLandsTrust_Calloway_22_loc_05 09/02/2022_2022,2022,36.8038,-83.536539,2022-09-02,2022-09-30,28,Forest,Wild,1,0.0357142857142857
KentuckyNaturalLandsTrust,KY_Forest_KentuckyNaturalLandsTrust_Calloway_22_loc_07 09/02/2022_2022,2022,36.79488,-83.537555,2022-09-03,2022-09-22,19,Forest,Wild,0,0
KentuckyNaturalLandsTrust,KY_Forest_KentuckyNaturalLandsTrust_Calloway_22_loc_08 09/30/2022_2022,2022,36.80619,-83.53682,2022-09-30,2022-10-19,19,Forest,Wild,0,0
KentuckyNaturalLandsTrust,KY_Forest_KentuckyNaturalLandsTrust_Calloway_28_loc_10 09/30/2022_2022,2022,36.80758,-83.53956,2022-09-30,2022-10-04,4,Forest,Wild,0,0
MarshallCounty,KY_Forest_Marshall_County_10B_2019,2019,36.94355,-88.47582,2019-09-12,2019-09-28,16,Forest,Rural,1,0.0625
MarshallCounty,KY_Forest_Marshall_County_11B_2019,2019,36.94789,-88.48706,2019-09-08,2019-09-28,20,Forest,Rural,2,0.1
MarshallCounty,KY_Forest_Marshall_County_12B_2019,2019,36.98739,-88.57142,2019-09-20,2019-09-28,8,Forest,Rural,0,0
MarshallCounty,KY_Forest_Marshall_County_13B_2019,2019,36.99189,-88.57151,2019-09-08,2019-09-28,20,Forest,Rural,2,0.1
MarshallCounty,KY_Forest_Marshall_County_14B_2019,2019,36.97387,-88.57114,2019-09-07,2019-09-28,21,Forest,Rural,2,0.0952380952380952
MarshallCounty,KY_Forest_Marshall_County_1_2019,2019,36.89426,-88.40725,2019-09-07,2019-09-15,8,Forest,Rural,1,0.125
MarshallCounty,KY_Forest_Marshall_County_20_01_2020,2020,36.89426,-88.40725,2020-08-31,2020-11-12,73,Forest,Rural,0,0
MarshallCounty,KY_Forest_Marshall_County_20_02_2020,2020,36.89931,-88.40725,2020-10-24,2020-11-13,20,Forest,Rural,0,0
MarshallCounty,KY_Forest_Marshall_County_20_03_2020,2020,36.89426,-88.40725,2020-10-24,2020-11-08,15,Forest,Rural,0,0
MarshallCounty,KY_Forest_Marshall_County_20_04_2020,2020,36.90825,-88.41265,2020-10-26,2020-11-12,17,Forest,Rural,0,0
MarshallCounty,KY_Forest_Marshall_County_20_05_2020,2020,36.94778,-88.49761,2020-09-26,2020-10-20,24,Forest,Rural,0,0
MarshallCounty,KY_Forest_Marshall_County_20_06_2020,2020,36.95235,-88.49208,2020-09-26,2020-10-20,24,Forest,Rural,2,0.0833333333333333
MarshallCounty,KY_Forest_Marshall_County_20_07_2020,2020,36.93544,-88.46906,2020-09-27,2020-10-20,23,Forest,Rural,3,0.130434782608696
MarshallCounty,KY_Forest_Marshall_County_20_08_2020,2020,36.93017,-88.46358,2020-09-02,2020-09-19,17,Forest,Rural,1,0.0588235294117647
MarshallCounty,KY_Forest_Marshall_County_20_09_2020,2020,36.94334,-88.49191,2020-09-27,2020-10-20,23,Forest,Rural,0,0
MarshallCounty,KY_Forest_Marshall_County_20_10_2020,2020,36.94348,-88.48068,2020-09-26,2020-10-20,24,Forest,Rural,0,0
MarshallCounty,KY_Forest_Marshall_County_20_11_2020,2020,36.94348,-88.48068,2020-09-26,2020-10-20,24,Forest,Rural,0,0
MarshallCounty,KY_Forest_Marshall_County_20_12_2020,2020,36.98738,-88.57142,2020-08-31,2020-09-18,18,Forest,Rural,0,0
MarshallCounty,KY_Forest_Marshall_County_20_13_2020,2020,36.99189,-88.57151,2020-09-01,2020-09-19,18,Forest,Rural,0,0
MarshallCounty,KY_Forest_Marshall_County_20_14_2020,2020,36.97387,-88.57114,2020-08-29,2020-09-19,21,Forest,Rural,2,0.0952380952380952
MarshallCounty,KY_Forest_Marshall_County_20_15_2020,2020,36.97394,-88.56552,2020-08-29,2020-09-19,21,Forest,Rural,1,0.0476190476190476
MarshallCounty,KY_Forest_Marshall_County_2B_2019,2019,36.89931,-88.40688,2019-09-07,2019-09-28,21,Forest,Rural,0,0
MarshallCounty,KY_Forest_Marshall_County_3B_2019,2019,36.90521,-88.41855,2019-09-09,2019-09-28,19,Forest,Rural,2,0.105263157894737
MarshallCounty,KY_Forest_Marshall_County_4B_2019,2019,36.90826,-88.41266,2019-09-09,2019-09-27,18,Forest,Rural,0,0
MarshallCounty,KY_Forest_Marshall_County_5B_2019,2019,36.94778,-88.49761,2019-09-09,2019-09-16,7,Forest,Rural,0,0
MarshallCounty,KY_Forest_Marshall_County_6B_2019,2019,36.95236,-88.49209,2019-09-08,2019-09-28,20,Forest,Rural,1,0.05
MarshallCounty,KY_Forest_Marshall_County_7B_2019,2019,36.93544,-88.46907,2019-09-09,2019-09-24,15,Forest,Rural,0,0
MarshallCounty,KY_Forest_Marshall_County_8B_2019,2019,36.93468,-88.46367,2019-09-09,2019-09-28,19,Forest,Rural,1,0.0526315789473684
MarshallCounty,KY_Forest_Marshall_County_9B_2019,2019,36.94335,-88.49191,2019-09-09,2019-09-28,19,Forest,Rural,1,0.0526315789473684
GreenRiverPreserve,KY_Wetland_Cam 3_Green River_bio preserve 09/01/2023_2023,2023,37.248592,-85.988974,2023-09-01,2023-11-06,66,Wetland,Rural,3,0.0454545454545455
GreenRiverPreserve,KY_Wetland_Green River Bio Preserve_Cam 2 09/11/2023_2023,2023,37.246467,-85.986096,2023-09-01,2023-11-06,66,Wetland,Rural,10,0.151515151515152
GreenRiverPreserve,KY_Wetland_green river bio preserve_Cam 1_2023,2023,37.241398,-85.9982404,2023-09-15,2023-11-06,52,Wetland,Rural,8,0.153846153846154
GreenRiverPreserve,KY_Wetland_green river bio preserve_cam 4 09/11/2023_2023,2023,37.244373,-85.999329,2023-09-01,2023-11-06,66,Wetland,Rural,4,0.0606060606060606
GreenRiverPreserve,KY_Wetland_green river bio preserve_cam 5 09/11/2023_2023,2023,37.242394,-85.996744,2023-09-01,2023-11-06,66,Wetland,Rural,29,0.439393939393939
GreenRiverPreserve,KY_Wetland_green river bio preserve_cam 6 09/11/2023_2023,2023,37.253547,-85.937792,2023-09-03,2023-11-01,59,Wetland,Rural,4,0.0677966101694915
GreenRiverPreserve,KY_Wetland_green river bio preserve_cam 7 09/11/2023_2023,2023,37.250902,-85.937025,2023-09-01,2023-11-01,61,Wetland,Rural,4,0.0655737704918033
GreenRiverPreserve,KY_Wetland_green river bio preserve_cam 8 09/11/2023_2023,2023,37.24844,-85.936479,2023-09-01,2023-11-01,61,Wetland,Rural,10,0.163934426229508
LSU2,LA_CalcasieuKNF_CAL_10_2023,2023,31.17672,-92.57168,2023-08-31,2023-11-03,64,Forest,Wild,2,0.03125
LSU2,LA_CalcasieuKNF_CAL_11_2023,2023,31.1808,-92.57196,2023-09-17,2023-11-02,46,Forest,Wild,0,0
LSU2,LA_CalcasieuKNF_CAL_12_2023,2023,31.18324,-92.57117,2023-09-03,2023-11-08,66,Forest,Wild,0,0
LSU2,LA_CalcasieuKNF_CAL_1_2023,2023,31.20029,-92.5873,2023-08-26,2023-11-08,74,Forest,Wild,1,0.0135135135135135
LSU2,LA_CalcasieuKNF_CAL_2_2023,2023,31.19703,-92.58875,2023-08-28,2023-11-04,68,Forest,Wild,4,0.0588235294117647
LSU2,LA_CalcasieuKNF_CAL_3_2023,2023,31.19224,-92.5886,2023-08-27,2023-11-08,73,Forest,Wild,3,0.0410958904109589
LSU2,LA_CalcasieuKNF_CAL_5_2023,2023,31.18129,-92.58976,2023-09-19,2023-11-08,50,Forest,Wild,5,0.1
LSU2,LA_CalcasieuKNF_CAL_6_2023,2023,31.19788,-92.5846,2023-08-28,2023-11-05,69,Forest,Wild,0,0
LSU2,LA_CalcasieuKNF_CAL_7_2023,2023,31.18974,-92.58388,2023-09-04,2023-11-08,65,Forest,Wild,1,0.0153846153846154
LSU2,LA_CalcasieuKNF_CAL_8_2023,2023,31.18104,-92.57757,2023-09-02,2023-10-29,57,Forest,Wild,0,0
LSU2,LA_CalcasieuKNF_CAL_9_2023,2023,31.17642,-92.57595,2023-08-30,2023-11-07,69,Forest,Wild,0,0
LSU3,LA_CatahoulaKNF_CAT_10_2023,2023,31.67936,-92.49586,2023-08-23,2023-10-02,40,Forest,Wild,3,0.075
LSU3,LA_CatahoulaKNF_CAT_11_2023,2023,31.67823,-92.4896,2023-08-23,2023-10-30,68,Forest,Wild,2,0.0294117647058824
LSU3,LA_CatahoulaKNF_CAT_12_2023,2023,31.67953,-92.486,2023-08-23,2023-10-26,64,Forest,Wild,2,0.03125
LSU3,LA_CatahoulaKNF_CAT_1_2023,2023,31.70116,-92.52276,2023-08-23,2023-11-05,74,Forest,Wild,2,0.027027027027027
LSU3,LA_CatahoulaKNF_CAT_2_2023,2023,31.69934,-92.53448,2023-08-23,2023-11-02,71,Forest,Wild,4,0.0563380281690141
LSU3,LA_CatahoulaKNF_CAT_3_2023,2023,31.70184,-92.528809999999993,2023-08-23,2023-11-03,72,Forest,Wild,4,0.0555555555555556
LSU3,LA_CatahoulaKNF_CAT_4_2023,2023,31.70135,-92.52177,2023-08-23,2023-11-01,70,Forest,Wild,2,0.0285714285714286
LSU3,LA_CatahoulaKNF_CAT_5_2023,2023,31.70135,-92.51414,2023-08-23,2023-11-04,73,Forest,Wild,3,0.0410958904109589
LSU3,LA_CatahoulaKNF_CAT_6_2023,2023,31.69601,-92.509,2023-08-23,2023-11-06,75,Forest,Wild,4,0.0533333333333333
LSU3,LA_CatahoulaKNF_CAT_7_2023,2023,31.68406,-92.50746,2023-08-23,2023-10-13,51,Forest,Wild,2,0.0392156862745098
LSU3,LA_CatahoulaKNF_CAT_8_2023,2023,31.67757,-92.50522,2023-08-23,2023-09-20,28,Forest,Wild,3,0.107142857142857
LSU3,LA_CatahoulaKNF_CAT_9_2023,2023,31.67659,-92.49586,2023-08-23,2023-10-22,60,Forest,Wild,4,0.0666666666666667
AbitaFlats,LA_Forest_AbitaFlats_21_CS01_2021,2021,30.5128,-89.9651,2021-10-02,2021-11-20,49,Forest,Wild,2,0.0408163265306122
AbitaFlats,LA_Forest_AbitaFlats_21_CS02_2021,2021,30.5217,-89.9641,2021-10-02,2021-11-19,48,Forest,Wild,2,0.0416666666666667
AbitaFlats,LA_Forest_AbitaFlats_21_CS03_2021,2021,30.5105,-89.9627,2021-08-28,2021-11-20,84,Forest,Wild,3,0.0357142857142857
AbitaFlats,LA_Forest_AbitaFlats_21_CS06_2021,2021,30.509,-89.9717,2021-10-02,2021-11-20,49,Forest,Wild,3,0.0612244897959184
AbitaFlats,LA_Forest_AbitaFlats_21_CS07_2021,2021,30.5064,-89.9766,2021-10-02,2021-11-20,49,Forest,Wild,2,0.0408163265306122
AbitaFlats,LA_Forest_AbitaFlats_21_CS08_2021,2021,30.512,-89.9587,2021-08-28,2021-11-20,84,Forest,Wild,3,0.0357142857142857
AbitaFlats,LA_Forest_AbitaFlats_21_CS09_2021,2021,30.5079,-89.9605,2021-08-27,2021-11-20,85,Forest,Wild,3,0.0352941176470588
AbitaFlats,LA_Forest_AbitaFlats_21_CS10_2021,2021,30.5162,-89.9731,2021-10-02,2021-11-19,48,Forest,Wild,2,0.0416666666666667
AbitaFlats,LA_Forest_AbitaFlats_21_CS4_2021,2021,30.5144,-89.9688,2021-10-02,2021-11-20,49,Forest,Wild,2,0.0408163265306122
AbitaFlats,LA_Forest_AbitaFlats_21_CS5_2021,2021,30.5177,-89.9713,2021-10-02,2021-11-17,46,Forest,Wild,1,0.0217391304347826
AbitaFlats,LA_Forest_AbitaFlats_21_SELU14_2021,2021,30.5119,-89.9731,2021-10-02,2021-11-20,49,Forest,Wild,2,0.0408163265306122
CCRoad,LA_Forest_CCRoad_21_CS11_2021,2021,30.437387,-93.076206,2021-10-08,2021-11-07,30,Forest,Wild,1,0.0333333333333333
CCRoad,LA_Forest_CCRoad_21_CS12_2021,2021,30.447159,-93.064826,2021-10-08,2021-11-21,44,Forest,Wild,3,0.0681818181818182
CCRoad,LA_Forest_CCRoad_21_CS13_2021,2021,30.440695,-93.067867,2021-10-08,2021-11-21,44,Forest,Wild,2,0.0454545454545455
CCRoad,LA_Forest_CCRoad_21_CS14_2021,2021,30.439206,-93.071294,2021-10-08,2021-11-21,44,Forest,Wild,2,0.0454545454545455
CCRoad,LA_Forest_CCRoad_21_CS15_2021,2021,30.444205,-93.057919,2021-10-08,2021-11-21,44,Forest,Wild,2,0.0454545454545455
CCRoad,LA_Forest_CCRoad_21_CS16_2021,2021,30.452061,-93.064469,2021-10-08,2021-11-21,44,Forest,Wild,2,0.0454545454545455
CCRoad,LA_Forest_CCRoad_21_CS17_2021,2021,30.440691,-93.076365,2021-10-08,2021-11-21,44,Forest,Wild,2,0.0454545454545455
CCRoad,LA_Forest_CCRoad_21_CS18_2021,2021,30.447259,-93.054636,2021-10-08,2021-10-29,21,Forest,Wild,1,0.0476190476190476
CCRoad,LA_Forest_CCRoad_21_CS19_2021,2021,30.43943,-93.061204,2021-10-08,2021-11-21,44,Forest,Wild,3,0.0681818181818182
CCRoad,LA_Forest_CCRoad_21_CS20_2021,2021,30.440898,-93.061296,2021-10-08,2021-11-21,44,Forest,Wild,2,0.0454545454545455
CCRoad,LA_Forest_CCRoad_21_TO02_2021,2021,30.444191,-93.057935,2021-10-08,2021-11-21,44,Forest,Wild,2,0.0454545454545455
Hammond,LA_Forest_Hammond_10_2019,2019,30.52671,-90.47836,2019-09-11,2019-10-23,42,Forest,Suburban,3,0.0714285714285714
Hammond,LA_Forest_Hammond_1_2019,2019,30.52322,-90.47366,2019-09-11,2019-10-23,42,Forest,Suburban,7,0.166666666666667
Hammond,LA_Forest_Hammond_20_01_2020,2020,30.5325,-90.4763,2020-09-02,2020-10-21,49,Forest,Suburban,3,0.0612244897959184
Hammond,LA_Forest_Hammond_20_02_2020,2020,30.5317,-90.4748,2020-09-04,2020-10-21,47,Forest,Suburban,2,0.0425531914893617
Hammond,LA_Forest_Hammond_20_03_2020,2020,30.5325,-90.4763,2020-09-04,2020-10-21,47,Forest,Suburban,2,0.0425531914893617
Hammond,LA_Forest_Hammond_20_04_2020,2020,30.52945,-90.4772,2020-09-02,2020-10-21,49,Forest,Suburban,4,0.0816326530612245
Hammond,LA_Forest_Hammond_20_05_2020,2020,30.5288,-90.4748,2020-09-02,2020-10-21,49,Forest,Suburban,3,0.0612244897959184
Hammond,LA_Forest_Hammond_20_06_2020,2020,30.52796,-90.47765,2020-09-02,2020-10-21,49,Forest,Suburban,5,0.102040816326531
Hammond,LA_Forest_Hammond_20_08_2020,2020,30.52657,-90.47617,2020-09-02,2020-10-21,49,Forest,Suburban,25,0.510204081632653
Hammond,LA_Forest_Hammond_20_09_2020,2020,30.5257,-90.47462,2020-09-02,2020-10-21,49,Forest,Suburban,11,0.224489795918367
Hammond,LA_Forest_Hammond_20_10_2020,2020,30.52322,-90.47366,2020-09-02,2020-10-21,49,Forest,Suburban,4,0.0816326530612245
Hammond,LA_Forest_Hammond_2_2019,2019,30.53188,-90.476,2019-09-11,2019-10-23,42,Forest,Suburban,4,0.0952380952380952
Hammond,LA_Forest_Hammond_3_2019,2019,30.52879,-90.475,2019-09-11,2019-10-23,42,Forest,Suburban,4,0.0952380952380952
Hammond,LA_Forest_Hammond_4_2019,2019,30.52796,-90.47765,2019-09-11,2019-10-23,42,Forest,Suburban,6,0.142857142857143
Hammond,LA_Forest_Hammond_5_2019,2019,30.52945,-90.4772,2019-09-11,2019-10-23,42,Forest,Suburban,4,0.0952380952380952
Hammond,LA_Forest_Hammond_6_2019,2019,30.5257,-90.47462,2019-09-11,2019-10-23,42,Forest,Suburban,15,0.357142857142857
Hammond,LA_Forest_Hammond_7_2019,2019,30.52657,-90.47617,2019-09-11,2019-10-08,27,Forest,Suburban,7,0.259259259259259
Hammond,LA_Forest_Hammond_9_2019,2019,30.53081,-90.47699,2019-09-11,2019-10-23,42,Forest,Suburban,4,0.0952380952380952
Hammond,LA_Forest_Hammond_CS 11_2022,2022,30.528511,-90.474616,2022-09-09,2022-10-28,49,Forest,Suburban,2,0.0408163265306122
Hammond,LA_Forest_Hammond_CS 12_2022,2022,30.52583,-90.474607,2022-09-09,2022-10-14,35,Forest,Suburban,13,0.371428571428571
Hammond,LA_Forest_Hammond_CS 14_2022,2022,30.531752,-90.474773,2022-09-09,2022-10-28,49,Forest,Suburban,2,0.0408163265306122
Hammond,LA_Forest_Hammond_CS 15_2022,2022,30.53176,-90.476046,2022-09-09,2022-10-28,49,Forest,Suburban,2,0.0408163265306122
Hammond,LA_Forest_Hammond_CS 16_2022,2022,30.528931,-90.477025,2022-09-09,2022-10-28,49,Forest,Suburban,2,0.0408163265306122
Hammond,LA_Forest_Hammond_CS 18_2022,2022,30.526787,-90.478446,2022-09-09,2022-10-28,49,Forest,Suburban,2,0.0408163265306122
Hammond,LA_Forest_Hammond_CS 19_2022,2022,30.533909,-90.474968,2022-09-09,2022-09-25,16,Forest,Suburban,2,0.125
Hammond,LA_Forest_Hammond_CS 20_2022,2022,30.526753,-90.478447,2022-09-09,2022-10-28,49,Forest,Suburban,2,0.0408163265306122
Hammond,LA_Forest_Hammond_Cs13_2022,2022,30.526608,-90.476232,2022-09-09,2022-10-28,49,Forest,Suburban,6,0.122448979591837
Hammond,LA_Forest_Hammond_SELU02 09/13/2021_2021,2021,30.533347,-90.476553,2021-09-13,2021-11-03,51,Forest,Suburban,2,0.0392156862745098
Hammond,LA_Forest_Hammond_SELU03 09/13/2021_2021,2021,30.532328,-90.47848,2021-09-13,2021-11-03,51,Forest,Suburban,2,0.0392156862745098
Hammond,LA_Forest_Hammond_SELU04 09/13/2021_2021,2021,30.529497,-90.477153,2021-09-13,2021-11-03,51,Forest,Suburban,2,0.0392156862745098
Hammond,LA_Forest_Hammond_SELU05 09/13/2021 complete_2021,2021,30.531429,-90.476708,2021-09-13,2021-11-03,51,Forest,Suburban,2,0.0392156862745098
Hammond,LA_Forest_Hammond_SELU06 09/13/2021_2021,2021,30.525521,-90.478381,2021-09-13,2021-11-03,51,Forest,Suburban,125,2.45098039215686
Hammond,LA_Forest_Hammond_SELU07 09/13/2021_2021,2021,30.527011,-90.478057,2021-09-13,2021-11-03,51,Forest,Suburban,21,0.411764705882353
Hammond,LA_Forest_Hammond_SELU08 09/13/2021_2021,2021,30.526661,-90.476255,2021-09-13,2021-11-03,51,Forest,Suburban,4,0.0784313725490196
Hammond,LA_Forest_Hammond_SELU09 09/13/2021_2021,2021,30.525702,-90.474427,2021-09-13,2021-11-03,51,Forest,Suburban,8,0.156862745098039
Hammond,LA_Forest_Hammond_SELU11 09/13/2021_2021,2021,30.52763,-90.477892,2021-09-13,2021-11-03,51,Forest,Suburban,3,0.0588235294117647
Hammond,LA_Forest_Hammond_SELU12 09/13/2021_2021,2021,30.528697,-90.474623,2021-09-24,2021-11-03,40,Forest,Suburban,2,0.05
Hammond,LA_Forest_Hammond_SELU13_2022,2022,30.523328,-90.472806,2022-09-09,2022-10-28,49,Forest,Suburban,5,0.102040816326531
LSU4,LA_LeeForest_LEE_11_2023,2023,30.878,-89.98708,2023-09-02,2023-11-01,60,Forest,Wild,0,0
LSU4,LA_LeeForest_LEE_12_2023,2023,30.87836,-89.99147,2023-09-01,2023-11-02,62,Forest,Wild,0,0
LSU4,LA_LeeForest_LEE_14_2023,2023,30.87296,-89.99343,2023-08-24,2023-11-09,77,Forest,Wild,1,0.012987012987013
LSU4,LA_LeeForest_LEE_1a_2023,2023,30.87291,-89.99724,2023-08-24,2023-11-08,76,Forest,Wild,1,0.0131578947368421
LSU4,LA_LeeForest_LEE_2_2023,2023,30.87673,-89.99651,2023-08-24,2023-11-08,76,Forest,Wild,1,0.0131578947368421
LSU4,LA_LeeForest_LEE_3_2023,2023,30.88286,-89.98244,2023-08-24,2023-11-08,76,Forest,Wild,1,0.0131578947368421
LSU4,LA_LeeForest_LEE_4_2023,2023,30.88383,-89.99577,2023-08-27,2023-11-09,74,Forest,Wild,0,0
LSU4,LA_LeeForest_LEE_5_2023,2023,30.88755,-89.99554,2023-08-24,2023-10-17,54,Forest,Wild,1,0.0185185185185185
LSU4,LA_LeeForest_LEE_6_2023,2023,30.89119,-89.99601,2023-08-24,2023-09-24,31,Forest,Wild,1,0.032258064516129
LSU4,LA_LeeForest_LEE_7_2023,2023,30.87836,-89.99147,2023-08-24,2023-10-06,43,Forest,Wild,1,0.0232558139534884
LSU4,LA_LeeForest_LEE_8_2023,2023,30.88104,-89.98864,2023-08-24,2023-10-16,53,Forest,Wild,1,0.0188679245283019
LSU1,LA_Vossburg_CHIP_10_2023,2023,30.74603,-91.69209,2023-08-25,2023-11-01,68,Wetland,Wild,3,0.0441176470588235
LSU1,LA_Vossburg_CHIP_11_2023,2023,30.74953,-91.69395,2023-08-25,2023-11-07,74,Wetland,Wild,4,0.0540540540540541
LSU1,LA_Vossburg_CHIP_12_2023,2023,30.75045,-91.68969,2023-08-25,2023-11-06,73,Wetland,Wild,12,0.164383561643836
LSU1,LA_Vossburg_CHIP_13_2023,2023,30.75472,-91.68866,2023-08-25,2023-11-07,74,Wetland,Wild,2,0.027027027027027
LSU1,LA_Vossburg_CHIP_14_2023,2023,30.75567,-91.6987,2023-09-01,2023-11-07,67,Wetland,Wild,1,0.0149253731343284
LSU1,LA_Vossburg_CHIP_15_2023,2023,30.75042,-91.70235,2023-08-25,2023-11-07,74,Wetland,Wild,7,0.0945945945945946
LSU1,LA_Vossburg_CHIP_16_2023,2023,30.74786,-91.70228,2023-08-25,2023-11-07,74,Wetland,Wild,11,0.148648648648649
LSU1,LA_Vossburg_CHIP_17_2023,2023,30.74148,-91.7,2023-08-25,2023-11-07,74,Wetland,Wild,4,0.0540540540540541
LSU1,LA_Vossburg_CHIP_18_2023,2023,30.74714,-91.67168,2023-08-25,2023-11-06,73,Wetland,Wild,4,0.0547945205479452
LSU1,LA_Vossburg_CHIP_1_2023,2023,30.74248,-91.6723,2023-08-25,2023-11-07,74,Wetland,Wild,3,0.0405405405405405
LSU1,LA_Vossburg_CHIP_2_2023,2023,30.75015,-91.6712,2023-08-25,2023-11-04,71,Wetland,Wild,2,0.028169014084507
LSU1,LA_Vossburg_CHIP_3_2023,2023,30.75372,-91.67513,2023-08-25,2023-11-06,73,Wetland,Wild,3,0.0410958904109589
LSU1,LA_Vossburg_CHIP_4_2023,2023,30.75414,-91.67889,2023-08-25,2023-11-05,72,Wetland,Wild,3,0.0416666666666667
LSU1,LA_Vossburg_CHIP_5_2023,2023,30.75423,-91.68437,2023-08-25,2023-11-07,74,Wetland,Wild,3,0.0405405405405405
LSU1,LA_Vossburg_CHIP_6_2023,2023,30.74859,-91.67918,2023-08-25,2023-11-05,72,Wetland,Wild,3,0.0416666666666667
LSU1,LA_Vossburg_CHIP_7_2023,2023,30.74386,-91.6773,2023-08-25,2023-11-03,70,Wetland,Wild,3,0.0428571428571429
LSU1,LA_Vossburg_CHIP_8_2023,2023,30.74488,-91.68221,2023-08-25,2023-11-06,73,Wetland,Wild,33,0.452054794520548
LSU1,LA_Vossburg_CHIP_9_2023,2023,30.74266,-91.6911,2023-08-25,2023-11-06,73,Wetland,Wild,4,0.0547945205479452
SLC,LCC_USA_01.2019_2019,2019,40.68014,-111.86089,2019-10-04,2019-10-26,22,Desert,Urban,1,0.0454545454545455
Wasatch,LC_03.Fall.USA.2020_2020,2020,40.57016,-111.75294,2020-09-07,2020-10-12,35,Forest,Wild,53,1.51428571428571
Herrera,LH0506_2019,2019,38.87941,-77.00023,2019-09-27,2019-10-10,13,Forest,Urban,38,2.92307692307692
Herrera,LH0507_2019,2019,38.87999,-77.0093,2019-09-27,2019-10-10,13,Forest,Urban,17,1.30769230769231
Herrera,LH0508_2019,2019,38.87878,-77.00309,2019-09-27,2019-10-10,13,Forest,Urban,11,0.846153846153846
Herrera,LH0512_2019,2019,38.87304,-76.99953,2019-09-27,2019-10-10,13,Forest,Urban,7,0.538461538461538
Herrera,LH0516_2019,2019,38.87678,-76.99829,2019-10-10,2019-10-24,14,Forest,Urban,53,3.78571428571429
Herrera,LH0518_2019,2019,38.87301,-76.99084,2019-10-10,2019-10-24,14,Forest,Urban,3,0.214285714285714
Herrera,LH0522_2019,2019,38.8749,-76.9877,2019-10-10,2019-10-24,14,Forest,Urban,4,0.285714285714286
Herrera,LL0119_2020,2020,38.87288,-76.97789,2020-09-02,2020-09-23,21,Forest,Urban,258,12.2857142857143
Herrera,LL0120_2020,2020,38.87171,-76.97617,2020-09-02,2020-10-05,33,Forest,Urban,209,6.33333333333333
Herrera,LL0121_2020,2020,38.86856,-76.98464,2020-09-02,2020-10-12,40,Forest,Urban,243,6.075
Herrera,LL0122_2020,2020,38.8684,-76.98692,2020-09-02,2020-09-17,15,Forest,Urban,2,0.133333333333333
Herrera,LL0123_2020,2020,38.86855,-76.98164,2020-09-02,2020-09-17,15,Forest,Urban,11,0.733333333333333
Herrera,LL0124_2020,2020,38.86751,-76.98161,2020-09-02,2020-09-15,13,Forest,Urban,247,19
Herrera,LL0125_2020,2020,38.86041,-76.98083,2020-09-02,2020-09-17,15,Forest,Urban,2,0.133333333333333
Herrera,LL0126_2020,2020,38.86589,-76.98289,2020-09-02,2020-09-17,15,Forest,Urban,10,0.666666666666667
Herrera,LL0127_2020,2020,38.86428,-76.98405,2020-09-02,2020-10-07,35,Forest,Urban,202,5.77142857142857
Herrera,LL0128_2020,2020,38.8656,-76.97736,2020-09-02,2020-09-17,15,Forest,Urban,5,0.333333333333333
Herrera,LL0129_2020,2020,38.86702,-76.97858,2020-09-02,2020-09-17,15,Forest,Urban,21,1.4
Herrera,LL0130_2020,2020,38.86668,-76.97587,2020-09-02,2020-09-22,20,Forest,Urban,230,11.5
Herrera,LL0131_2020,2020,38.86918,-76.96759,2020-09-02,2020-10-17,45,Forest,Urban,204,4.53333333333333
Wasatch,Lake Blanche.USA.2020_2020,2020,40.60809,-111.69187,2020-09-18,2020-10-27,39,Forest,Wild,0,0
Sovie,Lake View 08/06/2022_2022,2022,38.0125,-84.4705,2022-09-03,2022-10-30,57,Forest,Urban,0,0
SUCP,LawtonParkSS1_04SEP23-06OCT23_2023,2023,47.655776,-122.39133,2023-09-04,2023-10-06,32,Forest,Urban,21,0.65625
SUCP,LawtonParkSS1_06OCT23-28OCT23_2023,2023,47.655776,-122.39133,2023-10-06,2023-10-28,22,Forest,Urban,10,0.454545454545455
Sovie,Lexington Cemetery 09/30/2022_2022,2022,38.063,-84.5124,2022-10-01,2022-10-30,29,Forest,Urban,0,0
SLC,Little Confluence.USA.2019_2019,2019,40.66432,-111.90868,2019-10-04,2019-11-17,44,Desert,Urban,100,2.27272727272727
SLC,Little Confluence.USA.2020_2020,2020,40.665,-111.91014,2020-10-08,2020-11-03,26,Desert,Urban,41,1.57692307692308
Wasatch,Little Cottonwood.Dpat.USA.2020_2020,2020,40.57301,-111.69864,2020-09-03,2020-11-03,61,Forest,Wild,2,0.0327868852459016
SUCP,LowerWoodlandParkSS1_02OCT23-06NOV23_2023,2023,47.66725,-122.34328,2023-10-02,2023-11-06,35,Forest,Urban,40,1.14285714285714
SUCP,LowerWoodlandParkSS1_06SEP23-02OCT23_2023,2023,47.66725,-122.34328,2023-09-06,2023-10-02,26,Forest,Urban,15,0.576923076923077
EDG,MA_Anthropogenic_Edg_21_Loc_1 09/23/2021_2021,2021,41.38969,-70.52063,2021-09-23,2021-10-28,35,Forest,Suburban,48,1.37142857142857
EDG,MA_Anthropogenic_Edg_21_Loc_10 09/25/2021_2021,2021,41.4026,-70.52156,2021-09-25,2021-10-28,33,Forest,Suburban,27,0.818181818181818
EDG,MA_Anthropogenic_Edg_21_Loc_11 09/25/2021_2021,2021,41.4019,-70.52405,2021-09-25,2021-10-28,33,Forest,Suburban,18,0.545454545454545
EDG,MA_Anthropogenic_Edg_21_Loc_12 09/25/2021_2021,2021,41.39653,-70.52534,2021-09-25,2021-10-28,33,Forest,Suburban,90,2.72727272727273
EDG,MA_Anthropogenic_Edg_21_Loc_2 09/23/2021_2021,2021,41.3881,-70.51926,2021-09-23,2021-10-28,35,Forest,Suburban,25,0.714285714285714
EDG,MA_Anthropogenic_Edg_21_Loc_3 09/23/2021_2021,2021,41.38697,-70.522209,2021-09-23,2021-10-28,35,Forest,Suburban,256,7.31428571428571
EDG,MA_Anthropogenic_Edg_21_Loc_4 09/23/2021_2021,2021,41.38649,-70.52444,2021-09-23,2021-10-28,35,Forest,Suburban,142,4.05714285714286
EDG,MA_Anthropogenic_Edg_21_Loc_5 09/28/2021_2021,2021,41.38828,-70.52456,2021-09-28,2021-10-28,30,Forest,Suburban,30,1
EDG,MA_Anthropogenic_Edg_21_Loc_7 09/23/2021_2021,2021,41.38963,-70.51811,2021-09-23,2021-10-28,35,Forest,Suburban,45,1.28571428571429
EDG,MA_Anthropogenic_Edg_21_Loc_8 09/23/2021_2021,2021,41.3916,-70.5216,2021-09-23,2021-10-28,35,Forest,Suburban,38,1.08571428571429
EDG,MA_Anthropogenic_Edg_21_Loc_9 09/25/2021_2021,2021,41.39872,-70.52345,2021-09-25,2021-10-28,33,Forest,Suburban,44,1.33333333333333
Bak,MA_Anthropogenic_Suburban_CHS_23_CAMERA10_2023,2023,42.61245,-71.34919,2023-09-17,2023-11-05,49,Forest,Suburban,0,0
Bak,MA_Anthropogenic_Suburban_CHS_23_CAMERA11_2023,2023,42.58318,-71.34071,2023-09-14,2023-10-31,47,Forest,Suburban,3,0.0638297872340425
Bak,MA_Anthropogenic_Suburban_CHS_23_CAMERA12_2023,2023,42.58204,-71.33398,2023-09-14,2023-10-05,21,Forest,Suburban,5,0.238095238095238
Bak,MA_Anthropogenic_Suburban_CHS_23_CAMERA13_2023,2023,42.57288,-71.38099,2023-10-05,2023-11-06,32,Forest,Suburban,3,0.09375
Bak,MA_Anthropogenic_Suburban_CHS_23_CAMERA14_2023,2023,42.57342,-71.38369,2023-09-20,2023-11-06,47,Forest,Suburban,4,0.0851063829787234
Bak,MA_Anthropogenic_Suburban_CHS_23_CAMERA15_2023,2023,42.60136,-71.34388,2023-09-19,2023-11-14,56,Forest,Suburban,3,0.0535714285714286
Bak,MA_Anthropogenic_Suburban_CHS_23_CAMERA1_2023,2023,42.62072,-71.37945,2023-09-13,2023-11-06,54,Forest,Suburban,2,0.037037037037037
Bak,MA_Anthropogenic_Suburban_CHS_23_CAMERA2_2023,2023,42.61963,-71.37571,2023-09-13,2023-11-06,54,Forest,Suburban,3,0.0555555555555556
Bak,MA_Anthropogenic_Suburban_CHS_23_CAMERA3_2023,2023,42.62263,-71.3266,2023-09-16,2023-11-05,50,Forest,Suburban,2,0.04
Bak,MA_Anthropogenic_Suburban_CHS_23_CAMERA4_2023,2023,42.62094,-71.36999,2023-09-14,2023-11-15,62,Forest,Suburban,3,0.0483870967741935
Bak,MA_Anthropogenic_Suburban_CHS_23_CAMERA5_2023,2023,42.62439,-71.3774,2023-09-20,2023-11-07,48,Forest,Suburban,3,0.0625
Bak,MA_Anthropogenic_Suburban_CHS_23_CAMERA6_2023,2023,42.61786,-71.384133,2023-09-13,2023-11-03,51,Forest,Suburban,2,0.0392156862745098
Bak,MA_Anthropogenic_Suburban_CHS_23_CAMERA7_2023,2023,42.61969,-71.38499,2023-09-17,2023-11-05,49,Forest,Suburban,3,0.0612244897959184
Bak,MA_Anthropogenic_Suburban_CHS_23_CAMERA8_2023,2023,42.6181,-71.37072,2023-09-14,2023-11-13,60,Forest,Suburban,5,0.0833333333333333
Bak,MA_Anthropogenic_Suburban_CHS_23_CAMERA9_2023,2023,42.6174,-71.36626,2023-09-14,2023-11-14,61,Forest,Suburban,2,0.0327868852459016
EDG,MA_Anthropogenic_Suburban_EDG_23_10A_2023,2023,41.396497,-70.525301,2023-09-14,2023-10-31,47,Forest,Suburban,47,1
EDG,MA_Anthropogenic_Suburban_EDG_23_11A_2023,2023,41.400842,-70.523951,2023-09-14,2023-10-31,47,Forest,Suburban,11,0.234042553191489
EDG,MA_Anthropogenic_Suburban_EDG_23_12A_2023,2023,41.402649,-70.521544,2023-09-14,2023-10-31,47,Forest,Suburban,44,0.936170212765957
EDG,MA_Anthropogenic_Suburban_EDG_23_1A_2023,2023,41.38967,-70.520477,2023-09-13,2023-10-31,48,Forest,Suburban,38,0.791666666666667
EDG,MA_Anthropogenic_Suburban_EDG_23_2A_2023,2023,41.388146,-70.519261,2023-09-13,2023-10-31,48,Forest,Suburban,150,3.125
EDG,MA_Anthropogenic_Suburban_EDG_23_3A_2023,2023,41.386942,-70.522031,2023-09-13,2023-10-31,48,Forest,Suburban,84,1.75
EDG,MA_Anthropogenic_Suburban_EDG_23_4A_2023,2023,41.386469,-70.524584,2023-09-13,2023-09-26,13,Forest,Suburban,86,6.61538461538461
EDG,MA_Anthropogenic_Suburban_EDG_23_4B_2023,2023,41.386469,-70.524584,2023-09-26,2023-10-18,22,Forest,Suburban,302,13.7272727272727
EDG,MA_Anthropogenic_Suburban_EDG_23_4C_2023,2023,41.386469,-70.524584,2023-10-18,2023-10-31,13,Forest,Suburban,76,5.84615384615385
EDG,MA_Anthropogenic_Suburban_EDG_23_5A_2023,2023,41.38828,-70.524572,2023-09-13,2023-10-31,48,Forest,Suburban,61,1.27083333333333
EDG,MA_Anthropogenic_Suburban_EDG_23_6A_2023,2023,41.381546,-70.520011,2023-09-13,2023-10-31,48,Forest,Suburban,3,0.0625
EDG,MA_Anthropogenic_Suburban_EDG_23_7A_2023,2023,41.389607,-70.518128,2023-09-13,2023-10-31,48,Forest,Suburban,95,1.97916666666667
EDG,MA_Anthropogenic_Suburban_EDG_23_9A_2023,2023,41.398776,-70.523327,2023-09-14,2023-10-31,47,Forest,Suburban,45,0.957446808510638
OB,MA_Anthropogenic_Suburban_OB_23_10A_2023,2023,41.456298,-70.56193,2023-09-06,2023-10-31,55,Forest,Suburban,406,7.38181818181818
OB,MA_Anthropogenic_Suburban_OB_23_11A_2023,2023,41.458419,-70.564328,2023-09-06,2023-10-17,41,Forest,Suburban,57,1.39024390243902
OB,MA_Anthropogenic_Suburban_OB_23_11B_2023,2023,41.458419,-70.564328,2023-10-17,2023-10-31,14,Forest,Suburban,4,0.285714285714286
OB,MA_Anthropogenic_Suburban_OB_23_12A_2023,2023,41.459925,-70.56232,2023-09-06,2023-09-25,19,Forest,Suburban,10,0.526315789473684
OB,MA_Anthropogenic_Suburban_OB_23_12B_2023,2023,41.459925,-70.56232,2023-09-25,2023-10-31,36,Forest,Suburban,17,0.472222222222222
OB,MA_Anthropogenic_Suburban_OB_23_1A_2023,2023,41.446463,-70.569432,2023-09-07,2023-10-31,54,Forest,Suburban,82,1.51851851851852
OB,MA_Anthropogenic_Suburban_OB_23_2A_2023,2023,41.447755,-70.567778,2023-09-07,2023-09-22,15,Forest,Suburban,8,0.533333333333333
OB,MA_Anthropogenic_Suburban_OB_23_3A_2023,2023,41.449595,-70.562488,2023-09-06,2023-10-31,55,Forest,Suburban,190,3.45454545454545
OB,MA_Anthropogenic_Suburban_OB_23_4A_2023,2023,41.451665,-70.561548,2023-09-06,2023-09-13,7,Forest,Suburban,129,18.4285714285714
OB,MA_Anthropogenic_Suburban_OB_23_4B_2023,2023,41.451665,-70.561548,2023-09-22,2023-10-31,39,Forest,Suburban,44,1.12820512820513
OB,MA_Anthropogenic_Suburban_OB_23_5A_2023,2023,41.4518,-70.556112,2023-09-06,2023-10-31,55,Forest,Suburban,210,3.81818181818182
OB,MA_Anthropogenic_Suburban_OB_23_6A_2023,2023,41.45303,-70.5706,2023-09-07,2023-09-23,16,Forest,Suburban,38,2.375
OB,MA_Anthropogenic_Suburban_OB_23_6B_2023,2023,41.45303,-70.5706,2023-09-23,2023-10-31,38,Forest,Suburban,75,1.97368421052632
OB,MA_Anthropogenic_Suburban_OB_23_7A_2023,2023,41.454759,-70.571557,2023-09-07,2023-09-23,16,Forest,Suburban,88,5.5
OB,MA_Anthropogenic_Suburban_OB_23_7B_2023,2023,41.454759,-70.571557,2023-09-23,2023-10-31,38,Forest,Suburban,174,4.57894736842105
OB,MA_Anthropogenic_Suburban_OB_23_8A_2023,2023,41.455924,-70.569571,2023-09-07,2023-09-23,16,Forest,Suburban,73,4.5625
OB,MA_Anthropogenic_Suburban_OB_23_8B_2023,2023,41.455924,-70.569571,2023-09-23,2023-10-31,38,Forest,Suburban,74,1.94736842105263
OB,MA_Anthropogenic_Suburban_OB_23_9A_2023,2023,41.454645,-70.567255,2023-09-07,2023-09-23,16,Forest,Suburban,7,0.4375
OB,MA_Anthropogenic_Suburban_OB_23_9B_2023,2023,41.454645,-70.567255,2023-09-23,2023-10-31,38,Forest,Suburban,5,0.131578947368421
EDG,MA_Anthropogenic_Urban_EDG_22_10A_2022,2022,41.396497,-70.525301,2022-09-15,2022-10-13,28,Forest,Suburban,78,2.78571428571429
EDG,MA_Anthropogenic_Urban_EDG_22_10B_2022,2022,41.396497,-70.525301,2022-10-13,2022-10-31,18,Forest,Suburban,15,0.833333333333333
EDG,MA_Anthropogenic_Urban_EDG_22_11A_2022,2022,41.400842,-70.523951,2022-09-15,2022-10-13,28,Forest,Suburban,8,0.285714285714286
EDG,MA_Anthropogenic_Urban_EDG_22_11B_2022,2022,41.400842,-70.523951,2022-10-13,2022-10-31,18,Forest,Suburban,7,0.388888888888889
EDG,MA_Anthropogenic_Urban_EDG_22_12A_2022,2022,41.402649,-70.521544,2022-09-15,2022-10-13,28,Forest,Suburban,20,0.714285714285714
EDG,MA_Anthropogenic_Urban_EDG_22_12B_2022,2022,41.402649,-70.521544,2022-10-13,2022-10-31,18,Forest,Suburban,22,1.22222222222222
EDG,MA_Anthropogenic_Urban_EDG_22_1A_2022,2022,41.38967,-70.520477,2022-09-15,2022-10-12,27,Forest,Suburban,103,3.81481481481481
EDG,MA_Anthropogenic_Urban_EDG_22_1B_2022,2022,41.38967,-70.520477,2022-10-12,2022-10-31,19,Forest,Suburban,63,3.31578947368421
EDG,MA_Anthropogenic_Urban_EDG_22_2A_2022,2022,41.388146,-70.519261,2022-09-15,2022-10-12,27,Forest,Suburban,155,5.74074074074074
EDG,MA_Anthropogenic_Urban_EDG_22_2B_2022,2022,41.388146,-70.519261,2022-10-12,2022-10-31,19,Forest,Suburban,191,10.0526315789474
EDG,MA_Anthropogenic_Urban_EDG_22_3A_2022,2022,41.386942,-70.522031,2022-09-15,2022-10-12,27,Forest,Suburban,249,9.22222222222222
EDG,MA_Anthropogenic_Urban_EDG_22_3B_2022,2022,41.386942,-70.522031,2022-10-12,2022-10-31,19,Forest,Suburban,77,4.05263157894737
EDG,MA_Anthropogenic_Urban_EDG_22_4A_2022,2022,41.386469,-70.524584,2022-09-15,2022-09-28,13,Forest,Suburban,22,1.69230769230769
EDG,MA_Anthropogenic_Urban_EDG_22_4B_2022,2022,41.386469,-70.524584,2022-10-12,2022-10-31,19,Forest,Suburban,49,2.57894736842105
EDG,MA_Anthropogenic_Urban_EDG_22_5A_2022,2022,41.38828,-70.524572,2022-09-15,2022-09-30,15,Forest,Suburban,20,1.33333333333333
EDG,MA_Anthropogenic_Urban_EDG_22_5B_2022,2022,41.38828,-70.524572,2022-10-12,2022-10-29,17,Forest,Suburban,82,4.82352941176471
EDG,MA_Anthropogenic_Urban_EDG_22_6A_2022,2022,41.381546,-70.520011,2022-08-18,2022-09-11,24,Forest,Suburban,6,0.25
EDG,MA_Anthropogenic_Urban_EDG_22_6B_2022,2022,41.381546,-70.520011,2022-10-11,2022-10-31,20,Forest,Suburban,10,0.5
EDG,MA_Anthropogenic_Urban_EDG_22_7A_2022,2022,41.389607,-70.518128,2022-09-15,2022-10-09,24,Forest,Suburban,485,20.2083333333333
EDG,MA_Anthropogenic_Urban_EDG_22_7B_2022,2022,41.389607,-70.518128,2022-10-13,2022-10-31,18,Forest,Suburban,17,0.944444444444444
EDG,MA_Anthropogenic_Urban_EDG_22_8A_2022,2022,41.391576,-70.521627,2022-09-15,2022-10-12,27,Forest,Suburban,28,1.03703703703704
EDG,MA_Anthropogenic_Urban_EDG_22_8B_2022,2022,41.391576,-70.521627,2022-10-12,2022-10-31,19,Forest,Suburban,10,0.526315789473684
EDG,MA_Anthropogenic_Urban_EDG_22_9A_2022,2022,41.398776,-70.523327,2022-09-15,2022-10-13,28,Forest,Suburban,16,0.571428571428571
EDG,MA_Anthropogenic_Urban_EDG_22_9B_2022,2022,41.398776,-70.523327,2022-10-15,2022-10-31,16,Forest,Suburban,12,0.75
Amherst,MA_Forest_Amherst_10_2019,2019,42.31592,-72.50197,2019-09-04,2019-09-30,26,Forest,Suburban,0,0
Amherst,MA_Forest_Amherst_11_2019,2019,42.37383,-72.48542,2019-09-02,2019-09-30,28,Forest,Suburban,1,0.0357142857142857
Amherst,MA_Forest_Amherst_12_2019,2019,42.41433,-72.49433,2019-09-01,2019-09-30,29,Forest,Suburban,0,0
Amherst,MA_Forest_Amherst_13_2019,2019,42.39923,-72.50448,2019-09-01,2019-10-21,50,Forest,Suburban,0,0
Amherst,MA_Forest_Amherst_14_2019,2019,42.38962,-72.50982,2019-09-01,2019-09-27,26,Forest,Suburban,0,0
Amherst,MA_Forest_Amherst_16_2019,2019,42.35102,-72.51055,2019-09-01,2019-09-30,29,Forest,Suburban,0,0
Amherst,MA_Forest_Amherst_17_2019,2019,42.36162,-72.47678,2019-09-01,2019-09-30,29,Forest,Suburban,1,0.0344827586206897
Amherst,MA_Forest_Amherst_18_2019,2019,42.34088,-72.49468,2019-09-01,2019-09-27,26,Forest,Suburban,0,0
Amherst,MA_Forest_Amherst_19_2019,2019,42.3594,-72.53912,2019-09-02,2019-09-30,28,Forest,Suburban,0,0
Amherst,MA_Forest_Amherst_1_2019,2019,42.39357,-72.48895,2019-09-01,2019-09-30,29,Forest,Suburban,0,0
Amherst,MA_Forest_Amherst_20_2019,2019,42.37475,-72.53228,2019-09-02,2019-09-29,27,Forest,Suburban,0,0
Amherst,MA_Forest_Amherst_2_2019,2019,42.39653,-72.53712,2019-09-01,2019-09-28,27,Forest,Suburban,0,0
Amherst,MA_Forest_Amherst_4_2019,2019,42.39448,-72.51022,2019-09-01,2019-09-30,29,Forest,Suburban,2,0.0689655172413793
Amherst,MA_Forest_Amherst_5_2019,2019,42.42257,-72.54245,2019-09-01,2019-09-30,29,Forest,Suburban,0,0
Amherst,MA_Forest_Amherst_6_2019,2019,42.42845,-72.49945,2019-09-02,2019-09-30,28,Forest,Suburban,0,0
Amherst,MA_Forest_Amherst_7_2019,2019,42.37867,-72.4835,2019-09-01,2019-09-30,29,Forest,Suburban,11,0.379310344827586
Amherst,MA_Forest_Amherst_8_2019,2019,42.42917,-72.52433,2019-09-01,2019-09-28,27,Forest,Suburban,0,0
Amherst,MA_Forest_Amherst_9_2019,2019,42.3154,-72.52045,2019-09-01,2019-09-28,27,Forest,Suburban,0,0
Bak,MA_Forest_Bak_22_Alumni_Woods_2022,2022,42.62065,-71.37939,2022-09-01,2022-11-03,63,Forest,Suburban,2,0.0317460317460317
Bak,MA_Forest_Bak_22_Baseball_Woods_2022,2022,42.62108,-71.36976,2022-08-30,2022-11-02,64,Forest,Suburban,4,0.0625
Bak,MA_Forest_Bak_22_Bayberry_Woods_2022,2022,42.61246,-71.34928,2022-08-31,2022-11-02,63,Forest,Suburban,4,0.0634920634920635
Bak,MA_Forest_Bak_22_Byam_Elementary_2022,2022,42.5727,-71.38095,2022-10-26,2022-11-08,13,Forest,Suburban,2,0.153846153846154
Bak,MA_Forest_Bak_22_CHS_DPW_Main_Buildings_2022,2022,42.62361,-71.37506,2022-09-01,2022-11-03,63,Forest,Suburban,4,0.0634920634920635
Bak,MA_Forest_Bak_22_CHS_High_Ropes_2022,2022,42.6193,-71.37591,2022-08-30,2022-11-03,65,Forest,Suburban,6,0.0923076923076923
Bak,MA_Forest_Bak_22_CHS_PAC_2022,2022,42.62107,-71.37386,2022-09-30,2022-11-03,34,Forest,Suburban,4,0.117647058823529
Bak,MA_Forest_Bak_22_CHS_Pallet_Farm_2022,2022,42.62277,-71.37203,2022-10-09,2022-11-03,25,Forest,Suburban,1,0.04
Bak,MA_Forest_Bak_22_Center_Elementary_2022,2022,42.6014,-71.34441,2022-09-04,2022-11-02,59,Forest,Suburban,3,0.0508474576271186
Bak,MA_Forest_Bak_22_Central_Office_2022,2022,42.61734,-71.36602,2022-09-05,2022-11-02,58,Forest,Suburban,3,0.0517241379310345
Bak,MA_Forest_Bak_22_Dickenson_Woods_2022,2022,42.62101,-71.377,2022-08-31,2022-11-03,64,Forest,Suburban,17,0.265625
Bak,MA_Forest_Bak_22_Harrington_Football_Corner_2022,2022,42.624465,-71.377402,2022-08-31,2022-11-03,64,Forest,Suburban,9,0.140625
Bak,MA_Forest_Bak_22_McCarthy_Woods_2022,2022,42.61694,-71.36883,2022-09-02,2022-11-03,62,Forest,Suburban,3,0.0483870967741935
Bak,MA_Forest_Bak_22_Parker_Drive_2022,2022,42.61779,-71.38416,2022-09-30,2022-11-02,33,Forest,Suburban,2,0.0606060606060606
BridgewaterState,MA_Forest_BridgewaterState_21_FTire 08/30/2021_2021,2021,41.98604,-70.9537,2021-08-30,2021-11-03,65,Forest,Suburban,4,0.0615384615384615
BridgewaterState,MA_Forest_BridgewaterState_21_GHRoad 08/30/2021_2021,2021,41.98919,-70.95881,2021-08-30,2021-11-03,65,Forest,Suburban,7,0.107692307692308
BridgewaterState,MA_Forest_BridgewaterState_21_OrangeFerns 08/30/2021_2021,2021,41.986183,-70.956017,2021-08-30,2021-11-03,65,Forest,Suburban,3,0.0461538461538462
BridgewaterState,MA_Forest_BridgewaterState_21_PlotV 08/30/2021_2021,2021,41.98831,-70.95673,2021-08-30,2021-11-03,65,Forest,Suburban,23,0.353846153846154
BridgewaterState,MA_Forest_BridgewaterState_21_PurplePine 08/30/2021_2021,2021,41.98405,-70.95872,2021-08-30,2021-11-03,65,Forest,Suburban,2,0.0307692307692308
BridgewaterState,MA_Forest_BridgewaterState_21_SkeeterMill 08/30/2021_2021,2021,41.985,-70.95688,2021-08-30,2021-11-03,65,Forest,Suburban,2,0.0307692307692308
BridgewaterState,MA_Forest_BridgewaterState_21_Tinsley 08/30/2021_2021,2021,41.98906,-70.96003,2021-08-30,2021-11-03,65,Forest,Suburban,59,0.907692307692308
BridgewaterState,MA_Forest_BridgewaterState_21_TowerLot 08/30/2021_2021,2021,41.986017,-70.958117,2021-08-30,2021-09-27,28,Forest,Suburban,2,0.0714285714285714
BridgewaterState,MA_Forest_BridgewaterState_21_VernalPool 08/30/2021_2021,2021,41.98416,-70.9605,2021-08-30,2021-11-03,65,Forest,Suburban,2,0.0307692307692308
BridgewaterState,MA_Forest_BridgewaterState_21_WateringHole 08/30/2021_2021,2021,41.98339,-70.96355,2021-08-30,2021-11-03,65,Forest,Suburban,3,0.0461538461538462
BridgewaterState,MA_Forest_BridgewaterState_22_FTire_Cam3_2022,2022,41.986083,-70.9538,2022-08-31,2022-11-01,62,Forest,Suburban,6,0.0967741935483871
BridgewaterState,MA_Forest_BridgewaterState_22_GHRoad_Cam12_2022,2022,41.98919,-70.95881,2022-08-31,2022-11-01,62,Forest,Suburban,13,0.209677419354839
BridgewaterState,MA_Forest_BridgewaterState_22_OrangeFern_Cam2_2022,2022,41.986367,-70.9559,2022-08-31,2022-11-01,62,Forest,Suburban,7,0.112903225806452
BridgewaterState,MA_Forest_BridgewaterState_22_PlotV_Cam9_2022,2022,41.98827,-70.95671,2022-08-31,2022-10-25,55,Forest,Suburban,13,0.236363636363636
BridgewaterState,MA_Forest_BridgewaterState_22_PropertyLine_Cam10_2022,2022,41.984383,-70.96135,2022-08-31,2022-11-01,62,Forest,Suburban,6,0.0967741935483871
BridgewaterState,MA_Forest_BridgewaterState_22_PurplePine_Cam5_2022,2022,41.984033,-70.9588,2022-08-31,2022-11-01,62,Forest,Suburban,4,0.0645161290322581
BridgewaterState,MA_Forest_BridgewaterState_22_SkeeterMill_Cam7_2022,2022,41.984936,-70.956957,2022-08-31,2022-11-01,62,Forest,Suburban,6,0.0967741935483871
BridgewaterState,MA_Forest_BridgewaterState_22_TowerLot_Cam13_2022,2022,41.98605,-70.958117,2022-08-31,2022-11-01,62,Forest,Suburban,8,0.129032258064516
BridgewaterState,MA_Forest_BridgewaterState_22_VernalPool_Cam4_2022,2022,41.98416,-70.96036,2022-08-31,2022-11-01,62,Forest,Suburban,4,0.0645161290322581
BridgewaterState,MA_Forest_BridgewaterState_22_WateringHole_Cam8_2022,2022,41.9834,-70.96365,2022-08-31,2022-11-01,62,Forest,Suburban,26,0.419354838709677
BridgewaterState,MA_Forest_Bridgewater_State_University_1_2019,2019,41.98605,-70.95812,2019-08-29,2019-11-06,69,Forest,Suburban,4,0.0579710144927536
BridgewaterState,MA_Forest_Bridgewater_State_University_20_01_2020,2020,41.98602,-70.95812,2020-08-30,2020-11-01,63,Forest,Suburban,5,0.0793650793650794
BridgewaterState,MA_Forest_Bridgewater_State_University_20_02_2020,2020,41.98618,-70.95601,2020-08-30,2020-11-01,63,Forest,Suburban,2,0.0317460317460317
BridgewaterState,MA_Forest_Bridgewater_State_University_20_03_2020,2020,41.98636,-70.954,2020-08-30,2020-11-01,63,Forest,Suburban,5,0.0793650793650794
BridgewaterState,MA_Forest_Bridgewater_State_University_20_04_2020,2020,41.98423,-70.95897,2020-08-30,2020-11-01,63,Forest,Suburban,3,0.0476190476190476
BridgewaterState,MA_Forest_Bridgewater_State_University_20_05_2020,2020,41.98827,-70.95671,2020-08-30,2020-11-01,63,Forest,Suburban,30,0.476190476190476
BridgewaterState,MA_Forest_Bridgewater_State_University_20_06_2020,2020,41.98444,-70.96146,2020-08-30,2020-11-01,63,Forest,Suburban,2,0.0317460317460317
BridgewaterState,MA_Forest_Bridgewater_State_University_20_07_2020,2020,41.98336,-70.96359,2020-08-30,2020-11-01,63,Forest,Suburban,2,0.0317460317460317
BridgewaterState,MA_Forest_Bridgewater_State_University_20_08_2020,2020,41.98901,-70.96008,2020-08-30,2020-11-01,63,Forest,Suburban,95,1.50793650793651
BridgewaterState,MA_Forest_Bridgewater_State_University_2_2019,2019,41.98637,-70.9559,2019-08-29,2019-11-06,69,Forest,Suburban,4,0.0579710144927536
BridgewaterState,MA_Forest_Bridgewater_State_University_3_2019,2019,41.98608,-70.9538,2019-08-29,2019-11-06,69,Forest,Suburban,5,0.072463768115942
BridgewaterState,MA_Forest_Bridgewater_State_University_4_2019,2019,41.98403,-70.9588,2019-08-29,2019-11-06,69,Forest,Suburban,5,0.072463768115942
BridgewaterState,MA_Forest_Bridgewater_State_University_5_2019,2019,41.98438,-70.96135,2019-08-29,2019-11-06,69,Forest,Suburban,4,0.0579710144927536
BridgewaterState,MA_Forest_Bridgewater_State_University_6_2019,2019,41.9834,-70.96362,2019-08-29,2019-11-06,69,Forest,Suburban,4,0.0579710144927536
BridgewaterState,MA_Forest_Bridgewater_State_University_7_2019,2019,41.98907,-70.9601,2019-08-29,2019-11-06,69,Forest,Suburban,37,0.536231884057971
BridgewaterState,MA_Forest_Bridgewater_State_University_8_2019,2019,41.98827,-70.95671,2019-10-04,2019-11-06,33,Forest,Suburban,30,0.909090909090909
Grafton,MA_Forest_Grafton_101-23_2023,2023,42.209087,-71.712843,2023-08-29,2023-11-02,65,Forest,Suburban,2,0.0307692307692308
Grafton,MA_Forest_Grafton_101_22_2022,2022,42.215671,-71.717612,2022-08-31,2022-11-03,64,Forest,Suburban,9,0.140625
Grafton,MA_Forest_Grafton_101a_2021,2021,42.215931,-71.717629,2021-08-31,2021-09-14,14,Forest,Suburban,2,0.142857142857143
Grafton,MA_Forest_Grafton_101b_2021,2021,42.215931,-71.717629,2021-09-17,2021-11-01,45,Forest,Suburban,3,0.0666666666666667
Grafton,MA_Forest_Grafton_102-22_2022,2022,42.216692,-71.71721,2022-08-31,2022-09-29,29,Forest,Suburban,4,0.137931034482759
Grafton,MA_Forest_Grafton_102-23_2023,2023,42.209087,-71.712843,2023-08-29,2023-11-02,65,Forest,Suburban,10,0.153846153846154
Grafton,MA_Forest_Grafton_102_2021,2021,42.216986,-71.717822,2021-08-31,2021-11-01,62,Forest,Suburban,3,0.0483870967741935
Grafton,MA_Forest_Grafton_103-22_2022,2022,42.219175,-71.718374,2022-08-31,2022-11-03,64,Forest,Suburban,4,0.0625
Grafton,MA_Forest_Grafton_103-23_2023,2023,42.218574,-71.719753,2023-08-29,2023-11-02,65,Forest,Suburban,10,0.153846153846154
Grafton,MA_Forest_Grafton_103_2021,2021,42.218624,-71.719694,2021-08-31,2021-11-01,62,Forest,Suburban,4,0.0645161290322581
Grafton,MA_Forest_Grafton_104-22_2022,2022,42.220379,-71.71662,2022-08-31,2022-11-03,64,Forest,Suburban,3,0.046875
Grafton,MA_Forest_Grafton_104-23_2023,2023,42.221371,-71.721169,2023-08-29,2023-11-02,65,Forest,Suburban,3,0.0461538461538462
Grafton,MA_Forest_Grafton_104_2021,2021,42.220459,-71.719742,2021-08-31,2021-11-01,62,Forest,Suburban,15,0.241935483870968
Grafton,MA_Forest_Grafton_105-22_2022,2022,42.218988,-71.714818,2022-08-31,2022-11-03,64,Forest,Suburban,9,0.140625
Grafton,MA_Forest_Grafton_105-23_2023,2023,42.222293,-71.716963,2023-08-29,2023-11-02,65,Forest,Suburban,2,0.0307692307692308
Grafton,MA_Forest_Grafton_105_2021,2021,42.222203,-71.717189,2021-08-31,2021-11-01,62,Forest,Suburban,8,0.129032258064516
Grafton,MA_Forest_Grafton_106-22_2022,2022,42.218144,-71.715333,2022-09-01,2022-11-03,63,Forest,Suburban,5,0.0793650793650794
Grafton,MA_Forest_Grafton_106-23_2023,2023,42.222928,-71.712328,2023-08-29,2023-11-02,65,Forest,Suburban,2,0.0307692307692308
Grafton,MA_Forest_Grafton_106_2021,2021,42.222394,-71.714035,2021-08-31,2021-11-01,62,Forest,Suburban,5,0.0806451612903226
Grafton,MA_Forest_Grafton_107-22_2022,2022,42.217294,-71.714303,2022-08-31,2022-09-15,15,Forest,Suburban,2,0.133333333333333
Grafton,MA_Forest_Grafton_107-23_2023,2023,42.222007,-71.709839,2023-08-29,2023-11-02,65,Forest,Suburban,2,0.0307692307692308
Grafton,MA_Forest_Grafton_107_2021,2021,42.219978,-71.715794,2021-08-31,2021-11-01,62,Forest,Suburban,3,0.0483870967741935
Grafton,MA_Forest_Grafton_108-22_2022,2022,42.216976,-71.712833,2022-08-31,2022-11-03,64,Forest,Suburban,9,0.140625
Grafton,MA_Forest_Grafton_108-23_2023,2023,42.221773,-71.709324,2023-08-29,2023-11-02,65,Forest,Suburban,2,0.0307692307692308
Grafton,MA_Forest_Grafton_108_2021,2021,42.222251,-71.712211,2021-08-31,2021-11-01,62,Forest,Suburban,5,0.0806451612903226
Grafton,MA_Forest_Grafton_109-22_2022,2022,42.213186,-71.713723,2022-08-31,2022-11-03,64,Forest,Suburban,4,0.0625
Grafton,MA_Forest_Grafton_109_2021,2021,42.21796,-71.714142,2021-08-31,2021-11-01,62,Forest,Suburban,3,0.0483870967741935
Grafton,MA_Forest_Grafton_110-22_2022,2022,42.210532,-71.714936,2022-08-31,2022-11-03,64,Forest,Suburban,31,0.484375
Grafton,MA_Forest_Grafton_110-23_2023,2023,42.209426,-71.712431,2023-08-29,2023-11-02,65,Forest,Suburban,4,0.0615384615384615
Grafton,MA_Forest_Grafton_110_2021,2021,42.212763,-71.717361,2021-09-08,2021-11-01,54,Forest,Suburban,3,0.0555555555555556
Grafton,MA_Forest_Grafton_111-23_2023,2023,42.211539,-71.720456,2023-08-29,2023-11-02,65,Forest,Suburban,4,0.0615384615384615
Grafton,MA_Forest_Grafton_112-23_2023,2023,42.210316,-71.7211,2023-08-29,2023-11-02,65,Forest,Suburban,17,0.261538461538462
Grafton,MA_Forest_Grafton_1B_2019,2019,42.218468,-71.701737,2019-09-01,2019-11-02,62,Forest,Suburban,1,0.0161290322580645
Grafton,MA_Forest_Grafton_20_01_2020,2020,42.21875,-71.70292,2020-09-01,2020-10-18,47,Forest,Suburban,3,0.0638297872340425
Grafton,MA_Forest_Grafton_20_03_2020,2020,42.21676,-71.705,2020-09-01,2020-10-18,47,Forest,Suburban,1,0.0212765957446809
Grafton,MA_Forest_Grafton_20_04_2020,2020,42.21343,-71.70508,2020-09-01,2020-10-18,47,Forest,Suburban,2,0.0425531914893617
Grafton,MA_Forest_Grafton_20_05_2020,2020,42.21138,-71.70272,2020-09-01,2020-10-18,47,Forest,Suburban,5,0.106382978723404
Grafton,MA_Forest_Grafton_20_07_2020,2020,42.21571,-71.70018,2020-09-01,2020-10-18,47,Forest,Suburban,2,0.0425531914893617
Grafton,MA_Forest_Grafton_20_08_2020,2020,42.21758,-71.70247,2020-09-01,2020-10-18,47,Forest,Suburban,4,0.0851063829787234
Grafton,MA_Forest_Grafton_2_2019,2019,42.218184,-71.703183,2019-09-01,2019-11-14,74,Forest,Suburban,2,0.027027027027027
Grafton,MA_Forest_Grafton_3_2019,2019,42.217358,-71.70358,2019-09-01,2019-11-14,74,Forest,Suburban,1,0.0135135135135135
Grafton,MA_Forest_Grafton_5_2019,2019,42.215098,-71.703878,2019-09-01,2019-11-14,74,Forest,Suburban,3,0.0405405405405405
Grafton,MA_Forest_Grafton_7_2019,2019,42.214038,-71.699458,2019-09-01,2019-11-09,69,Forest,Suburban,1,0.0144927536231884
Grafton,MA_Forest_Grafton_8_2019,2019,42.216589,-71.700402,2019-09-01,2019-11-14,74,Forest,Suburban,4,0.0540540540540541
BridgewaterState,MA_Forest_Suburban_BridgewaterStateUniversity_23_Ftire_Cam3_2023,2023,41.986083,-70.9538,2023-08-31,2023-11-03,64,Forest,Suburban,4,0.0625
BridgewaterState,MA_Forest_Suburban_BridgewaterStateUniversity_23_GHRoad_Cam12_2023,2023,41.98919,-70.95881,2023-08-31,2023-11-03,64,Forest,Suburban,11,0.171875
BridgewaterState,MA_Forest_Suburban_BridgewaterStateUniversity_23_OrangeFern_Cam2_2023,2023,41.986367,-70.9559,2023-08-31,2023-11-03,64,Forest,Suburban,3,0.046875
BridgewaterState,MA_Forest_Suburban_BridgewaterStateUniversity_23_PlotV_Cam9_Dep1_2023,2023,41.98827,-70.95671,2023-08-31,2023-10-08,38,Forest,Suburban,7,0.184210526315789
BridgewaterState,MA_Forest_Suburban_BridgewaterStateUniversity_23_PlotV_Cam9_Dep2_2023,2023,41.98827,-70.95671,2023-10-13,2023-11-03,21,Forest,Suburban,6,0.285714285714286
BridgewaterState,MA_Forest_Suburban_BridgewaterStateUniversity_23_PropertyLine_Cam10_2023,2023,41.984383,-70.96135,2023-08-31,2023-11-03,64,Forest,Suburban,2,0.03125
BridgewaterState,MA_Forest_Suburban_BridgewaterStateUniversity_23_PurplePine_Cam5_2023,2023,41.984033,-70.9588,2023-08-31,2023-11-03,64,Forest,Suburban,3,0.046875
BridgewaterState,MA_Forest_Suburban_BridgewaterStateUniversity_23_TowerLot_Cam13_2023,2023,41.98605,-70.958117,2023-08-31,2023-11-03,64,Forest,Suburban,5,0.078125
BridgewaterState,MA_Forest_Suburban_BridgewaterStateUniversity_23_VernalPool_Cam4_2023,2023,41.98416,-70.96036,2023-08-31,2023-11-03,64,Forest,Suburban,5,0.078125
BridgewaterState,MA_Forest_Suburban_BridgewaterStateUniversity_23_WateringHole_Cam8_2023,2023,41.9834,-70.96365,2023-08-31,2023-11-03,64,Forest,Suburban,19,0.296875
WT,MA_Forest_Suburban_WT_23_10A_2023,2023,41.401196,-70.660483,2023-09-04,2023-10-31,57,Forest,Suburban,6,0.105263157894737
WT,MA_Forest_Suburban_WT_23_11A_2023,2023,41.404168,-70.658877,2023-09-12,2023-10-31,49,Forest,Suburban,7,0.142857142857143
WT,MA_Forest_Suburban_WT_23_12A_2023,2023,41.404333,-70.6564,2023-09-12,2023-10-31,49,Forest,Suburban,8,0.163265306122449
WT,MA_Forest_Suburban_WT_23_1A_2023,2023,41.420228,-70.664877,2023-09-19,2023-10-31,42,Forest,Suburban,6,0.142857142857143
WT,MA_Forest_Suburban_WT_23_2A_2023,2023,41.419097,-70.662996,2023-09-19,2023-10-31,42,Forest,Suburban,15,0.357142857142857
WT,MA_Forest_Suburban_WT_23_3A_2023,2023,41.417288,-70.663721,2023-09-19,2023-10-31,42,Forest,Suburban,6,0.142857142857143
WT,MA_Forest_Suburban_WT_23_4A_2023,2023,41.406464,-70.660573,2023-09-12,2023-10-31,49,Forest,Suburban,7,0.142857142857143
WT,MA_Forest_Suburban_WT_23_5A_2023,2023,41.40459,-70.661297,2023-09-12,2023-10-31,49,Forest,Suburban,9,0.183673469387755
WT,MA_Forest_Suburban_WT_23_6A_2023,2023,41.404566,-70.663661,2023-09-12,2023-10-31,49,Forest,Suburban,7,0.142857142857143
WT,MA_Forest_Suburban_WT_23_7A_2023,2023,41.40282,-70.66438,2023-09-12,2023-10-31,49,Forest,Suburban,288,5.87755102040816
WT,MA_Forest_Suburban_WT_23_8A_2023,2023,41.401234,-70.662925,2023-09-12,2023-10-31,49,Forest,Suburban,8,0.163265306122449
WT,MA_Forest_Suburban_WT_23_9A_2023,2023,41.399526,-70.664318,2023-09-04,2023-10-31,57,Forest,Suburban,40,0.701754385964912
Tufts,MA_Forest_Tufts_01_CAW27 08/16/2023_2023,2023,42.241444,-71.678182,2023-08-16,2023-09-20,35,Forest,Rural,16,0.457142857142857
Tufts,MA_Forest_Tufts_01_CAW27 08/25/2022_2022,2022,42.241444,-71.6781818,2022-08-25,2022-10-09,45,Forest,Rural,4,0.0888888888888889
Tufts,MA_Forest_Tufts_02_MCM07 08/25/2022_2022,2022,42.24364,-71.678277,2022-08-25,2022-10-09,45,Forest,Rural,3,0.0666666666666667
Tufts,MA_Forest_Tufts_02_MCM07 09/08/2023_2023,2023,42.24364,-71.678277,2023-09-08,2023-11-21,74,Forest,Rural,2,0.027027027027027
Tufts,MA_Forest_Tufts_03_CAW16 08/24/2023_2023,2023,42.248579,-71.670159,2023-08-24,2023-11-21,89,Forest,Rural,5,0.0561797752808989
Tufts,MA_Forest_Tufts_03_CAW28 08/20/2022_2022,2022,42.248579,-71.670159,2022-08-20,2022-10-09,50,Forest,Rural,4,0.08
Tufts,MA_Forest_Tufts_04_MCM05 09/14/2023_2023,2023,42.25488,-71.66779,2023-09-14,2023-11-21,68,Forest,Rural,4,0.0588235294117647
Tufts,MA_Forest_Tufts_05_MCM06 08/20/2022_2022,2022,42.244663,-71.66897,2022-08-20,2022-10-09,50,Forest,Rural,4,0.08
Tufts,MA_Forest_Tufts_05_MCM06 09/07/2023_2023,2023,42.244663,-71.66897,2023-09-07,2023-11-21,75,Forest,Rural,6,0.08
Tufts,MA_Forest_Tufts_06_CAW02 08/25/2022_2022,2022,42.24236,-71.68361,2022-08-25,2022-10-09,45,Forest,Rural,4,0.0888888888888889
Tufts,MA_Forest_Tufts_06_CAW02 09/05/2023_2023,2023,42.242331,-71.683581,2023-09-05,2023-11-22,78,Forest,Rural,4,0.0512820512820513
Tufts,MA_Forest_Tufts_07_CAW14 08/25/2022_2022,2022,42.23989,-71.68356,2022-08-25,2022-10-09,45,Forest,Rural,4,0.0888888888888889
Tufts,MA_Forest_Tufts_07_CAW14 09/11/2023_2023,2023,42.23989,-71.68356,2023-09-11,2023-11-22,72,Forest,Rural,2,0.0277777777777778
Tufts,MA_Forest_Tufts_07_CAW32@14 09/01/2022_2022,2022,42.236405,-71.683937,2022-09-01,2022-10-09,38,Forest,Rural,4,0.105263157894737
Tufts,MA_Forest_Tufts_08_CAW32 09/11/2023_2023,2023,42.236405,-71.683937,2023-09-11,2023-11-22,72,Forest,Rural,2,0.0277777777777778
Tufts,MA_Forest_Tufts_09_CAW30@16 08/26/2022_2022,2022,42.236814,-71.686946,2022-08-26,2022-10-10,45,Forest,Rural,4,0.0888888888888889
Tufts,MA_Forest_Tufts_09_CAW39 09/11/2023_2023,2023,42.236814,-71.686946,2023-09-11,2023-11-22,72,Forest,Rural,2,0.0277777777777778
Tufts,MA_Forest_Tufts_10_2019,2019,42.24488,-71.66906,2019-09-18,2019-11-06,49,Forest,Rural,8,0.163265306122449
Tufts,MA_Forest_Tufts_10_CAW29 08/24/2022_2022,2022,42.23312,-71.68535,2022-08-24,2022-10-08,45,Forest,Rural,4,0.0888888888888889
Tufts,MA_Forest_Tufts_10_CAW43 09/12/2023_2023,2023,42.23309,-71.68562,2023-09-12,2023-11-22,71,Forest,Rural,2,0.028169014084507
Tufts,MA_Forest_Tufts_11_2019,2019,42.24292,-71.66836,2019-09-18,2019-11-02,45,Forest,Rural,8,0.177777777777778
Tufts,MA_Forest_Tufts_11_CAW15b 09/24/2022_2022,2022,42.239019,-71.676191,2022-09-24,2022-10-20,26,Forest,Rural,1,0.0384615384615385
Tufts,MA_Forest_Tufts_11_CAW44 10/12/2023_2023,2023,42.24339,-71.66386,2023-09-07,2023-11-01,55,Forest,Rural,4,0.0727272727272727
Tufts,MA_Forest_Tufts_12_2019,2019,42.24234,-71.68362,2019-09-17,2019-11-16,60,Forest,Rural,10,0.166666666666667
Tufts,MA_Forest_Tufts_12_CAW15 08/16/2023_2023,2023,42.239019,-71.676191,2023-08-16,2023-09-16,31,Forest,Rural,2,0.0645161290322581
Tufts,MA_Forest_Tufts_13_CAW01 09/14/2023_2023,2023,42.24311,-71.67362,2023-09-14,2023-11-21,68,Forest,Rural,5,0.0735294117647059
Tufts,MA_Forest_Tufts_14A_2019,2019,42.23641,-71.68394,2019-09-17,2019-09-30,13,Forest,Rural,2,0.153846153846154
Tufts,MA_Forest_Tufts_15_2019,2019,42.23638,-71.68401,2019-09-02,2019-09-17,15,Forest,Rural,3,0.2
Tufts,MA_Forest_Tufts_1_2019,2019,42.24353,-71.67826,2019-09-23,2019-11-06,44,Forest,Rural,7,0.159090909090909
Tufts,MA_Forest_Tufts_20_01_2020,2020,42.24144,-71.67818,2020-09-13,2020-11-01,49,Forest,Rural,27,0.551020408163265
Tufts,MA_Forest_Tufts_20_05_2020,2020,42.25488,-71.66779,2020-09-13,2020-11-01,49,Forest,Rural,1,0.0204081632653061
Tufts,MA_Forest_Tufts_20_06_2020,2020,42.24466,-71.66897,2020-09-13,2020-11-01,49,Forest,Rural,3,0.0612244897959184
Tufts,MA_Forest_Tufts_20_07_2020,2020,42.24364,-71.67828,2020-09-12,2020-11-01,50,Forest,Rural,4,0.08
Tufts,MA_Forest_Tufts_20_08_2020,2020,42.23681,-71.68695,2020-09-12,2020-11-01,50,Forest,Rural,4,0.08
Tufts,MA_Forest_Tufts_20_09_2020,2020,42.24292,-71.66836,2020-09-05,2020-10-25,50,Forest,Rural,4,0.08
Tufts,MA_Forest_Tufts_20_11_2020,2020,42.24858,-71.67016,2020-09-12,2020-11-01,50,Forest,Rural,8,0.16
Tufts,MA_Forest_Tufts_20_12_2020,2020,42.24234,-71.68355,2020-09-06,2020-10-26,50,Forest,Rural,6,0.12
Tufts,MA_Forest_Tufts_20_13_2020,2020,42.24006,-71.68349,2020-09-08,2020-10-28,50,Forest,Rural,4,0.08
Tufts,MA_Forest_Tufts_20_14_2020,2020,42.23641,-71.68394,2020-09-11,2020-10-31,50,Forest,Rural,3,0.06
Tufts,MA_Forest_Tufts_21_dep_01 09/01/2021_2021,2021,42.241444,-71.678182,2021-09-01,2021-10-21,50,Forest,Rural,8,0.16
Tufts,MA_Forest_Tufts_21_dep_03_2021,2021,42.248579,-71.670159,2021-09-01,2021-10-21,50,Forest,Rural,4,0.08
Tufts,MA_Forest_Tufts_21_dep_04_2021,2021,42.25488,-71.66779,2021-09-01,2021-09-26,25,Forest,Rural,2,0.08
Tufts,MA_Forest_Tufts_21_dep_05_2021,2021,42.244663,-71.66897,2021-09-01,2021-10-21,50,Forest,Rural,4,0.08
Tufts,MA_Forest_Tufts_21_dep_06_2021,2021,42.24236,-71.68361,2021-09-27,2021-10-22,25,Forest,Rural,3,0.12
Tufts,MA_Forest_Tufts_21_dep_07_2021,2021,42.23989,-71.68356,2021-09-02,2021-10-21,49,Forest,Rural,3,0.0612244897959184
Tufts,MA_Forest_Tufts_21_dep_08_2021,2021,42.236405,-71.683937,2021-09-02,2021-10-22,50,Forest,Rural,4,0.08
Tufts,MA_Forest_Tufts_21_dep_10_2021,2021,42.236814,-71.686946,2021-09-02,2021-10-22,50,Forest,Rural,4,0.08
Tufts,MA_Forest_Tufts_21_dep_11_2021,2021,42.23312,-71.68535,2021-09-15,2021-09-25,10,Forest,Rural,2,0.2
Tufts,MA_Forest_Tufts_21_dep_12_2021,2021,42.24151,-71.68815,2021-10-01,2021-10-26,25,Forest,Rural,3,0.12
Tufts,MA_Forest_Tufts_21_dep_13_2021,2021,42.239,-71.67585,2021-10-04,2021-10-29,25,Forest,Rural,2,0.08
Tufts,MA_Forest_Tufts_21_dep_14_2021,2021,42.24311,-71.67366,2021-10-03,2021-10-29,26,Forest,Rural,8,0.307692307692308
Tufts,MA_Forest_Tufts_3_2019,2019,42.24767,-71.67062,2019-10-23,2019-11-02,10,Forest,Rural,2,0.2
Tufts,MA_Forest_Tufts_50_2019,2019,42.23856,-71.68789,2019-09-20,2019-11-06,47,Forest,Rural,9,0.191489361702128
Tufts,MA_Forest_Tufts_5_2019,2019,42.25488,-71.66779,2019-09-18,2019-11-06,49,Forest,Rural,9,0.183673469387755
Tufts,MA_Forest_Tufts_9_2019,2019,42.248306,-71.679565,2019-09-18,2019-11-02,45,Forest,Rural,4,0.0888888888888889
Tufts,MA_Forest_Tufts_CAW25@5 08/20/2022_2022,2022,42.25488,-71.66779,2022-08-20,2022-09-24,35,Forest,Rural,3,0.0857142857142857
Tufts,MA_Forest_Tufts_dep_02_2021,2021,42.24364,-71.678277,2021-09-01,2021-10-21,50,Forest,Rural,4,0.08
WT,MA_Forest_WT_21_Loc_1 09/25/2021_2021,2021,41.42024,-70.66486,2021-09-25,2021-10-31,36,Forest,Suburban,4,0.111111111111111
WT,MA_Forest_WT_21_Loc_10 09/22/2021_2021,2021,41.40115,-70.66048,2021-09-22,2021-10-26,34,Forest,Suburban,4,0.117647058823529
WT,MA_Forest_WT_21_Loc_11 09/22/2021_2021,2021,41.40422,-70.65886,2021-09-22,2021-10-26,34,Forest,Suburban,2,0.0588235294117647
WT,MA_Forest_WT_21_Loc_12 09/28/2021_2021,2021,41.40436,-70.65636,2021-09-28,2021-10-31,33,Forest,Suburban,17,0.515151515151515
WT,MA_Forest_WT_21_Loc_2 09/26/2021_2021,2021,41.4191,-70.66293,2021-09-26,2021-10-31,35,Forest,Suburban,4,0.114285714285714
WT,MA_Forest_WT_21_Loc_3 09/22/2021_2021,2021,41.41734,-70.66368,2021-09-22,2021-10-31,39,Forest,Suburban,2,0.0512820512820513
WT,MA_Forest_WT_21_Loc_5 09/22/2021_2021,2021,41.40452,-70.66132,2021-09-22,2021-10-26,34,Forest,Suburban,13,0.382352941176471
WT,MA_Forest_WT_21_Loc_6 09/22/2021_2021,2021,41.4045,-70.66362,2021-09-22,2021-10-26,34,Forest,Suburban,4,0.117647058823529
WT,MA_Forest_WT_21_Loc_7 09/22/2021_2021,2021,41.40282,-70.66438,2021-09-22,2021-10-26,34,Forest,Suburban,60,1.76470588235294
WT,MA_Forest_WT_21_Loc_8 09/22/2021_2021,2021,41.40124,-70.66293,2021-09-22,2021-10-26,34,Forest,Suburban,5,0.147058823529412
WT,MA_Forest_WT_21_Loc_9 09/22/2021_2021,2021,41.39952,-70.6643,2021-09-22,2021-10-26,34,Forest,Suburban,2,0.0588235294117647
WT,MA_Forest_WT_21_loc_4 09/22/2021_2021,2021,41.40646,-70.66057,2021-09-22,2021-10-26,34,Forest,Suburban,6,0.176470588235294
WT,MA_Forest_WT_22_10A_2022,2022,41.401196,-70.660483,2022-09-14,2022-10-13,29,Forest,Suburban,4,0.137931034482759
WT,MA_Forest_WT_22_10B_2022,2022,41.401196,-70.660483,2022-10-13,2022-10-31,18,Forest,Suburban,2,0.111111111111111
WT,MA_Forest_WT_22_11A_2022,2022,41.404168,-70.658877,2022-09-14,2022-10-13,29,Forest,Suburban,2,0.0689655172413793
WT,MA_Forest_WT_22_11B_2022,2022,41.404168,-70.658877,2022-10-13,2022-10-31,18,Forest,Suburban,2,0.111111111111111
WT,MA_Forest_WT_22_12A_2022,2022,41.404333,-70.6564,2022-09-14,2022-10-13,29,Forest,Suburban,3,0.103448275862069
WT,MA_Forest_WT_22_12B_2022,2022,41.404333,-70.6564,2022-10-13,2022-10-31,18,Forest,Suburban,2,0.111111111111111
WT,MA_Forest_WT_22_1A_2022,2022,41.420228,-70.664877,2022-09-20,2022-10-31,41,Forest,Suburban,3,0.0731707317073171
WT,MA_Forest_WT_22_2A_2022,2022,41.419097,-70.662996,2022-09-25,2022-10-31,36,Forest,Suburban,15,0.416666666666667
WT,MA_Forest_WT_22_3A_2022,2022,41.417288,-70.663721,2022-09-20,2022-10-31,41,Forest,Suburban,5,0.121951219512195
WT,MA_Forest_WT_22_4A_2022,2022,41.406464,-70.660573,2022-09-14,2022-10-13,29,Forest,Suburban,17,0.586206896551724
WT,MA_Forest_WT_22_4B_2022,2022,41.406464,-70.660573,2022-10-13,2022-10-31,18,Forest,Suburban,24,1.33333333333333
WT,MA_Forest_WT_22_5A_2022,2022,41.40459,-70.661297,2022-09-14,2022-10-13,29,Forest,Suburban,11,0.379310344827586
WT,MA_Forest_WT_22_5B_2022,2022,41.40459,-70.661297,2022-10-13,2022-10-31,18,Forest,Suburban,8,0.444444444444444
WT,MA_Forest_WT_22_6A_2022,2022,41.404566,-70.663661,2022-09-14,2022-10-13,29,Forest,Suburban,4,0.137931034482759
WT,MA_Forest_WT_22_6B_2022,2022,41.404566,-70.663661,2022-10-13,2022-10-31,18,Forest,Suburban,2,0.111111111111111
WT,MA_Forest_WT_22_7A_2022,2022,41.40282,-70.66438,2022-09-14,2022-10-13,29,Forest,Suburban,94,3.24137931034483
WT,MA_Forest_WT_22_7B_2022,2022,41.40282,-70.66438,2022-10-13,2022-10-31,18,Forest,Suburban,2,0.111111111111111
WT,MA_Forest_WT_22_8A_2022,2022,41.401234,-70.662925,2022-09-14,2022-09-18,4,Forest,Suburban,3,0.75
WT,MA_Forest_WT_22_8B_2022,2022,41.401234,-70.662925,2022-10-13,2022-10-31,18,Forest,Suburban,2,0.111111111111111
WT,MA_Forest_WT_22_9A_2022,2022,41.399526,-70.664318,2022-09-14,2022-09-28,14,Forest,Suburban,11,0.785714285714286
WT,MA_Forest_WT_22_9B_2022,2022,41.399526,-70.664318,2022-10-13,2022-10-31,18,Forest,Suburban,2,0.111111111111111
Nemes,MD_Anthropogenic_Forest_Nemes_21_dep_01_2021,2021,39.591954,-79.13996704,2021-09-17,2021-10-16,29,Forest,Urban,0,0
Nemes,MD_Anthropogenic_Forest_Nemes_21_dep_02_2021,2021,39.594068,-79.14010199,2021-09-20,2021-10-15,25,Forest,Urban,0,0
Nemes,MD_Anthropogenic_Forest_Nemes_21_dep_03_2021,2021,39.59689,-79.149241,2021-09-27,2021-10-12,15,Forest,Urban,0,0
Nemes,MD_Anthropogenic_Forest_Nemes_21_dep_03_B_2021,2021,39.59689,-79.149241,2021-10-20,2021-10-30,10,Forest,Urban,0,0
Nemes,MD_Anthropogenic_Forest_Nemes_21_dep_04_B_2021,2021,39.595187,-79.137945,2021-10-18,2021-10-21,3,Forest,Urban,0,0
Nemes,MD_Anthropogenic_Forest_Nemes_21_dep_05_2021,2021,39.59130197,-79.138004,2021-09-17,2021-10-17,30,Forest,Urban,2,0.0666666666666667
Nemes,MD_Anthropogenic_Forest_Nemes_21_dep_06_2021,2021,39.59312101,-79.13814297,2021-09-24,2021-09-27,3,Forest,Urban,0,0
Nemes,MD_Anthropogenic_Forest_Nemes_21_dep_07_2021,2021,39.5972,-79.137939,2021-09-27,2021-10-30,33,Forest,Urban,0,0
Nemes,MD_Anthropogenic_Forest_Nemes_21_dep_08_2021,2021,39.58875798,-79.13926397,2021-09-18,2021-11-06,49,Forest,Urban,0,0
Nemes,MD_Anthropogenic_Forest_Nemes_21_dep_09_2021,2021,39.58764796,-79.14140202,2021-09-20,2021-10-10,20,Forest,Urban,0,0
Nemes,MD_Anthropogenic_Forest_Nemes_21_dep_10_2021,2021,39.58823897,-79.13647296,2021-09-17,2021-11-06,50,Forest,Urban,1,0.02
Nemes,MD_Anthropogenic_Forest_Nemes_21_ldep_01_B_2021,2021,39.591954,-79.13996704,2021-10-17,2021-10-29,12,Forest,Urban,0,0
Baltimore,MD_Forest_Baltimore_10_2019,2019,39.268,-76.58772,2019-09-30,2019-10-29,29,Forest,Urban,1,0.0344827586206897
Baltimore,MD_Forest_Baltimore_11_2019,2019,39.32798,-76.64611,2019-09-05,2019-09-23,18,Forest,Urban,5,0.277777777777778
Baltimore,MD_Forest_Baltimore_12_2019,2019,39.36792,-76.68835,2019-09-04,2019-09-23,19,Forest,Urban,5,0.263157894736842
Baltimore,MD_Forest_Baltimore_13_2019,2019,39.31357,-76.57121,2019-09-06,2019-09-24,18,Forest,Urban,3,0.166666666666667
Baltimore,MD_Forest_Baltimore_14_2019,2019,39.35091,-76.58928,2019-09-30,2019-10-29,29,Forest,Urban,2,0.0689655172413793
Baltimore,MD_Forest_Baltimore_16_2019,2019,39.30279,-76.65753,2019-09-05,2019-09-23,18,Forest,Urban,2,0.111111111111111
Baltimore,MD_Forest_Baltimore_1_2019,2019,39.28594,-76.53235,2019-09-30,2019-10-29,29,Forest,Urban,0,0
Baltimore,MD_Forest_Baltimore_20_2019,2019,39.2766,-76.68253,2019-09-05,2019-09-23,18,Forest,Urban,2,0.111111111111111
Baltimore,MD_Forest_Baltimore_2_2019,2019,39.36375,-76.60707,2019-09-05,2019-09-23,18,Forest,Urban,0,0
Baltimore,MD_Forest_Baltimore_3_2019,2019,39.31944,-76.6042,2019-09-05,2019-09-23,18,Forest,Urban,2,0.111111111111111
Baltimore,MD_Forest_Baltimore_4_2019,2019,39.35025,-76.6502,2019-09-05,2019-10-11,36,Forest,Urban,3,0.0833333333333333
Baltimore,MD_Forest_Baltimore_5_2019,2019,39.36585,-76.56649,2019-09-06,2019-09-24,18,Forest,Urban,2,0.111111111111111
Baltimore,MD_Forest_Baltimore_6_2019,2019,39.32442,-76.70402,2019-09-04,2019-09-23,19,Forest,Urban,2,0.105263157894737
Baltimore,MD_Forest_Baltimore_7_2019,2019,39.34783,-76.60319,2019-09-06,2019-09-22,16,Forest,Urban,2,0.125
Baltimore,MD_Forest_Baltimore_8_2019,2019,39.33569,-76.60261,2019-09-05,2019-09-23,18,Forest,Urban,3,0.166666666666667
Baltimore,MD_Forest_Baltimore_9_2019,2019,39.36082,-76.64178,2019-09-05,2019-09-23,18,Forest,Urban,2,0.111111111111111
PenobscotForest,ME_Forest_PEF 10 G7 08/20-9/7_2022,2022,44.84981444,-68.62564522,2022-08-20,2022-09-07,18,Forest,Rural,4,0.222222222222222
PenobscotForest,ME_Forest_PEF 10 G7 10/10-10/27_2022,2022,44.84981444,-68.62564522,2022-10-10,2022-10-27,17,Forest,Rural,1,0.0588235294117647
PenobscotForest,ME_Forest_PEF 10 G7 9/10-10/7_2022,2022,44.84981444,-68.62564522,2022-09-10,2022-10-07,27,Forest,Rural,4,0.148148148148148
PenobscotForest,ME_Forest_PEF 32 J1 08/20-9/4_2022,2022,44.87043476,-68.62478898,2022-08-20,2022-09-04,15,Forest,Rural,0,0
PenobscotForest,ME_Forest_PEF 32 J1 10/7-10/27_2022,2022,44.87043476,-68.62478898,2022-10-07,2022-10-27,20,Forest,Rural,7,0.35
PenobscotForest,ME_Forest_PEF 32 J1 9/7-10/4_2022,2022,44.87043476,-68.62478898,2022-09-07,2022-10-04,27,Forest,Rural,0,0
PenobscotForest,ME_Forest_PEF 6 G7 08/20-9/7_2022,2022,44.85962867,-68.62643279,2022-08-20,2022-09-07,18,Forest,Rural,0,0
PenobscotForest,ME_Forest_PEF 6 G7 10/10-10/25_2022,2022,44.85962867,-68.62643279,2022-10-10,2022-10-25,15,Forest,Rural,4,0.266666666666667
PenobscotForest,ME_Forest_PEF 6 G7 9/10-9/18_2022,2022,44.85962867,-68.62643279,2022-09-10,2022-09-18,8,Forest,Rural,0,0
PenobscotForest,ME_Forest_PEF 6 G7 9/21-10/7_2022,2022,44.85962867,-68.62643279,2022-09-21,2022-10-07,16,Forest,Rural,10,0.625
PenobscotForest,ME_Forest_PEF 7A 10/12-10/25_2022,2022,44.86064243,-68.63092807,2022-10-12,2022-10-25,13,Forest,Rural,1,0.0769230769230769
PenobscotForest,ME_Forest_PEF 7A 10/4-10/10_2022,2022,44.86064243,-68.63092807,2022-10-03,2022-10-10,7,Forest,Rural,0,0
PenobscotForest,ME_Forest_PEF 7A B9 08/20-9/1_2022,2022,44.86064243,-68.63092807,2022-08-20,2022-08-31,11,Forest,Rural,0,0
PenobscotForest,ME_Forest_PEF 7A B9 9/4-10/1_2022,2022,44.86064243,-68.63092807,2022-09-01,2022-10-01,30,Forest,Rural,6,0.2
PenobscotForest,ME_Forest_PEF 7B J4 08/20-9/1_2022,2022,44.86234129,-68.62737308,2022-08-20,2022-09-01,12,Forest,Rural,0,0
PenobscotForest,ME_Forest_PEF 7B J4 10/11-10/25_2022,2022,44.86234129,-68.62737308,2022-10-11,2022-10-25,14,Forest,Rural,3,0.214285714285714
PenobscotForest,ME_Forest_PEF 7B J4 10/3-10/10_2022,2022,44.86234129,-68.62737308,2022-10-03,2022-10-10,7,Forest,Rural,2,0.285714285714286
PenobscotForest,ME_Forest_PEF 7B J4 9/4-10/1_2022,2022,44.86234129,-68.62737308,2022-09-04,2022-10-01,27,Forest,Rural,6,0.222222222222222
PenobscotForest,ME_Forest_PEF BG J4 08/20-9/4_2022,2022,44.84632523,-68.61159314,2022-08-20,2022-09-04,15,Forest,Rural,0,0
PenobscotForest,ME_Forest_PEF BG J4 10/7-10/27_2022,2022,44.84632523,-68.61159314,2022-10-07,2022-10-27,20,Forest,Rural,1,0.05
PenobscotForest,ME_Forest_PEF BG J4 9/7-10/4_2022,2022,44.84632523,-68.61159314,2022-09-07,2022-10-04,27,Forest,Rural,0,0
PenobscotForest,ME_Forest_PenobscotForest_Preserve A 08/31-09/05_2022,2022,44.89671,-68.66386,2022-08-31,2022-09-05,5,Forest,Rural,0,0
PenobscotForest,ME_Forest_PenobscotForest_UF-2 08/31-11/4_2022,2022,44.91045,-68.66256,2022-08-31,2022-11-04,65,Forest,Rural,5,0.0769230769230769
PenobscotForest,ME_Forest_PenobscotForest_UF-3 08/21-11/4_2022,2022,44.91202,-68.6667,2022-08-31,2022-11-04,65,Forest,Rural,6,0.0923076923076923
PenobscotForest,ME_Forest_PenobscotForest_UF-4 08/31-11/4_2022,2022,44.91487,-68.66897,2022-08-30,2022-11-04,66,Forest,Rural,5,0.0757575757575758
PenobscotForest,ME_Forest_PenobscotForest_UF2_2023,2023,44.91105,-68.66363,2023-09-01,2023-11-08,68,Forest,Rural,11,0.161764705882353
PenobscotForest,ME_Forest_PenobscotForest_UF3_2023,2023,44.91284,-68.66539,2023-09-01,2023-11-08,68,Forest,Rural,2,0.0294117647058824
PenobscotForest,ME_Forest_PenobscotForest_UF4_2023,2023,44.91496,-68.66729,2023-09-01,2023-11-08,68,Forest,Rural,3,0.0441176470588235
PiscataquisCounty,ME_Forest_Piscataquis_County_10_2019,2019,46.03986,-69.203,2019-09-06,2019-11-07,62,Forest,Wild,2,0.032258064516129
PiscataquisCounty,ME_Forest_Piscataquis_County_11_2019,2019,45.99082,-69.17353,2019-09-06,2019-11-07,62,Forest,Wild,0,0
PiscataquisCounty,ME_Forest_Piscataquis_County_12_2019,2019,46.04332,-69.15558,2019-09-07,2019-11-07,61,Forest,Wild,0,0
PiscataquisCounty,ME_Forest_Piscataquis_County_13_2019,2019,46.06262,-69.13603,2019-09-06,2019-11-07,62,Forest,Wild,2,0.032258064516129
PiscataquisCounty,ME_Forest_Piscataquis_County_14_2019,2019,46.07565,-69.1049,2019-09-06,2019-11-07,62,Forest,Wild,1,0.0161290322580645
PiscataquisCounty,ME_Forest_Piscataquis_County_15_2019,2019,45.92609,-69.1657,2019-09-06,2019-11-07,62,Forest,Wild,1,0.0161290322580645
PiscataquisCounty,ME_Forest_Piscataquis_County_1_2019,2019,45.95804,-69.18176,2019-09-08,2019-10-15,37,Forest,Wild,0,0
PenobscotForest,ME_Forest_Piscataquis_County_20_01_2020,2020,44.8971,-68.6642,2020-09-09,2020-11-04,56,Forest,Rural,8,0.142857142857143
PenobscotForest,ME_Forest_Piscataquis_County_20_02_2020,2020,44.9066,-68.6613,2020-09-09,2020-10-22,43,Forest,Rural,6,0.13953488372093
PenobscotForest,ME_Forest_Piscataquis_County_20_03_2020,2020,44.9084,-68.6616,2020-09-09,2020-09-28,19,Forest,Rural,6,0.31578947368421
PenobscotForest,ME_Forest_Piscataquis_County_20_04_2020,2020,44.91004,-68.66321,2020-09-09,2020-09-12,3,Forest,Rural,1,0.333333333333333
PenobscotForest,ME_Forest_Piscataquis_County_20_05_2020,2020,44.91182,-68.66475,2020-09-09,2020-10-09,30,Forest,Rural,1,0.0333333333333333
PenobscotForest,ME_Forest_Piscataquis_County_20_06_2020,2020,44.9132,-68.6663,2020-09-09,2020-11-04,56,Forest,Rural,4,0.0714285714285714
PenobscotForest,ME_Forest_Piscataquis_County_20_07_2020,2020,44.9148,-68.6679,2020-09-09,2020-11-04,56,Forest,Rural,5,0.0892857142857143
PenobscotForest,ME_Forest_Piscataquis_County_20_09_2020,2020,44.8952,-68.6643,2020-09-09,2020-11-04,56,Forest,Rural,27,0.482142857142857
PenobscotForest,ME_Forest_Preserve B 09/12-10/04_2022,2022,44.89671,-68.66386,2022-09-12,2022-10-04,22,Forest,Rural,3,0.136363636363636
PenobscotForest,ME_Forest_Preserve C 10/11-10/29_2022,2022,44.89671,-68.66386,2022-10-11,2022-10-29,18,Forest,Rural,2,0.111111111111111
PenobscotForest,ME_Forest_Rural_PenobscotForest_10_2023,2023,44.84999365,-68.62529311,2023-09-08,2023-11-08,61,Forest,Rural,53,0.868852459016393
PenobscotForest,ME_Forest_Rural_PenobscotForest_32_2023,2023,44.87079691,-68.62541958,2023-09-05,2023-11-08,64,Forest,Rural,13,0.203125
PenobscotForest,ME_Forest_Rural_PenobscotForest_6_2023,2023,44.85980788,-68.62608068,2023-09-08,2023-11-03,56,Forest,Rural,18,0.321428571428571
PenobscotForest,ME_Forest_Rural_PenobscotForest_7A_2023,2023,44.86243338,-68.62800537,2023-09-01,2023-11-03,63,Forest,Rural,21,0.333333333333333
PenobscotForest,ME_Forest_Rural_PenobscotForest_7B_2023,2023,44.8624342,-68.62825847,2023-09-01,2023-11-08,68,Forest,Rural,12,0.176470588235294
PenobscotForest,ME_Forest_Rural_PenobscotForest_BG_2023,2023,44.8464174,-68.61222529,2023-09-05,2023-11-03,59,Forest,Rural,17,0.288135593220339
Herrera,MH0210_2019,2019,38.88466,-77.00222,2019-09-24,2019-10-11,17,Forest,Urban,11,0.647058823529412
Herrera,MH0217_2019,2019,38.88098,-77.00243,2019-10-11,2019-10-23,12,Forest,Urban,16,1.33333333333333
Herrera,MH0219_2019,2019,38.88163,-77.00577,2019-10-11,2019-10-23,12,Forest,Urban,40,3.33333333333333
Herrera,MH0404_2019,2019,38.89248,-76.99885,2019-09-23,2019-10-08,15,Forest,Urban,79,5.26666666666667
Herrera,MH0408_2019,2019,38.8901,-76.98971,2019-09-23,2019-09-25,2,Forest,Urban,55,27.5
Herrera,MH0518_2019,2019,38.92329,-77.02481,2019-09-04,2019-09-19,15,Forest,Urban,23,1.53333333333333
Herrera,MH0519_2019,2019,38.92229,-77.02256,2019-09-04,2019-09-19,15,Forest,Urban,34,2.26666666666667
Herrera,MH0701_2020,2020,38.91592,-77.01338,2020-09-22,2020-10-07,15,Forest,Urban,57,3.8
Herrera,MH0702_2020,2020,38.91606,-77.00989,2020-09-22,2020-10-07,15,Forest,Urban,4,0.266666666666667
Herrera,MH0703_2020,2020,38.91823,-77.00986,2020-09-22,2020-10-07,15,Forest,Urban,11,0.733333333333333
Herrera,MH0704_2020,2020,38.92032,-77.00971,2020-09-22,2020-10-07,15,Forest,Urban,30,2
Herrera,MH0707_2020,2020,38.91171,-77.00584,2020-09-22,2020-10-03,11,Forest,Urban,331,30.0909090909091
Herrera,MH0708_2020,2020,38.91079,-77.00778,2020-09-22,2020-10-07,15,Forest,Urban,2,0.133333333333333
Herrera,MH0709_2020,2020,38.91248,-77.00996,2020-09-22,2020-10-07,15,Forest,Urban,91,6.06666666666667
Herrera,MH0711_2020,2020,38.91073,-77.01461,2020-09-22,2020-10-07,15,Forest,Urban,467,31.1333333333333
Herrera,MH0712_2020,2020,38.91359,-77.01423,2020-09-22,2020-10-07,15,Forest,Urban,4,0.266666666666667
Herrera,MH0713_2020,2020,38.90714,-77.02599,2020-09-22,2020-10-07,15,Forest,Urban,27,1.8
Herrera,MH0714_2020,2020,38.90825,-77.02937,2020-09-22,2020-09-27,5,Forest,Urban,62,12.4
Herrera,MH0715_2020,2020,38.90469,-77.01888,2020-09-22,2020-10-07,15,Forest,Urban,26,1.73333333333333
Herrera,MH0717_2020,2020,38.91107,-77.01085,2020-10-07,2020-10-22,15,Forest,Urban,4,0.266666666666667
Herrera,MH0718_2020,2020,38.91272,-77.00666,2020-10-07,2020-10-22,15,Forest,Urban,13,0.866666666666667
Herrera,MH0719_2020,2020,38.91264,-77.01169,2020-10-07,2020-10-22,15,Forest,Urban,4,0.266666666666667
Herrera,MH0720_2020,2020,38.91552,-77.00816,2020-10-07,2020-10-14,7,Forest,Urban,1,0.142857142857143
Herrera,MH0721_2020,2020,38.91742,-77.00777,2020-10-07,2020-10-22,15,Forest,Urban,33,2.2
Herrera,MH0723_2020,2020,38.9159,-77.0179,2020-10-07,2020-10-22,15,Forest,Urban,10,0.666666666666667
Herrera,MH0724_2020,2020,38.92032,-77.0115,2020-10-07,2020-10-22,15,Forest,Urban,16,1.06666666666667
Herrera,MH0725_2020,2020,38.9204,-77.01443,2020-10-07,2020-10-22,15,Forest,Urban,6,0.4
Herrera,MH0726_2020,2020,38.91984,-77.01347,2020-10-07,2020-10-22,15,Forest,Urban,3,0.2
Herrera,MH0727_2020,2020,38.90906,-77.01082,2020-10-07,2020-10-22,15,Forest,Urban,6,0.4
Herrera,MH0728_2020,2020,38.90639,-77.01276,2020-10-07,2020-10-22,15,Forest,Urban,79,5.26666666666667
Herrera,MH0729_2020,2020,38.90718,-77.01414,2020-10-07,2020-10-22,15,Forest,Urban,3,0.2
Herrera,MH0822_2019,2019,38.91445,-77.03038,2019-09-03,2019-09-18,15,Forest,Urban,3,0.2
Herrera,MH1418_2019,2019,38.88548,-76.98299,2019-10-10,2019-10-24,14,Forest,Urban,3,0.214285714285714
Herrera,MH1717_2019,2019,38.92646,-77.03693,2019-09-05,2019-09-20,15,Forest,Urban,6,0.4
Herrera,MH1824_2019,2019,38.93662,-77.02708,2019-09-05,2019-09-20,15,Forest,Urban,6,0.4
Herrera,MH1831_2019,2019,38.93816,-77.03587,2019-09-05,2019-09-20,15,Forest,Urban,77,5.13333333333333
Detroit,MI_Forest_Detroit_10_2019,2019,42.43092,-83.12377,2019-10-20,2019-10-31,11,Forest,Urban,0,0
Detroit,MI_Forest_Detroit_11_2019,2019,42.36131,-83.25742,2019-10-22,2019-10-31,9,Forest,Urban,2,0.222222222222222
Detroit,MI_Forest_Detroit_12_2019,2019,42.32664,-83.14329,2019-10-20,2019-11-02,13,Forest,Urban,8,0.615384615384615
Detroit,MI_Forest_Detroit_13_2019,2019,42.36284,-83.20659,2019-10-20,2019-10-31,11,Forest,Urban,0,0
Detroit,MI_Forest_Detroit_14_2019,2019,42.39379,-83.27236,2019-10-20,2019-11-01,12,Forest,Urban,0,0
Detroit,MI_Forest_Detroit_16_2019,2019,42.38889,-83.26783,2019-10-23,2019-10-31,8,Forest,Urban,0,0
Detroit,MI_Forest_Detroit_17_2019,2019,42.41128,-83.20264,2019-10-19,2019-10-31,12,Forest,Urban,7,0.583333333333333
Detroit,MI_Forest_Detroit_18_2019,2019,42.33018,-83.0772,2019-10-20,2019-10-31,11,Forest,Urban,115,10.4545454545455
Detroit,MI_Forest_Detroit_19_2019,2019,42.44235,-83.05642,2019-10-18,2019-11-02,15,Forest,Urban,15,1
Detroit,MI_Forest_Detroit_21_2019,2019,42.2949,-83.0982,2019-10-25,2019-10-29,4,Forest,Urban,0,0
Detroit,MI_Forest_Detroit_22_2019,2019,42.2995,-83.0941,2019-10-25,2019-10-31,6,Forest,Urban,0,0
Detroit,MI_Forest_Detroit_23_2019,2019,42.3991,-82.9929,2019-10-19,2019-10-31,12,Forest,Urban,0,0
Detroit,MI_Forest_Detroit_24_2019,2019,42.35098,-83.04919,2019-10-20,2019-10-25,5,Forest,Urban,110,22
Detroit,MI_Forest_Detroit_26_2019,2019,42.44185,-83.19138,2019-10-18,2019-10-29,11,Forest,Urban,30,2.72727272727273
Detroit,MI_Forest_Detroit_27_2019,2019,42.35236,-82.9856,2019-10-19,2019-10-23,4,Forest,Urban,15,3.75
Detroit,MI_Forest_Detroit_28_2019,2019,42.43698,-83.16639,2019-10-19,2019-10-30,11,Forest,Urban,29,2.63636363636364
Detroit,MI_Forest_Detroit_2_2019,2019,42.3519,-83.25104,2019-10-25,2019-10-31,6,Forest,Urban,0,0
Detroit,MI_Forest_Detroit_30_2019,2019,42.35897,-82.93833,2019-10-18,2019-10-29,11,Forest,Urban,0,0
Detroit,MI_Forest_Detroit_31_2019,2019,42.3576,-82.95232,2019-10-18,2019-10-31,13,Forest,Urban,0,0
Detroit,MI_Forest_Detroit_32_2019,2019,42.39564,-82.97466,2019-10-18,2019-10-31,13,Forest,Urban,2,0.153846153846154
Detroit,MI_Forest_Detroit_33_2019,2019,42.35621,-83.10237,2019-10-18,2019-10-29,11,Forest,Urban,3,0.272727272727273
Detroit,MI_Forest_Detroit_34_2019,2019,42.43698,-83.22945,2019-10-19,2019-11-03,15,Forest,Urban,0,0
Detroit,MI_Forest_Detroit_35_2019,2019,42.43958,-83.23282,2019-10-19,2019-10-25,6,Forest,Urban,0,0
Detroit,MI_Forest_Detroit_48_2019,2019,42.314,-83.13615,2019-10-20,2019-11-01,12,Forest,Urban,96,8
Detroit,MI_Forest_Detroit_6_2019,2019,42.3987,-83.26998,2019-10-21,2019-10-31,10,Forest,Urban,0,0
Detroit,MI_Forest_Detroit_8_2019,2019,42.3431,-83.2496,2019-10-25,2019-10-31,6,Forest,Urban,0,0
Detroit,MI_Forest_Detroit_9_2019,2019,42.3681,-83.2521,2019-10-25,2019-10-30,5,Forest,Urban,0,0
Kellogg,MI_Forest_Kellogg_10_2019,2019,42.48828,-85.45087,2019-09-26,2019-09-30,4,Forest,Rural,1,0.25
Kellogg,MI_Forest_Kellogg_12_2019,2019,42.49117,-85.46871,2019-09-26,2019-11-09,44,Forest,Rural,9,0.204545454545455
Kellogg,MI_Forest_Kellogg_1_2019,2019,42.47735,-85.45202,2019-09-24,2019-11-09,46,Forest,Rural,2,0.0434782608695652
Kellogg,MI_Forest_Kellogg_2_2019,2019,42.47277,-85.45481,2019-09-24,2019-11-06,43,Forest,Rural,1,0.0232558139534884
Kellogg,MI_Forest_Kellogg_3_2019,2019,42.47526,-85.45341,2019-09-24,2019-11-09,46,Forest,Rural,4,0.0869565217391304
Kellogg,MI_Forest_Kellogg_4_2019,2019,42.47546,-85.45033,2019-09-26,2019-11-09,44,Forest,Rural,1,0.0227272727272727
Kellogg,MI_Forest_Kellogg_5_2019,2019,42.49144,-85.45635,2019-09-24,2019-11-09,46,Forest,Rural,13,0.282608695652174
Kellogg,MI_Forest_Kellogg_6_2019,2019,42.4898,-85.45399,2019-09-24,2019-11-09,46,Forest,Rural,8,0.173913043478261
Kellogg,MI_Forest_Kellogg_7_2019,2019,42.49298,-85.453,2019-09-26,2019-11-09,44,Forest,Rural,4,0.0909090909090909
Kellogg,MI_Forest_Kellogg_8_2019,2019,42.4909,-85.45103,2019-09-26,2019-11-07,42,Forest,Rural,10,0.238095238095238
Kellogg,MI_Forest_Kellogg_9_2019,2019,42.48579,-85.4562,2019-09-24,2019-11-09,46,Forest,Rural,6,0.130434782608696
WaWaSum,MI_Forest_Rural_WaWaSum_23_loc10_D1_2023,2023,44.67172,-84.61528,2023-09-12,2023-10-24,42,Forest,Rural,2,0.0476190476190476
WaWaSum,MI_Forest_Rural_WaWaSum_23_loc11_D1_2023,2023,44.6702,-84.60718,2023-09-12,2023-10-24,42,Forest,Rural,2,0.0476190476190476
WaWaSum,MI_Forest_Rural_WaWaSum_23_loc12_D1_2023,2023,44.67334,-84.60526,2023-09-12,2023-10-24,42,Forest,Rural,9,0.214285714285714
WaWaSum,MI_Forest_Rural_WaWaSum_23_loc13_D1_2023,2023,44.67121,-84.6,2023-09-12,2023-10-24,42,Forest,Rural,2,0.0476190476190476
WaWaSum,MI_Forest_Rural_WaWaSum_23_loc14_D1_2023,2023,44.67086,-84.60196,2023-09-12,2023-10-24,42,Forest,Rural,2,0.0476190476190476
WaWaSum,MI_Forest_Rural_WaWaSum_23_loc15_D1_2023,2023,44.67063,-84.60405,2023-09-12,2023-10-24,42,Forest,Rural,2,0.0476190476190476
WaWaSum,MI_Forest_Rural_WaWaSum_23_loc16_D1_2023,2023,44.67133,-84.6054,2023-09-12,2023-10-24,42,Forest,Rural,2,0.0476190476190476
WaWaSum,MI_Forest_Rural_WaWaSum_23_loc1_D1_2023,2023,44.66915,-84.61085,2023-09-12,2023-10-24,42,Forest,Rural,2,0.0476190476190476
WaWaSum,MI_Forest_Rural_WaWaSum_23_loc2_D1_2023,2023,44.67037,-84.61059,2023-09-12,2023-10-24,42,Forest,Rural,2,0.0476190476190476
WaWaSum,MI_Forest_Rural_WaWaSum_23_loc3_D1_2023,2023,44.67179,-84.60875,2023-09-12,2023-10-24,42,Forest,Rural,2,0.0476190476190476
WaWaSum,MI_Forest_Rural_WaWaSum_23_loc4_D1_2023,2023,44.67309,-84.609,2023-09-13,2023-10-24,41,Forest,Rural,1,0.024390243902439
WaWaSum,MI_Forest_Rural_WaWaSum_23_loc5_D1_2023,2023,44.67396,-84.60808,2023-09-12,2023-10-24,42,Forest,Rural,60,1.42857142857143
WaWaSum,MI_Forest_Rural_WaWaSum_23_loc6_D1_2023,2023,44.67667,-84.6089,2023-09-12,2023-10-24,42,Forest,Rural,2,0.0476190476190476
WaWaSum,MI_Forest_Rural_WaWaSum_23_loc7_D1_2023,2023,44.67502,-84.60982,2023-09-12,2023-10-24,42,Forest,Rural,2,0.0476190476190476
WaWaSum,MI_Forest_Rural_WaWaSum_23_loc8_D1_2023,2023,44.67378,-84.61381,2023-09-12,2023-10-24,42,Forest,Rural,3,0.0714285714285714
WaWaSum,MI_Forest_Rural_WaWaSum_23_loc9_D1_2023,2023,44.67397,-84.6163,2023-09-12,2023-10-24,42,Forest,Rural,2,0.0476190476190476
UpperPeninsula,MI_Forest_Upper_Peninsula_10_2019,2019,46.63872,-87.56389,2019-08-31,2019-11-02,63,Forest,Wild,3,0.0476190476190476
UpperPeninsula,MI_Forest_Upper_Peninsula_11_2019,2019,46.63312,-87.61017,2019-09-01,2019-11-03,63,Forest,Wild,3,0.0476190476190476
UpperPeninsula,MI_Forest_Upper_Peninsula_12_2019,2019,46.6241,-87.60623,2019-09-01,2019-11-03,63,Forest,Wild,3,0.0476190476190476
UpperPeninsula,MI_Forest_Upper_Peninsula_13_2019,2019,46.63608,-87.59148,2019-09-01,2019-11-03,63,Forest,Wild,3,0.0476190476190476
UpperPeninsula,MI_Forest_Upper_Peninsula_14_2019,2019,46.64587,-87.59091,2019-09-01,2019-11-03,63,Forest,Wild,30,0.476190476190476
UpperPeninsula,MI_Forest_Upper_Peninsula_15_2019,2019,46.66467,-87.55459,2019-09-02,2019-11-02,61,Forest,Wild,6,0.0983606557377049
UpperPeninsula,MI_Forest_Upper_Peninsula_16_2019,2019,46.65748,-87.56915,2019-09-02,2019-11-02,61,Forest,Wild,8,0.131147540983607
UpperPeninsula,MI_Forest_Upper_Peninsula_17_2019,2019,46.66727,-87.57115,2019-09-02,2019-11-02,61,Forest,Wild,89,1.45901639344262
UpperPeninsula,MI_Forest_Upper_Peninsula_19_2019,2019,46.62767,-87.48078,2019-09-02,2019-11-05,64,Forest,Wild,3,0.046875
UpperPeninsula,MI_Forest_Upper_Peninsula_1_2019,2019,46.653,-87.5092,2019-08-29,2019-10-31,63,Forest,Wild,3,0.0476190476190476
UpperPeninsula,MI_Forest_Upper_Peninsula_20_01_2020,2020,46.6539,-87.5092,2020-09-03,2020-11-03,61,Forest,Wild,4,0.0655737704918033
UpperPeninsula,MI_Forest_Upper_Peninsula_20_02_2020,2020,46.6323,-87.4674,2020-09-05,2020-11-03,59,Forest,Wild,9,0.152542372881356
UpperPeninsula,MI_Forest_Upper_Peninsula_20_03_2020,2020,46.6764,-87.5636,2020-09-03,2020-11-08,66,Forest,Wild,4,0.0606060606060606
UpperPeninsula,MI_Forest_Upper_Peninsula_20_04_2020,2020,46.6617,-87.5203,2020-09-05,2020-11-03,59,Forest,Wild,5,0.0847457627118644
UpperPeninsula,MI_Forest_Upper_Peninsula_20_05_2020,2020,46.6349,-87.4936,2020-09-05,2020-11-03,59,Forest,Wild,381,6.45762711864407
UpperPeninsula,MI_Forest_Upper_Peninsula_20_06_2020,2020,46.6426,-87.514,2020-09-15,2020-11-08,54,Forest,Wild,5,0.0925925925925926
UpperPeninsula,MI_Forest_Upper_Peninsula_20_07_reupload_2020,2020,46.6466,-87.5323,2020-09-17,2020-11-08,52,Forest,Wild,5,0.0961538461538462
UpperPeninsula,MI_Forest_Upper_Peninsula_20_08_2020,2020,46.6488,-87.5459,2020-09-15,2020-11-05,51,Forest,Wild,3,0.0588235294117647
UpperPeninsula,MI_Forest_Upper_Peninsula_20_10_2020,2020,46.6387,-87.5638,2020-09-11,2020-11-05,55,Forest,Wild,5,0.0909090909090909
UpperPeninsula,MI_Forest_Upper_Peninsula_20_11_2020,2020,46.6331,-87.6101,2020-09-04,2020-10-31,57,Forest,Wild,3,0.0526315789473684
UpperPeninsula,MI_Forest_Upper_Peninsula_20_12_2020,2020,46.6241,-87.6062,2020-09-04,2020-10-31,57,Forest,Wild,6,0.105263157894737
UpperPeninsula,MI_Forest_Upper_Peninsula_20_13_2020,2020,46.636,-87.5914,2020-09-04,2020-10-31,57,Forest,Wild,3,0.0526315789473684
UpperPeninsula,MI_Forest_Upper_Peninsula_20_14_2020,2020,46.6458,-87.5909,2020-09-04,2020-10-31,57,Forest,Wild,2,0.0350877192982456
UpperPeninsula,MI_Forest_Upper_Peninsula_20_15_2020,2020,46.6647,-87.5546,2020-09-06,2020-11-04,59,Forest,Wild,5,0.0847457627118644
UpperPeninsula,MI_Forest_Upper_Peninsula_20_16_2020,2020,46.6575,-87.5692,2020-09-06,2020-11-04,59,Forest,Wild,3,0.0508474576271186
UpperPeninsula,MI_Forest_Upper_Peninsula_20_17_2020,2020,46.667,-87.5709,2020-09-06,2020-11-04,59,Forest,Wild,49,0.830508474576271
UpperPeninsula,MI_Forest_Upper_Peninsula_20_18_2020,2020,46.668,-87.5859,2020-09-06,2020-11-04,59,Forest,Wild,4,0.0677966101694915
UpperPeninsula,MI_Forest_Upper_Peninsula_20_19_2020,2020,46.6276,-87.4807,2020-09-05,2020-11-01,57,Forest,Wild,5,0.087719298245614
UpperPeninsula,MI_Forest_Upper_Peninsula_20_2019,2019,46.62478,-87.49741,2019-09-02,2019-11-03,62,Forest,Wild,3,0.0483870967741935
UpperPeninsula,MI_Forest_Upper_Peninsula_20_20_2020,2020,46.6248,-87.4974,2020-09-13,2020-11-01,49,Forest,Wild,12,0.244897959183673
UpperPeninsula,MI_Forest_Upper_Peninsula_20_22_2020,2020,46.6083,-87.5487,2020-09-17,2020-11-06,50,Forest,Wild,2,0.04
UpperPeninsula,MI_Forest_Upper_Peninsula_20_23_2020,2020,46.6107,-87.5485,2020-09-13,2020-11-08,56,Forest,Wild,3,0.0535714285714286
UpperPeninsula,MI_Forest_Upper_Peninsula_20_24_2020,2020,46.6204,-87.5506,2020-09-13,2020-11-06,54,Forest,Wild,3,0.0555555555555556
UpperPeninsula,MI_Forest_Upper_Peninsula_20_25_2020,2020,46.6208,-87.532,2020-09-17,2020-11-01,45,Forest,Wild,3,0.0666666666666667
UpperPeninsula,MI_Forest_Upper_Peninsula_20_28_2020,2020,46.6084,-87.4728,2020-09-09,2020-11-07,59,Forest,Wild,4,0.0677966101694915
UpperPeninsula,MI_Forest_Upper_Peninsula_20_29_2020,2020,46.5989,-87.4696,2020-09-16,2020-11-07,52,Forest,Wild,4,0.0769230769230769
UpperPeninsula,MI_Forest_Upper_Peninsula_20_30_2020,2020,46.6014,-87.49,2020-09-16,2020-11-07,52,Forest,Wild,4,0.0769230769230769
UpperPeninsula,MI_Forest_Upper_Peninsula_21_dep_10_2021,2021,46.6387,-87.5638,2021-09-05,2021-10-31,56,Forest,Wild,2,0.0357142857142857
UpperPeninsula,MI_Forest_Upper_Peninsula_21_dep_11_2021,2021,46.6331,-87.6101,2021-09-17,2021-11-14,58,Forest,Wild,3,0.0517241379310345
UpperPeninsula,MI_Forest_Upper_Peninsula_21_dep_12_2021,2021,46.6241,-87.60622,2021-09-17,2021-11-13,57,Forest,Wild,3,0.0526315789473684
UpperPeninsula,MI_Forest_Upper_Peninsula_21_dep_13_2021,2021,46.636,-87.5914,2021-09-12,2021-11-14,63,Forest,Wild,2,0.0317460317460317
UpperPeninsula,MI_Forest_Upper_Peninsula_21_dep_14_2021,2021,46.6458,-87.5909,2021-09-12,2021-11-14,63,Forest,Wild,7,0.111111111111111
UpperPeninsula,MI_Forest_Upper_Peninsula_21_dep_15_2021,2021,46.6646,-87.5545,2021-09-09,2021-11-07,59,Forest,Wild,4,0.0677966101694915
UpperPeninsula,MI_Forest_Upper_Peninsula_21_dep_16_2021,2021,46.6574,-87.5691,2021-09-09,2021-11-07,59,Forest,Wild,3,0.0508474576271186
UpperPeninsula,MI_Forest_Upper_Peninsula_21_dep_17_2021,2021,46.6672,-87.5711,2021-09-09,2021-11-07,59,Forest,Wild,2,0.0338983050847458
UpperPeninsula,MI_Forest_Upper_Peninsula_21_dep_18_2021,2021,46.6679,-87.5859,2021-09-09,2021-09-11,2,Forest,Wild,3,1.5
UpperPeninsula,MI_Forest_Upper_Peninsula_21_dep_19_2021,2021,46.6276,-87.4807,2021-09-04,2021-11-08,65,Forest,Wild,2,0.0307692307692308
UpperPeninsula,MI_Forest_Upper_Peninsula_21_dep_1_2021,2021,46.6529,-87.5092,2021-08-29,2021-11-01,64,Forest,Wild,4,0.0625
UpperPeninsula,MI_Forest_Upper_Peninsula_21_dep_20_2021,2021,46.6247,-87.4974,2021-09-04,2021-11-08,65,Forest,Wild,4,0.0615384615384615
UpperPeninsula,MI_Forest_Upper_Peninsula_21_dep_22_2021,2021,46.6083,-87.5334,2021-09-11,2021-11-06,56,Forest,Wild,3,0.0535714285714286
UpperPeninsula,MI_Forest_Upper_Peninsula_21_dep_23_2021,2021,46.6108,-87.5319,2021-09-11,2021-11-06,56,Forest,Wild,2,0.0357142857142857
UpperPeninsula,MI_Forest_Upper_Peninsula_21_dep_24_2021,2021,46.6204,-87.5506,2021-09-11,2021-11-06,56,Forest,Wild,2,0.0357142857142857
UpperPeninsula,MI_Forest_Upper_Peninsula_21_dep_25_2021,2021,46.6208,-87.532,2021-09-07,2021-11-06,60,Forest,Wild,4,0.0666666666666667
UpperPeninsula,MI_Forest_Upper_Peninsula_21_dep_26_2021,2021,46.6082,-87.4554,2021-09-14,2021-11-01,48,Forest,Wild,13,0.270833333333333
UpperPeninsula,MI_Forest_Upper_Peninsula_21_dep_27_2021,2021,46.6154,-87.521,2021-09-07,2021-11-06,60,Forest,Wild,1,0.0166666666666667
UpperPeninsula,MI_Forest_Upper_Peninsula_21_dep_28_2021,2021,46.6084,-87.4728,2021-09-04,2021-11-01,58,Forest,Wild,3,0.0517241379310345
UpperPeninsula,MI_Forest_Upper_Peninsula_21_dep_29_2021,2021,46.5989,-87.4696,2021-09-04,2021-11-02,59,Forest,Wild,3,0.0508474576271186
UpperPeninsula,MI_Forest_Upper_Peninsula_21_dep_2_2021,2021,46.6323,-87.4674,2021-09-04,2021-11-07,64,Forest,Wild,5,0.078125
UpperPeninsula,MI_Forest_Upper_Peninsula_21_dep_30_2021,2021,46.6014,-87.49,2021-09-14,2021-11-02,49,Forest,Wild,4,0.0816326530612245
UpperPeninsula,MI_Forest_Upper_Peninsula_21_dep_3_2021,2021,46.6767,-87.5636,2021-08-29,2021-11-01,64,Forest,Wild,2,0.03125
UpperPeninsula,MI_Forest_Upper_Peninsula_21_dep_4_2021,2021,46.6616,-87.5203,2021-08-29,2021-11-01,64,Forest,Wild,2,0.03125
UpperPeninsula,MI_Forest_Upper_Peninsula_21_dep_5_2021,2021,46.6349,-87.4936,2021-09-04,2021-11-08,65,Forest,Wild,246,3.78461538461538
UpperPeninsula,MI_Forest_Upper_Peninsula_21_dep_6_2021,2021,46.6426,-87.514,2021-09-14,2021-11-13,60,Forest,Wild,6,0.1
UpperPeninsula,MI_Forest_Upper_Peninsula_21_dep_7_2021,2021,46.6466,-87.5323,2021-09-07,2021-11-13,67,Forest,Wild,10,0.149253731343284
UpperPeninsula,MI_Forest_Upper_Peninsula_21_dep_8_2021,2021,46.6487,-87.5459,2021-09-05,2021-11-13,69,Forest,Wild,3,0.0434782608695652
UpperPeninsula,MI_Forest_Upper_Peninsula_21_dep_9_2021,2021,46.6306,-87.5552,2021-09-11,2021-11-06,56,Forest,Wild,3,0.0535714285714286
UpperPeninsula,MI_Forest_Upper_Peninsula_22_2019,2019,46.60836,-87.54876,2019-09-06,2019-10-31,55,Forest,Wild,6,0.109090909090909
UpperPeninsula,MI_Forest_Upper_Peninsula_22_dep_11_2022,2022,46.633118,-87.610169,2022-09-03,2022-10-30,57,Forest,Wild,3,0.0526315789473684
